,X_sentences,Y,Y_decision,Y_confidence
3600,Georgina is out of control due to speculation. Our friends ( who happen to be Chinese) told us of their mainland Chinese friends buying up to 5 houses at a time.,0,-2.9052622098395315,2.9052622098395315
4139,"I appreciate having the Unitarian Church in Hawaii.  As a church, they stand for the principles of Jesus.  Keep up the good work.",0,-2.903756929188714,2.903756929188714
694,Rail does not reach downtown Kapolei where rental housing is being built.  Rail does not reach Ewa communities that have been built over the last couple of decades.  Rail does not reach the Waianae coast were the working class is force to reside because it is too expensive to live anywhere else.  The cancellation of rail WILL have tremendous benefit for all these communities.  None of them benefit from rail and rail will cause the development of tens of thousands of homes downstream from all of them which will a cause huge impact on travel times for these areas.,0,-2.9032276723981756,2.9032276723981756
476,"But that was not her comment said. She said ""She (the judge) helped stall the trial for more than two years."" and ""There was clearly a coverup, perhaps a payoff"" which equates to a conspiracy.",0,-2.902195331458456,2.902195331458456
1050,"I agree that we must find new understandings of the meaning of Incarnation. I have searched for one that makes sense to me, but what I have arrived at might not be others' preferred way of thinking. But the concept of Incarnation is the most important idea of Christianity, I'd say, even granting a broad range of interpretations.",0,-2.900191544077922,2.900191544077922
1874,"I don't want to partake in socialized medicine. In a ""free country"" I should have that right. Right?",0,-2.8946039355855953,2.8946039355855953
2400,"Buddhists and Catholics collaborating for the common good. Go beyond rhetoric, I hope; go beyond pietistic platitudes. Get your act(s) together and focus: contemplation and discernment. We have so much in common. Contemplation without discernment is self-illusory; discernment without contemplation leads to ideology.",0,-2.892394685168976,2.892394685168976
1496,"Many (maybe most) of us who hunt are hunting for food. If an animal is healthy and legal, I am taking it. I enjoy eating the animal a lot more than I enjoy hunting it.",0,-2.8917319983251293,2.8917319983251293
3216,"You are entirely wrong. As one counterexample, I am an independent; my view of political parties is ""a plague on all their houses"". However, I support the government's handling of the Khadr case.",0,-2.891521603977311,2.891521603977311
2198,"Link? What dubious source does this come from?  Here's peer-reviewed published research showing ocean heat content increasing: http://onlinelibrary.wiley.com/doi/10.1029/2012GL051106/full
As mentioned in other posts, glaciers are melting, ice caps are melting, sea level is rising. We don't even need thermometers to see the warming. But, the thermometers do show it, too. That's according to NASA, NOAA, UK Met Office, Japanese Met. Agency, and BerkeleyEarth. 

So, on one hand we have multiple lines of evidence, data and experiments, 150 years of physics demonstrating that CO2 has a warming effect. We have thousands of scientists, 31 US scientific societies, and 195 countries in the Paris Accord all point to the same thing: climate change is real, its caused by us, its getting to be a serious problem, and the sooner we act, the better off we'll be. 
On the other hand, we have what? What's your evidence DD?",0,-2.889790880267417,2.889790880267417
1031,"Yeah, the best way to get the congregation involved is to have the celebrant turn his back on the them. And mumble in a language that the congregation does not know. 

Since God is everywhere, and priest facing the congregation is facing God.",0,-2.8872436207015784,2.8872436207015784
668,"Uhmm, I guess you aren't too in the know concerning Kanerva and UAA skiing.  There is a Heikki Kanerva scholarship fund for UAA skiers.  Has been for a long time.  And it's funded from money he earned at Microsoft.  How many hockey players, basketball players, volleyball plaers and gymnasts have gone on to set up generous scholarship funds for their UAA sports teams?",0,-2.884644880729655,2.884644880729655
1528,"It was an ""Influence"" campaign.",0,-2.884005664844553,2.884005664844553
3410,"I believe it does. But I'm thinking hard about your question. It's a good one. Is the government responsible for health care? Should it be?
If I'm being robbed, I expect the government to send police.
If I have children, I expect the government to provide education for them.
I expect the government to mark hazardous reefs and rocks in waterways and make sure restaurants don't poison me.
I don't expect the government to choose my career, my friends or tell me what to read. I don't expect the government to keep me from anything that is not harmful to my fellow citizens. 
It's our government though, so it's debatable.
If your mother is old and has alzheimers and you can't afford to take care of her, I will happily pay taxes to provide care for her. If your legs are blown off because you are a veteran, it is our duty to support you. 
We can probably agree about these.
Where it gets tough is when we determine what is fair and right for the rest of us. 
Personally I believe in single payer.",0,-2.882123012063043,2.882123012063043
2027,"What is meant by ""acquire?""  I've never heard any derision on this church.  Why would there be?  We don't criticize churches in this country, just mosques.",0,-2.8787365694932423,2.8787365694932423
4131,"Such effort - your fingers must be bleeding with all the cut and paste you did!  But it proves my point about you, that you deluge us with one-sided citations.  You are indeed consistent!

Now - continuation to Pandora17:
The Church puts almost all of its efforts into holding marches and influencing legislators, but not where it can actually carry out the Gospel message.  When I worked for Catholic Charities, we had a program that provided, among other things, financial support of different kinds to pregnant, unmarried women.  Their social conditions would compel them to look to abortion as a solution - but we provided an incentive for an alternate one.  We spent a lot of time in trying to raise money from local parishes, and also asked the diocese for the basic funding of the service.  The whole thing caved because we had such poor donations and the local bishop didn't feel the diocese could ""spare"" the funds for it.  
(to be continued to Pandora17)",0,-2.8777141391905587,2.8777141391905587
994,"It is about both - Eucharist's primary symbol is the community.  You appear confused.  Try reading your catechism again.  Liturgy is both horizontal and vertical.  The symbol of that community is the table of the Lord around which we gather.
Theology/liturgy is best when it is *both/and* rather than *either/or*",0,-2.8757858763267046,2.8757858763267046
3035,God given right? Where in the bible does it say this or is it an american Rule?,0,-2.8733198687615227,2.8733198687615227
3655,"Morning Ken,
Yes, computers and technology can serve a huge purpose and should be used to further our kids abilities. However, I see a gross neglect in penmanship, basic math skills and writing skills not to mention the physical education is severely lacking since the inception of the computer.",0,-2.8723258931188056,2.8723258931188056
754,And that matters how?,0,-2.8722285802149434,2.8722285802149434
926,"Big timber has made it clear already-nothing matters except maximum profit.  Plants, animals, or people-we are all only in the way of corporate plans.  Of course, once they destroy the planet, the wealthy plan to jet off to another, leaving the rest of us to wait out the million years or so until the Earth regenerates.",0,-2.870911851124215,2.870911851124215
1566,"I believe all of your questions can be answered at www.honolulutransit.org. Let's not forget the City Council meeting on July 14, 2010 when Cliff Slater said ""We don't disagree at all that rail will have effect on reducing traffic congestion from what it might be if we did nothing at all.""",0,-2.8696285248572693,2.8696285248572693
2132,I might travel once every 3 years via plane...elsewise its by bike or train.  Maybe get your facts right before spouting off.,0,-2.8682124032610377,2.8682124032610377
4132,"Sorry, Marty---but Jesus did not BEGIN a church.  The Twelve [Apostles] and Paul also BELIEVED that the end of the world was coming during their life-times.  THEY believed that it was their mission from Christ to reach as many as possible to save them from the ""last days.""  It was ONLY after the persecutions---that the groups of Christians all around the Middle East and the Mediterranean, and their elected [cheirotonesate] leaders, called 'episkopoi' or bishops, realized that maybe the world wasn't ending 'right away'.  They did gather in local little groups to discuss issues, but it wasn't until after the Treaty of Milan in 311, that they began to see themselves a large gathering called an 'ekklesia'.  That was when the church began.

Citations:
Everett Ferguson, ed., ENCYCLOPEDIA OF EARLY CHRISTIANITY, 2d ed. [New York: Garland Publishing, 1997]. 

Hippolytus of Rome, THE TREATISE ON THE APOSTOLIC TRADITION, eds. Gregory Dix and Henry Chadwick, 2d rev. ed. [London: Alba Press, 1992]",0,-2.8681007606564806,2.8681007606564806
4109,"Apart from Brad, Christy is the best premier in Canada. By a mile.

She's worth every penny.",0,-2.867216351070257,2.867216351070257
969,"I met Muhammad ‘Ali (rah’matullahi alayhi) in 1985. He gave me a book of du’a (prayer supplications) said to have been recited by the Most Noble Messenger Muhammad (Saala Allahu alayhi wa Ah’liihi wa Salaam), and autographed it. I gave it to my son, who still has it. It has become a prized family possession.

I have admired Muhammad ‘Ali (rah’matullahi alayhi) since about the age of eight. It was from him that I learned that it was possible to stand up to “principalities and powers” for the sake of what was right, and to have the courage to face the consequences.

Inna lillahi wa inna ilayhi raji’uun–to Allah we belong, and to Him we return. May you find Peace and Joy in al-Jenna ya’Mujahid. May Allah be Pleased with you and bring you Near to Him.

I and my family will be saying Fatiha for you tonight, inshaa Allah. Ya’Allahumma amiin! Allahumma saali alaa Muhammadan wa alaa Ah’li Muhammad.",0,-2.8667788591319567,2.8667788591319567
3918,"Prolific sexual predator? Thus far the actual charges that have come to light are he ""ogled"" one woman and called another a blond. Your entire post is hate filled nonsense that completely ignores the FACT that thus far nothing but accusations have arisen. 
I suspect that you, like most liberals do not hate him for what he did, but rather for he said. Hate of all things conservative to the exclusion of all else.",1,2.86595412035162,2.86595412035162
1975,"And most important ""he took responsibility for his role in the fire"", what a guy!",0,-2.8652189204878082,2.8652189204878082
331,"I would recommend you report them to DPP.  Nothing is going to happen if the city doesn't know about this.  If you at least let them know, someone should be tracking these and making requests for some type of follow up or follow through.",0,-2.8646861541923103,2.8646861541923103
2579,"On its face, if we believe in ""Natural Law"", we are compelled morally to become educated factually with respect to the laws of nature. The radical lesson of Natural Law is that life evolves according to internal cosmic dynamics controlling wave/ particle inter-phasing, biological evolution and the evolution of consciousness.
Fixating faith consciousness in presumed old-time understandings of static nature, flies in the face of Natural Law. 'Cosmic Religion's First Lessons' still control with respect to understanding 'Primary Scripture' and Natural Law. Evolving consciousness compels openness to the transforming powers of the laws of nature.
It is morally wrong for humans to twist laws of nature to serve human advantage in a way that is destructive of the survival laws of nature. If excess human population taxes ecological nature to death, humankind has to rethink its take on Natural Law.
Church indeed needs to change ""to accommodate new advancements in learning"".",0,-2.8593507181217293,2.8593507181217293
1283,"Most experts agree that three years is still too early to make a concrete determination about the effects.   However, drivers in fatal crashes are now more likely to test positive for marijuana in washington, and rates of marijuana poisoning in small children have increased in colorado.   Whatever the numbers end up showing, it's the state coffers that benefit at the expense of individuals.   So, is it worth it?   Not to the families of the people affected.",0,-2.8549920554087325,2.8549920554087325
648,"In Vancouver and Toronto, Canada has already disappeared. A few Canadian neighbourhoods still exist in both cities but their numerous and size diminish by the year.",0,-2.8542727535056147,2.8542727535056147
3013,"Always beware of free money or anything free from any government, whatever they give you they can take away, so its best not to count it as steady income that you can rely on.. All it takes is a change in the power structure, such as our recent presidential election.",0,-2.853934362647579,2.853934362647579
388,"Herein is an example of the 'parallel universes' that men and women inhabit. Men don't realise how profoundly women are affected by words, hence things that men say in jest or in passing are often interpreted to mean something different, or have significance greater than intended. In the same way women often don't realise how profoundly affected men are by visual stimuli. Hence, the way a woman dresses can communicate a message that is interpreted by men in a manner not intended by the woman.",0,-2.8531998158109815,2.8531998158109815
1426,"We are talking about the church, the origin and place of our worship, and reflection, and prayer, central to our faith in God.  I find nothing wrong - in fact, it is wonderful - that the council did so at this time.  This is not Microsoft or IBM or Apple where meetings are designed to produce an immediate work product that earns the company money. We are Church.  If you find ""no real intention or desire to reform"" in this report, then I would suggest a re-reading of it, with a goal of discernment rather than the understandable first reaction.  Of particular note are the phrases ""Less clerical and more international,"" ""Francis' December 2016 address to the Roman Curia,"" ""the curia as an instrument of evangelization and service to the pope and the local churches;"" and ""the selection and competence of personnel"" for the Vatican's bureaucracy.""  I, personally, am full of anticipation as to what's to come......",0,-2.8530979186031376,2.8530979186031376
1640,"TV shows can't focus on developing local audiences.  If they want ratings and advertisers and thus success, they need a national audience predominantly.",0,-2.85239142138448,2.85239142138448
4101,"What is the EV range with a 5 year old battery on a cold snowy winter night driving into a headwind pushing through a couple inches of slush - hoping the next charging station doesn't have a long line up? When governments have all the Ev's,what is going to replace all the revenues from gasoline taxes? Also someone better look real closely at designing and funding a new electricity grid. Why wouldn't the public want to buy these things and how long do our tax dollars have to subsidize the few who really want to buy one? Also note that most of China's electricity comes from coal. ( Electricity is not allways pollution free and as we have seen in Wyntario, when it comes from wind and solar it gets kind of expensive.",0,-2.8497698921388928,2.8497698921388928
483,With more competition will prices come down?,0,-2.8497366604800574,2.8497366604800574
2390,"""There are tensions that cannot be solved by the magisterium or by canon law,"" Faggioli continues. ""Christianity in general and Catholicism in particular teach us to live with these tensions without (if possible) to make of these paradoxes a pattern of hypocrisy.""

Catholicism has not always been very good at living with such tensions. Anglicans have historically been much better at this since the whole concept of the ""via media"" is embedded in their DNA and has been since their inception. Those four cardinals who signed the now-infamous ""dubia"" would rather exercise total control and impose their worldview on everyone else rather than live with such tension, a process that can sometimes be messy. But life in general can sometimes be messy, and that's just a fact of life. Often life's little gifts are found in the messiness. Burke, et al. should respect that, learn to live with the tension, and relinquish their firm grip of control for the good of the church.",0,-2.8495354726770836,2.8495354726770836
4515,"I merely pointed out that 90% of Black and Hispanic voters voted for Clinton. So if two of each had voted for Trump, you would say that ""Blacks and Hispanics voted for Trump.""? Either you are ignorant of facts, or you are trolling.  I think both, troll, spreading ignorance or trolling to irritate people, then making a childish wisecrack about Democratic voters. You are a troll. What does ""bubbleguts"" refer to, maybe your inguinal hernia?",1,2.842631674225943,2.842631674225943
2470,"ThohahenteWeaver:  I want to understand your point.  It seems that you are suggesting that the topic of one's family, one's roots, one's connection to the larger Indigenous community, are extremely important in the Indigenous world.  In fact, these topics are much more important than in the white world.  As such, since a white man like Yakabuski cannot understand the importance from within his culture, he actually can have no opinion until he comes to understand this point.  Is that a fair interpretation of your comment?",0,-2.841634923163157,2.841634923163157
1651,"Leafs have won 5 in a row, four on the road. Leafs are 15th in GA. That is average D. Time to learn arithmetic. It is useful.",0,-2.8413582204012235,2.8413582204012235
2899,"""Okay, so"" yes.  The answer is yes.  But that does not seem relevant to this article.",0,-2.8408859133677584,2.8408859133677584
1386,"There is 1 particular group of Catholics with A SPECIAL NEED and that's for the Pope to
answer the Dubia!",0,-2.8371110285773655,2.8371110285773655
2591,"Yes, sometimes you just cannot facepalm enough. Asking the bishops to complete a survey to find out how young people experience the Church. No wonder things are as they are at the Vatican. No wonder. No wonder....",0,-2.8354878801031917,2.8354878801031917
2680,It's better to look good than to feel good.,0,-2.8350065356473872,2.8350065356473872
3662,"Very interesting article. Two big numbers missing. One is how much of forgone revenue to the British government. Second success rate of companies from this program. UK growth in the last 10 years was certainly not just this program. 
In addition, if its working so well why so many unhappy and unemployed UK workers? They voted to leave the EU because they felt many were taking their jobs. 
Finally how do you then explain the wild success of Asian companies that pick winners and losers and back them ? Samsung, LG and Hyundai in South Korea, Huawei and Alibaba in China, Japan has Sony and the list goes on.  Governments and banks overall have an excellent record of picking winners and easing the losers into the sunset. Certain markets have a history of failure in this regard while others are better but it's not a silver bullet.",0,-2.8346447354507696,2.8346447354507696
3834,"I think UO has the talent.  Now they need the discipline and commitment demanded of UConn ladies.  And the coaching.  UConn is just like a Wooden team of old:  solid, solid basics.  No fancy stuff.  Just solid defense and you crisply pass the ball,  keep it moving,  moving,  until the other team makes a mistake and you capitalize on it.  

UConn coach gets good athletes.  Undoubtedly.  And then he molds them into what works in his team setting.  There are at least 100 difference maker kids in every class,  and he only takes three.  I am going to say coaching,  as per UConn, Stanford, makes the difference.  And if I were to tell a young lady where to play,  it would be Stanford over UConn every day,  because the education is what works after basketball,  and Stanford has the best outcomes over all but maybe no more than three or four universities in the world.",0,-2.8320624011386166,2.8320624011386166
1641,"Because it sinks. Bottom line? World class recovery hasn't been invented yet. Maximum recovery at the moment is 15 %. If we're in high seas and gale force winds those figures don't apply.
If you check you'll find the scientists Justin refers to are industry scientists, in other words...a suspect comment by JT.",0,-2.8318479707074355,2.8318479707074355
2582,"Hey, she can come back anytime, just not under the visa waiver program.  She needs to apply for a ""real"" tourist visa at one of our consulates there.  She will have to prove to a consular officer, that an unemployed 27 year old girl with no visible means of support, is not a potential visa overstay.",0,-2.8316296739803883,2.8316296739803883
1394,"After over three decades of reading and researching every reference to women deacons in the West and most of the references in the East as well as all the secondary literature on the subject from the 17th century to the present, I am certain as an historian that women were ordained.  The rituals for ordination exist and many references to ordained women also remain.  The question of whether the ordination of women was ""real ordination"" is a theological, not an historical question.  The ordinations of women were considered as having the same value as the ordination of men at the time.  Whether any or some of these ordinations met criteria developed much later can be decided, then, only by the theologians who now apply the criteria of their own time.  The definition of and criteria for ""true ordination"" has changed drastically over time, particularly in the Western Church.",0,-2.8314431627452237,2.8314431627452237
4023,Next step - PREVENTION. Still a big gap.,0,-2.8306383204464565,2.8306383204464565
3033,"Buyers should beware.  The public should not be made to bear the burden for those who want river views, ocean views, hilltop views, and other pieces of paradise.   The same people who rail against government over-reach are often the ones who are first in line.   A lot of nonsense would stop if people bore the consequences of their decisions.",0,-2.8301699511719547,2.8301699511719547
689,"It works for all the other areas of our existence!  Might as well ""subsidize"" parks too!",0,-2.8295697598813785,2.8295697598813785
2494,"I can believe that, if only because women spend vastly greater time looking after children than do men.  Some men are primary child carers, but not many.",0,-2.829231075890822,2.829231075890822
1950,"""so that families with children and people with serious medical conditions can get housing assistance first""
The first client being a man with a heart condition.
The homeless stories don't often spotlight ""families with children"" as being the beneficiaries of efforts to house people.
It seems to me that there are more homeless men receiving help than there are
""families with children"" or is that my imagination?",0,-2.828487614882417,2.828487614882417
998,"Its really tragic that a man like Mr. Ilitich  (who cared deeply about his community and realized their sports teams played a role in civic pride) couldn't have been born and been successful in Toronto--instead we were ""stuck"" with Harold Ballard who only cared that the cash register kept ""ringing"" at MLG",0,-2.8237839954582826,2.8237839954582826
1535,"He is the chief administrator of the University of Oregon, not the department of science.    I doubt he can speak Mandarin or perform on the uneven bars.

The is no equivalence in matching skills to the position, between the two men.",0,-2.8205173447849754,2.8205173447849754
3666,"Read first, then react. When you wrote this to me  --> I harbored you as a Latina for years after you came here from Mexico <--: 

I specifically responded with this to you:  ""Seek help. Sooner is best. I am very serious. Time is of the essence medically speaking. You and your family will thank me for saying that, guaranteed.""



To add to it-there is no such person or thing as a ""Apracio"" in this article - honest. 

I understand that is real to you but there is help.",0,-2.8190241165700627,2.8190241165700627
592,"Fair enough Paul, I thought I was parsing your statement too much so It's good to hear the reply.    I worked in continuous improvement project as leader and participant within Pella Corp for several years.    It's a bottom up process, that starts with clear parameters of what the project could do, or not do.     It's important to have this kind of definition and the support that comes with an agreed upon ...hmm, range of influence.      Projects often succeeded, or failed, depending on if the project had well defined responsibilities.

These of course were very small projects in comparison to neighborhood planning, but I think you've got a great approach in looking at process failure that can be improved, versus blame casting on individuals.

A question if I may.     I've seen Portland explode in every direction into their surrounding hills, noticing in particular the eastern side.  In Eugene, how did they designate the 'margins' for growth?",0,-2.8169546830716263,2.8169546830716263
