,X_sentences,Y,Y_decision,Y_confidence
3076,"It's not just us older folks losing our hearing abilities. It is too often ill trained lectors, celebrants and gospel proclaimers who have severe microphone fright, who rush through the reading, have garbled pronunciations, thick accents, and plain disregard for the hearing impaired. Too often emotionless speaking bores us to tears and lack of understanding of either the scripture passages, topic and inadequate animation make us give up even trying. Individual amplifiers in the pew, hooked up to the master sound system are some help, but many hearing impaired (like Rosalyn above) don't think they need them either. An engaging preacher will always see the blank face feedback of those who can't follow him. But too many are oblivious to the cues and press on anyway (seemingly forever). We had a Nigerian associate pastor whose remedy for his accent was to speak louder and longer. And don't get me started on the church of the small print in bulletins and worship aids.",0,-3.3618269961543357,3.3618269961543357
845,"Espero: ""Our backs are against the wall""
No, Espero's back is NOT against the wall, however his chrome dome is reflecting the light.",0,-3.361324171042145,3.361324171042145
1738,"Reaching people where we are is an ongoing task of all preaching and public prayer.  It isn't necessary to produce full cosmological treatises, or to achieve something that feels perfectly right.  The Gospel upsets all relationships we have learned to accept.  So our prayer should shake and upset us and take us beyond our accepted categories, be they Ptolemaic or Newtonian or Einsteinian, to where Christ is.  Attempts like Daly's are a positive step because they remind us that what once served the church well becomes slowly inadequate.  But we still have to ratify the prayer with our Amen, and if only we did so in a growing awareness of what is at stake!",0,-3.3611914081572754,3.3611914081572754
681,"Justin Trudeau regularly committed to openness and transparency during the campaign. Now, where is the openness and transparency about the cost to Canadians of his climate deal? Nowhere to be found.",0,-3.357736454494666,3.357736454494666
1515,I do know someone who was not affected. But you right about Equifax that's how they got hacked. Not much security.,0,-3.343321297360097,3.343321297360097
4149,"Friday celebrates African-American heritage. Actor Levar Burton, known for his portrayal of Kunte Kinte in the original television series “Roots,” delivered a powerful talk about storytelling and the humanity that connects us. Thom Reed from FamilySearch shared family history about Burton’s grandmother and his second- and third-great-grandparents.  <a href=""http://www.proessay.co.uk/do-my-essay/"">Who Can Write my Essay for Me</a>",0,-3.3432693405186926,3.3432693405186926
568,Our State Attorney General Jahna Lindemuth has been in office a solid year now. It would be a great time to hear what she says on the subject.,0,-3.3430817541596483,3.3430817541596483
2398,Well they more than likely will have to rely on us in about a year Lynn.,0,-3.3415240396900097,3.3415240396900097
735,"So now we know it's not individuals, but it's ""the power structures."" Well that really clarifies things. Yeah, let's put ""the power structures"" on trial. Great article that's certainly going to help women.",0,-3.3387948609162827,3.3387948609162827
419,"Cites, please.  No cites from valid sources, no credibility.",0,-3.3368698250807487,3.3368698250807487
1991,"Hey Scott - I'm all for more Church in the government, but in the US, the government has gone completely secular and amoral.  In any case, my point about Rome was not so much about how the Catholic Church grew inasmuch as it was about how long it took to grow.

The New Testament is filled with stories of what one must do and not do to inherit the Kingdom, and Catholic doctrine codifies it.  But good luck finding a Church nowadays that teaches it. Even the Holy Father promotes the ""just be nice"" teaching over the what Catholicism has taught for centuries.  And then the media cherry picks and promotes, e.g., ""Who am I to judge?"" as if that is the totality of Catholic teaching. 

The 2 greatest commandments are not simple, because love is not simple.  That's why the rest of the New Testament is so important; because it tells us what it means to love God and to love one another.",0,-3.3331851672724735,3.3331851672724735
3580,"Anchorage voters denied us a new library three times, even though it only affected taxes in Girdwood.",0,-3.330104587073989,3.330104587073989
4059,"A simple challenge, ot: write something — anything — insightful about any field of science using your own words. Just a paragraph.",0,-3.3234926696448692,3.3234926696448692
4444,That is much the same as St Robert Bellarmine said. A formal heretic can not be Head of the Church.,0,-3.3200006272332416,3.3200006272332416
1015,"People are all unique.  We are in different places with our lives, have different experiences, and need different things to grow spiritually.  Amoris Laetitia understands this and seeks to reach out to people where they are.  Cupich when discussing the internal forum at the Synod last year illustrated this through a wonderful story about a remarried woman who received Communion at her son's funeral.  (The son apparently committed suicide.)   The woman later reconciled with the Catholic Church because the priest at her son's funeral cared about her and allowed her Communion.",0,-3.315897890808417,3.315897890808417
652,a77:  Maybe neither.  Maybe it depends on the perspective of the viewer.  My point is we should understand what is was and how it came to be not what it has become to some.,0,-3.3057045462382226,3.3057045462382226
4265,"I will grant you that Leo XIII's Apostolicae Curae didn't go over especially well with the Anglicans, but that was more than 100 years ago. Also in the past century bishops from the Old Catholic Church (recognized as valid by Rome) have participated in numerous episcopal consecrations in the C of E. Apostolicae Curae's main points rested on the wording in the BCP as revised in 1552 under Edward VI, relegated to the dustbin by Mary I between 1553 and 1558, and then reimposed in 1559 by her sister Elizabeth. The language that was objectionable to Leo was removed in 1662. From Rome's perspective, all legitimately ordained/consecrated priests and bishops had died out by that point, and the wording in the BCP meant no one ordained since that point was valid. With the wording restored about 100 years later and the participation of bishops from the Old Catholic Church since the 20th century, it is possible/likely that the impediment Leo recognized no longer exists.",0,-3.302031722431982,3.302031722431982
1278,"it's an impressive thing to see.  and i know from personal experience that it can be tricky getting up through the bay, into the main stem; channels change year to year.

and that's not a bulldozer.

great article.",0,-3.295026048716336,3.295026048716336
3720,"pt. 2
 Continued quote from Pacem in Terris by Pope John XXIII

""Since women are becoming ever more conscious of their human dignity they will not tolerate being treated as mere material instruments, but demand rights befitting a human person both in domestic and public life.""

Since this was written, women engaged in Church ministry----especially in teaching and in research have more than doubled their efforts in making sure---that the work and contributions of their spiritual sisters of the past will not remain covered or forgotten.",0,-3.2946108908532032,3.2946108908532032
742,At one time when the pre-paid legal service came out officers thought it was a good idea and were promoting it.  The obvious entities involved were advising against it.  It was surmised that the City and associated entities didn't want officers to always have an attorney involved in every incident especially since they can not take the fifth and required to provide a statement which can be used against them.,0,-3.2876077487911046,3.2876077487911046
960,The parents want to use their own money they raised online.,0,-3.277052409790959,3.277052409790959
2447,"You would have no idea, I know.  It is the Universal Catholic Church - as yet unfinished.",0,-3.2737256909350356,3.2737256909350356
1560,The preceding paragraph belongs in the National Enquirer along with the stories of Elvis Presley being alive and well and living in Buffalo.,0,-3.2688435829822633,3.2688435829822633
4449,"The direction of the discussion seems insular to me, since Amor Laetitia attends to Catholics and tries to create a path that would include many now excluded within full ecclesial communion. It is an in-house issue at a time when so many are simply abandoning church altogether. How can we become a credible witness to the world when we cannot open our own doors and communion rails to fellow believers?",0,-3.2684900694595163,3.2684900694595163
3354,"Bison are bison.  The 1928 re-introduction of Bison was to provide for saving the species wiped out by hunters for profit and government  in the 19th Century.  Plains Bison were the only species available for transplant to re-establish Bison in the same area they had thrived in for millenniums.  None of your comments have any factual content and are just false.  The only harvest of these bison should be for subsistence.  The lottery removes any aspect of subsistence in favor of the ""sport"" hunter.  Airplanes can spot the herds which will not move from an area until the feed runs out, so same day ban has no relevance.  Off road vehicles can be used without restriction to travel throughout the hunting area.  No need for roads.  Oil revenues used by the state created the implantation of barley farming into the area with no historical existence.  Your last sentence have no relevance and are just false in structure and content.  Give it up.",0,-3.264490271559711,3.264490271559711
1360,"We've had over a hundred years to determine ""safe use' methods for asbestos--none has been found. There is not a single protocol for asbestos use in the world that has been found to protect workers or those exposed environmentally, not one. Asbestos doesn't cause problems ""once in a while."" Having worked with asbestos victims for ten years, and my own father dying from asbestosis, I would be happy to tell you about ""incidents.""",0,-3.2634064740548716,3.2634064740548716
3443,"I celebrate the success of the caucuses, the manifestation of a pure democracy where where each person gets a vote.  The energy at the caucus I attended at Houston High School was palatable with a beautiful mix of young, old, male, female, families, and a rainbow of people of a variety of heritages, some dressed in formal, traditional garb.  Our caucus went 84% for Bernie Sanders, a reflection of the promise Bernie offers for a government ""of the people.""",0,-3.2631195783594658,3.2631195783594658
2887,"I am sure a good defense lawyer would have subpoenaed more but the Fairbanks 4 had public defenders, not the kind of lawyers big money can buy.",0,-3.2611468328034503,3.2611468328034503
794,"Stats and estimates etc. are one thing. How about actual. A drilling unit (1) set up for work prescribed will employ +/- 50 people with a payroll of +/- R40,8 million per annum. This model is Mozambique is that close enough? If yes, then we can go into support services, spin off, and return from skills transfer.",0,-3.2608928510886406,3.2608928510886406
2274,"Josh apparently is lacking in either formation about Church history, or in his ability to see connections between events.  

Either way not a good indicator of career progression. 

Josh read the history of Athanasius and then rework this article.",0,-3.259581590744591,3.259581590744591
2560,"That is the folk-tale which propagated for some years, because dissident consultors on the Pontifical Commission assisting the study of this issue selectively leaked documents while others dutifully stayed quiet allowing Paul VI to have the final say.  But now more information has come to light--see, for example, the archive made public by Germain Grisez at http://twotlj.org/BCCommission.html --and historians and fair observers alike can say that the folk-tale is false.

In some way it doesn't matter, as the case for HV is more solid than it was back then.  That's what happens when predictions come true--and when advances in science make concrete what was only known vaguely at the time.  The post-Vatican II strengthening of moral theology and return to relevance of Catholic philosophers also helps.  But history does matter in some ways, and we now know that what dissidents have been telling themselves and us about the history of HV is simply incorrect and indefensible.",0,-3.2488310737164214,3.2488310737164214
338,How so?,0,-3.2483934814015827,3.2483934814015827
2218,"Do you have same vitriol  for government workers with defined benefits that work for 20-30 years and end up with multimillion dollar pensions? Is that more fair to you? A governments workers entire existence is based on the contribution of taxpayers. 

Housing prices this year are up 30% so far in the GTA. Is that $200,000 to $1,000,000 in some cases earned? What exactly did those home owners do since January to ""earn"" that windfall?

Like others have said, investing involves using dollars you have already been taxed on to get an opportunity at a return over time. Nothing is guaranteed and the liquidity it provides allow businesses to expand and jobs to be created.",0,-3.2470445596183515,3.2470445596183515
3036,"Many of Mr Trudeau's political enthusiasms  have proven on closer examination to be premature. While China has much to offer if free trade is a good idea it would be wise to take our time and make sure we get the deal we want and need as the minor partner.  There will be three in this relationship whether we like it or not. We have had a long and largely reasonable relationship with our American neighbour with whom we share many political, social and economic ties.  Still, the relationship has been described, by its friends, as like sleeping with an elephant. We share few political and social ties with China and economic ties will naturally have dislocating consequences on current relationships. These must be fully explored and understood before making serious commitments. Err in haste, repent at leisure.",0,-3.246793947472669,3.246793947472669
229,What is racist about calling someone what they are? Black people love to play the victim. It's pathetic.,1,3.2465965011731517,3.2465965011731517
1848,The point I am making is that the monthly interest cost on a house is the same as it was in 1984.,0,-3.237217919664978,3.237217919664978
1692,"That team gave us a battle in Eugene last year, I wouldn't expect any less this season.  Holder is a blast to watch.",0,-3.2365335414062413,3.2365335414062413
527,"You list three questions for consideration about putting in place a permanent shelter. A pertinent question is missing. What is the anticipated impact of a permanent shelter on the number of homeless persons in Eugene? Until this question is answered, plans for a permanent shelter are dubious at best. As Congressman DeFazio said at his August 1 community meeting at Churchill High School, the homeless population is mobile. Cities that increase services can attract greater numbers of homeless persons. In that case, Eugene's current huge problem would become overwhelming. A better approach would be to develop programs that are implemented regionally or nationally.  This is a situation where good intentions are likely to have undesirable consequences.",0,-3.231906196119946,3.231906196119946
2681,"What should be asking is what Puerto Rico has been doing since Katrina to prepare itself for hurricane, has it spent money on preparing its structures and infrastructures for hurricane has it stockpiled equipment to help it clear its roads of hurricane debris, as well as other emergency supplies in places that are if possible sheltered from hurricane damage? The same can be said of every place likely to be hit by Hurricanes, the best time to prepare for them is before they happen. Adequate preparation makes recovery easier and faster. Surely all of us have learned from Katrina how to prepare for hurricanes and have put those lessons into practice?",0,-3.2289048467180077,3.2289048467180077
2129,"I read recently (perhaps in these comments) that something as important as public policy should not be left to those who are also engaged in politics, and I agree.",0,-3.2219559394060395,3.2219559394060395
976,"Ms Freyd contends she's paid less than comparable male colleagues. Either that's the case or it's not the case. I'm not sure how ""individualized"" the University tenure track pay scale is......If it's ""flexible"" so the University can pay high dollars to attract ""rock star"" faculty, it's difficult to have an ""objective"" comparison. If, as an extreme example, the U of O might want to attract President Obama for a stint at the Law School, it might offer him more than another less attractive candidate, and far more than current faculty members , both male female, are paid.

If, as she claims, there exists ""gender bias"", it will likely be a difficult charge to support. We do know that such gender bias exists in many settings, but proving it always the task of the litigant.  Ms. Freyd is a controversial professor, but that's not the issue here.....it's a distraction.  Eithere there are ""objective"" measures to determine compensation or they're more ""subjective""........I don't really know.  G.C",0,-3.219627088118928,3.219627088118928
3356,Wealthy families don't need tax credits. What do young children really need? A stay at home parent or money for day care?,0,-3.2190284075044517,3.2190284075044517
583,"Yes, the base of people paying into the system is much smaller than those wo are on the system. This is not going to be sustainable. IMHO, giving people the option to invest more into retirement plans might ease the strain but do you trust the stock market?",0,-3.218724004279148,3.218724004279148
3416,"As a parent of two autistic children in the ASD Structured Learning Program.  ASD does an amazing job and should be commended and not sensored.  How are my children less important than mainstream children?  Don't they also deserve an education to be the best they can be too? My one daugher goes mainstream with her TA on occasion and it's her favorite part of the day!  In Autisms case, early intervention is key!  My twin girls started ASD in pre-school at 3 unable to talk or were even potty-trained!   At 9 my girls can talk, can self-care, and can read!  This wasn't all ASD, but they are a major component of my girls therapy. If I can urge anything it is for the School Board to continue and increase this amazing program.
Thank you, Tanya Hickok",0,-3.212256207063912,3.212256207063912
1836,Good idea! Trusts are a PERFECT PLACE TO LOOK FOR REVENUE.,0,-3.2072730296159513,3.2072730296159513
1238,"Yes, after a significant drop in total number of storms. What do you make of that? The computer models they use to predict AGW are in utter turmoil as they have not been right about a single prediction in close to 20 years. I mean, whats up with that?",0,-3.203348223030333,3.203348223030333
3415,"Get rid of Nordic skiing in Fairbanks for Golf?  You've got to be kidding.  The teams just joined the most elite NCAA conference - what disrespect to them.  Skiing has been part of UAF campus life since its inception and builds community for our northern town. In reviewing the UA committee report on line, I found no systematic data on cost of each of the sports, both mens and womens (nor did it itemize the particular costs for each sport such as scholarships, tuition waiver, facility costs, equipment, travel, coaches, management, etc.); nor did it even list all the sports.  Without sufficient facts about how funds are spent, new configurations merely speculate; provide facts on detailed costs for review prior to the public meetings.  Sustainable Alaska depends on pre-K to university education that will foster creativity, research, and civic minded people building a stronger community across the state. Putting around orange golf balls in the snow is a sport best left in Nome",0,-3.2027716491364786,3.2027716491364786
3539,This is a sensitive topic and only users that haven't been restricted in the last 30 days can comment. Your last restriction was 11 days ago.,0,-3.194628131717206,3.194628131717206
2945,"it is already there at UBC and at Carleton

i think you knew that",0,-3.1942305201362764,3.1942305201362764
2235,"Regarding unsolicited hugs, I love to hug friends, not strangers, but know many casual acquaintances who are huggers, and I just hug them back.  If a complete stranger did it, I would be uncomfortable too, but I realize huggers were just probably brought up that way, and as long as they aren’t offensive about it, I just tolerate it.  Years ago, the wife of my husband’s friend would kiss me on the lips in greeting.  I was very uncomfortable with it, so one time I just turned slightly and gave her a warm hug.  After that she was very cool towards me, and there were no hugs, let alone a kiss.  Oh, well.  I didn’t do anything wrong, so I didn’t let it bother me.",0,-3.1939778575019306,3.1939778575019306
669,"The church was established by Christ as a means of spreading the gospel, not to be in control of anything. Christians are to point others to Christ by sharing the truths found in the Word. It's by reading and understanding God's Word for ourselves with the Holy Spirit as our guide that we get to know Christ, and through Him, God the Father. Anything that comes from the pulpit must align with the Scriptures. We are individually accountable for verifying what we hear and what we're taught.",0,-3.18864345846646,3.18864345846646
1841,I was waiting for the bit where we learn that knee replacement surgery isn't so bad after all. Couldn't find it in the article.,0,-3.187947369302103,3.187947369302103
3418,"Your article and your perspective ignores the main point of pope Francis, subsidiarity.  We on a local level are responsible for our brothers.  It is we who are the first and best to help.  Family, Parish, Town, County, State, then and only then the Federal Government.  Like most you praise the overarching hand of Government when it hands out and decry when it strangles your faith (they cant be separated you will always have one with the other).Ryan's Catholic faith is on display and far more in line with the Popes than Byden or Polosi.",0,-3.1843476075957184,3.1843476075957184
1985,"What a brilliant idea - using church property to provide a service to the community and provide sustainable income for the church. It's too bad the diocese denied St. Matthias church in Guelph the opportunity to do the same, but instead sold the property to the highest bidder.",0,-3.1837533841814665,3.1837533841814665
329,"This editorial hits a painful nail on the head - the distressing lack of effective local leadership to wrestle  with a persistent,  growth-provoked dilemma.  The Oregon Consensus report glosses over this lacuna by its ""discovery"" (come on, now - a 6th grader could have known this  by glancing  the RG) of an abysmal absence of trust and poor communication (duh ...) but evidently little serious notion about how to remedy the problem (their unproven, piecemeal  intervention formulas are simply not up to that daunting task).   For all of their  ""progressive"" rhetoric, Eugene's current ""leaders"" clearly have not figured out how one gets from grand words to tough, balanced decisions that a broader public can eventually accept (and may, one day, applaud).  What's most needed now is a rejuvenated cast of  more competent civic ""solution finders"" on both procedural and substantive fronts.  That lacking, market forces will likely take over with predictably risky results for the community.",0,-3.181844953401691,3.181844953401691
1060,"You misconstrue on purpose I think.

He came to show us what love is, and how to love, and how to draw strength from Him while we are here so that we can love like Him.

Of course we will never succeed, but He wants us to struggle, to cooperate with our whole ""heart, mind, soul, and strength"" in order to grow ""ever closer"" to Him and His will for us.

He very clearly and dramatically said ""Be perfect, as my Heavenly Father is perfect"".

Perfect in love, not in human power.  

He gave us the Sacraments to nourish and renew us in our happy struggle for holiness until our last breath, in what Vatican II called the ""universal call to holiness"". 

Is it Jesus's words that I gave above from St Matthew's Gospel, or is it Vatican II that you reject?",0,-3.1812718894154455,3.1812718894154455
