,X_sentences,Y,Y_decision,Y_confidence
1122,"The SDA church is predicated on the presumption of voluntary participation.

Unfortunately, the longer one remains in any leadership role, the greater the temptation becomes to develop a sense of entitlement.  This is true both individually and institutionally.  And it applies with especial vengeance to those who ascend to the higher tiers of an organization.

In this regard, I find the various studies that seek to streamline church operations, that tend to focus on how to reduce overhead at the local conference level, to be missing the mark.  

(continued)",0,-4.485627835924449,4.485627835924449
791,"""""I would make it clear that not all discussions of doctrinal, moral or pastoral issues need to be settled by interventions of the magisterium. ""

I think this depends on an understanding of the English language verb ""settled;"" accepting that this sentence was almost certainly not drafted in English originally.

""...doctrinal, moral or pastoral issues need to be settled by interventions of the magisterium. Unity of teaching and practice is certainly necessary in the Church, ...""

I warm much more to the start of this second sentence when it comes to things mentioned specifically by Christ in the Gospel.

""...Unity of teaching and practice is certainly necessary in the Church, but this does not preclude various ways of interpreting some aspects of that teaching or drawing certain consequences from it. ""

Now I am just confused. To be blunt, the second part contradicts the first. I think it's an oxymoron. But it isn't coherent or rational; whether voiced in porteño or in classical Latin",0,-4.4442330194687525,4.4442330194687525
3408,"Since ""ex cathedra"" did not exist in Eugene's day, Cantate Domino is not ex cathedra. One can also argue that since Pastor Aeternus (the Vatican I document which defined ex cathedra teaching) said that an ex cathedra teaching ""defines"" something, and Cantate Domino doesn't define anything, it isn't ex cathedra.

The current teaching, as given in Lumen Gentium, is that essentially everyone has at least the possibility of salvation.",0,-4.415541970060994,4.415541970060994
3062,"I do appreciate that some Protestant denominations hold views along the lines of what you outline, and apparently hold them in sincerity. I have studied the gospels, the Acts of the Apostles, and the Epistles and have found their views, and yours, completely unconvincing.

Since the only source of the Scriptures themselves, in fact, is through the Church, those views pretty much cut the ground out from any credibility of the Christian texts. I would be as well off learning Old Avestan and reciting the 72 chapters of the Yasna.",0,-4.236262662372058,4.236262662372058
1381,"There always seems to be ""one more important"" thing missing for us to get more out of the Holy Mass.

the homilies
the music
the age of the priest
the noisy children
the form of the liturgy itself
the sound system

never

- the love I don't give or exercise in pursuit of closer unity with Jesus at the Mass
- my lack of preparation before going to Mass (reading the scriptures..readily available on the internet, phone, etc.)
- the reconciliation I didn't pursued at Confession earlier in week, allowing me to get closer to God through this wonderful Sacrament.
-my prayer times I didn't give leading up to Mass
-my lack of prayer immediately upon entering the Sanctuary..praying for the priest, focusing my mind and attention on the Tabernacle, in which My Lord awaits for me and for you.

Something else (outside of me) is always offered as the excuse.

But as Jesus recently told us in the Mass earlier this week..it's what is inside us that makes us unholy, not what is outside of us.",0,-4.2251671023267505,4.2251671023267505
3659,"I will admit that this is easier to understand in terms of unity of teaching with variety in application, but we are a sacramental church, so unity of practice should be doable. I'm not sure I am up to it, but maybe somebody is.
Take the Eucharist. For 1500+ years it was explained in terms of pre-Christian religious ritual, like sacrifice and altars. The final stage in a sacrifice is the sharing of the victim to enable a distribution of the numinous among the believers.
The same ritual can be reinterpreted from a different perspective. Instead of the sacrifice as explanatory key, the meal can be understood as Christ's purpose. Christ died so that we can share in his life. The concluding communal meal is a more effective key today than the rarely experienced ritual sacrifice, in a Church based on communion.
One event, understood in two ways, can easily become two different ways of experiencing a common practice. I guess i could have just said Extraordinary and ordinary forms coexist.",0,-4.218494376689179,4.218494376689179
3645,"What are the odds that,whatever happens in court, the delays will find ways of continuing?",0,-4.213421301364705,4.213421301364705
2969,"In Indonesia the Catholic Bishops' Conference and the National Council of Churches will be holding joint commemorations next year. Where either Protestants or Catholics are in a large majority they tend to ignore each other. Where they are both minorities in this Muslim nation an ecumenical ""merging"" has been taking place between Calvinist, Lutheran and Catholic traditions and insights. We've had a common Bible since the early 1970s. Quietly, but yes all too slowly, we are becoming one at the local and regional levels.",0,-4.19676035327891,4.19676035327891
840,"The reason why Eucharist Prayers in the Catholic, Orthdox, and non-Chalcedonian communions are not designed for congregational participation is that theologically the congregations are not the priest-celebrants.

The entire notion of ""draw(ing) people in"" is contained in the prayers, readings, and responses prior to the Eucharist Prayer and the prayers of thanksgiving afterwords.",0,-4.183263836067523,4.183263836067523
4047,"Please let us know the basis on which the government has decided not to fund your program. They must have had reason. 
Maybe you could provide web links to your recent climate change research peer reviewed articles so readers could judge their relevance/merit.",0,-4.1564264887027065,4.1564264887027065
2627,"Dude!  Ssssh!  You tryin' to upset Trumpy the Clown's banana-boat, or what?  He needs immigrants to whip-up his lynch-mob supporters!

Eh--he's still got Muslims to scapegoat.  B-b-but hey!  That's me!

Hmm...reminds me of a joke I told a Mexican coworker shortly after 911: ""Now they'll ignore you at the checkpoints and roust me instead.""",1,4.144012193802075,4.144012193802075
3611,"Kimberly:  One of the chief arguments for those 16 bed community-based facilities is that they can be sited around the state so it will be easier for families and support systems to help patients with their treatment and reintegration into the community.  Only those patients who require a high-security, locked ward placement should be in the locked-ward facilities.  The ""least restrictive appropriate treatment placement"" model seeks to support the placement which best serves patients and, yes, you and I agree, part of that service is for the patient to be as close to supportive relatives and friends as possible.  Indeed, those patients from other communities do deserve to be helped in the communities where they live.  Closure of the JC Hospital and a re-directing of part of that 34.5 million toward community-based facilities would accomplish jus that.  Regards, Gary Crum",0,-4.122226984741311,4.122226984741311
435,Sigh.  Motion 103 does not / will not disallow anything.  It's a motion to discuss matters of interest; it does not create any new laws.,0,-4.104398701399722,4.104398701399722
1378,"IRT John Corboy's letter, he is right in that ALL government social programs have been inefficient and NONE have produced good outcomes.  These social programs have just become goblins for tax dollars with no end in sight. Social programs were created as a crutches/walkers/canes when someone is down and out, it was never meant to be for able-bodies to take advantage of.  We have raised a generation or two with their hands out for government hand outs.  Remember when something is ""free"" no one gives a &hit about that free stuff, but it that something is one that you need to work on to get you will value it more because you did something to get it. Example, buying a car vs renting a car--you know you will take care of that bought car than the rented one.....Section 8 vs owning a home.",0,-4.077745505307658,4.077745505307658
1567,Please give the location and time of the meeting.  Thanks,0,-4.060992499852264,4.060992499852264
315,"Great news, thanks to all involved who cared and helped!",0,-4.036738775334777,4.036738775334777
0,"That's it, boast about your stupidity.",1,4.028936232547295,4.028936232547295
2286,"I agree with you. Bernard Lonergan wrote that Geniune Religion is Love. In parishes that stress Church Teaching focused on rules and doctrine that fosters judgment and dualism, I can understand the stimulus to flee. Meanwhile, parishes that focus on the teachings of Jesus, involving inclusion, caring, sharing, service, and forgiveness are attractive and inviting, and nurture spiritual growth to change and support our lives. 
Buddhism has also discovered Love as the key to Enlightenment.",0,-4.027701367257137,4.027701367257137
2290,"This past summer I was in a discussion about whether God changes. We discovered Aquinas handles it in a very interesting way.

God does not change in the way we change. We actualizze our potential to be on the other side of the room by moving to the other side of the room. God is everywhere, so God is on the other side of the room not by actualizing a potential, but by being on the other side of the room.

To generalize that, Aquinas says the God is pure act, with no potential to be anything else. When we act, we change: when God acts, God acts. We see God act and conclude God changes. God is not unchanging in the way a rock is unchanging, unmoving, still. God is always acting, it is the divine nature.

Hope that helps somebody.",0,-4.020324656531751,4.020324656531751
545,"How many spills has Big State Logistics had in the last couple of years? This seems like number three from what I recall, and the 2nd on the Richardson.",0,-3.9734883306154956,3.9734883306154956
1993,"Vatican II qualified Church doctrines, it did not contradict them. The principles of the Church's teachings before and after the Council remained the same. 

Doctrine of a social or political nature does not follow the same course of development as pure dogma. It emerges with a certain irregularity according to the vicissitudes of history. Pope John Paul II explained that the social teaching of the Magisterium is under continual revision insofar as the unchanging principles of the gospel need to be upheld in varying social situations. The fundamental principles are constant, but the judgments and adaptations are new.",0,-3.9492140415484984,3.9492140415484984
1416,"I think Phyllis Tickel may have it right, by placing the reformation as something of a ""cyclical"" event in church history.  Her thesis is that about every 500 years or so, the church goes through a period of upheaval and change as needed to adapt to changing society and human growth.  

I mention this in no small part because as she notes, we're ""due"" for another such period.  From what I can tell, there most certainly appears to be sufficient internal stress within the church to drive that kind of upheaval.  We may not be able to predict how this will play out, but I think we're seeing the start of this in the church today.",0,-3.9276195679685495,3.9276195679685495
697,"Go talk to some business leaders. They will tell you the same thing as this article: People who have good EQ are more likely to win collaboration, which is critical to success for any tasks or organizations which have more than one participant.",0,-3.88073318182622,3.88073318182622
21,"Trump is definitely a worthless stain on America.
He's definitely a sick, fascist, white supremacist traitor.",1,3.8521133922729054,3.8521133922729054
235,"Trump is definitely a worthless stain on America.
He's definitely a sick, fascist, white supremacist traitor.",1,3.8521133922729054,3.8521133922729054
1988,"I have supported my positions from the very documents of Vatican II against folks who agree with you repeatedly.

Given my age and experience, it is likely that my familiarity with ""liturgical reform"" predates yours by one or more decades.

Vatican II did NOT refer to the Eucharist Prayer as ""a communal prayer"".

It referred to it as the ""prayer of the Church"", which it is.",0,-3.8373623465276117,3.8373623465276117
1259,Did you order the 34 special Auston wore yesterday?,0,-3.833064904973506,3.833064904973506
2435,"Regarding the so-called 'Nordic model', a lot of it depends on the country. Norway has a higher level of state-ownership than the other Scandinavian states. There is a lot of apples to oranges comparisons when you talk about North America vs nordic countries.

One thing common to successful left wing movements, and I tend to think that successful right wing government policies have the same, is putting pragmatism and economic realism over ideology. For example, while Sweden is still a very progressive social democracy, in the 1990s they steeply cut income taxes in order to spur economic growth.

IMO, it matters less what position you start from than whether you are willing to honestly assess the consequences of policies, and prioritize sustainability.",0,-3.818942063768793,3.818942063768793
1057,"thanks for this article.  Wouldn't it be lovely if we actually became a church who put into practice the 2 commandments of Jesus - Love of God; Love of self so that we can love one another as we love ourselves.  

And leave the judging of others up to the Divine.  

To me - it has always struck me as ""unloving"" that at a time of incredible stress and devastation for a number of our parishioners because of a marriage break-up - that folks would be denied the sacraments - particularly the Eucharist which is - according to our teachings - is supposed to feed out souls and hearts.  

I agree with Farrell ... Amoris Laetita is the Holy Spirit speaking to us.  

And I hope Gaillardetz is right ... that Pope Francis is open to respectful dialogue on issues.  

To me - he modelling what we all need to be doing ... gently getting us to rethink our teachings ... and opening up ""dogma"" for reconsideration.  We are after all ... supposed to have a ""living faith"".",0,-3.8108553216504757,3.8108553216504757
1644,Wires crossed and nanoseconds from short circuiting.,0,-3.8048181276396162,3.8048181276396162
3342,"I followed up individual who is a professional tax preparation specialist. She indicated that she is familiar with the APTC.  She reviewed the number of returns she submitted last year the APTC percentage was less than 1% (.007 %) of submitted returns.  Note:  APTC is not given to those on Medicare.  The APTC applies to those individuals that do not qualify for Medicaid and fall below the income level that would qualify them for a tax credit (which the APTC).  However interestingly we rely on prior year's income (2016) reported by the taxpayer to qualify for APTC of upcoming year (2017).  Upon filing for 2017, if taxpayer understated or simply had reported above the estimate, the credit is paid back when filing taxes.  Hence, the if we back out the Medicaid recipients (who were a large percentage of ACA enrollees) the 90% seems a bit askew.  We would appreciate the source of this number (90%) and it would be interesting to have it vetted by her research department.  Thank You.",0,-3.797327277082024,3.797327277082024
703,"The City funds many positions (mostly administrative in nature) that relative to the current needs of the community, we simply can no longer afford. For example: people working on marketing; public relations, unnecessary trainings, staffing endless committees; special events; open houses - feel good, community relations positions/events, that may be of some value IF the basic services of public safety, public infrastructure repair/replacement, and now homelessness, were fully funded.
So many of these ""Admin"" and other program positions were added years ago when there was more money in the City coffers. We can no longer afford those positions/programs that are of limited value to the public relative to the current needs. Yet these positions/programs are not evaluated/prioritized relative to what we currently need and can afford (the spending of $160,000 for consultant work that could/should have been done in-house.)
NO new taxes until every position is reviewed/prioritized.",0,-3.790885381190193,3.790885381190193
1653,"I wonder if the junior negotiator has recognized she's being lead into a standard negotiating framework. Buoyed & disarmed by the positive use of `tweaks,' now whittle away in small chunks.",0,-3.7627725754177126,3.7627725754177126
3436,"Denis LeBlanc----trust you or four mayors ?  I'll trust what the mayors have to say before you any day of the week. We don't need 14 additional firefighters . You cite how busy things may get and use the same scare tactics you and the police use every time you want something .  Before you boast what a great job your guys do , I know of two heart attack cases where your guys arrived on the scene and got it wrong . Taking one person on a slow ride to the hospital when they were having a heart attack because your people got the assessment wrong . That was two case in two weeks. What are the odds ?  Who knows how many more may have not made it because your people got their cases wrong as well.    And then there's the overtime money taxpayers were saddled with because fire officials allowed too many fire fighters off on vacation at one time , many times.  Taxpayers were correct to tell you NO .",0,-3.7597962254201898,3.7597962254201898
702,"If both parents are working every day, it'd be a challenge to use the most energy during the day when no one's home.  It might be good for stay-at-home parents or retired folks or those who work nights, but for the vast majority of folks, it's just not possible.",0,-3.7587696848469294,3.7587696848469294
808,"Just go to the ""react"" button and click on the reaction you'd rather let stand.",0,-3.740637371205615,3.740637371205615
4060,"Happy Anniversary, Max and Bev!

Tom Eley",0,-3.7198130037732637,3.7198130037732637
4388,"My own preference was Our Lady of Lourdes plus a parking garage....with the Chancery office just up the street, closing those inner city parishes like old  Mary's was just awful.....

These diocesan folks were very busy trying to unearth monies to offset the Cathedral costs that were approaching the 175-200 million range.

I would like to see the weekly mass  attendance stats at the cathedral....I considered having my accountant take a look at the Diocesan budget but decided it wasn't worth paying him for his time....

It should be noted in terms of education issues that there were a lot of folks out in the Livermore Pleasanton area who really wanted a catholic high school and had made efforts in that direction...but instead the diocese went for the cathedral....frankly think inner city schools and that high school would have been a far better idea.",0,-3.714078187783673,3.714078187783673
854,"The fact that anyone believes government isn't at the heart of all enterprise is fascinating.  It is the equivalent of a teenager feeling that everything they have they did on their own.

We can debate about the merits of different kinds of government intervention; however, let us not forget that the framework within which all enterprises operate is created by and maintained by government and government institutions.",0,-3.70960457573041,3.70960457573041
3157,"The paucity of comments pointing to a cultural problem in preaching suggests a problematic delicacy in assessing some of the real reasons for the substandard communication of the gospel in this changing church.  But sometimes Christian charity is best served by Christian correction, however indelicate that may be.",0,-3.692017928567741,3.692017928567741
1717,About a decade ago Hawaii Reserves announced it had done successful test plantings of koa trees on its lands in Laie - glad to see plans for native hardwoods now moving forward!,0,-3.686263369610043,3.686263369610043
508,"But there is, specifically, a downtown and 19th and Downing isn't in it.",0,-3.6647871893506796,3.6647871893506796
2301,"So would I!  But the issues in this case do not easily lend themselves to successful mediation!  Recall that Catholic bishops do NOT like SNAP.  If nothing else, they'll be cheering on the sidelines for SNAP to go down, and never come back up.  That's just the way it is, but it isn't just!",0,-3.6635029770175978,3.6635029770175978
3011,"One less cardinal among the living: Paulo Evaristo Cardinal Arns, OFM has gone home for Christmas.  Requiescat in pace!",0,-3.6599475510012693,3.6599475510012693
433,"I know several financially successful women that followed steps 1 and 2, but decided to have children (or adopt) in their thirties. I know several others that struggle financially, in large part because their marriages fell apart after children (compounding the economic impact). That doesn't contradict the research; it supports it at a more granular level.

My point, really, is that delaying childbirth until you've established economic stability is the core prerequisite to maintaining economic stability. You'll be ahead if you can do this while in a stable marriage (or long term relationship), either because two incomes are better than one, or because one party can maintain employment while the other raises kids. But it is successfully done all the time.  What is rarely successfully done, as you and the research point out, is achieving economic success when childbirth precedes economic stability (or, if you prefer, education and career) - regardless of marital status.",0,-3.6596908104194084,3.6596908104194084
3718,I have lived in three different diocese in my 60+ years and never have I heard of lay people being consulted before a bishop is appointed. It may well be the case that a select committee is engaged to the exclusion of us 'little people'. If Pope Francis can make this change in a way that all who wish to comment or give input are permitted to do so that would promote the credibility of the church.,0,-3.6570708658122015,3.6570708658122015
2281,"The 'trials of a translator' are described right there in the Bible itself, by the author of Ben Sirach! (At least for the early Christians and Catholics who considered the Septuagint to be the 'inspired' Bible.)

What's written in one language (whether Hebrew or Greek or Latin -- or 'Parseltongue')
often can't be accurately translated into another language. As Son of Sirach points out, all of our translations actually differ considerably from the original.  That's just a fact of any translation process, and has to be expected.

It says so in the Bible.",0,-3.6492793866842774,3.6492793866842774
3231,"It is not that the world is catching up to the Church.  The Church is still lagging behind the world.  

The Church may STATE equal the divinity of men and women.  But the actual PRACTICE of it is far, far behind.  

Women, especially religious in the early days, began hospitals, orphanages, education, and did work in the missions.  They followed the example of the poor Jesus to work among the poor.  They brought the feminine face of God to the people as members of the Church---which has always been called ""Mother Church."" But those who make the decisions within the Church are hung up on their androcentric expressions, and hierarchal structures---that have no place for the gifts of women to be part of decision-making within the Church.",0,-3.647913305730697,3.647913305730697
1942,"Join me for a stroll down scriptural lane.

And why not start with Isaiah 33?  Who held the 'pen' here? Yahweh? No! That would be silly, wouldn't it? And everyone would laugh. 

There are (and often are in terms of Scripture) only human agents involved in its composition. Which means we have to be very careful in interpreting it (and even more careful not to put base words in God's mouth. The Pharisees did this, and Jesus rarely had a good word to say about them.)

Isaiah 'wrote' in politically and socially very uncertain times: the Assyrian empire had already swallowed up the northern kingdom, Israel, and the southern kingdom, Judah, might be next? 

By this time more than a little beside himself with alarm, Isaiah expressed his emotional state in such colourful words as this: 'Who among us can dwell with everlasting burnings'? Desperate times, desperate measures. Panic the people into submission. But God's words? No. Isaiah's.

Scripture is not solely the work of divine agency.",0,-3.6474094527239025,3.6474094527239025
1324,The biggest delays were caused by the city beginning construction before they had the proper clearances to begin.,0,-3.6457228020358916,3.6457228020358916
704,I once attended a roundtable on volunteerism that Ms Raitt chaired and was very favourably impressed by how down to earth she is.,0,-3.643760344882909,3.643760344882909
2910,"Sounds pretty close to the catou system...:)
Value,waiting for recent lows and reversion to the mean
Interesting comment on dividend investing;

""Dividends allow me to be......... longer ""

(runs and hides)",0,-3.6437105995694763,3.6437105995694763
1221,"Is it possible, even remotely, the he and or the Spirit, are opening up the rhetoric to truth and appropriate actioning?",0,-3.6421138663271457,3.6421138663271457
