,X_sentences,Y,Y_decision,Y_confidence
1317,"With the current Alaska Senate majority you can count on the State going for a waiver. The Congressional Republicans are masters at using smoke and mirrors to create the illusion that they are preventing the chronically ill and poor access to health care if they have a pre-existing condition by pushing the ACA pre-existing clause on to the States. This BS that government should not be involved in medical insurance is just that BS. The US Congress, Alaskan Senate Majority, and House Minority don't have a problem with government getting involved with legislating what health care women can access to control their own bodies. They don't have a problem with trying to legislate religion being a part of the public education system. Enough with these smoke and mirror tactics.",0,-0.0737551341765712,0.0737551341765712
3456,"Wow, Tridy, you are sowing a belief in schizoid character development.  It is indeed necessary for most of us to have sex.  It is a basic need and promotes solid binding of the couple.  Deprivation does not lead to holiness.  Truly Celibate men and women are attempting to give up a basic need and are putting themselves into unnatural and  certainly not holy development..  Schizoid personality development does not lead us to God as well as healthy development relating to a partner..  Notice, I do not say that all celibates can not be holy, but the RCC has failed to realize that celibacy is much more a hinderance to holiness than it is of benefit.",0,-0.0734641471611539,0.0734641471611539
2717,"1)  You don't know what people do behind closed doors.
2)  It is not only gays who engage in what you call ""sodomy""; heterosexuals also do so.
3)  If you think that an action is sinful, you ought to refrain from it.  However, since we do not live in a theocracy, others are free to define sin or inappropriate behavior as they wish, as long as they are not harming others and not violating civil laws.  
4)  Because we do not live in a theocracy, and because same-sex marriage is lawful, it is valid marriage.",0,0.07270604678072923,0.07270604678072923
100,"Huh? I only thought WOMEN could get pregnant? If a woman who identifies as a man gets pregnant, that cannot qualify her as a man. He/she/ze ? may feel that way, but feeling does not make being.",0,0.07205189976449988,0.07205189976449988
2528,"Would our adversaries be more afraid of Hillary or of Trump?  Which is the more unpredictable?  

The chauvinistic would never admit fear of Hillary, of course, and the Mullah's and Imam's reactions to anything said by any woman are predictable.  

Was Reagan's apparent unpredictability an asset or a liability?   Was Obama's stated belief in the policy of 'kumabya' with all adversaries  at the beginning of his presidency an asset or a liability?   Was  Bill Clinton's agreement to save North Korea from starvation in return for nuclear stand down (later reneged upon) at the time a wise policy decision or not?   Who will the actual foreign policy experts be under Hillary or Trump?    Will Putin pay more attention to a Trump 'deal'/threat or to one from Hillary?  

Failure to even to consider any of these questions is short-sighted, in my view.",0,-0.07141418617906514,0.07141418617906514
1071,"Roger Bacon was not the church? 

The best you can say is that for you ""he major tenets of faith which are absurd and defy rational thought"", and only for you.

The constant drumbeat of anti-Catholicism really does become uncivil with repetitions.",0,-0.07117349273741991,0.07117349273741991
482,"It may be and probably is a racket - remember the Big 3 Bail-out !
At that time fully supported ( and caused ) by excessive union wage demands. Nobody is innocent .....
The workers who got to keep their jobs don't think it's a racket.",0,0.0702258197420027,0.0702258197420027
4217,"Sorry to say it, but somebody has to.
Look up John Money, he was the founder of the multi gendered movement we are now faced with.
Pedophile, rapist, pervert....this is the research base ""multigenderism"" comes from.
I am sorry to say it, but a name change and an adopted persona do not change anything about Ms Pheonix.
She is a woman who couldn't get a man, and instead opted to legitimize her existence with a buzzcut and a suit coat from JC Penney, now she wants the world to cow tow to her and acknowledge her perception on reality. Sorry Ms. Pheonix reality is universal in nature your chrmosones say XX, you have lady parts for all intensive purposes you are a woman.
No matter how badly an apple wants to be a banana, it is still an apple.
I don't care for the apple's feelings, the apple cant bend reality nor will I encourage it to do so by making it feel better by using the right pronouns.",1,-0.06998908521493985,0.06998908521493985
3711,"Sorry to say it, but somebody has to.

Look up John Money, he was the founder of the multi gendered movement we are now faced with.

Pedophile, rapist, pervert....this is the research base ""multigenderism"" comes from.

I am sorry to say it, but a name change and an adopted persona do not change anything about Ms Pheonix.

She is a woman who couldn't get a man, and instead opted to legitimize her existence with a buzzcut and a suit coat from JC Penney, now she wants the world to cow tow to her and acknowledge her perception on reality. Sorry Ms. Pheonix reality is universal in nature your chrmosones say XX, you have lady parts for all intensive purposes you are a woman.

No matter how badly an apple wants to be a banana, it is still an apple.

I don't care for the apple's feelings, the apple cant bend reality nor will I encourage it to do so by making it feel better by using the right pronouns.",1,-0.06998908521493985,0.06998908521493985
4464,"I did get his message. It was that gays should wait for the hierarchs to start treating them properly, and that the hierarchs should do exactly that.

However, the hierarchs, to date, have shown ZERO respect for their LGBT brothers and sisters so most of the gays have left. It's doubtful that they will be coming back. Why should they?",0,0.0684520451842816,0.0684520451842816
1759,The transsexual agenda for Hawaii schools http://www.hawaiifreepress.com/ArticlesMain/tabid/56/ID/108/The-transsexual-agenda-for-Hawaii-schools.aspx,0,-0.0681093217367772,0.0681093217367772
2541,In a different time that might work...but this is post-national Canada headed by a feminist ideologue we're talking about.,0,-0.06772321196898123,0.06772321196898123
4392,Men and boys don't count in Trudeaus world.,0,0.06757689986800486,0.06757689986800486
1974,An antiquated corrupt arm of the Bishops and Opus Dei.  Unthinking males have been duped big time.,0,-0.06748423246902568,0.06748423246902568
565,"""My father was an immigrant, and did it right. Why can’t they?""
Please pass on congratulations to your Father.  Men and Women like him are what makes this country great.  All Americans love immigration.",0,0.06692005422204272,0.06692005422204272
1087,"Elias:  Pardon me for expressing my displeasure but  I resent your telling me I'm ""robbing kids and their education."" and referring to my retirement as ""welfare.""  I spent by career helping kids and I earned my retirement.. You, somehow, feel justified in accusing me of ""robbing"" from kids and living off ""welfare.""  

 I'm not intersted in a prolonged discussion with someone making such nasty attacks on those of us who spent our lives working to help young men and women become responsible, successful adults.  I enjoyed by career and I enjoy my retirement and don't intend to spend it answering to nasty, ad hominem attacks.  Gary Crum",0,-0.06691361518769834,0.06691361518769834
3368,"Shame, this woman is brave, but so very naive. She says that the problem with the DA is that they support minority rights. Isn't the role of any government to protect minority rights?

After all everybody is part of a minority. It is easy to identify whites as a minority; but what about Zulus, or Xhosas, or Vendas? 

South Africa will prosper when everyone's rights are protected by the government. That is why governments exist.",0,-0.06691291622794848,0.06691291622794848
1194,"How can those born abroad who were brought by their parents as children now be held legally liable for deportation, since they had no control over whether or not they were brought here?? Were they all ""emancipated minors"" who could disobey or refuse their parents' decisions?? How were they legally able to consent to their migration to the USA if they were underage?? 
Is there any way that when they become adults, they can choose to apply for citizenship on their own, since they were innocent of the decision to enter this country without the proper procedures??  Otherwise, they are being subject to a form of ""post facto"" law enforcement, forbidden under the Constitution & are being punished for the crimes committed by others!!",0,-0.06656724876819964,0.06656724876819964
3249,I voted against the spam messages about the BMW after working 20 hours a week online and now I get the same warning about questionable voting.,0,-0.06642741419869824,0.06642741419869824
3982,Wow breaking news. This has been true for years.,0,-0.0659715745414553,0.0659715745414553
3604,"""A fish rots from the head down.""",0,-0.06576586932564754,0.06576586932564754
2208,"That is excellent news and it will open the door for Alberta to tax any (all) BC products traveling east by rail.  

Notley-Arab better make sure that Albertans get their fair share of that business.",0,-0.06572435516709407,0.06572435516709407
3971,"Still a response that deflects from the original point. If Obama did this, you'd be screaming. But since your guy is in office you are praising it.",0,0.06563979297636835,0.06563979297636835
497,"There is a difference between dogma (which is about God) and natural law (about man). Dogma is essential. Natural law is subject to human understanding. It’s the difference between faith and loyalty. Try LoyalCatholic as a pen name. As for me, it bothers me that certain bishops and priests, not my own, helped drive Catholics to the polls for Trump, although Hillary deserved it by trying to rally her base, who was voting for her anyway, on partial birth abortion. Had she simply said that it was already illegal and that he apparently did not know it, that it never happens anyway and that it was the attempt to overturn Roe that did not work because three Republican Justices did not agree with that approach, nor would any he would appoint, then she might be President today. Mentioning that would have shown the pro-life movement as the scam it is. Still, I am not leaving the Church for its participation in that fraud, because that is about the bishops, not about Christ.",0,-0.06505743033522293,0.06505743033522293
2497,"I agree.  I read medical records practically every day, and I see how often people are unable to afford basic healthcare or insurance.  This does not accord with Catholic social teaching.  At the same time, however, a responsible health care system does not have to be, and should not be, government-run.  It does no one any good to allege (as some do here) that conservatives would just as soon let people die.  That's irresponsible, dishonest, and divisive.  

BTW, it's also irresponsibly false to say that Bush lied about the WMDs.  Many responsible people with access to good intelligence also believed that Iraq had them.  Even Bob Woodward acknowledged that it was excessive to call Bush a liar about WMDs.",0,-0.06491467508413984,0.06491467508413984
1366,"The left has gone so far over the edge that a ""personally opposed"" candidate who SUPPORTS legal abortion is too far from their extreme position to allow the DNC to support them. All this for the sin of allowing women access to an ultrasound...talk about your anti-choice anti-science position!!!

The fact is that very few voters concerned about abortion have voted Democrat in the last 20 years, this gaffe by Perez mainly exposes the frauds telling uninformed Catholics that voting Democrat is a moral option.",0,-0.06375978282521544,0.06375978282521544
1712,"Thank you, Ms. Tyler Moore for all the laughs, tears (sometimes from laughing so hard), the terrific writing and one of the best ensemble casts of all time.

""A little song, a little dance, a little seltzer, down your pants."" (Chuckles The Clown)",1,-0.0636875257751186,0.0636875257751186
4239,Trudeau will have to do more shirtless photo bombs to keep his supporters.,0,-0.06347703836297058,0.06347703836297058
962,"Not surprising all you white guys are missing the point- it's not about the fiction of the stories written by Boyden, it's about the fiction he told about himself.  Bowden claimed to be from a wide range of Indigenous backgrounds- just google him, every time something different comes up- Metis, Ojibway, Micmac, and Nipmuc.  Wanting to be Indigenous doesn't make him so, there is no lived experience, no community ties, and it certainly shouldn't make him eligible to speak about the ""Indigenous experience"" and to claim prizes and money set up for for Indigenous artists. This has nothing to do with what the status quoers call ""identity politics"", it's identity theft.",0,0.06245228538423819,0.06245228538423819
4101,"I hope she does appeal, and this time perhaps they'll have a tad more objective and rational in Albany. An acknowledged and admitted error of this magnitude could have only been drawn together maliciously. That one man found that it just ""not plausible?"" Really? ""Not plausible"" that one of the most Leftist and slanted (by their own CEO's admission) publications could set out to attack a Conservative figure?",0,-0.062426343439355936,0.062426343439355936
3959,"The Nation Brood will be all over this with negativity... Why not..  Broods breed negativity.   Bergevin is the GM of the Habs... Posters,  what is your position in the world?  Mine is an Accountant and a big truck driver.  I stick to those areas of expertise,   maybe the rest of you should stick to yours....   Whazzooooo.. Yes you.....",0,0.062036098234210746,0.062036098234210746
1652,"He can also believe it is murder, but that that it an issue between a woman and God, not that of the government.  That's exactly what every other Catholic member of the House believe, Justin included.",0,0.061872295428951674,0.061872295428951674
685,"And as per usual, refusing to come to grips with why 50 million women got abortions last year and substituting a response with Catholic moral outrage accomplishes absolutely nothing.",0,0.06171337355570983,0.06171337355570983
369,"If you look at the electoral map of this election you will see that the Conservatives largely represent the shires and squires of the nation, where capital lives and reproduces. Populism is not ""peripheral,"" representing as it does the class reaction of the misled readers of the tabloids, propaganda organs for finance capital.",0,-0.06065650386533705,0.06065650386533705
1291,"Ya, Katie grew up in a DRUG INFESTED House and Environment  with a DRUGGIE family.  It certainly is NO Surprise to me that Katie has struggled with Drug Abuse.  Her children should be taken from her and placed with a Clean, Loving couple.  The children are ALWAYS the VICTIMS......................",0,-0.06046680735002519,0.06046680735002519
1815,looks like you are in the minority here.,0,-0.060462821287978086,0.060462821287978086
2776,"In tRump's mind (if you can call it that), ""better"" only equates as more profits for the insurance companies. tRump and the health insurance companies don't give a rat's patootie about anyone's health - they only care about corporate profitability and disgustingly huge executive pay packages.",0,-0.06042393590947803,0.06042393590947803
3458,"The Church supports illegal immigration, but doesn't understand that supporting it also supports the traffickers.

http://www.heritage.org/immigration/report/the-human-tragedy-illegal-immigration-greater-efforts-needed-combat-smuggling",0,0.06030975463048582,0.06030975463048582
2834,"""Van had spent most of the day stuck in the sand""!
Why do people even try to drive unsuitable vehicles Dow the beach on the South side of the river. Amazing.",0,-0.06003955710880926,0.06003955710880926
472,Except some don't claim the moral high ground such as Justin.,0,-0.05990628430818967,0.05990628430818967
1230,You'd think a professor of philosophy would recognize self-deception and not fall prey to such themselves.,0,0.05896845665995176,0.05896845665995176
3337,the physcos have been there all along harassing and shooting proteseters,0,0.058854328429323255,0.058854328429323255
3676,"“Every child has a right to a safe and healthy home and to grow up in a society where they are treated with dignity and respect and have the same opportunities as other children,” Bellegarde told the assembly in his opening address....The violence, the racism, the discrimination has to end...""

Very well - let us start with the reserves where children grow up - but without opportunity and commit suicide in despair, FN women without respect so they leave, racism and discrimination between tribes never mind between the FN and Canadians who - let it be said here - are getting tired of the whole FN ""industry"" ...... and the $$ Billions wasted.

The reserve policy maintained in principle by the FN themselves is a cultural dead end, no matter how many $$ and support is injected into this tiresome parade. The emperor has no clothes .....",0,0.05812326680872215,0.05812326680872215
4313,"So what? He didn't need to teach on this because the Jews He was talking to fully understood it contradicted the will of God. 

Jesus did speak clearly about sexuality in general. Concerning marriage, Jesus stated, “At the beginning the Creator ‘made them male and female,’ and said, ‘For this reason a man will leave his father and mother and be united to his wife, and the two will become one flesh’ So they are no longer two, but one flesh. Therefore what God has joined together, let no one separate” (Matthew 19:4–6). Here Jesus clearly referred to Adam and Eve and affirmed God’s intended design for marriage and sexuality.

Jesus affirmed that people are either to be single and celibate or married and faithful to one spouse of the opposite gender. Jesus considered any other expression of sexuality sinful. This would include same-sex activity.",0,-0.057305664874490514,0.057305664874490514
3534,Do you really think she has ever even been next to Trump or DeVos for that matter?  Its called Photoshop.,0,-0.05715538157465527,0.05715538157465527
29,This mother is nobody home. 25 minutes to buy two pair of shoes? What was she thinking? She must not have been thinking anything. Why not at least crack a window? Anyone would do that for a dog!,0,-0.05687624459842966,0.05687624459842966
3453,"Elections do have results, and what Trump is doing certainly can be interpreted as payback to his enemies. But he doesn't have a majority. He lost the vote to Hillary, and it angers him.

A normal President who won the election but lost the vote might be a bit conciliatory, but this one is on a rampage. Trump supporters will pay the price too. For instance, a lot of them are on the ACA, which he just trashed by executive order, with no replacement in sight. If you look at current bills, you'll also see that Congress is quietly gutting consumer protections, and funneling a lot of money back to big banks.",0,0.05683826044549489,0.05683826044549489
2459,"Islamic ideology as contained within the Quran is the direct source of the problem. The Quran is viewed by all practicing Muslims as the immutable, irrefutable, eternal and direct word of God and thus it's commands and dictates cannot be challenged. The Quran serves as the basis for Sharia jurisprudence and is incompatible with the values of liberal western democracies. This fact seems to be lost on most western politicians. Please sign petition e-909 to help Canada ensure that a parallel Sharia court system never exists in Canada (unlike the secret Sharia courts of the UK) https://petitions.parl.gc.ca/en/Petition/Sign/e-909",0,0.05675000009545017,0.05675000009545017
4156,This isn't about athletics! It's about the unwise wide distribution of lethal weapons throughout society for no discernible purpose beyond sociopathic patterns of corporate profit and wanton political division.,0,0.05614839048524556,0.05614839048524556
1572,He admitted to spreading false rumours about Justin Trudeau: that type of politics needs to stop. It undermines our democracy.,0,0.05609568836514689,0.05609568836514689
4066,"Are you serious?  The Europeans are all about politics, that's where every other country has learned how to be political and create bureaucratic red tape.   The cost premium of one of those jets are probably so high just because of the bureaucracy and labor laws surrounding these planes.",0,0.05607152460424314,0.05607152460424314
3867,The Guptas are just a red herring for a far more deeper problem that stems from wmc greed for economic control.,0,-0.05573309788590475,0.05573309788590475
3372,"If you attend a university you will see several student societies that have come together to advance their own interests. You will see the Black Student Union, an Indian Student Union, a Gay Student Union etc. But woe be the individual that tries to start a White student union because he or she will be closed down quicker that Trudeau closing tax assistance to businesses. Might even be kicked out of school. 

I had some kids come to me about this a while back so I helped them organize, mind you we couldn't use the name so we called it the John A. MacDonald Society. Worked it so we got funding like all of the other clubs too. And just like all of the other groups I helped arrange speakers and the occasional outing. If an outsider came we we had boring late 1800s political speeches to read and in short order the busybody thought it was a nerdy History Club and left. 

Now everyone was truly equal.",0,0.054970315950136905,0.054970315950136905
1147,"After all, 70 per cent of new spending by universities in recent years went to salaries and pensions, mostly for existing faculty, according to the Ontario University Student Alliance.

WHY ARE WE PAYING THESE FACULTY SO MUCH !

No Canadian university is even remotely close to the Top 10 in the world !

This is a waste of tax payer money.  Then they take foreigners on top of that to waste our tax payer money further.",0,-0.05493311833737913,0.05493311833737913
4475,"The mayor says ""...if you're not engaged in drug trafficking and not out after midnight, it's a very safe city.""  Wrong.  I'm not engaged in drug trafficking and am rarely out after midnight, and still I had probably 10 worrisome encounters last year in Anchorage.  Rough people out on the streets.  For years I biked and walked to work, and moved about in Anchorage without worry.  Last winter I had several scary encounters while walking in the early evening, so I cut back on my walking.  Someone harassed me as I left the gym in broad daylight, so I started carrying pepper spray.   While biking I started carrying a little broom to brush the broken alcohol bottles off the sidewalks, so I wouldn't get flat tires on the bike.  I left Alaska recently.  In my new place there's no litter and the streets are friendly.  It amazes me when officials say Anchorage is a ""very safe city"" and the homeless numbers are ""decreasing.""  I hope Anchorage turns it around somehow.  I loved living in Alaska.",0,-0.05280286633484388,0.05280286633484388
3820,"Beautiful words but then the RCC prevents divorced and remarried from receiving communion and how ""welcome"" are gay families in church ... Beautiful words.",0,-0.052792762313878416,0.052792762313878416
3842,"People aren't going to sit by and get beaten up by neo-Nazis. They're going to defend themselves and quite possibly others depending on the circumstances. While peaceful protest is the safest way to protest injustice, when violent extremists come with weapons-- I saw the Charlottesville rally as it was happening--no reasonable person is going to sit by and allow someone to bash his/her head in. The right to self-defense is constitutionally protected. Antifa--anti-fascists--are not new and have historically been in the vanguard of battles with fascism. World War II fought fascism because fascism is violently unethical and an affront to democratic norms. Who wants their neighbor to sport a Nazi flag? Only another Nazi, but then ""there goes the neighborhood"" and property values with it. Ask your local realtor how much homes next to open neo-Nazis sell for. White supremacy and Nazism are both un-American not to mention completely disgusting.",0,-0.0521215343362853,0.0521215343362853
1870,"http://www.miamiherald.com/news/nation-world/national/article152948259.html

anything else?",0,-0.051364186231573905,0.051364186231573905
