,X_sentences,Y,Y_decision,Y_confidence
2736,"Since Oligarchy-wood went politics so am I

Meet the terrorist behind the next women’s march
When you rip the cover off the headlines you see the liberal scum underneath

Rasmea Yousef Odeh, a convicted terrorist. Odeh, a Palestinian, was convicted in Israel in 1970 for her part in two terrorist bombings, one of which killed two students while they were shopping for groceries. She spent 10 years in prison for her crimes. She then managed to become a US citizen in 2004 by lying about her past (great detective work, INS: Next time, use Google) but was subsequently convicted, in 2014, of immigration fraud for the falsehoods. However, she won the right to a new trial (set for this spring) by claiming she had been suffering from PTSD at the time she lied on her application. Oh, and in her time as a citizen, she worked for a while as an ObamaCare navigator.


http://nypost.com/2017/02/25/the-next-womens-march-is-co-organized-by-a-terrorist/",0,0.05125058305370933,0.05125058305370933
1979,"His sister loves him and supports him, but no one in their family could be bothered to get him the mental help he clearly needed?  Thanks for unleashing him on the rest of us.  Are we getting the stomach to re-instate mental hospitals yet, or are we enjoying what the mentally ill have been visiting on us lately?",0,0.051206639787490404,0.051206639787490404
1950,"If Rona/cons and Trudeau are both for Chinese bribes and call that ""investments"" then both should be charged.",0,0.050585045317259825,0.050585045317259825
4096,"Thomas:  That would work, OR, just give them a couple of animals like a Sheep.  He could have a Female sheep and she could have a Male sheep.   2 years in Prison????    I will bet you my last Nickel that when he gets out he will RE-OFFEND within a matter of days if not hours..............This POS needs 10-15 years MINIMUM.............The daughter should get the same time, the rage nowadays is all about Equality.  In prison she will meet Ms. Bubba where she will really get Satisified.......A 70's band sang a song about it:  https://www.youtube.com/watch?v=90QXhl95qP8",0,-0.05050864470620975,0.05050864470620975
4150,"So you're saying that this individual would have ""cried racism"" just because some other individual cried racism? Why, because they both are of African heritage? 

Maybe the fact that so many people view black people as one single monolith is the reason racism persists. Racists see white people as individuals, only responsible for and representative of themselves and black people as a monolith, each person responsible for representative of the entire group.

You read another story about some other individuals somewhere else who had African ancestry and  your first instinct is to essentially comment, ""they're all the same; this principal would have done it because some other black person did it."" This is the instinct that allows racism to persist.",0,-0.049748697570535017,0.049748697570535017
3381,"You sparked my interest!  Look again carefully.  It is the head of another man.  See the side of his eyeglasses, and the top of his ear?  He has salt and pepper hair.  Reminds me of ""Where's Waldo.""",0,-0.04909965644371184,0.04909965644371184
2161,"You said, in the comment that got deleted, that those who leave the Catholic Church are in serious danger of going to hell. This is not what the magisterium teaches. Ergo, your claim that your beliefs are wholly congruent with the magisterium is untrue. I made up nothing, and you are slandering me when you claim that I did -- but everyone knows you will neither recant nor apologize.",0,-0.047526793153940705,0.047526793153940705
2531,"I would hope so, in that way everyone can be warned regarding their socialist nanny state agenda",0,-0.04750877069317516,0.04750877069317516
490,"That propaganda phrase again: ""MSM""",0,0.04634205509175793,0.04634205509175793
1188,"Seems like no matter how hard you try there is always some low life that comes along who wants to shoot it, break it, trash it, or steal it. I hope the person who did this is caught and the Ashers can get past the discouragement.  The whole thing is sad, but not surprising.",0,0.04602993769413222,0.04602993769413222
1715,"You are what your record says you are, and the Nuggets, and the once-proud Avalanche, have never been further away from playing meaningful games in the spring. It's easy to say it's because the Kroenke family have moved their attention to their more glamorous holdings. 
  However, it is more pertinent to say that their decision-making, and their failure to hire professionals who know what they are doing, has led to bad personnel choices, the squandering of the talent they do have, and the erosion of their once-rabid fan bases to historically bad levels, and all of the hot air being pumped in by their sycophants in the press mean nothing.
  Either hire quality professional management and let them do their job, or sell the damn teams to someone who will, or you will continue to see the fans who regularly attended Nuggets and Avs games abandon them. The public perception is that our teams are now a rich boy's toy. These teams used to matter. What are you going to do about it, Mr Kroenke?",1,-0.046005773925549276,0.046005773925549276
1227,I'm sorry... what laws did he break?,0,0.04599053694941557,0.04599053694941557
703,10 BILLION gets us what? and when? with no effect on traffic snarl? Auwe. What a joke...... tell me I'm dreaming please.,0,-0.04517268569972921,0.04517268569972921
1130,"Children are, by definition, children and do not have the same rights as adults. They can't vote or buy cigarettes or see R-rated movies. Under Alaska law as it is currently written, 14 year old girl can ride her bicycle to Planned Parenthood, have an abortion and then go on about her day without ever saying a word to her parents. That seems wrong to me.",0,-0.045137912162685145,0.045137912162685145
4011,"I agree: I carry a Canadian passport but have not paid taxes there for two decades. I keep all my business wealth and assets outside the country. I can visit whenever I like and enjoy the best of the country without being hosed by the tax system. In this respect, I share much with the Chinese, only, being white, I am enjoying the benefits of this lifestyle they enjoy - I am sure to the chagrin of the government!",0,-0.04509003390095789,0.04509003390095789
2175,"There is such stringent laws against the raising of edible fish that it's impossible to do it illegally. Sure there are now laws against crustaceans, but it's illegal to ship them here. I don't see an issue with fish such as tilapia that could never survive in our waters. Honestly carp and goldfish are more dangerous and capable of survival. But this being said I plan on having my system up and running by the first of the year.",0,-0.04498745800121906,0.04498745800121906
63,"I know about all that 'third eye' mythology, so you needn't bother.  You simply seek to cloak it in a ""scientific"" facade.  As for terrorism, my so-called ""brothers"" perpetrating it would kill me before they would you, because I'm Shi'a.  And your secularist 'brothers' in the powerful western nations are the ones who armed and financed these Wahabbi, Salafi, Al-Qa'eda, Taliban, and Da'esh (""ISIS"") and unleashed them on Muslim countries.  Frankenstein's monster is a reflection of its creator--it was NOT Allah.  Look in the mirror and at your own hubris and hypocrisy in presuming to dictate to others what's ""best"" for them (but which always turns out to be what's profitable to your and your ilk).

And I'm a fisheries biologist.  In fact I love animals far more than you--as the unique, irreplaceable creatures they are.  Not as ""pets"" and not as faux ""children"".  Oh yes, and the bible isn't 'my' Book.  One would think you'd be used to being wrong by now.",1,-0.04479381165920304,0.04479381165920304
2284,"What about how good blacks had it before, say, 60 years ago? Show us the average family/individual income of blacks compared to today. Don't short-change us. You made the claim; now defend it.",1,0.044460389556342905,0.044460389556342905
3649,"80% of Canadian population will be non-white immigrants in a century it says.
Try 20 years

http://vancouversun.com/opinion/op-ed/opinion-canada-replacing-its-population-a-case-of-wilful-ignorance-greed-excess-political-correctness",0,-0.043948533457702554,0.043948533457702554
1055,How do we stop natives from appropriating western  European white culture?,0,-0.04369780335899498,0.04369780335899498
4387,"You are ridiculing me?  Anyhow, you prove my point on the papal silence in spite of ridicule. The Pope has no reason to stay silent if he is correct. And he has no reason to stay silent if he is wrong, according to the point of your ridicule.  If God indeed does *not have a pass/fail test, and there are no consequences for incorrect teaching, then why silence?  Just answer.  Rather, I think I will continue to exercise the gift of the Spirit, Holy Fear, as Jesus talked about millstones on this very subject.",1,-0.04354560261469542,0.04354560261469542
2261,"Metrotown Burnaby:  Pet Store sells puppies imported directly from China.  VANCOUVER puppy ban has absolutely no effect on this Pet Store business, only one skytrain border crossing east of Vancouver.   The puppies are imported from China and ARE NOT home raised.  Yet, nobody protests because we might offend their Chinese culture.  South Burnaby is about 65% Chinese.  What to do about that??  Oh, and once that is solved, a Philippine owned pet store located on the Kingsway and Edmonds sells reef fish that have been taken directly off the reefs of the Philippines.  They are unloaded behind black out curtains downstairs.  Check it out sometime and wonder who is being paid off at Vancouver customs to let this into the province?  Again.  Can't protest; will offend their culture.  20% of South Burnaby is Phillipino.",0,-0.04337256903484965,0.04337256903484965
1946,She must have AMAZING power on this site,0,0.04264890046097514,0.04264890046097514
4400,"thanks for taking time to write - I personally could care less what happens to ms demboski's career - but seems to me that everyone i know is familiar with the difficulties america faces coming to grips with religious beliefs (christian or muslim or whatever) - and how they have become associated with fanaticism at times. For us to pretend that skepticism about islamic association is isolated is just as dangerous as unnecessary bigotry. 
I repeat - let's get the ADN back on to things that are more important.",0,-0.04253157712876576,0.04253157712876576
3804,"WHY is it that whenever issues of equity, equality, inclusion come up people- like the commenters- here go to their usual and ignorant/bigoted assumptions that the reason women and (especially) minorities cant/dont/shouldnt get these positions because they are not qualified?  Is the assumption then that only white men are capable? Minorities are told that in order for them to be seen as qualified they have to be twice as good as their white counter parts, and even when they are they are not hired because they 'dont fit'.  I've seen it more than once on 'Bay St.', minorities train their white counter parts only to end up being managed by them, operating on the  fake it til you make it plan; competent enough to train their managers but not good enough to be promoted.  No one seems to notice white male mediocrity even when its screaming at them; I point you to the current occupant of the white house.",0,0.042473647222625255,0.042473647222625255
3065,"So your question implies that only ""men-of-color"" can be ""way-cists""?  How about ""men-of-white""?  They've had considerably more practice at it in this country.

Perhaps you should re-evaluate your assumptions before attempting to apply them to me.  Corollary to Poitier's First Law, which thou shalt keep Wholly: ""Assumption just makes an @$$ of U and UMPTION.""",0,0.042431271121311065,0.042431271121311065
2998,Was he excommunicated?  Or did he walk away because he refused to accept that same-sex acts are sinful and objectively disordered?  I've never heard of anyone in the Church calling someone with same-sex attraction as objectively disordered; just their attraction and associated acts.,0,-0.042027648605008405,0.042027648605008405
2495,It is good that the hacking is being looked into - Russia playing roulette is not something you should excuse.,0,0.04193542516858639,0.04193542516858639
365,You think they need to fire 75% of her teachers and replace them?,0,0.041289472512625824,0.041289472512625824
920,"𝑯𝒆 𝒕𝒐𝒍𝒅 𝒑𝒐𝒍𝒊𝒄𝒆 𝒕𝒉𝒂𝒕 𝒉𝒆 𝒃𝒖𝒚𝒔 𝒄𝒐𝒄𝒂𝒊𝒏𝒆 “𝒊𝒏 𝒍𝒂𝒓𝒈𝒆 𝒒𝒖𝒂𝒏𝒕𝒊𝒕𝒊𝒆𝒔 𝒂𝒏𝒅 𝒖𝒔𝒆𝒔 𝒊𝒕 𝒐𝒗𝒆𝒓 𝒕𝒊𝒎𝒆”

He's been miscast in that musical.  The one he ought to be starring in is the production for children, ""The Little Engine That Could"".

Toot!  Toot!",0,0.041214343554404564,0.041214343554404564
276,It's not the State that has wasted the money it's the Feds.,0,-0.04028911829199644,0.04028911829199644
2067,"You missed my point, extravagantly.  What if this was your only shot, there was no heaven, no hell, and you've wasted a good part of your life pretending otherwise?  I haven't, and I'm not worried about it one iota.  I've had lots of fun, helped lots of people, taught the hungry to fish (and the inept to drive a boat), and regret absolutely nothing. I'll be judged by my friends, and by what I leave in my wake, not by someone else's imaginary fever dream.  I'll be fine; when the lights go out, I'll have silence, and oblivion.  My friends and those I've met will either remember or forget.  It is enough.",0,-0.039693291119957896,0.039693291119957896
2034,Good. Doomahs needed to get his due.,0,0.039548969725496486,0.039548969725496486
1116,"While not a big NDP fan for a lot of boringly practical reasons, I do agree (for what it is worth) with your article in its remaining entirety.  I hope that Canadians and Chinese nationals come to understand this.  China is not generally naive or dumb any longer.  They seem to be excellent capitalists.  Canada will always be Canada - low population, high tech, diverse, non-sectarian.  China is a great prospective partner so long as they keep in mind that partnership like spousal relations have to be open, honest and empathetic.  One moment of heavy-handedness and the whole thing goes into the sewer.",0,-0.03923578014737572,0.03923578014737572
3346,"Sᴛᴀʀᴛ ᴡᴏʀᴋɪɴɢ ғʀᴏᴍ ʜᴏᴍᴇ! Gʀᴇᴀᴛ ᴊᴏʙ ғᴏʀ sᴛᴜᴅᴇɴᴛs, sᴛᴀʏ-ᴀᴛ-ʜᴏᴍᴇ ᴍᴏᴍs ᴏʀ ᴀɴʏᴏɴᴇ ɴᴇᴇᴅɪɴɢ ᴀɴ ᴇxᴛʀᴀ ɪɴᴄᴏᴍᴇ... Yᴏᴜ ᴏɴʟʏ ɴᴇᴇᴅ ᴀ ᴄᴏᴍᴘᴜᴛᴇʀ ᴀɴᴅ ᴀ ʀᴇʟɪᴀʙʟᴇ ɪɴᴛᴇʀɴᴇᴛ ᴄᴏɴɴᴇᴄᴛɪᴏɴ... Mᴀᴋᴇ $90 ʜᴏᴜʀʟʏ ᴀɴᴅ ᴜᴘ ᴛᴏ $12000 ᴀ ᴍᴏɴᴛʜ ʙʏ ғᴏʟʟᴏᴡɪɴɢ ʟɪɴᴋ ᴀᴛ ᴛʜᴇ ʙᴏᴛᴛᴏᴍ ᴀɴᴅ sɪɢɴɪɴɢ ᴜᴘ... Yᴏᴜ ᴄᴀɴ ʜᴀᴠᴇ ʏᴏᴜʀ ғɪʀsᴛ ᴄʜᴇᴄᴋ ʙʏ ᴛʜᴇ ᴇɴᴅ ᴏғ ᴛʜɪs ᴡᴇᴇᴋ... 

+++++++++http://www.cashapp24.com/",0,0.038993610118407185,0.038993610118407185
1809,"She said breast cancer screenings. Like a good con, you changed her words for the lazy convenience of avoiding the whole truth.",0,-0.03797184088358985,0.03797184088358985
2282,White media questioning Guptas representing the nation overseas. We know that majority of the mainstream media in this country is owned by white monopoly capital. This is partly the reason why the true corruption taking place in the country committed by whites in designer suits hardly get any media attention,1,0.03795660109043664,0.03795660109043664
1195,"You don't have to have a license to insure a car. The car may not be hers for one, the owner has it insured then it's insured. The holder of the insurance policy would likely see an increase in their rates, maybe even be dropped.",0,0.03787950921608929,0.03787950921608929
3721,The counter-protesters had two permits. The Nazis' permit was revoked before the event because they violated its terms. Stop lying.,0,0.03622715053258685,0.03622715053258685
3794,"I had the distinct displeasure to watch union protection of SEIU 503 Union drones at the Oregon Department of Human Services for 12 and 1/2 long years.

It took about 15 to 18 months of Work Improvement Program after Work Improvement Program and dozens of hours of a supervisor's time to actually get rid of one of them.    

Usually, after 6 or 7 months, they would 'voluntarily' transfer to a different State job and become their newest headache.  It's called ""Passing the Trash"".",0,-0.034817825443456796,0.034817825443456796
2220,Broncos - PAY THE MAN!  Show you believe in Trevor!,0,-0.03436116586305782,0.03436116586305782
3307,"Moral caution is a good argument. It is persuasive, and properly so. 

But  it is not conclusive.  The woman may think it is or isn't murder, and be correct, or not, and the fetus will or won't have whatever degree of consciousness of its end, but the only one who knows definitively is God.  I think that suggests the matter is best left to the woman and her conscience.  The belief that a zygote is morally indistinguishable from a delivered baby is not conclusively upheld by the argument for moral caution, or the argument from biological continuity, as long as we hold that a person is more than flesh.  It is therefore a personal belief, held by many people. Some are so swayed by the belief that they hold it as a moral certainty, not just for themselves, but for all women.  They proclaim abortion murder, and women who abort murderers,  when the principle of moral caution itself would suggest they ought to hesitate at leveling such a grievous charge, given the lack of objective certainty.",0,-0.034133848690860225,0.034133848690860225
4355,"What this event yesterday tells me is that - despite attempts by Trudeau, the mainstream media, so-called ""experts,"" and virtually every major institution in this country to suppress criticism of islam - people in many parts of the country just aren't drinking the PC Kool-Aid anymore. The combination of M-103, recent events in Canada and Europe, and revolts by everyday people against traitorous, out of touch elites in recent elections have created an environment where a few concerned citizens can put up a Facebook page - and Presto - We now have protests at city halls across the country! A movement is finding its legs in this country and will undoubtedly grow. Prior to this, I have often been quite discouraged, seeing people in other countries waking up to the dire threat posed by islam while Canadians kept spouting PC diarrhea. Now, I have some reason to hope that Canadians won't be the Last of the Kool_Aid Drinkers. Maybe Trudeau's feckless support of M-103 will blow up in his face!",0,-0.03326399261249158,0.03326399261249158
3325,They might not have gotten Julie Payette right. Rumor has it that she's an anti-monarchist. That's like having an atheist perform a Roman Catholic Mass.,0,-0.03297418589239287,0.03297418589239287
117,"Given the many, many, many proven cases of officers straight up murdering people, assaulting people and lying to cover each other's rear-sides...I no longer believe they deserve the benefit of the doubt.

What could the woman possibility have said in an otherwise calm looking interaction that would justify the assault they perpetrated on her?",0,0.03294913406574573,0.03294913406574573
3819,"Sorry this was a light weight attempt to smear a fine fine organization.

These articles just continue to be recycled, week after week,  month after month

- women priests
- Knights = bad
- gay priests
- married priests
- abuse stories recycled
- nuns on buses
- ex priests
- ecochurch

not much left after screening out these type of stories.",0,0.03289625685004749,0.03289625685004749
499,"Most people dont understand the nature of evidence but they trust those who do because they know from experience that the outcomes are waaaaaay better.  People have been getting conned by snake oil salespeople since eve screwed things up in garden. 
Look at Rump. He conned millions. If its not the naturopathy clinic its some fad diet from an overseas scammer or the promise of all things good from an orange-haired carpetbagger.  Better to educate people than attempt to keep chasing down false advertising. Same goes for fake news.",0,0.032700351452064735,0.032700351452064735
2817,"Your comment about JFK confirms my point.  The Democrat party has moved so far from Al Smith, FDR. HST, JFK, and Pat Moynihan that it is impossible to support them.  I don't mind well-intentioned but misguided economic policies, but the social nonsense such as untrammeled abortion, so-called same sex marriage,  undermining marriage, disturbed men in the ladies room, and trans-gendered soldiers, has made the Dems a bizarre collection of odd constituencies.",0,0.032233534065367886,0.032233534065367886
1693,"Good article.  The only thing I take issue with is that ""He is a man in full command of his faculties "".  He is quite obviously not.  What you see is what you get and what you have been getting for the past few years.  His erratic, ill conceived decisions and pronouncements are not the result of clear thinking.",0,0.03183431832766814,0.03183431832766814
2263,"I am glad to hear that the PM has ""thoughts"" with this devastation. I think we need prayer there Justin! It is OK to say it. The PC police will not get you! Thoughts alone (with the brain God created in us) alone will not do. Canada has been  under a heavy hand lately. Fort MacMurray, unprecedented rain and miserable grey weather here on the West Coast (Victoria, BC) a looming trade war with the USA (which will have not a chance to win under Trump, the new leader of the free world) and now mass flooding in the East? What is next? We will pray for the good grace of the Almighty God of the bible and of this country. We are ALL under God (including the Liberal PM and elected politicians, lawyers and even the Elite CBC media) Canada has sliding morally, and we need hope and revival in our land.",0,-0.03130337072096245,0.03130337072096245
688,Whatever happened to Asian Lives Matter?,0,0.030568957706613276,0.030568957706613276
2314,"hmmm, could you paint that same scenario on the Democrats who ran and still run the inner cities of Chicago?
Come on! hahahahaha

imo, the institution uses some of it's money to help it's people in communities around the island. They can't educate every kid, maybe if the State of Hawaii pays up it's rent or having the State and US Gov. return it's rightful land who knows how many more kids they could support with schools and community services.

Liberal Democrats, AG Chin, Judge Watson, etc. should know better and get the rents and Haw'n lands back to it's rightful owner, Hawaiians! Come on, our own Hawaiians, a minority, under their noses and they get overlooked for the rights of possible foreign Islamic Terrorists?

My parents were poor, they just got by and had no time for me as being a latchkey kid. They scrimped to send me to a private school AND look at might use of the English language.
my take:",0,-0.030188892575536697,0.030188892575536697
1527,"If this isn't a Poe...are child brides the Schrodinger cats of ethical concerns when it comes to xtians? In other words, it's terrible when Muhammad allegedly did it - or at least I always see xtians concern-trolling about this - but if it occurred in xtian mythology (there is no historical evidence for the story you referenced), it's okay?",0,-0.029206158522240733,0.029206158522240733
3061,"He followed the laws....St Joseph obeyed the census, Jesus paid the taxes, told othres to follow the law...etc.

this idea of recasting Jesus as refugee is silly, anti-intellectual. Cheap.",1,-0.02848872609490649,0.02848872609490649
3993,"My bet is Trump doesn't make it past two years as president. This three week old government is floundering in chaos. His own advisors are so desperate they are appearing on news shows in an attempt to influence him. 

Today he will host a round table discussion on women in business, attended by Trudeau and a who's who of female corporate brass, as well as Ivanka. I'd bet money that Trump will struggle to not look bored, say something grossly inappropriate and spend most of his time grading the attendees for hotness.",0,-0.02790709496401811,0.02790709496401811
3243,"Regulations save lives.  Don't vote for folks who want to throw out regulations. Alaskans want clean air, clean water, healthy planet, safe working conditions, and sensible regulations.",0,-0.02768586693912667,0.02768586693912667
615,Thank you Mr. Segal.,0,-0.02642664321826893,0.02642664321826893
3143,"""relevant because of new repressive policies and positions in the U.S. that trivialize crimes against women""
Nonsense! Name the offending new policies. Or, are they merely ""positions""? Evidenced by what?
Natalie's screed is a fine illustration of the radical feminist alternative reality bubble.",0,-0.02451264743430115,0.02451264743430115
1468,"legal and company policy are different. it's legal to smoke pot, you just can't find a workplace that allows it. walmart drug tests  - for me , the MOST shocking thing about walmart i've ever heard.",0,-0.02444292375644208,0.02444292375644208
422,"I'm not holding my breath. Every time I think that he may actually act presidential, he Tweets.",0,-0.024234884149145097,0.024234884149145097
