,X_sentences,Y,Y_decision,Y_confidence
4113,"It is interesting that St. Paul names a female apostle.  In Romans 16:7 (NRSV), Paul says “Greet Andronicus and Junia, ... they are prominent among the apostles, and they were in Christ before I was.”
    To be an apostle, Junia must have had an encounter with the risen Christ and engaged in missionary work.  Church fathers, including Origen, John Chrysostom and Jerome confirm that Junia was a woman.  Further, the hypothetical male name ‘Junias’ is simply unattested in ancient inscriptions, while the female Latin name ‘Junia’ has been found more than 250 times in Latin and Greek inscriptions in Rome alone!
   Also of note is the fact that in the early Church women were often spiritual advisers and heard confession!  The rule that only priests could hear confession wasn’t part of the early Church.  If you want to explore the history of the sacrament of reconciliation, I’d recommend Monica Hellwig’s book ""Sign of Reconciliation and Conversion: The Sacrament of Penance for Our Times""!",0,-2.6713436012727714,2.6713436012727714
2214,"One should always have  the understanding that when they run for public office their lives will change for as long as they are in power and if there are young families involved then at the very least the proper support systems are in place. 
Much like high power female executives have to have these very  systems  in place.
If you make the decision to run the ball  is in your court, you are paid very well for the honor. Sorry its all about choices .",0,-2.670861821644998,2.670861821644998
1401,"For 80 % or so of the poor...the best concern for the pope trump and this country can give is an opportunity and encouragement (incentives) to work.

work develops a person...virtues, capacities, unity.

one can not be ""integrally developed) (a teaching of the Church) if one doesn't work, and work hard and well.",0,-2.669213495187684,2.669213495187684
2019,"I knew her, she was a saint.",0,-2.6684283607679737,2.6684283607679737
1241,"No, the reason they had to file for bankruptcy is because their expenses were great than their income. The ADN before Alice bought it depended on classified ads for a large part of their revenue. Along came Craigslist and that revenue stream dried up. Display advertising is also down. It's unlikely that the editorial content of the paper has any effect on revenue.",0,-2.667719968558502,2.667719968558502
3550,"The fact that maybe one of the executives decided to sell off would maybe not be so obvious, but what are the chances that 3 of them do it all within a couple days of each other?  That is just too close to be coincidence.  

Also, when one of those 143 million people has their identity stolen now, Equifax should be liable for all associated fees and legwork to restore that person's identity.",0,-2.6676254083389264,2.6676254083389264
1584,"The Fraser Institute thinks the 1995 slash-and-burn (and raise taxes) federal budget was a most wondrous thing. Yes, it did help lower the federal debt over the next 6 years, but the circumstances were different in 1995 compared to 2017. The U.S. economic expansion in the late 1990s was lifting  Canada's boat, the energy sector was not in distress, house prices were actually affordable and employment growth was strong for a number of reasons. The impact of the large cuts to provincial transfers begun in the 1995 budget made Canada a less compassionate and more unequal society, so it was definietly a mixed blessing. If this was a graduate economics seminar, this opinion piece would rate no more than a D.

The Globe and Mail should be more discriminating about the analytical rigour of what it chooses to share with its readership. We do have long memories and can think for ourselves.",0,-2.665463939393201,2.665463939393201
4240,"My husband insisted we watch even though we have never been interest in watching an inauguration in the past. He was convinced there was going to be an assassination attempt. It did not come to pass. However it does mean that if others thought the same thing, one might deduce that  more people would watch from the safety of home rather than attend in person.",0,-2.66529010781877,2.66529010781877
2281,"Interestingly, of all the things Jesus told his followers to do, write books on theology was not listed...",0,-2.664910579794284,2.664910579794284
216,"Trump haters are stark raving mad. Just read some of the MSM websites where most of the hateful liberal nut jobs congregate to get a general idea. 
CNN just fired some female comedian she thought she was being very funny doing what she did.  Anderson Cooper wasn't laughing but obviously she was catering to the Trump haters that follow her sick and demented comedy style.  CNN fired her for good reason the Trump hating propaganda on the MSM has escalated out of control.   Somehow the liberal wack jobs in the media think this is all ok. Trump haters are stark raving nuts and they show their true colors on the MSM everyday. No rational thought coming from Incognito Trump haters, just daily poison.",0,2.664633028812421,2.664633028812421
2031,"There is a ""battery breakthrough"" story every month, but almost none survive comercialization. The most glaring example was A123 funded with a quarter billion from the Obama stimulus. Then it went bankrupt when Asian companies could make them cheaper.
Lets hope this new idea is a commercial success.",0,-2.663673175787009,2.663673175787009
1696,"As a senior member of the congregation, listening to the Sunday sermon can be extremely frustrating. I have a hearing aid, the preacher has a microphone. However I frequently have little or no idea of what he says. i can hear bits and pieces as his voice rises and falls, as he speaks distinctly at times, rushes his words and becomes unintelligible, not inaudible, at other times. I can hear sound but not distinct words. It is painful to sit and listen for fifteen minutes and be unable to follow what is said. 
Perhaps we need to teach priests to speak clearly and distinctly!! Of course the problem is exacerbated when the priest is not fluent in English! But the problem exists with all of them.
Bill Keane",0,-2.6584862947855745,2.6584862947855745
3121,"Basically balancing the budget on the backs of students... Meanwhile every flight I'm on in this state has dozens of people that work here for the oil industry, but don't live here. They take the money and don't reinvest it in anything in our state.",0,-2.657818201030529,2.657818201030529
4180,"How many women outside the loop were forced to remain silent by the very group of feminists, e.g. due to their blatant hypocrisy.  Could it be that women are waking up to the fact that each woman is her own best  advocate. There is a reason for this,  Feminism, under Gloria Steinem was birth by Operation  Chaos, and Steinem kept it a secret; her Ms. MAGAZINE was financed as well so from the outset they and her cronies, including HRC betrayed women. (SEE:""It Changed My Life: Writing on the Women Movement,"" [by Betty Friedan] Village Voice,  by Stephanie Harrington, July 4, 1976)

Betty Friedan tells of the revelation she discovered, finding out about the CIA and FBI infiltration of the women movement and feeling helpless of the perpetrators of the ""dirty tricks"" were sisters leaders of the women movement, namely, Gloria Steinem  and Bella Abzug. For that reason she distance herself. Is this betrayal or what  from then to now.",0,-2.6573132968974895,2.6573132968974895
2293,"I certainly did read them, so you take up a lot of space unnecessarily.  You idea of ""balance"" in your own commentary is the most 'unusual' one I've heard of!  But have it your way.  What you really fail at understanding is that I am anti-abortion.  I've stated that many times before.  But I am not in favor of imposing that belief (which, BTW, was a long journey from my original position) on others through the means you and others push.  I am convinced that if we as faithful Christians who witness to the sanctity of life in ALL of its forms, provide the most compassionate and relevant programs and services, we will begin to see real progress in reducing the rate of abortions.  The Church is rather two-faced about it, in my opinion: it speaks of how precious the life of the unborn is, and then does little in actual intervention to really truly help women who face difficult pregnancies (none are easy) to choose carrying to full term.
(to be continued)",0,-2.6568731891111357,2.6568731891111357
632,"Cont United Health Care:

    * 
* Members will not be reimbursed if they purchase an approved OTC contraceptive without a prescription.  
* UnitedHealthcare has determined that contraceptives with the same progestin are equivalent to each other. Therefore, each unique progestin contraceptive medication is represented on the Preventive Medication List making sure women have access to a variety of contraceptives at no cost-share. Other contraceptives will be covered in other tiers at the applicable plan cost-share.",0,-2.6568588947385328,2.6568588947385328
2532,"Aloha ! I am Mister Great White and Mrs. Tiger Shark we both enjoy staying here in the Hawaiian blue waters cause people visiting from around the world just to see my cousins at Haleiwa area just outside the harbor . We love the Aloha , free food from the visitors who come to see us but us sharks prefer fresh meat not week old stuff it is hauna , some times we go visit to Waimea maybe if we are lucky we may be able to get some fresh meat , so keep on calling those visitor from around the world we prefer Asian food it is better for us it is so quick and ono ! Not to much Polynesian food ono but to much poi , we also like dark meat white meat is okay healthy but to dry need more gravy . Aloha too all especially the rich visitors .",0,-2.6553134303028694,2.6553134303028694
2410,Right? My bulbs have barely started growing. Very sad season.,0,-2.6535222449860427,2.6535222449860427
2854,"47 other u.s. attorneys dutifully submitted their resignations after trump's inauguration.

were the others trying to stage a sit in as if they were congressional delegates?",0,-2.6519148519046736,2.6519148519046736
3628,"Well almost.

His teaching is actually revealing a deeper point or truth about that Mosaic law.

There is the ""eternal law"" (the mind of God, the order, and criteria in His Mind):  not directly knowable, but it's reasonable to think about. 

There are the laws of nature:  material laws, which reflect some aspect of the mind of God. Perhaps a ""half-thought!""

Then there is the ""Divine Law""

which is made of up Natural Law and the Divine Positive Law (what scripture tells us, and what the Church has extruded from Scripture). 

So what Jesus was ""positively telling us"" supersedes the Mosaic law.  It doesn't mean it replaces it entirely...there is some hint in those laws of the Eternal Law.",0,-2.6518119348020885,2.6518119348020885
3887,"I am not sure why LifeSite News,
Church Militant and ""Fr Z"" have this enormous influence in the Catholic Church.  To me they represent the complete opposite of 
what Jesus has asked of us.  I pray other Catholic and non Catholic organizations and institutions invite him to speak.",0,-2.6507963474155254,2.6507963474155254
1529,"Have 9 and 10 year old Kia and Hyundai.   Pretty much trouble free except minor parts.   
No signs of trouble yet.   So planning on keeping them for another a few years, if not more.   Wife is very satisfied with them.   The best value and good reliability, and very pleasant vehicles to be in even after all these years.",0,-2.642443964485264,2.642443964485264
1397,I hope your daughter continues to receive the support she needs.  I wish both her and you the best.  Gary Crum,0,-2.642162026041433,2.642162026041433
2564,"Imagine how long the exemptions to the Labour Standards Act requiring IT workers to be on call and work unscheduled overtime without extra pay would last if the IT industry was not %99 male. We would be treated fairly by spring, but its men. Diversity?",0,-2.639742053776048,2.639742053776048
1040,"I am one of those women who delayed motherhood until the age of 40. I was fit and healthy, ate well and practiced yoga. I had no idea that trying to become pregnant would be so difficult. But I managed to get pregnant by following this method:
( infertilityinwomen.com/how-to-get-pregnant-faster )...",0,-2.636748806801995,2.636748806801995
918,"A wonderful article about wonderful people and places in the midst of life contrasted by the stark beauty of Alaska.  Thank you. 
 I agree with Physicist Mingming Yang, that confirming the existence and parameters of the Higgs boson are not for exploitation.  I believe, however, they are to be utilized for a much higher purpose or perhaps pursuit - the integration of the realities of the cosmos with the understanding of the human intellect. This ongoing adventure may unlock a greater respect and stewardship of all that dynamically exists in each and every moment of our reality and beyond.  This may indeed save the planet, and much more, for future generations.  Peace.  
Bruce Dalious",0,-2.6361880718694843,2.6361880718694843
1855,"I'm going to try again to reply to this since my reply seems to have been ""lost"" in the ""peer review"" process, not that I view many here as my peers.   The State NEVER negotiated retirement benefits as a part of labor agreements other than very early contracts with maritime unions.

I had some part in negotiating every labor agreement between 1987 and 2006.   And I didn't ""walk away"" with anything; I paid in what the State asked me to pay.",0,-2.6358501824816245,2.6358501824816245
2191,Enjoying every minute of this season so far!,0,-2.6351857537751577,2.6351857537751577
1050,"People are all unique.  We are in different places with our lives, have different experiences, and need different things to grow spiritually.  Amoris Laetitia understands this and seeks to reach out to people where they are.  Cupich when discussing the internal forum at the Synod last year illustrated this through a wonderful story about a remarried woman who received Communion at her son's funeral.  (The son apparently committed suicide.)   The woman later reconciled with the Catholic Church because the priest at her son's funeral cared about her and allowed her Communion.",0,-2.6320292536869836,2.6320292536869836
1701,How did Josiah get separated from his father? Why is Tammy living in a group home? Did she have a pre-existing condition that was the cause of her needing counselling?,0,-2.6300688040365787,2.6300688040365787
502,"Yes, we have children, lots of them. Yes we live on the outskirts of a major metropolitan area. Yes we send and have sent our children to Catholic schools, until and including 12th grade. We home school all our children until 9th grade, saving our money to send them to a good solid Catholic High School.  Some people may need a crash course in Catholic living...heroic living, living their vocation with trust, effort, prayer, abandonment, ""kenosis"", getting closer and closer and closer to unity with God each day...USING the raw material of parenting...the diapers, the shortages, the little joys, the tragic medical conditions that can come, the broken cars, washing machines, and all difficulties and all easy days too.
Kenosis! So few people understand. 
So many Catholics have NO IDEA what I am talking about. None. They don't understand at any depth the meaning of the ""universal call to holiness"".
Some Catholics complain if they can't eat out more than once a month.",0,-2.6281121417423465,2.6281121417423465
587,"So, the gov signed a contract that won't give conditions or prices, that gives the company rights to a lot of radio territory. This sounds a lot like other signings with the oil companies, those who rebuilt the anc. port, etc, etc, etc, SS DD.",0,-2.6274235920027698,2.6274235920027698
3372,"Are Mexico and Canada being subjected to some analogous tactic at this opening stage of negotiations in the hope that they will start offering unilateral concessions in order that negotiations do not break down? 

Is Canada responding in part by introducing a wide range of new topics for negotiation thereby showing that we're not going to concede control of the agenda to the US?",0,-2.627015290826823,2.627015290826823
1868,"Oh why oh why oh why ....didnt The Globe and Flail ......aspirant to being Canada's newspaper of record.... give us the actual vote total  or percentages in the byelection, even a comparison  to last time, and how about turnout. 

 Now i have to check other alternatives. 

Not providing such basic information is almost like writing about a heat wave and not mentioning the temperature.",0,-2.6263589102503575,2.6263589102503575
3096,"Have we Maxed out on the island's holding capacity?  If you're not building affordable housing for the residents,...who's coming?  I remember when we had an influx of unhappy well-to-dos, relocating from Maui...another disaster waiting to happen, who came to a peaceful island to build their walled estates... you no longer can see the ocean nor feel the breeze.  Don't you know what ""enough"" means?",0,-2.6238816032342447,2.6238816032342447
3264,"During  George W's administration, 473 days of E-Mail went missing  including the Executive Office of the President and the Office of the Vice President,  between 2003 and 2005.

""The special counsel who oversaw the investigation of the Valerie Plame Wilson CIA leak case, Patrick J. Fitzgerald, wrote in a letter to defense counsel in January 2006 that some e-mail in the offices of Bush and Cheney was not preserved through ""the normal archiving process"" in 2003.""

http://www.washingtonpost.com/wp-dyn/content/article/2008/01/17/AR2008011703575_pf.html",0,-2.6237836427240504,2.6237836427240504
778,who made the biggest sacrifices building our Canadian railways?,0,-2.623432036110152,2.623432036110152
1998,"A group of local women who form an organization to advance their interests is not a ""business open to the public."" And organizations, like churches, Have the freedom of association.

From Wikipedia: ""the Court [has] ruled that a group may exclude people from membership if their presence would affect the group's ability to advocate a particular point of view.""",0,-2.622929591012462,2.622929591012462
2430,"What an incredible story,  good for her, a lot of American born people could learn from this,  great story,  great woman, an inspiration to all. thanks for the read.",0,-2.622756761583862,2.622756761583862
3187,Next year...,0,-2.622699922760698,2.622699922760698
1260,If the housing being locally produced is not affordable or available to the average person then it's being built for speculation. No amount of rhetoric changes that.,0,-2.6191676041450256,2.6191676041450256
1893,"Both Labour and the Conservatives were supportive of Brexit and considering not much was said about Brexit during the campaign, I don't really get the basis of this column. The negotiations on Brexit start in a few days, actually. This election doesn't change that.",0,-2.615995180042326,2.615995180042326
1123,"Character is what we say and do when we think no one is listening or watching. If Trump's bragging about trying to bed another man's wife was just ""locker-room talk"" I've never heard anything that vile in any locker room. Anyone that can't see what a vile person Trump is by now is a fool or a tool -- blindly partisan and without ethics or morals themselves, just as is their smarmy Trump.",0,2.6140687967550003,2.6140687967550003
662,Florida people love Alaskans and welcomes them with kindness and hospitality! I am looking to move to Alaska and live mostly in Florida or Hawaii for the very cold Alaskan Winters! Can I buy an old 160 acre homestead with Mineral Rights and drill a well for Gas in Houston Willow area?,0,-2.6132481766920455,2.6132481766920455
2467,"We were sold a bill of goods that light rail would eliminate some of the traffic congestion. Problem was it's 30, 40, or 50 year to late. People are used to driving their car. How old is the subway system in New York? People are used to using it. Add do the this RTD can't get it running effectively, or on time, why use it. If I have a plane to catch, I'm either driving and parking, or having someone drive me.",0,-2.605597882516924,2.605597882516924
631,If labor costs are higher we have to make do with fewer city employees.,0,-2.603351522969773,2.603351522969773
1674,"Not surprisingly coming from you - you have no understanding of the nature of liturgy.

The Eucharist Prayer is to God.

It is not a conversation amongst each others.

As Jesus said to the Apostles ""Do this in memory of me"".",0,-2.600810109460511,2.600810109460511
3470,"“The fact is that Puerto Rico has been destroyed by two hurricanes. Big decisions will have to be made as to the cost of its rebuilding!”

South Florida has had four major hurricanes since 1928.  Any questions on the cost of rebuilding there?",0,-2.5994926919786066,2.5994926919786066
346,"I am pleased that Tom Driscoll appears to recognize that ""Making America Great Again"" is a good objective. "" Working together"" is also a healthy position for Mr. Driscoll to take and I do hope that Tom can convince his party friends to adopt a more positive level of tolerance with the new government. So far, during the past 4 weeks since the election result, the excuses, resistance, denial and hysteria from the opposition, including the biased media, has not shown the wisdom and maturity being demonstrated by Mr. Driscoll.  
Alan Jackson. Poulsbo.",0,-2.5989359793793088,2.5989359793793088
3444,"You are mixing the situation 2000 years ago when the Roman Empire was dictatorial and only provided law and order with today when people have a somewhat democratic government.
The social justice that Jesus proclaimed has inspired many people to elect governments to provide universal healthcare and social services to help the needy, sick, homeless. Jesus NEVER said it was a personal responsibility. That statement is YOUR will not GOD's will. We can be more effective and help more people as a community of Christians, Muslims, Jews, and non-religious than individually! God asks us to love others, not be ""virtuous"".",0,-2.5974012738193633,2.5974012738193633
484,"Great point, I hope the powers to be read your post. UH needs  much more exposure nation wide. They also need exposure on the island to generate interest in the team. Currently UH is not in a strong negotiating position. Also, if the State committed to UH Athletics, and  a decent business plan were to be developed, a major part of the plan would be broadcast exposure. I would sure like to see the business plan, but I'm not convinced that one even exists.",0,-2.5961491396454366,2.5961491396454366
424,This is a test of the new system that says the comments are closed yet it keeps accepting them...and the sorting system doesn't work other than newest first...probably why the other three choices are gone...anyway...where does the buck stop in Ontario...just below the Premier and her caucus?,0,-2.593695530396778,2.593695530396778
1323,"""It might"", ""it's possible"", ""it could"".  Wow! What a ""prediction""!",0,-2.5935748115769206,2.5935748115769206
4491,"I'm a young Catholic convert drawn to the Mass, Mary, the saints and the Eucharist who loves NCR. I'm meeting with a young undergrad who shares my beliefs soon. We are here, some may call it hanging on. Many young  people in the college town where I work are the ones who don't question anything. It's has been harder for my young friend and I to spend time with this crowd after the election.",0,-2.5925853442854145,2.5925853442854145
2453,"An Oceanic tech working on a cable problem at my home a few weeks ago told me that Charter actually wants to pull the plug on any broadcasts of UH sports, not just streaming. 
Charter's top brass (or representatives) were supposed to meet with Oceanic officials to discuss the issue sometime before the summer. If true, the real problem might be with Charter, not Oceanic or UH.",0,-2.5902717781028795,2.5902717781028795
3391,"I was watching videos of the islamic female leader of the black lives matter movement in Toronto, and I have never seen such a stream of vile, hatred from any group since the KKK.

islamic speaker after islamic speaker was just spewing their hatred in a public place and the police did nothing?
Yet these same hate filled bigots would label Canadians islamophobes?

Why is this not labeled as hate speech and Whitephobia?",1,2.5901707004186143,2.5901707004186143
3466,I would bet that the majority of parental leave is being taken by women. And any man that wants to take it when his wife wants it is just out of luck.,0,-2.5901611918676615,2.5901611918676615
3736,None of your pitch exists,0,-2.588120266890268,2.588120266890268
776,Bring on the soup weather!,0,-2.5861522170758677,2.5861522170758677
324,It is my understanding that it was Pierre Trudeau's government that first enacted the legislation enabling individuals to incorporate. I agree with your point that the Gini index isn't a perfect reflection of income inequality and can be skewed for a number of reasons.,0,-2.582504031548525,2.582504031548525
1223,"""I spent my morning transplanting forsythia and tiger lilies in advance of the rain, and rain always makes  me think of this exquisite aria from Handel's ""Solomon"" - ""Will the sun forget to streak?"" here sung by Sarah Connolly...""

MSW, just your typical American heterosexual Catholic male.",0,-2.5806240504968403,2.5806240504968403
