,X_sentences,Y,Y_decision,Y_confidence
2606,"Such rigid metaphors!  The virtuous circle starts with the devotion to God and then it flows to your neighbor (community).  As St. John of the Cross mapped in the 'The Ascent to Mount Carmel', at a certain point, your devotion to God is deep enough, that your love of God and your love of your neighbor are practically the same and mutually enriching thanks to the sanctifying power of God and His sacraments.

Jesus even sequenced the commandments in that way:  the greatest commandment is to love God and then to love your neighbor as yourself.  

The problem is we have too many liberal or lapsed Catholics suffering from some type of deep-seated envy over the primacy of conscience of Protestants so they can do whatever they want with God's commandments.   And they also want to be entertained and informed during the one hour of the week that they set aside for God.  The most self-defeating sense of multi-tasking ever.",0,-2.5771483791833365,2.5771483791833365
4102,At least Protestants are open about their divisions; Catholics just hide theirs.  Who are the more honest?,0,-2.574419193326503,2.574419193326503
2383,"I should have said ""son of an immigrant father"" in the last two sentences rather than ""son of an immigrant"".",0,-2.5732932712676484,2.5732932712676484
3228,What's with the photo of the hoses and valves?  Are they supposed to tell us something as to the fire's cause?  A little explanation would of helped.,0,-2.5725261221633824,2.5725261221633824
4015,"TDW,

For manufacturers who don't move with the times you might be right. The German car industry recognizes that Tesla is their most important competition going forward.

http://insideevs.com/der-spiegel-calls-tesla-biggest-concern-german-automakers/",0,-2.572475697136875,2.572475697136875
3457,"Eliminate the ""Statewide"" function; it adds zero value to the educational process.  Let the Major Academic Units (MAUs) propose their own budgets, and let the Board of Regents submit the budget request.",0,-2.5719625196977716,2.5719625196977716
3916,Actually I own a 350.  Not much risk of me ever getting into a leaf.,0,-2.571216194678212,2.571216194678212
4033,"I think this is magnificent. It so happens that I was in the wheat production business for about 40 years, and I got to know it well. But, unfortunately, there was no pot containing specks of gold beneath; we were still able to feed many mouths.",0,-2.570849347142598,2.570849347142598
2292,"<<To say He was a product of His time is is to effectively deny that He was the Son of God, which I'm sure you don't wish to do.>>

No, it does not effectively mean that. The Church proclaims Christ was fully man, no? A man of his time.",0,-2.5644771006149782,2.5644771006149782
2976,"First you need to decide what you want to achieve, then build an appropriate system.   The blind trust issue is likely to deter well-qualified candidates - is that a desirable outcome?  I don’t think so...  So what is a reasonable alternative?  ‘Reasonable’ is important.  IPPs are an existing (but not well known) product.  Other firms than Morneau’s could provide it.  If the product can address some of the issues in the small business tax spat, it would be irresponsible for the Minister to not refer to it!  Yes, he might benefit a bit through his firm, but unlikely by a large amount.  What is needed is a way to identify the issue, then decide how important it is, and monitor the outcome.  Taken to extremes, you could say anything a political figure says or does could affect the markets - does that mean they should only be allowed to hold cash?!  Why should their small business holdings be exempt?  It’s complicated and reducing it to an oversimplified statement is not helpful.",0,-2.5635039261429657,2.5635039261429657
3195,"“Imagination is more important than knowledge. For knowledge is limited to all we now know and understand, while imagination embraces the entire world, and all there ever will be to know and understand.”
― Albert Einstein",0,-2.5634478806517644,2.5634478806517644
2967,"Are you referring to Roman Catholicism during the Spanish Inquisition?
.
Are you referring to both Roman Catholics and Protestants during the 30 Years' War?
.
Are you referring to Shinto before and during the Tokugawa Shogunate?.
.
Are you referring to Chinese government policy during and after the Tai-Ping rebellion?
.
Are you referring to the partition of India?
.
Please clarify.",0,-2.561995068981053,2.561995068981053
3196,"""Cue the sounds of crickets""",0,-2.5616948141830336,2.5616948141830336
3519,"A highlight of my life was seeing them play for about 50 people at The Railway Club in Vancouver in 93. I remember shaking Gord’s hand and thanking him profusely for making Canada’s music. He was a class act all the way. His was a unifying voice for Canada. 

“Did you know, Gord, that you were the rock blood for all of us?
In the conduit of Vesuvius?
You were far more unifying than you know”

Rest In Peace, Gordon. And Thank You. You will be loved always. Cherished and greatly missed.",0,-2.561436323359732,2.561436323359732
2144,"Indeed, why is Gabriel bringing up Sessions?",0,-2.5607749871240104,2.5607749871240104
4171,Why don't you ask all my black friends and black college roommates if I'm a racist. Or watch my wedding ceremony and see if I'm a islomophobe.,0,2.560397718189167,2.560397718189167
1643,"The Church had no role in marriage in the Roman Empire until the 4th or 5th century. And when it took over control of weddings services and recording marriages from the empire, the theology of marriage developed in the Western and Eastern Church were significantly different.",0,-2.5563529992413008,2.5563529992413008
1275,"I went once for a minute in the summer, but I was really close to never going at all. I just think if I'd listened to everyone else, I wouldn't know what I'd be missing, and that'd be a shame.",0,-2.5550386693400178,2.5550386693400178
2164,"So this study seems to show that the big chains will adapt just fine, but the small independent businesses won't? All that will be left are the big chains then...is this what is wanted?",0,-2.5548912583206067,2.5548912583206067
180,"So if ""white working class boys "" are so stupid and ignorant how come the generations of grown up ""white working class boys"" succeeded in creating democratic and prosperous societies so ""black and brown working class boys"" and their parents are dying in droves trying to get into ?",1,2.554855285425118,2.554855285425118
3920,She's not JV anymore when they move her up. Now she is Varsity.,0,-2.5538507827676886,2.5538507827676886
790,"To provide such an example is fairly simple, once you understand the structure of the SA ""basic"" education system.
In a simplified analysis, there exist three classes of schools:
1. Totally state-operated schools.
2. Partially state-operated schools (probably the majority, and particularly including the ""former model-C"" schools)
3. Totally private schools.
Of those, the first two classes report, in non-academic activities, wholly or partially to government, and can be regulated in terms of their religious policies.  
The third class are only regulated in terms of their academic curriculum being directed towards the same matric examinations, but otherwise they are free to set their own rules, particularly in religious matters.  In that way, there are some church-operated Christian schools, some Moslem schools, and some operated by the Jewish community.  All of these will show strong religious preferences.
The OGOD matter seems to be directed basically at the second group.",0,-2.55306158664214,2.55306158664214
3986,"""(Horgan) noted — as he has many times over the past two weeks – that most voters did not choose the Liberals.""

Selective noting on Horgan's part.  60% of BC voters didn't vote for the NDP, did they?",0,-2.552624640085389,2.552624640085389
3013,"In other words, they leave because most boomers, Gen Xers, etc. simply can not comprehend a world or institution which does not conform to their {protestant} notion of ecclesiology, dogma, or the Church's binding magisterial office. Conversely, why is it that the bulk of Traditional Mass {Latin Rite Missal 1962 or earlier} Catholics aren't from the senior home, but rather the 25-50 demographic?",0,-2.552113157084585,2.552113157084585
1809,"""Mayor Kirk Caldwell has proposed requiring all large residential projects to allocate a certain percentage of units to low-income people, but he hasn’t introduced a bill to Council due to opposition from developers."".......This is opinion from the reporter...........""The Council plans to vote Wednesday on a resolution that would approve the concept for the development by Manaolana Partners."" .........The reporter got this correct in that the project is in the hands of the City Council. What is missing from the article is the reporter failed to poll Council members on how they intend to vote.",0,-2.5516577578424036,2.5516577578424036
1032,"Artster says_
""What? Trump is keeping the guy who single-handedly swung the election for him? ""

 He did? How did he do that again? You have proof, right? Oh.....

""And when is Comey's Congressional Medal of Honour Ceremony?""

 He's a war hero, too? Please share that link, Id love to read the citation.",0,-2.549977752443339,2.549977752443339
3286,"I am sorry but I would challenge you to post something, anything, that would show Freeland using either eloquence or common sense. 

Have you seen the Bill Mahr interview with her?

(PS - I voted Libs this time around)",0,-2.5476194085361916,2.5476194085361916
1938,Doesn't matter if they shut off the supply coming in.  People can make it here on island using common ingredients that are pretty simple to obtain.,0,-2.543951990781149,2.543951990781149
420,"Well, I haven't worn fur for pretty much my entire life, so I guess so.",0,-2.5438625081448043,2.5438625081448043
1043,"Carbon taxes and strangling regulations are not  ""unstoppable market driven trends."" Biden and Trudeau are living in a world where ElNino and El Nina are man made climate change rather than forces of nature.",0,-2.5427365284729477,2.5427365284729477
3748,"You might THINK the Unitarian church ""stands for the principles of Jesus.""  Maybe they do.  If so, that's an accident; a mere coincidence.  There are people with backgrounds in Christianity, Buddhism, Hinduism, Judaism, animism, etc. who call themselves Unitarians.  Unitarianism has no creed, no specific concept of God(s).  In fact, they are very proud to have no creed, because they think creeds cause divisiveness between people who believe or don't believe in them.  They focus mainly on ""social justice"", helping our fellow man (and woman, and animal), and all manner of feel-good things which are not inherently related to any particular theology.",0,-2.5400085550066462,2.5400085550066462
2408,"Buddhists and Catholics collaborating for the common good. Go beyond rhetoric, I hope; go beyond pietistic platitudes. Get your act(s) together and focus: contemplation and discernment. We have so much in common. Contemplation without discernment is self-illusory; discernment without contemplation leads to ideology.",0,-2.537160518616105,2.537160518616105
80,"What's the matter, np5491, can't answer a simple question?  You're pathetic if you can't disavow trump's indecent behavior.  That makes you an enabler for sexual assault.  It's people like you that have made life so difficult for women.",1,2.5357754124400778,2.5357754124400778
93,"It's a free country.  He did his best, but stupid is as stupid does.  I feel bad for the kids family.",1,2.534806070376142,2.534806070376142
2173,Have you tried taking Henry to dinner or perhaps a show with drinks afterward. Not for you ofcourse but for Henry. Better yet if you provide airfare to a city of his choice for him and his family and tell him it's for an educational jaunt to see how other similar size cities regulate smoking I'm sure that would get you a face to face sit down. I mean no disrespect Sara Kay when I ask why haven't your teachers taught you how government really works?,0,-2.5343191671482774,2.5343191671482774
4090,"Defense
Positives:  Found a way to win the game in the end.  Gotsis played well (never expected that).  D. Stuart made some great tackles (even though he got beat on the long TD).  For most part, stopped the run.  Talib played well.
Negatives:  No pass rush with a standard 4 man rush.  Blitzes worked sometimes.  Miller has to find a way to get to a QB even if he is double teamed.  If he is double teamed all the time, then other defensive players have to step up.  Roby is the weak ink in the DBs.  He makes plays but also gets burned.  Simmons was just okay today.  Todd Davis had a big stop.  But also cannot cover.",0,-2.5337432909213913,2.5337432909213913
3428,"The examples you cite of Jesus 'upping' things are all examples of his radical interpretation of the Mosaic Law.  These are the famous 'you have heard it said ... but I say to you' teachings in Matthew's gospel.  Jesus did teach a lot more than there is room to discuss here in a single post.  And Christians take Jesus at his word when He said ALL the law, and ALL the prophets are fulfilled in the love of God and the love of neighbour.  I read the readings for the day every morning about dawn, and they fit rather beautifully the points I've been trying to make here.  You imply there is some sort of conflict between what I've posted and what the readings say, but you don't explain what you mean ...  In today's gospel reading, Jesus teaches us how to pray.  How does the Lord's Prayer conflict with what I've said?",0,-2.5337300781743446,2.5337300781743446
1634,"Some of the ""insights"" may be misleading.  For example, talking about 2 stocks that each have a 65% probability of outperforming, the probability of both outperforming being 42%. This makes it sound superior to buy just 1 stock.  Now let's step into the real world, the stock you buy ends up going down 30% and the stock you don't buy doubles.  OOPS!  If however you split the position, you might still be ok.  If both stocks outperform by the same amount, you're no worse off than if you had bought only 1. And yes if you buy the stock that goes up and avoid the stock that goes down, clearly that's the better scenario but what are your odds of doing THAT?  Then of course there's the possibility both stocks go down, then you had better revisit your analysis and probabilities.",0,-2.5328254099927054,2.5328254099927054
123,I flagged your post for its vilely racist views.,0,2.532525208084669,2.532525208084669
828,My deepest sympathies to all of Gertrude's family and friends in Mountain Village and the surrounding communities.,0,-2.5324805568611164,2.5324805568611164
4181,"These articles are thinly veiled marketing infomercials for the pharmaceutical industry disguised as ""news"".",0,-2.5314571199372753,2.5314571199372753
1823,"""When Nobel purchased the school in 2013, Ammidown became the principal of Merryhill and reported to Krista Bielat, the lawsuit says.""

One can only wonder who Nobel bought it from.",0,-2.5305518178986297,2.5305518178986297
2590,"My version of the Beatitudes says nothing about setting up government programs to feed the poor.  Actually, nothing in the Bible says to do this.  It's the opposite - attention to the poor is required to be a private, personal act of charity by either individuals or the church, not the state.  More people and churches than you imagine are doing precisely that, including the food bank I'm connected with.

You believe that resources are so widely available that we should feed every kid at taxpayer expense, regardless of parent ability to pay to feed their own child?  We shouldn't question why a parent is neither refilling the lunch account nor applying for federal assistance?  Is it your contention that no one should even try anymore to hold any parents responsible for providing the necessities for their own kids?",0,-2.5291440474789173,2.5291440474789173
1268,"Yup. People really don't think clearly about cars. The resale price reflects supply and demand in the second hand market for a given type of vehicle, not necessarily any absolute measure of 'value' or the replacement cost of the transportation  services provided to you by the car.",0,-2.524815064697717,2.524815064697717
2399,"I have been involved with these groups and I think the follow up organization after the approximately 4 million women march nationwide...and we are talking about groups in the many many thousands in many many cities...was the healthcare issue.

Women are passionate about protecting healthcare for those 22,000,000 to 32,000,000 poor and elderly who were proposed to be thrown off Obamacare....without a doubt it was a key issue.

Folks toook a dim view of Trumps airport shanigans hence the rush to the airports, folks objected to abandoning the Paris Accords, hence the marches for the environment and it goes on and on.

Folks also learned from the Indivisible Guide...just how to get the attention of their legislators (it was written by staffers).

Please note the NYTime piece on this movement...

https://www.nytimes.com/2017/11/05/opinion/the-new-democratic-party.html?smprod=nytcore-ipad&smid=nytcore-ipad-share",0,-2.515422607563427,2.515422607563427
2963,"Immigration, like so many issues is complex, but applying the past to the current situation is just selectively blind optimism. 
In the past, most immigrants came with the intent to make a better life - & to make that possible- to learn the language, to blend in with the American culture.  Massive illegal drug importation & illegal entry were not significant factors. Terrorism was not a big issue, back then.
 Things are very different now & new parameters must be employed. In the past there were no large bureaucracies anxious to add to new clients to the welfare roles. In fact immigrants -like citizens - had to fend for themselves.
When I drove to Alaska from the 'lower 48' in 1967, I had to show sufficient cash to pass through Canada - as a means of minimizing risk that I would become a burden to Canada before I could get through the country. That was reasonable. A similar requirement should be made of all people requesting entry to the USA.",0,-2.5133111434824995,2.5133111434824995
3191,"From the same article:""...median estimates are derived for ECS of 1.64 K and for TCR of 1.33 K.""
You're quoting equilibrium climate sensitivity (ECS); I'm not sure we'll ever see ECS. We will see a transient climate response (TCR) in a hundred years or so. That's 1.3 K - about 1 K.
The gentleman's question was about whether we can safely move forward with fossil fuel consumption. The answer is yes; the effect is small and we have no choice.",0,-2.5114515671474296,2.5114515671474296
321,"His immigration related executive order changes current immigration law and he does not have the constitutional authority to do so, as he told us 23 times.",0,-2.509982887602515,2.509982887602515
160,"Trump is a White Supremacist and he only cares about his popularity, not his country. That much has been clear from day one.  I truly don't know why anyone is surprised at Trump's failure to specifically call out the violent, right wing neo nazis in Virgina who killed one and injured many more.  He just doesn't care. Further, since he represents those who voted for and continue to support him, why should he? They are all racists, bigots and haters. His base, in more ways than one.",1,2.5072351652216307,2.5072351652216307
2932,"I'd advise you not to do any research on FDR's campaigns; you'll be disappointed. 

You may also not wish to avoid learning that FDR died 4 months after inauguration.",0,-2.507206761237045,2.507206761237045
2691,"I offer a layman's assessment based on reading articles and assessments of NK.    It's not particularly ""unique.""  Read a few of the hundreds of assessments of NK's goals and I think youi will see there pertty much agreement.  regards, Gary Crum",0,-2.5063599548167614,2.5063599548167614
894,"You mean the supposed 30 million-55 million (pick your stat of the week) who didn’t have coverage and were clamoring for it so much that a fraction of them actually bought policies, even though it’s required by the law, and even though nothing prevented them from getting actual care through other means, including applying for Medicaid? Those ""millions""?",0,-2.506295836483453,2.506295836483453
1530,"It will be a Lib majority, perhaps a couple of new seats for the Greens and another major disappointment for the NDP when the ballots have been counted. Horgan will soon know how Premier Adrian Dix felt last provincial election day.",0,-2.5048978162573383,2.5048978162573383
3530,"Take time to look over the plans at this project, the travel plan for the salmon heading up to spawn. It's quite impressive, and does work. It's down to population growth, or not, how much does a person want to be paying, not only out of your budget, but in the long term life of a commodity. Power generation, born out of necessity, so keep that in mind. The dynamics mentioned in this article, pristine wilderness, tourism, the economy, all are indeed important. The utility faces equal challenges when gas turbines are to be employed. Although clean burners nowadays, they are indeed burning fossil fuel 24/7. Hydro power, initially does stir up some land for roads, and underground, depending on the project, after completion, be amazed the reclamation that is done to the area.If you want no electric power, then let's return to the pristine late 50s when I first saw the Kenai area, not much of an electrical demand then. What was tourism? The utility is just addressing demand.",0,-2.504071976784363,2.504071976784363
4047,"I believe Mr. and Mrs. Jones.  When was the first or last time you were in the Jones house visiting?  That's what I thought, never.",0,-2.503372421509014,2.503372421509014
2832,Weird that white supremacist would be white...,0,2.5023792778588607,2.5023792778588607
1312,"Just returned from Tokyo last week.  It was a step above Honolulu!  They have rail both above and below ground, no vibrating, no noise, no problem.  Maybe Tokyo was a bad example to use?",0,-2.5004353567993762,2.5004353567993762
4108,"Three things come to mind here.  The second:

2) Some here have observed that in modern Western society many marriages fail.  (To be more precise, perhaps we should say that 1 or both parties fail to keep the marriage going—marriages don’t fail, but people do.)  But given this situation, it’s all the more reason—not less—for the church to challenge this decadent modern society and to uphold moral truths.",0,-2.5001696956513344,2.5001696956513344
4478,"The inquiry will fold before winter, while there are still millions ($20 -$25 million) in the budget accounts. The members of the inquiry will demand that the remaining funds be transferred to native women's groups and reserves for traditional aboriginal style healing. In truth the money will simply disappear. Trudeau will hand the money over without question and with deep remorse for white man's' treachery.  Bennett will wear sackcloth and ashes.",0,-2.499360896934113,2.499360896934113
2196,"In mid-January, the advocacy and support group for survivors of sexual abuse by clergy learned of a lawsuit filed by a former employee alleging the group had abandoned its core mission of supporting survivors and had engaged in a ""kickback"" scheme with attorneys who sued the Catholic church on behalf of survivors.—Brian Roewe  Thank God in the United States, the accused is assumed innocent, unless proved guilty in a court of law.  “The Lord’s kindness is everlasting to those who fear him” (Psalm 103: (see 17)).  “See to it that no one be deprived of the grace of God, that no bitter root spring up and cause trouble, through which many may become defiled” (Hebrews 12:15).  “`A prophet is not without honor except in his native place and among his own kin and in his own house’” (Mark 6:4). Liturgy of the Word, Reading 325, Wednesday of the Fourth Week in Ordinary Time, Year I",0,-2.4992721713988395,2.4992721713988395
2097,"Independence was only ever  embraced by a fervid minority among francophone Quebecers, although they held the high ground among intellectuals and artists, which created the  perception of a larger movement

in truth, the core and non-negotiable demand of QC voters during the Quiet Revolution was to be able to work in French, that it become the economic language and that the business  hierarchy be entirely open to French speakers ... the result was a massive increase in the number of francophone MBAs and the parallel rise of Quebec Inc. corporations in the 1980s ""Bombardier generation""

After  that was  achieved, support for nationalist parties steadily softened, to the point that the PQ is almost certainly doomed to 3rd place among electoral groups after the next elections in 2018.",0,-2.4983459353563258,2.4983459353563258
1642,"Jesus said that the greatest commandment is to love God, with all your heart, with all your mind and with all your soul.  The liturgy is the organizing element that allows us to love God and receive the gifts of his sacraments, so that we can learn to love our neighbor in our daily lives.  But of course, if you believe in the primacy of conscience over Scripture (the word of God) and Tradition (accumulated wisdom) then you will naturally prefer to worship God in your own way and on your own terms.  But if that is the case, why would you even call yourself Catholic (universal)?",0,-2.4977156779630403,2.4977156779630403
