,X_sentences,Y,Y_decision,Y_confidence
1536,The preceding paragraph belongs in the National Enquirer along with the stories of Elvis Presley being alive and well and living in Buffalo.,0,-4.2223264919321055,4.2223264919321055
3468,Thanks for confirming my thesis!,0,-4.126652554300593,4.126652554300593
70,You are delusional because no one can be that stupid.,1,4.080633086092972,4.080633086092972
3487,"The ""potential"" younger ticket buyers aren't especially interested in the Bach Fest, whether played by smaller ensembles on period instruments or not. Is it just possible that they grew up in school systems that had cut, either entirely or to the bone, music and other arts programs, so weren't exposed to this music in any form?
Also, if the Bach Fest isn't packing in the crowds, wouldn't it be prudent to acknowledge that it's biggest years are past, and scale it back to a more sustainable model? Oh, but there's that UO prestige thing to consider...",0,-4.044328989949254,4.044328989949254
1046,"Inna lillahi wa inna ilayhi raji'uun--To God we belong, and to Him we return.",0,-4.002031957570534,4.002031957570534
1077,"And the Fathers of the Council of Trent remind us:

""And whereas such is the nature of man, that, without external helps, he cannot easily be raised to the meditation of divine things; therefore has holy Mother Church instituted certain rites, to wit that certain things be pronounced in the mass in a low, and others in a louder, tone. She has likewise employed ceremonies, such as mystic benedictions, lights, incense, vestments, and many other things of this kind, derived from an apostolical discipline and tradition, whereby both the majesty of so great a sacrifice might be recommended, and the minds of the faithful be excited, by those visible signs of religion and piety, to the contemplation of those most sublime things which are hidden in this sacrifice.""

Now, if TWO Church Councils take pains to remind us that the sights, sounds, and smells matter in teaching us the Catholic Faith at mass, we ought to pay attention.",0,-3.9973810098456424,3.9973810098456424
2526,"I don't remember having vog ""back in the day"".  Unless my ""back in the day"" was waaaay before yours.",0,-3.9104376361656694,3.9104376361656694
1562,"Find the best medium to spread this message.  Show good parenting strategies on television programs that the targeted audiences watch.  Write dialog of popular characters on those programs talking to their toddlers to build vocabulary and reading to them, showing how special that time is for the kids.",0,-3.906884761719268,3.906884761719268
609,"This article is so short, we're only getting a snapshot of his life.  Not sure if we can fairly judge how much social interaction he had to trade off?  I didn't go downtown very much during school either and just hung around my department's study hall which was party central when it wasn't exam time and I made some pretty good friends during my summer jobs.",0,-3.8834647615892344,3.8834647615892344
1386,"I suspect the impulse to diverge from Rome and follow what a group sees as the ""right path"" runs just as strong on either end of the spectrum.  To be ""successful"" requires money, which requires a laity.  

This is one of those areas where I think the loss of trust in church leadership has made the church not only more vulnerable, but would seem to demand more transparency and dialog within the church.  I suspect this won't be the only ""ad limina"" visit in the next few years where this topic arises.",0,-3.849805627666397,3.849805627666397
73,"Trump is a vacuous idiot.
And a traitor.",1,3.8307676886132045,3.8307676886132045
1020,"""we keep telling ourselves that we're achieving the mission Jesus gave us to do!""

WE will never achieve the mission that Jesus gave us.  HE will achieve the mission.

The church we attend will have its Nth baptism of the year today, rain or shine.  We are on a trajectory to baptize at least 15% x present membership, as new members this year.

Mathematically, early growth ratios are difficult and ultimately impossible to sustain on a long-term basis.  Every ""market"" eventually reaches saturation.  If the Apostolic church had maintained its initial growth ratio for even a single decade, the entire world would have been baptized.

I do not fault the internal church PR mills for trying to foster a ""can do"" attitude among the members.  That is their job, though some may do it better than others.  We can celebrate whatever and wherever we see signs of God moving among us.

I will leave the definition of what constitutes ""success"" in the capable hands of Jesus Christ.",0,-3.7722909186566707,3.7722909186566707
2580,"We are practiced in a 'religious' faith that is received from top-down -- not so much a faith that is conscience-based, compelled by truth-sense, authentically people-owned and welling from the ground-up.
What should happen is for conscience to well-up from the people who are practiced in faith/hope/ love: faith that is grounded in understanding the authentic connectedness of all life; hope that is justified in authentically informed consciousness of life's universal relatedness; and love that is solidly grounded in the sense of mutual and personal obligation to one another and all other;
except for these, people-based faith, hope and love, chaos prevails. It's for institutions, churches included, to recognize and authenticate people in faith/hope/love, communication/consciousness/conscience - the trinitarian dynamic of godlikeness. In this endeavor, churches must be of one mind - as to the oneness-thinking of churches, there's a long way to go! what hurts to say, but is true.",0,-3.751819605382445,3.751819605382445
3015,"1} Justice, among other things, means maintaining the Deposit of Faith s it has been taught for nearly two thousand years. 2} Vatican I's PASTOR AETERNUS dogmatically taught that DE FIDE teachings NEVER change, even under the modernist rubric of ""deeper understanding"" or ""development of doctrine"". And ""I notice"" you ""fail to answer"" {rebut}"" the Church's other two dogmatic pronouncements on EENS.",0,-3.7459370278969075,3.7459370278969075
1096,Do some more research on your Bible and where it came from/how we got it :),0,-3.7390903252445558,3.7390903252445558
4,"That's it, boast about your stupidity.",1,3.7256437324994796,3.7256437324994796
2475,"Ok, I'm not an English Major. Not proper in my delivery, but correct in my meaning.",0,-3.7238874100609114,3.7238874100609114
1667,"6(cont'd).
I think that if we did not not deny visa applications indiscriminately this would be a big help.  (I am now helping a woman whose mother from one of the ""'stans"" received a denial of her visa renewal application, because a consular officer did not like her attitude.  This despite the fact that she has been here on several visits to her daughter and grandchildren and who has never violated any law at all.)  Another help would be to help eliminate some of the hoops through which employers have to jump and to cut down on processing times.  If people had the opportunity to work legally, most would jump at it.  Then, we could concentrate on those who are bent on violating the law.",0,-3.6974678648336594,3.6974678648336594
3644,"I don't usually roll through all the posts, but I wanted to see if anyone recognized that much of what is mentioned is what 'compelled' Vatican II to acknowledge the presence of the laity who had for decades - or more - simply looked at the back of the priest, who whispered in Latin , in a building that was designed for visual impact not --- acoustics. There was a massive pipe organ that drowned out everything from the back pew to the high altar. It was more important to see the priest during the homily than to hear him. The rosary people pressed on regardless through to the final amen.

Enter...Vatican II, Liturgical reform, Mass in vernacular, facing the assembly... but no one can really remedy the church structures/buildings that were never designed for -- full active conscious participation in the liturgy and have merely been 'adapted' to that purpose. New constructions take that in a bit more.  
I waited to see if someone would recognize Vatican II factor.",0,-3.6869566058142578,3.6869566058142578
1290,"Reluctantly gave up running recently because of lower back issues. So, now doing the gym and long walks on alternate days. I find this article to be right on!",0,-3.6868509627259294,3.6868509627259294
1505,"To Branko and Co, this is wonderful news and I wish you all the best in your endeavours - this country is crying out for more top-notch investigative journalism, so I for one will be holding supporting your work as best I can on my own limited means.

Best of luck for the future, Scorpios!!",0,-3.6822380408158573,3.6822380408158573
2228,"""Ukrainian academic Anton Shekhovtsov..."" . Now there's an unbiased source.",0,-3.663554195975653,3.663554195975653
3544,"As an 85 yr old hearing aid wearer, former teacher of  oral and written communication and frustrated Roman Catholic receptor of prayers and homilies at liturgies I would like to add a comment or two. The Classical Canons of Rhetoric include Invention, Disposition, Style, Delivery, and Memory.  It would seem that seminary training does an adequate job of stressing all of Canons except delivery. The concept of ""talk more slowly""  means little ether practically  or quantifiably the stress should be placed on articulation especially of all vowels and consonants: the word is ""probably"" not ""prolly.""  Volume needs to be maintained until the end of the sentence and not swallowed up in an ibreath gulp. An occasional breath would be nice between words, sentences, and even- forgive the sarcasm - ideas. As I remind my grandchildren ""You have to stop sounding like a maure salesman wth a mouthful of samples.""
.",0,-3.661706436818328,3.661706436818328
1078,"In a way as has never before happened by and within Church, 'Laudato si' speaks to the oneness of life, the oneness of Sacrament in Divine/ human Hypostasis, and the existential need of humankind to witness Truth and authenticity in Light of this universal earth-reality.",0,-3.63677761304854,3.63677761304854
3241,"Inclusive Excellence? Just wondering... which one will become the determining factor, the adjective or the noun? Inclusive? or Excellence?",0,-3.621113330617301,3.621113330617301
1073,"Because we don't know where he wept, we can conclude he was not giving in to mere emotions, which are of no import.  We can always rely upon what is not in gospel to support our positions.  We must also remember that Jesus did not have the traditions of the Church to guide his actions.  He had not been educated in the strict logic of Aquinas et al.  We, however, know that Logic must guide our actions, not emotions, also Tradition and Ritual.  To rely on Jesus' example is to engage in the heresy of sola scriptura.",0,-3.6149414841739906,3.6149414841739906
2308,"Does a canonization strictly fall under the ex cathedra category?   I admit I can't say with certainty at this point that it does.   I believe it does though;   Because a pope seems to be teaching on a point of faith .... namely, that a person is saved and in heaven and is a Saint, and has to be venerated as such by the entire Church.  

Aren't all canonizations in the Church in recent times all approved by the Roman Pontiff?   Therefore, all modern canonizations at least are infallible.",0,-3.6077660286646873,3.6077660286646873
257,"This is absurd and beyond insane. His parents and supporters encouraged him and Islam brainwashed him to be a killer.  They must pay!  The Cdn taxpayers have nothing to do with his problems, so why are they always paying for the ""stupid white people"" lack of common sense.",1,3.599839142939106,3.599839142939106
1532,"I have a rate of 1.90 % and I put more than 20% down, so care to cite your source?",0,-3.5729205829525474,3.5729205829525474
1351,"Many forget that within the Latin Rite of the Catholic Church, there are differing and rich liturgical traditions. There are many styles to celebrate the Mass to reflect the people at a particular and time. The one constant with varying styles is the substance of the Church being reflected in infinite diversity.",0,-3.569889853972577,3.569889853972577
4364,"Except for the female pole of communication/consciousness, there is no dialog with respect to Word/ Light/ Love. Deep down and for all time, all life is 'divinely maternal' in origin and in experience - becoming more godlike is what processing of communication/ consciousness/ conscience is about.
In God's image we are female/ male. The communication of the male-self on the male-self produces self-arrogated narcissism - as history and the state of Roman Catholicism attest.",0,-3.5596465508186315,3.5596465508186315
1140,"< It (people wishing you happy Rosh Hashanah and Eid Al-Fitr) happens very frequently. >
I'll be honest with you, Pandora: I don't believe that for a second. Not for a nano-second.

I'm mostly retired, but I live and work part-time in a very multi-cultural environment with people from a variety of national, ethnic and religious backgrounds.  None of our Muslim friends, employees or clients has ever wished me a ""Happy Eid Al-Fitr""; none of our Jewish friends, employees or clients has ever wished me a ""Happy Rosh Hashanah"".  I think a Wiccan may have wished me Happy Yule once; but maybe he meant Merry Christmas.",0,-3.5347780397686286,3.5347780397686286
4037,Outstanding!,0,-3.522139674773646,3.522139674773646
663,Outstanding!,0,-3.522139674773646,3.522139674773646
4466,single parents are encouraged economically by government - less taxes - financial aid - even preference to some private schools for the indigenous - as well as rent or housing preference - Government is encouraging the single parent household...,0,-3.51935618252294,3.51935618252294
1084,A great story of the community and church and a great example of how  church sites can be better integrated into city planning,0,-3.5060701667097716,3.5060701667097716
3003,"Elizabeth, when I was in ""Catholic"" high school, a theology teacher told me that there were only two ex cathedra/infallible teachings:  the Immaculate Conception and the Assumption.  

A young kid at the time, I thought deeply about this later, and I thought, ""wait a minute -- that can't be correct.   Vatican I itself had to be infallible ... otherwise, Vatican I could have been wrong about 'ex cathedra' ... and this casts the infallibility of these two Marian dogmas into doubt.  And if Vatican I had to be infallible, then Trent and other councils could/must be too.""

Much later on, I learned the criteria laid down by Vatican I for ex cathedra definitions.   (I also learned that Vatican I taught that not only ex cathedra definitions are infallible, but also that the Universal Ordinary Magisterium is infallible.)

I also learned that the teachings of councils are meaningless, unless approved/taught by the pope.   Sections of ecumenical councils not approved by popes have been scrapped",0,-3.504714402521027,3.504714402521027
1413,"I think Phyllis Tickel may have it right, by placing the reformation as something of a ""cyclical"" event in church history.  Her thesis is that about every 500 years or so, the church goes through a period of upheaval and change as needed to adapt to changing society and human growth.  

I mention this in no small part because as she notes, we're ""due"" for another such period.  From what I can tell, there most certainly appears to be sufficient internal stress within the church to drive that kind of upheaval.  We may not be able to predict how this will play out, but I think we're seeing the start of this in the church today.",0,-3.4810167600518573,3.4810167600518573
174,Stupid is as stupid does.,1,3.4793454017850003,3.4793454017850003
514,"Thanks for the last twenty years, that is very successful. It takes such a high level of commitment and hard work!! So from someone who does not know you personally or otherwise I thank you and appreciate all you have done with the young people over the years....",0,-3.4380411768707297,3.4380411768707297
2996,"Jesus spoke of the following Him and the coming Kingdom of God. The Kingdom includes a consciousness of social justice, peace, and inclusion. God's Love is not something we earn or deserve by being good. It is a free gift. Jesus taught us a way of life of loving God and others as God loves us. It is showing mercy, compassion, forgiveness, and helping and healing others. It is both a personal and community mission. The early followers sold everything  they owned in order to help the more needy in their community. Recently, every parish in our area have developed their mission statement which describes their community based goals. It is part of belonging to the Kingdom of God.",0,-3.4359065906126824,3.4359065906126824
3224,"A 40% non-SOV mode split is the goal, I sincerely doubt that Matt Brown suggested that would be the starting split.  Do you have some sources to reference?  Similarly, with Portland's general mode split for cycling alone being nearly 7% I would like to see the studies you reference before accepting those figures.",0,-3.426266588541012,3.426266588541012
629,"Here’s a “glimpse” of 47 clips, 47 different universes, 47 songs ONLY on Montréal 
(in French & in English)
https://www.youtube.com/watch?v=VKN5D2e2EYs&list=PLIv-c67XZQkiN2o0-Hv2aBg2IS3uJ1Jv_
(copy & paste in Web address )",0,-3.424755879895031,3.424755879895031
2272,"Agree, but I would not be so tough on Briggs. We do need a world-wide reopening of religious talk on Jesus engaging the world (incarnation) emerging from the world (resurrection) formed by the meeting of (unlimited) spirit and body towards the completion of creation.
Let the institution role on, but, create an alternate sort of ""curia of the listening"" - a ten-year mandated mission to listen to the world - observe, listen; invite those of good faith to talk, challenge and be challenged (by reality, fact, science, culture, tradition); teach civility in sacred spaces; teach and challenge to discernment; incorporate expertise; restore and appreciate the silenced and demeaned - aka those silenced by the John Paul/Benedict era; feed back/publish in terminology of the audiences; report openly (expecially highlights and rejections) .
Allow the Spirit a voice that has not been heard, in a way that has never been.
A ten year mission for the Jesuits?",0,-3.3980716632347825,3.3980716632347825
341,are you a journalist?,0,-3.3963780152297263,3.3963780152297263
3655,"What you call ""sound doctrinal teachings"" are man-made and can never replace the words of Jesus. For too long, the institutional Church has replaced the will of Jesus with its own will, maybe because the Church, as an institution, has been more important to our popes and bishops than having a personal relationship with Jesus? I believe Pope Francis wants us to focus on Jesus more than on man-made institutional Church doctrines. Pope Francis is asking us to be discerning, to read the Gospels, and to be open to the gift of grace and to a personal relationship with Jesus, rather than focusing on the Catechism, in my view.
Sincerely,   Dr Rosemary Eileen McHugh",0,-3.387074450908689,3.387074450908689
1828,"And it's a little more difficult and time-consuming to retrieve older stories and columns, too.  If I wanted to see a particular editorial by Margaret Wente published 2-3 months ago...quick, now: what do I do?

One upon a time, all I had to do was click on her name in the ""editorial"" page and ...voila!  There they were, all nicely listed.  

I'm forced to go OUTSIDE the newspaper, Google the subject--having forgotten the exact title--and hope for the best.",0,-3.367829710550064,3.367829710550064
1557,"Did you receive a PFD ""before"" the Zobel case was settled?",0,-3.364805847837128,3.364805847837128
1034,"My very 1st introduction to the Bible, was sitting in my mom's lap, while she read the ""Illustrated Bible History"" by Dr.I. Schuster. That could have been hers when she was little. Now one of our daughters has it, & reads to her children, who enjoy the simple illustrations & presentation.

That simple introduction to seed & grew into a life long study of the Bible, along with the multitude of  avenues to pursue. The beauty of it was it's simplicity of presentation, to a young mind,  & awakens curiosity with embarrassingly simple questioning.",0,-3.360325732940386,3.360325732940386
540,Davie: perhaps it is all of that!,0,-3.356644014284644,3.356644014284644
1664,"But in both of these cases, the senior Cardinal is retired and no longer of voting age.  Madrid's by just a few weeks (Varela just turned 80 in August) and Daneels in Malines-Brussels by 3.35 years.  I think it has almost always been the case where there were not two voting age cardinals in the same see city at the same time. It's extremely rare if there are two cardinals from the same city under 80.",0,-3.3430049423496264,3.3430049423496264
2600,"Part 4
These thoughts from a spiritual master are a profound challenge for anyone progressive today.

Francis transformed these Rules into a progressive manifesto by saying, no one should have a problem with the gist of these rules provided you understand the Church in V2 terms--God's holy people, not the magisteriuim.  With that simple observation, the focus for finding the Spirit becomes What is happening among the entire Church, including all of the faithful, that matters. It does seem pretty obvious that Francis' Church and the magisterium are not at all pointed in the same direction. 

That is the deeper Francis, IMHO; but given his position and the need to hold this fractious people together, he has to push for open discussion rather than led in the direction he may prefer.

Put these two anecdotes together. Jesuits have a fourth vow of papal obedience re mission, and Francis told them Continue as you are. I read this to mean his heart is in the progressive theology among Jesuits",0,-3.324974950108809,3.324974950108809
3568,The Catholic Church gets to decide it's membership and what is required to be a member and who gets to speak for it without outside interference.,0,-3.304966403131411,3.304966403131411
2179,"Take your hate somewhere else, seriously.",0,3.3047667605365056,3.3047667605365056
3676,"WRONG!
That refers to LEGISLATIVE powers, meaning only the House and Senate can legislate. The other two branches can't. The government as a whole derives its power from the people.

""How could both the national government and the states exercise sovereignty?  For Madison the answer was quite simple: all the power ultimately derived from a third entity: the people. Neither the national or state governments were truly self-governing. Both derived their authority from the consent of the governed.  The opening phrase of the preamble of the Constitution--""We the people of the United States""--reflected the conviction that the new government derived its power from the citizens.""

Source: The Everything Founding Fathers Book: All you need to know about the men who shaped America, by Meg Greene, Paula Stathakis, page 43",0,-3.291841346550463,3.291841346550463
3184,"What he did say though'   perhaps I might be dating her ' , referring to Ivanka",0,-3.2735990955476097,3.2735990955476097
203,What is racist about calling someone what they are? Black people love to play the victim. It's pathetic.,1,3.271672311724468,3.271672311724468
3028,"So glad that Angela retreat center and the chapel were ""unscathed"". ..the site of so many wonderful cursillos, family days, women's retreats and Vatican II inspired events...including its use as a refuge for Vietnamese boat people during that era if I remember correctly. The good people of the Santa Rosa Diocese have been through a great deal of suffering over the past 25 years in more ways than one. Let us assure them, not only of our continued prayers and donations, but our hope for the  Lord's choicest blessings as they rebuild and  bind the wounds of those afflicted in every way in their community!",0,-3.2674627724984964,3.2674627724984964
1915,"""Esperanza"" is a word - in Spanish. It means hope.",0,-3.2670057724618013,3.2670057724618013
2538,"Each parish ought to use whatever liturgy is pastorally appropriate. At Saint Cecilia Catholic Community, where I am pastor, we use a hybrid of Roman Missal 3rd and 2nd editions and the 1979 American Book of Common Prayer. We occasionally use Church of England, Lutheran, and protestant sources as well. The liturgy serves the people, not the people the liturgy!",0,-3.2531121532505605,3.2531121532505605
752,Cool,0,-3.252419430103523,3.252419430103523
1332,"That being the case, it was misleading right from the start.",0,-3.2424193258843372,3.2424193258843372
696,"My previous post explained the two known possibilities for the source of truth. Which one do you believe, or do you have another? Without defining the source of truth you speak about, you cannot begin to discuss what you believe to be supported by truth.

We had two poor choices for president. I chose the least poor choice, as did many Christians and others. Despite his many flaws, his particular skill set may produce some good results for our country.

As Abe Lincoln commented and I agree, I do not ask God to be on my side, but to help me be on His. Presuming the creator of the universe needs to choose any human viewpoint on anything exposes a basic lack of understanding of God's nature.",0,-3.2254530879906222,3.2254530879906222
