,X_sentences,Y,Y_decision,Y_confidence
28,"I have no objections to this practise at all. The goal is stable and good governance and grassroots democracy is highly unpredictable and the party in question should be able to engage in these practise.

That being said, they should be open about it.",0,-14.163269957388678,14.163269957388678
23,"Except that Antifa (anti-fascists) and BLM (black lives matter) are not ""black supremacist"" movements. If you educate yourself, you would see how your comment lacks any merit.",0,-14.117202331552207,14.117202331552207
18,"Places you can no longer go due to fear of sniper fire:  School, college, church, movies, concerts, the highway, night clubs...
Have I left something out...???  Soccer games..??  High school football games..??
Once the automatic weapons get 'silencers'....""good guys with guns"" no longer works...the ""good guys with guns"" can't tell where the shots are coming from...
The 2nd Amendment is destroying the very fabric of our country....",0,-14.096653274253825,14.096653274253825
15,Excellent points. Income and sales taxes are off the table until the Dividend is ended and a plan for a sustainable annual draw from the PF Earnings is implemented.,0,-13.89949108160546,13.89949108160546
16,"God Bless him, and his grieving wife and the family.",0,-13.894064024500906,13.894064024500906
30,"Not talking about fornicating. Men and women need to deal with their sex drive whatever way they see fit. But for the man just make damn sure you don't impregnate a women until you're ready to have a child with her. Yes that applies to women too. Of course such  a law would be near impossible to enforce but so was abortion before 1973. If you want to go the legal route to protect the unborn just remember its egg & sperm. Then let's find every root cause of abortion and work to eliminate it like poverty, social pressure, dignity of women etc. But to simply think law alone works and just the female end to save the unborn is not realistic. There were more abortions in the lower east side neighborhood in my family circle before '73 then after. And now Google Trends has found 'do it yourself' abortions increasing in states with tight laws. See if I can find link. I've said enough here.",0,-13.61065006934112,13.61065006934112
41,"The scientific method is very similar to journalistic integrity- explore an event, object or condition and discover the facts, regardless of where said information may lead the investigator.  Now- media bias, especially from the 'right', front loads the conclusion- much as we see in religious institutions- the facts MUST FIT the dogma of their beliefs.  

As if that wasn't enough of a challenge, now we have the Russians taking full advantage of American bias and partisan behavior.  Our unchecked open forums allow (entice?) anyone to become a 'journalist'.  For those here who are on the R side of the aisle- just imagine how you would be acting if it 17 US intel agencies had stated that HRC's campaign had met with the Russians.  

In Alabama, the special congressional election to replace Sessions has theocrat Roy Moore as the R candidate.  We now find out that he has 30,000 Russian twitter 'followers'.  

http://nypost.com/2017/10/16/roy-moore-flooded-with-fake-russian-twitter-followers/",0,-13.026650286847016,13.026650286847016
4,"Just keep hitting the approve option, my2cents, whether you agree or not and then the ADN censor bot will eventually praise you for being civil by using less of bad comment option.  Go figure.",0,-12.825319890402184,12.825319890402184
10,"According to the author, ""not all cleavage is created equal...Minaj’s breast-baring outfit was very much a refusal to conform...a topless political demonstration of one, whose goal is to disrupt the male power structure."" 
It is evident that Nicki Minaj has undergone a series of cosmetic surgeries. Is her goal really to disrupt the male power structure? Or, is it more likely that she and her team of doctors and publicists have made her into a celebrity brand who is profiting handsomely by reinforcing the structure.",0,-12.791233659491947,12.791233659491947
21,"1. The anti-gay population would probably have stayed and joined ISIS.
2. Anyway, the recent migrants have not been around long enough to be able to vote.",0,-12.282478283457197,12.282478283457197
11,"Thank you, I have pondered similar meanings from this Genesis 3 story as well...as a matter of fact in the last couple of days as I pondered this and other sections of Genesis, a few others popped into my head and impacted me greatly concerning God's infinite, boundless mercy that is, as Chrizmart has beautifully said, full of compassion.  Namely, when the man and woman disobeyed (which as their Creator, he could have done), destroyed them as fault-ridden.  We know of course, that He did not do that.  2nd.  Adam is refered to as beast of burden.  Jesus chose a beast of burden to ride into Jerusalem.    3rd. The story of Balaam and the donkey in Numbers is important as well.  Again, a story about who will take the lead?  Ours, God's?  And in this case, there are times God's Will is expressed through the least likely of His Creation...because they are ones listening--not us.  And those we would be wise to listen to as well.",0,-12.208586149282876,12.208586149282876
7,"""How does a seriously disturbed man build such an empire"" This was your statement, nothing there about being ""voted in"". Cruel and greedy for money and power fits Trump to a T. The only question is can he rise to the same ""heights"" the other three did. Only time will tell. 
My comments are ""offensive""? A Trump supporter with thin skin, who'd a thunk.

You wouldn't happen to be related in some way to Trump would you? I only ask because you seem to have such intimate knowledge of his family, otherwise how would you know how close they are. Or maybe your idea of ""close"" is whatever is packaged for you on TV.",0,-12.166236969665789,12.166236969665789
29,"An ugly story with something for everyone.....Like you, I couldn't resist reading it...we all love a scandal.  They're like trainwrecks; we know we shouldn't watch but we still do.  We also know that ""office romances"" virtually never turn-out well.  Anyone smart enough to become a Superintendent should be smart enough to not get romantically involved with a school employee.......Apparently, that wasn't the case with Ms Parent. Long story short......regardless of how this plays out, everyone involved is going to lose.   Gary Crum",0,-11.574403429688353,11.574403429688353
37,"Yeah, that's why she's in jail. Oh wait.....I'm guessing you're not a lawyer? To find someone guilty they have to have evidence. When there is none that person is found not guilty. See how that works?",0,-11.386746108381669,11.386746108381669
6,Da Hawaiian Bernie Madoff...govt funding style.,0,-11.15969184651871,11.15969184651871
9,Need an o-line first.,0,-11.044620152046935,11.044620152046935
44,Unless you are a woman you have no dog in this fight.,0,-10.8376826540175,10.8376826540175
24,"Good Luck Vance, I like his hires, time to see the product. O starts slow and hopefully improves along with O line play, D should be just fine.",0,-10.153874424392555,10.153874424392555
43,"Gardner thinks anyone should make a profit off of sick people! Hallelujah! That there is your state representative, Colorado.",0,-9.861237002368483,9.861237002368483
34,trump is no different from Hillary...he is a freemason and all for the new world order. We are getting same stuff,0,-9.723212166081666,9.723212166081666
1,"it's not about who ""won"" this round; it's about trump exploiting and inflaming the racial divide in america.

trump, humiliated by a major legislative defeat (pending) and more evidence of  the russian (non) ""hoax"",  retreated to his default safe-space, yelling at a rally in alabamee: ""look! quick! disrespectful black people! fire them!""

sick.",1,-8.868645592459856,8.868645592459856
40,Many of our Crazies are on this comment board.,0,-5.183300318037288,5.183300318037288
