,X_sentences,Y,Y_decision,Y_confidence
2357,"More suspense than mystery, but well done and without things I often dislike in the more suspense-like books. Would read more.",3,"[-3.4140655317640123, -1.7720615020700798, -1.0589617437309107, -1.0382228019352921, -0.8666588426990081]",-0.8666588426990081
936,"This novel is the closing book in the quartet that Mr. Shaara wrote about the largely ignored (at least in historical fiction) western theater of the American Civil War. I believe that the series is worth your time to read if you have a preexisting interest in the subject.
The Fateful Lightning is really General Shermans book. It begins with his leaving Atlanta after its capture and concludes with the surrender of Joe Johnstons army in late April of 1865. Per his usual style, the book is written in alternating viewpoints from a few character's point of view. Each chapter is a first person account from its narrator. Other than William T. Sherman, no other character really registers consistently in the novel. I think that General Sherman is one of the better characters (in terms of how he is written) that Mr. Shaara has created so I did not mind this.
A quibble with the text, Mr. Shaara clearly cannot write woman characters. When they show up and speak it is not very authentic or interesting. Oddly enough, the second book in this series did have a compelling female character as one of its alternating narrators. Not sure what happened here?
There are also a few moments where slavery appears to be whitewashed, but stick with it. The evil of slavery is not whitewashed at all; Mr. Shaara is just presenting it in its historical context without judging. I appreciated that approach. It speaks for itself, and the author does not (and did not) have to condemn it in modern terms. As the novel progresses, it clearly condemns itself.
The book bears out the enormity of the Civil War with an unexpected subtlety in its final chapters that is quite good. It is appropriate and well done.
Overall, the books in this series are not great. They are good, at times very good, and I read them all quickly. I am glad that I did.",3,"[-2.938870213336613, -0.8751134204907175, -0.8668878885801592, -0.9983863989200072, -1.1769204675659548]",-0.8668878885801592
6514,"It's what you expect from Michelle Love, great writing, intriguing characters, sizzling chemistry and lots of sex scenes.
I voluntarily reviewed an ARC of this book.",3,"[-2.467269515139864, -0.8894008060583931, -1.0507577327905926, -1.0018271075448424, -0.8670793661802475]",-0.8670793661802475
8528,"Dreams can come true.

Five days is a long time to be a car with someone.  Its even harder when they cant stop thinking about each other.  Ex-costars, Edwina Calloway and Justin Wilde are participating in a fundraising car rally to benefit the Royal Flying Doctor Service.  With Edwina free from her marriage, Justin can finally make his move.  How steamy will this ride get?

This was a fun romantic story.",3,"[-3.58112357527535, -2.3319088495848996, -1.4507556698460395, -0.9918097646230114, -0.8671025577632395]",-0.8671025577632395
2321,I loved this book. I only wish I would have know that there was a cliffhanger at the end. I still would have bought it but I would have waited to read it till the next in the series was out.,4,"[-2.6385024510852433, -1.1767677029280363, -0.8671245150940485, -0.9961058551700069, -1.0764834366784264]",-0.8671245150940485
793,"This novel explores the vulnerable imagination of thirteen-year-old girls still clinging to innocence but on the verge of the knowledge the world bestows, stripping away the fragile cocoon of childhood, where magic is still possible, but demons lurk in the darkness. Best friends and neighbors, Lizzie Hood and Evie Verver share everything until the summer before high school in their Midwestern suburban community when Evie disappears. Refusing to relinquish Evie to the terrors that the adults have already assumed, Lizzie clings to hope, drawn to Evie's family and the unfolding emotional drama of a handsome, loving father, a goddess-like older sister and a ghostly mother, even more insubstantial since Evie's disappearance. Lizzie desperately wants to help as she slides smoothly into Evie's environment, dredging up memories, searching for clues the police might have missed. A girl in crisis who cannot find traction in her own fatherless home, Lizzie is lost without Evie- and the family that has welcomed her throughout childhood.

While Abbott captures the intimacy of friendship and the often unreliable impulses of young girls' hearts, the beat of disquiet thrums, secrets bloom in the dark and emotions collide even before Evie's disappearance. The shining family, repository of Lizzie's happiest memories, shatters more the further she is drawn into an emotional vortex beyond her ken, both rapturous and vulnerable as her discoveries aid the search for Evie. This novel bridges the chasm between childhood and reality, Lizzie vaguely conscious of what she knows but cannot bear to acknowledge. This tough novel is filled with horrors, perhaps too slight to bear the weight of its terrible revelations, the truths that fill the shadowy places of the Verver's home. Vacillating between seduction and brutal frankness, Abbott holds a mirror up to society's faade, Sleeping Beauty staring into the eyes of evil, poison apple staining her lips. Luan Gaines/2011.",3,"[-3.168676729121391, -1.78555388994254, -1.2087950795387346, -1.0308977371822303, -0.867441752283233]",-0.867441752283233
6858,"Drake sees Mandy/Mandissa, and he wants her. He stalks her relentlessly. And he finds something she cherishes, he uses it to get her.

I would have liked to know more about Drake, and how he was connected to the criminal underworld. I couldn't connect him being a photographer who dresses like a biker that lives in a mansion, to somebody that is feared/respected in the hood.

I also would've liked to know more about Mandissa's background.

 The book needed a little editing. Some words and punctuation used incorrectly.

Overall a decent read. A romance where tow people fall in love in an unconventional way, and for the wrong reasons. But they fulfill each other's needs. At least Drake said he would be faithful, which is more than we can say about ""light"" romance stories.",2,"[-3.9963832204706895, -1.1610946031137632, -0.867516619510945, -0.9656745691104187, -1.8326326524617826]",-0.867516619510945
4990,Love a bad boy story I was so glad it ended the way I hoped and that things worked out,4,"[-2.5360747916386064, -1.2873699892919797, -1.1237292016144116, -1.035301766990816, -0.867815190099886]",-0.867815190099886
7980,What a great third novel in this series!  The plot is absolutely marvelous...who would have ever figured??  Bill Travis is a great protagonist.  George Wier does a great job with building the suspense and keeping the reader wanting more.,4,"[-4.22772597224767, -2.646601547184818, -0.867819166774972, -0.991790349801388, -1.2175414725723985]",-0.867819166774972
7593,"easy to set up, nice sound, a little hard to mate my cable box remote to vizios remote, but I finally got volume up, down and mute to work.",4,"[-1.8371008734302703, -1.9112893654685705, -1.4203372810666792, -1.0829001871388195, -0.8680996628145943]",-0.8680996628145943
4514,"Vi Keeland doesn't disappoint. She can make a bad day glow. She can make a sad day become filled with laughter. I have to admit I cringed at the idea of a football romance. But you know what there really wasn't that much football. The Baller is about mega hunk, crude dude Brody Easton, quarterback for the Steel. It is also about Delilah Maddox, gorgeous sports reporter with ahead for stats, a love of football, and a need to prove herself in the locker room.
From first contact I couldn't stop laughing. Brody is a laugh one minute and a drool the next. What that man can say is swoon worthy, panty dropping, desire. With the drop of a towel he issues a challenge. He wants Delilah in his bed. Challenge accepted be Delilah to avoid the bedroom. Brody struts. Delilah shirks. Brody traps and scores the win. It wasn't easy to get to the relationship stage and it won't be easy to remain.
Both have a past. Brody comes face to face with his past while Delilah doesn't quite know how to begin again. Their situations gave us a deeper understanding of the characters. Brody's devotion to Marlene was beautiful. That man loves with his whole heart. Only if Delilah will accept it.",4,"[-2.814174986609796, -1.068126221000855, -1.244912871659714, -1.0161261398451036, -0.8685669991048217]",-0.8685669991048217
7993,"Joe is just a guy who can't open up to his lady
  He's an excellent detective, but he's clueless in the world of the opposite sex.  So while invested in a mystery concerning his partner he gets smacked by a kidnapping of his own daughter.  By the end of the story he finally seems to understand",4,"[-2.850275224034511, -1.397279896740347, -1.125783133726148, -1.0064559055941862, -0.8685999260689524]",-0.8685999260689524
5190,This was an okay book to read.  I liked the characters and their attraction to each other.  I hope to read more from this author.,2,"[-3.0235060821503135, -1.6391405840540818, -0.8687053075451977, -0.9930314212061881, -1.195400516556778]",-0.8687053075451977
2652,"For those reading on kindle book ends at 89% rest is  reviews and  other books written.

I said clift hanger because that is how the book ends you know what the question is and you know a decision has been reach but anser in book 4.

This books deals with meeting Fang and learning a little more about what she is and even meeting other vampires.  Love the story, love the books.",4,"[-1.7339152606932635, -1.0966423699588792, -0.868709665293423, -0.9903681866562721, -1.4309766213242177]",-0.868709665293423
7573,I love my purple headphones they work well good sound lightweight and having no issues last long while listening .,4,"[-2.0889398308987506, -1.8756098459549144, -1.2290746953916776, -1.0543168609630404, -0.8691524852210718]",-0.8691524852210718
2087,"I've been included in another September Blog tour with Revell Books, a division of Baker Publishing Group folks! Today's post is on Justice Buried: A Memphis Cold Case Novel by Patricia Bradley. It's book #2 in the Memphis Cold Case series, but the story itself was definitely of standalone quality. (I can say that since I haven't read book #1 yet.) I have read other Patricia Bradley books - they were in the Logan Point series.

The main female character in this series is Kelsey Allen, a woman who has been very careful in guarding her heart for years because of her past. As Kelsey's story is revealed, her father disappeared decades ago and was suspected to have been involved in a robbery at a Memphis museum when artifacts went missing. Kelsey is in the process of building her security consulting business and is hired at the same museum to go undercover and pose as a curator. Due to the fact that Kelsey's mother married a man who adopted Kelsey when she was young, she has a different last name than her biological father, so no one knows her true identity.

Her undercover job suddenly leads into a murder investigation, and soon everything becomes tied to the cold case of Kelsey's father's disappearance. This leads Kelsey to the realization that she will need to get the assistance of the police in order to solve the mystery. Detective Brad Hollister, a homicide detective from Kelseys past recently assigned to cold cases, so it's no surprise they had romantic sparks flying.

I really thought plot was great and my only regret was that I hadn't read the first book. I loved that I kept thinking there were several different characters who could have been the suspect for this crime, and I had no idea until I was probably through 3/4ths of the book. It kept me on my toes and kept me guessing. It wasn't easy to figure out or see where the story was going, and there were even a few surprises along the way that I didn't see coming.

I was provided with a trade paperback copy of this book from Revell Books, a division of Baker Publishing Group in exchange for this, my honest review.",3,"[-2.9237337091285838, -1.501339668154051, -1.0089123732208176, -1.0320271386320152, -0.8692095367367092]",-0.8692095367367092
9680,"I have a fast growing cactus that I split and re-pot frequently. I usually use my own mix of dirt, sand, stones, and a bit of perlite.
They always do well, but on the chance that they could do even better, I tried this ready mix.

I suppose if you're in a hurry, this is nice, but after a month of side-by-side, there was absolutely no difference in growth or health.",2,"[-4.962411923577946, -2.4006368534054943, -1.4364458910186744, -0.9846050033004987, -0.8692670205516106]",-0.8692670205516106
3945,"For those who have read Flat-Out-Love like me there is the desire to find out what happens with Celeste who was such a pivotal character in the story.  This story does just that and it does it in a very beautiful and sweet way.  It is 5 years later, Celeste is a senior getting ready for college and trying to figure herself out.

I was grabbed by Celeste personality and had a great desire to see where the story goes.  This isn't a drama filled tale but a gentle quiet exploration into the growth of a socially challenged girl becoming a woman and standing on her own.

Also great about this was that we got to find out more about Matt and Julie because apparently their story had more bumps in it after the first book ended.  I loved getting both tales interwoven in even though Celeste was the star of this one.  There was also a great cast of supporting characters and moments that made me laugh.  I smiled a lot at the sweetness in this story.

A fun read, though something was just missing which is why it was a 4/5 for me.",3,"[-3.1846072415891093, -0.8697346174348441, -0.9218619027258984, -0.9743018912811044, -1.4979727642176646]",-0.8697346174348441
4888,"Vincenzo, Arabella & Eddie's ""story"" could not be more perfect.  Even Gordy's importance in the story is appreciated & enjoyable as Ms Lee brings her storyline ""full circle"" as life itself so often does.

You come to grips with the terrible aftermath of the Civil War; a man dreadfully scarred, a woman who has lost the love of her life, a child without a Father; yet that doesn't begin to describe what ""Beauty"" is about.  You are taught many things through the telling of this tale.  And you, the reader, finish the last line of the story understanding & appreciating the lesson being taught.

A very good book, well written, a most enjoyable read.",4,"[-3.3639746214348434, -1.9621158350176866, -1.1775421577585075, -1.0077769381192765, -0.8698113070504889]",-0.8698113070504889
3481,"Imagine this plot: a 6 man team of U.S. Rangers is parachuted into Nazi Germany in April 1945 to create havoc behind enemy lines. They jump during a freak storm, and when they land they assume that they are right where they were supposed to be. Unknown to them, however, the storm caused them to time jump, and they have landed in the right place, but it's now 2011, almost 60 years from when they left the plane. They begin to carry out their assigned mission, causing havoc and death in the area.

 The question is: will they ever realize where in time they actually are before things get really bad for them and the folks around them? Also, once they are confronted with the news of when they are, will they believe it, or just feel it's some Nazi trick?

 I don't want to spoil the plot for future readers, except to say that I enjoyed the book very much. It's an intriguing premise, and I compliment the author on thinking it up for us.",4,"[-2.244207441096706, -1.1518117831107566, -1.312788528339655, -0.9805967207156571, -0.8701489113146466]",-0.8701489113146466
3891,"It's a nice story,a sweet and interesting story but honestly reading about a 17 year old find love and a cliffhanger ? Just honestly not for me... I want a story I can relate to at least a little bit, be the story contemporary,historical,SciFi,paranormal,BBW,menage,what ever the genre maybe I still need my heroine older... Sweet but not really for me and I wish YA aged books were easier to spot..",2,"[-2.3680565194182774, -0.8703905822869762, -0.9012198934608388, -1.0243491217726515, -1.137867286388157]",-0.8703905822869762
3787,I thought this was a very well-written book. Likeable characters and overall a great story. Would definitely recommend this book.,3,"[-3.47232414852055, -1.980377197152766, -1.182433951499078, -1.0025388733867198, -0.8704427390044962]",-0.8704427390044962
3910,"In the golden age of the mystery novel, one of the brightest lights was Rex Stout and his creations Nero Wolfe and Archie Goodwin.

After Stout died, an unknown writer named Robert Goldsborough was called upon to try and continue the series.

He did so brilliantly.

So much so, that it would probably be impossible for any but the most astute scholar to tell the difference between vintage Stout and ""upstart"" Goldsborough.

For 8 more novels, he kept the Wolfian canon flourishing and then...?

Many years passed and, except for a passing ""What ever happened to...?"" most of us just felt the day was over.

Then, about a year ago, Goldsborough was back with ""Archie meets Nero Wolfe"", and it was as if he'd never left.

Now, we have ""Archie in the Crosshairs""

It's good to have you back Mr G

Now, I have to make clear: These ARE vintage Wolfe, and vintage Wolfe is of his time and place which is NOT today.

There are no Girls getting Gone, here, Islands do not get shuttered, none of the characters would be all that comfortable in a graphic novel setting.

But, if you love Golden age stuff... or want to know what made the age golden, .....",4,"[-2.017707882319132, -0.9110450393930192, -0.8704859626463163, -1.0055076678282018, -1.137711520914295]",-0.8704859626463163
2750,"Having followed this series since book #1 I am still fascinated by the story.  Of course, the characters have grown and those who started as children in the series now have their own children.  The descriptions of life and the living conditions circa 1670 Bavaria are a testimony to mankinds resilience.  The hangman seems to be presented as super human by his actions.  Corruption, scheming, murder all much like today, just with cruder weapons and methods.  Medicine consisting of treatment with herbs and potions are still prominent in the series as are descriptions of life among the less fortunate.  I recommend this to any fan of historical fiction, likely sprinkled with nuggets of factuality. Five star thriller.",4,"[-2.731632198345821, -2.1753160778381666, -1.0339780916090713, -1.004025483050903, -0.8706343703312857]",-0.8706343703312857
6234,"This was a dark and twisted book. I really liked it and can't wait for the next book in the series.
I voluntarily reviewed an ARC of this book.",3,"[-2.3277401212945463, -0.870642148386437, -1.0520256178802543, -0.999396853867453, -1.1034939964485995]",-0.870642148386437
4976,"Standalone
Dual POVs
HEA

Beck and Willow have been best friends since elementary school.  He's come to her rescue most of their lives. Her mom is verbally abusive, manipulative, an addict, and emotionally stunted. Willow's mom would have boyfriends or parties that Willow would need to get away from. Beck would pick her up to get her safe. Beck's family is rich. He doesn't have the same type of problems as Willow. His dad is manipulative, never home, and verbally abusive.

I don't think the title of this book portrays the characters very well. Beck doesn't really do anything that is different from regular teenagers. I don't think Willow is shy. She doesn't seem to have issues talking to or being around normal people. I don't recall her acting shy in the book.",3,"[-3.123147840564899, -1.0452578578032101, -0.8707103951722404, -1.0210705990110593, -1.09268551951476]",-0.8707103951722404
5506,"A new young actor falls for his co star, a older more seasoned actor.  And the more they hang out together the harder it is to hide their feelings.",4,"[-3.6921250436480406, -1.3791636163317325, -0.8710993958333535, -0.9688841807344306, -1.4853601970964978]",-0.8710993958333535
4604,"This is a romance novel with complex characters, in depth story line, and happy ending.  I would recommend this book to all who like a good romance and this one even made me shed a tear.",4,"[-3.371348203820065, -1.3850372258247945, -1.2029374032338933, -1.007748276662833, -0.8711575748945819]",-0.8711575748945819
2873,"If ever a hero deserved a happy ending, it was  Nick.  Unloved by his parents,  Nick became a bitter man.  Forced into a marriage with Julia by his father,  Nick left England without consumating his marriage.  Julia has been waiting eight years hoping for her husband's return.  Left nearly destitute by her husband's unscrupulous cousin who manages her husband's money, Julia pays a courtesan with what little she has to teach her how to her husband so she can become pregnant with his heir. This book got right into the heart of the story from page one and kept me entertained throughout.  There were times I didn't much like Nick and how he treated Julia but upon learning of Nicks childhood, I began to understand what drove him.  Nick and Julia had a rocky road to the path of their happily ever after but it was well worth reading.  Highly recommend this book.",4,"[-3.328879375140115, -1.712206756866536, -1.2287691505822127, -0.9789615890479815, -0.8711783166504382]",-0.8711783166504382
151,"When this novel was published decades ago the Los Angeles Times called it ""perfect."" I agree. It's short, but satisfying, full of well-wrought characters and placed in a compelling interesting pre-World War II time period, in Scotland. As an author, Muriel Spark makes use of repetition better than any writers I can recall.

A bonus: if anyone has seen the 1969 movie adapted from the book and starring Maggie Smith, you will hear her voice as you read.",4,"[-2.4329761066193525, -1.017851189519334, -0.8712217791212197, -1.027744791934763, -0.9012035932928627]",-0.8712217791212197
231,My hubby is an avid reader of spy novels and this one didn't disappoint. He has been to Russia also so all the details were familiar to him. Very entertaining (he says) and likes the writing style of this author.,3,"[-3.5245007808984834, -1.5950664136737398, -1.272427203374749, -1.0006203290887472, -0.8712270764364677]",-0.8712270764364677
163,"This story is aptly named, as it's definitely a challenge both to read and, possibly, to your ideas as to what mental illness is and how people cope with it. It's rather difficult to get into, as the story hops around and it's hard to get your bearings. But it's brilliantly written and insightful (as it should be, considering the author's son suffers from these mental challenges).",3,"[-3.2193943865995083, -0.8712692318514194, -1.206278757687442, -1.025298534501529, -1.2614147433559963]",-0.8712692318514194
1024,"More Fool's Gold shenanigans, means more to love!  Do yourself a favor and start reading the series.  It really doesn't matter where you start",4,"[-2.588870860500297, -0.8716477881788847, -1.1313202528221953, -1.0066690430734682, -0.9439033758555219]",-0.8716477881788847
8451,"I enjoyed every page of this.  What a novel setting for the beginning of a courtship......the Hero's (Blair) dressing room.  That may be old hat to some of you, but it was new to me and I liked it.  Of course, wooing wasn't the plan.  Philippa was searching Blair's room for an incriminating letter written by her twitty sister.  Here came Blair, Philippa dashed to his dressing room to hide, he entered the room to undress for bed, and.....

Yes, I bought into the whole implausible, would-not-happen-in-real-life set-up.  Just went with it all starry-eyed.

These characters were three-dimensional, there was humor, no tedious misunderstandings or secrets, the love scenes were lovely.  This was very well done and a delight to read.

Enjoy your reading! :)",3,"[-1.951892200717343, -0.8716639602097094, -1.000726746910842, -0.9804977442966418, -1.2214032595473967]",-0.8716639602097094
8998,"This was a nice story, he wanted a mate and she never thought she find love, throw in some bad guys and the mix works well. Now I have get the second book to pick up what I missed, can't wait",4,"[-3.3400215245962226, -1.2438315317319746, -0.87169528411417, -0.9944352836335447, -0.994855353453042]",-0.87169528411417
6919,"Another awesome book by Ms. Woods. The book focuses on 4 women who have been friends for many years. They helped each other to grow and get past hardships. Now the women are business owners. Rowen does most of the lingerie designs but seems to have lost her muse. They are friends with a group of men who have always watched over the girls. Hitchcock has always liked Rowen. He knows she's in her late twenties but is shy and innocent. Hitch/Nathan is a nature photographer and likes solitude. He knows something's troubling Rowen so asks her to go on a weekend camping trip. Rowen has always had a crush but realized it was one way. The weekend will be enlightening for them both. The author is excellent in giving enough background information so that it helps the reader understand why the characters are who they are now. Personally, it's like becoming friends with the characters and feeling part of their story. I received a free copy of this book solely in exchange for an honest opinion. I look forward to reading more of Ms. Woods books especially those in this series.",4,"[-4.035771982471141, -1.5905644461151764, -0.8719390282756017, -0.9831886530117363, -1.1975205281747905]",-0.8719390282756017
