,X_sentences,Y,Y_decision,Y_confidence
8388,"Cash is a badass biker. Rachel is as sweet as southern sweet tea. Together they are the odd couple but the Jamie writes their yin and yang very well.

This is the fifth (5) book in The Last Riders series and Jamie provides readers with enough background history to ensure that you can follow Cashs and Rachels story.

The story opens with Cash trying to get some pussy but he is cock blocked by the Porter brothers. Which is really funny. Cash decides he will ruffle some Porter Brother feathers by spending time with Rachel, their sister.

Cash is a member of The Last Riders motorcycle club. Prior to joining the MC, he has been a loner. The more I read about him, I realize that he has no emotional connection with anyone outside of the MC.

This changes when Cash sees Rachel again since he has returned.

Rachel is a novice and wholesome. She is patient and kind. She tolerates her brothers and their foolish but loves them so much.

Rachel has loved Cash since she was young. When Cash starts to pay attention to Rachel. The feelings that she begins to have deviously wet feelings for him (wagging my eyebrows) and this is unfamiliar to her. She is not use to that kind of attention from man. The love that Rachel has for family, passion and community is the same that wants to convey to Cash. Will Cash be receptive to her love, is he worthy of her? Can he be emotionally available to her?

I love MCs and this book was something new for me. The theme of book was not at all what I thought but how the author integrated this into the story line was fantastic.

My review has to be limited because; just the littlest of information will give this great story away. I can say the sex is good in the book. It is just enough to keep you wiggling in your seat.

This is the first book I read in the series but I was not lost at all. That is a great author. She gave me enough back-story of the previous books, to feel comfortable with the flow of Cashs book.

Happy Reading.

Reviewer with Sexways of Reading",3,"[-3.802270268780629, -1.7260545218390946, -1.1336576595973025, -0.9898405253216899, -1.4659078344955445]",-0.9898405253216899
8358,"This is the tale of a cursed family. He finds her and she does at first. But finds out all kinds of things. This Dragon is very shifty , if you get my drift. A must read",4,"[-3.3729036577430254, -1.4599253261963785, -1.1421501832743122, -0.9898535357575572, -1.1464962445524458]",-0.9898535357575572
5728,"I liked this book.  Going in, I had different expectations than what the overall book was.  However, it was thoroughly enjoyable.  The dynamic between Shannon and Matteo was great.  I wished that there was a little more back story or explanation as to why there was such an attraction from Matteo, given the age difference.  Otherwise, the emotional roller coaster that Shannon was on gave her great depth as a character.  The story was good and gave you a great description of the seedy underworld that Shannon was thrust into when she was uprooted from her home in Ohio.  The friendship and support that Shannon had from her school counselor and Danny seemed genuine and helped give roots to the supporting characters.
A good read overall",3,"[-4.1298197497689, -2.037583499066013, -1.2239503732828858, -0.9898764754310868, -1.126576594987998]",-0.9898764754310868
5683,"I received a complimentary copy from Netgalley...

Possible spoilers below...

I really liked the characters in this book. The storyline was different and I like how Ash didn't just give in at first to Luke. She made him prove his feelings for her and show her that she wasn't just a rebound.

Although I loved the story I felt it lagged a little in the middle and some points were somewhat tedious.
I still loved the story of Luke and Ash.",3,"[-2.068221825727953, -1.2120238841457571, -0.9898815598207502, -1.0068710744988425, -1.0938501527329485]",-0.9898815598207502
5595,"The publisher of Andrea Kane's latest is a new one; Bonnie Meadow.

This is important because Bonnie Meadow is, according to it's mission statement, dedicated to emphasising the author's importance over the publisher's which is admirable but I'm not quite sure how this differs from others.

I only even bring this up because the FOUNDER of Bonnie Meadow is, well, Andrea Kane and this might lead some to treat this as a self-published work which, in the mind of more than a few diminishes it... which shouldn't be the case.

Kane is a solid, professional, writer who, while unfamiliar to me, appears to have quite a following

Moreover, this is the FIFTH book in the ""Forensic Instincts"" series and, although I am equally unfamiliar with the others in the series, I regret that because, not only is this book a lot of fun, the concept (a team of, more than a little, odd specialists who use their talents to help people in need) is one I have always loved from the ""League of Extraordinary Gentlemen"" to the ""Monkey Wrench"" folks.

For what it's worth, I think FI is a LITTLE less enthralling than those, but far better than many others

In other words, this is a good genre novel and well worth your time.

Kinda clunky title though (but apt for the book)",3,"[-3.2877546076061277, -1.3545166700432392, -1.222649957033572, -0.9898930909691677, -1.1735865981897062]",-0.9898930909691677
9022,"Player was a good, quick, fun, enjoyable read. Received an ARC from Hidden Gems and I'm leaving a voluntary review.",2,"[-2.105677315561028, -1.7384197025559904, -1.188609176486514, -0.9899093486137299, -1.3385543082615772]",-0.9899093486137299
3176,"I enjoyed this Romantic suspense, the tale of an abused wife running for her life with her two  children from a previous marriage. When she discovers a secret about her powerful politician husband that would end his career, he attacks her with a letter opener and she barely escapes. She runs to the only family she has, Uncle James, a  Vietnam vet with scary skills. When her husband's men get too close, James sends her to a friend he hasn't seen in thirty years, but who owes him. Danny hires her as caretaker of his country estate, but dies days before she arrives. Danny wills the estate to his nephew, Jack, a homicide detective recovering from injuries sustained in a car accident.  He doesn't have kids, but recognizes fear when he sees it, and knows Beth and her children are terrified of men and on the run. He agrees to honor the job offer, and having nowhere else to turn, Beth agrees to a trial period.  As Beth begins to settle in, Jack uses his resources to learn more about her, her husband's men again begin closing in, and a serial killer strikes in their little town.  There is no lack of suspense, and while the identity of the serial killer is easy to guess, there is enough else going on to keep it interesting.  I will put this book on my reread list and recommend it.",3,"[-3.0196163111356795, -1.4667794311599684, -1.0490998019109843, -0.9899235273169112, -1.1155901975560534]",-0.9899235273169112
9808,"The small Size 4 ball is perfect for preschoolers. Our 4-year-old loves kicking & playing with soccer balls (in fact, she calls all ball games--basketball, baseball, even catch, etc.--""soccer ball"" for some reason), but the standard size is a little large for footwork. This one is just right, much easier for her to manage well than the larger balls.",4,"[-4.259012541158305, -2.0587214054713194, -1.0175442062957956, -0.9900356287857119, -1.6423553557865285]",-0.9900356287857119
2716,"As I was reading Edgar &  Lucy by Victor Lodato, I realized its been a while since Ive read such an excellent book. I loved this book from the very beginning to the very end.  Its a long book that you don't mind at all thats its long, as a matter of fact, I would have gladly kept reading had there been more story to tell.  But like the perfect book that it is, it ended on just the right note and left me completely fulfilled.

The title of the book refers to Edgar and his mother Lucy.  Lucy is widowed and a bit wild.  Edgar is a thoughtful child dealing with the ramifications of being an albino.

If I had to come with one word to describe this book it would be relationships.  Every relationship is so developed, complicated and intricate like they are in real life.  There is Edgar & Lucy, Edgar & Florence, Edgar & Conrad, Edgar & Jackie, Lucy & Florence, Lucy & Frank, Lucy & Ron, and even more smaller relationships.  When you finish reading the book, you feel like you know these people, that they are your friends.

While your getting to know all these characters and their relationships you are surrounded by prose so moving.  The writing so beautiful.  When we sit out on our back porch in the summer, we face an area of woods at the back of the lawn.  Sometimes when there is a breeze, all of the leaves are nodding at once.  Ive watched them and wished that I could describe it.  Well, Victor Lodato did and much more beautifully than I ever could:

The congress of leaves shivered and rolled, a voluptuous tossing that culminated in a vigorous nodding, as if all the trees agreed on something.  The decision was unanimous; the answer; yes.

This book has everything:  beautiful writing, excellent characters, and a few turns of plot that I didn't see coming at all.  Excellent.

I received an ARC of this book.",4,"[-2.852415856622575, -1.1849098496235813, -1.242034576659051, -1.0104571872429746, -0.9901000032136696]",-0.9901000032136696
9774,I keep a few of these chicken and vegetables pods around to give to rescue dogs mostly. The small quantities are just enough to mix in with dry food and water to add flavor and texture. Most dogs that we have given these too don't experience any digestive upset or problems.,3,"[-3.1253839373188788, -1.1677520952355902, -1.0347632475292445, -1.0348847455472001, -0.9903007358655962]",-0.9903007358655962
358,"If you're looking for the next 'Gone Girl' this book will hold you over until the real things comes along.  The story is part legal thriller, part romance, and part police procedural.  The writing is pretty lean and sparse, and overall the story flows well.  I enjoyed the overall mystery, but didn't really fell any sympathy for any of the characters, many of whom were morally bankrupt.

Enjoyable!",3,"[-3.4787417823650744, -1.5610986710751105, -1.0586565788482472, -0.9903249658967754, -1.1625059344470028]",-0.9903249658967754
8522,"Arianna was stolen from her family and forcibly mated to a dark Alfa Mace.  Mace was a cruel man and Mace's brother had his beta Jak watch Arianna.  Jak's mother was also a captive mate who was killed by his father in front of him. Jack now had to free Arianna from Mace. Suspense, action, and romance are on the menu in this paranormal romance, with witches thrown just to spice it up.  Adult readers due to sexual and violent content.",4,"[-1.038775117276093, -1.650549375708621, -0.9903604677579029, -0.999037272057561, -1.0836155898924569]",-0.9903604677579029
8249,"Good start of a new series. Along with her police dog, threatened with dismissal, the Detective keeps looking for the truth.",3,"[-4.658580190259097, -1.9300223012300777, -1.1538144269598114, -0.9904350044499584, -1.1241660385678598]",-0.9904350044499584
1525,"Inspired by a true story, Ernest, who is half-Chinese and orphaned at a very young age, is brought to America from China in hopes that he will have a better life here. Set in Seattle in dual time periods, 1909 and 1962, Ernest is raffled off at the age of twelve at the 1909 Seattle World's Fair and goes to live and work in a high class brothel. He is treated well there and becomes friends with Maisie, the daughter of the brothel's Madame Flora, and Fahn, a scullery maid at the brothel. In 1962, Ernest, through the coaxing of his journalist daughter, tells her his story of how he arrived in America, his time living in the brothel, and meeting Gracie there, his wife who is suffering from dementia. This is a heartbreaking but beautiful story that is masterfully written by Jamie Ford. I highly recommend it.

I received an ARC from NetGalley for my honest review. All opinions are my own.",4,"[-3.1021872957496313, -1.581372347831767, -1.2487073720910435, -0.9906501865789584, -1.0166076666238455]",-0.9906501865789584
1619,"I finished DARK BAYOU in a day, it held my attention and it made want to find out what would happen to the interesting characters.
Leigh has had enough death in her life that she leaves her Louisiana home for L.A., med school, and a new start. New deaths in her family make her return. Her brother and his wife were killed in a car accident leaving their ten year old daughter alive but an orphan. Liegh begins having dreams that something bad will happen to her niece.
The story then centers on the dark character in her dreams and the problems he has caused for all her family. Leigh has to choose whether she will accept her role in her family, a role much different from any she had ever imagined for herself. I felt the characters in the book were very well done. The love family and friends had for each other was compelling. I especially enjoyed the characters diversity, young, older, a boy with downs syndrome, all cared deeply for each other and worked together to solve their problem.
The paranormal aspect of the story was very well done. I was left wanting to read the series to see what lies ahead for them all. Overall I think this is a 4.5 book. There were a few typos and weird spacing on some pages.",3,"[-3.451391202661627, -1.158132991718701, -1.0128355161764815, -0.9907000465772917, -1.2766133699421065]",-0.9907000465772917
2315,The characters are fleshed out in a way that allows them to become like an old friend. Very entertaining book.,4,"[-1.638363066297706, -1.248973350993247, -1.1452957710388822, -0.9907476548955763, -1.2333008823655627]",-0.9907476548955763
5968,"This is the first book I have read by Corinne Michaels, and from what I gather, readers were already introduced to the main character, Mark Dixon, in The Consolation Duet and/or The Belonging Duet. Mark is a former Navy SEAL who now works for Cole Securities, a private security company mainly consisting of other former Navy SEALs. While on a mission to rescue a friend/co-worker, Mark meets Charlie, a spitfire undercover CIA agent who likes to think she is the alpha dog.
A year later, when things start going wrong for both of them with their work, they partner up in hopes that together or with the other's inside information, they might be able to piece together the missing clues needed to rectify their situation.
Things heat up real fast and when I say heat...I mean sizzle! However, I found the constant battling between the two of them as far as who is the alpha got exhausting.
Overall, this is a great read with an interesting storyline.",3,"[-4.26401658746058, -1.9334289609008297, -0.990786680873101, -1.0074108981020788, -1.0446924099718957]",-0.990786680873101
9004,"I like how we are finding out about the different family members and their stories, my only complaint is the books are too short. There's not enough detail or suspense builders. The family member looks for mate, finds mate, loves mate, bonds mate and boom happily ever after",3,"[-3.2494879063463684, -1.1753577990809616, -1.1440933546665488, -0.9908907526367116, -1.0313549826288542]",-0.9908907526367116
7387,Comfortable and fit pretty well.,3,"[-2.2716868113613966, -2.700689534909289, -1.0591377687376604, -0.9909620852752756, -1.7551711327929884]",-0.9909620852752756
61,"Every detective has a case that haunts them. For former LAPD Detective Danny McGuire, that case is the murder of millionaire art dealer Andrew Jakes. When police arrived at the Jakes home, they found the elderly Mr. Jakes savagely murdered and tied to his much younger wife, Angela, who had been brutally raped. With stolen art and jewels, the scene looks like a horrific burglary. Suspicion is placed on the young Mrs. Jakes, who survives the incident and whom Mr. Jakes left his entire fortune. Surprisingly, Angela leaves her entire windfall to a local charity, and disappears from LA. With his number one suspect/witness gone, Danny McGuire is left to ponder the case with no leads.

Ten years later, Danny McGuire, newly married, living in France, and working for Interpol, has all but moved on from the Jakes case. He is still haunted by the look in the young wife's eyes, but has accepted that he will never know the truth behind the killing. Then one day Matt Daley contacts him. Daley is a struggling scriptwriter who happens to be the estranged son of Andrew Jakes. In an attempt to discover a compelling story, he looks into his father's case and finds that other murders fitting the exact profile of his father's have occurred in various cities around the world. When he relays this information to Danny, the two embark on a fast paced, worldwide investigation to uncover the truth behind these murders.

Although the bestselling author, Sidney Sheldon, passed away in 2007, author Tilly Bagshawe continues his tradition of fast paced, intriguing mysteries in a expert manner. This story had as many plot twists as we've grown accustomed to in stories like this, and the ending is sure to leave readers reeling. The beginning of this novel has several time, location and character changes over a short number of pages. While this is vital to the telling of the story, I felt that the jumps could be a bit confusing. Fortunately, I stayed with it, and the last two-thirds of the novel were clearly written and very entertaining. This novel is a solid addition to the mystery genre and a nice continuation of the Sidney Sheldon legacy.",3,"[-3.23253381408953, -1.4379616682561782, -1.1410166558962538, -1.0090796114308016, -0.9909736807310852]",-0.9909736807310852
2034,Intriguing story with history entwined. Great character development. Twist and turns in plot to keep you guessing.,4,"[-3.7463337954723435, -3.0053365874237916, -1.3743528385697714, -0.9909956348387936, -1.395544049270088]",-0.9909956348387936
2048,"This is a reasonably fast-paced thriller with a well-thought-thru plot, including many twists & turns. I recommend the book for readers who enjoy this genre. My only problem with this book is that the main antagonist/terrorist was a bit too ""bullet proof"" successfully escaping from far too many traps unscathed, to seem reasonable. Of course many authors often use this tactic for the hero ... but it doesn't work as well with the villain for my particular taste.",2,"[-1.841278793763268, -1.3720782652854786, -1.0474410497442823, -0.9912676300121455, -1.0445456275723202]",-0.9912676300121455
4923,Dax and Remi ... definitely interesting,3,"[-3.6647022217577216, -2.0309443986060574, -1.4042519902968729, -1.0051622680237877, -0.9912954767628377]",-0.9912954767628377
2106,"Once Id read the first chapter of Lily Kings latest novel, ""Euphoria"", I knew I was going to love it. It fascinates like Yanagiharas, ""The People in the Trees"" and Patchets, ""State of Wonder"", two other recent novels with anthropological settings.
The novel is lush with vivid descriptions of the New Guinea landscapes, rivers, rainforests and indigenous people. I found myself hoping that a film would be made from it, especially after I looked up the Rainbow Gum Tree on the internet; its truly an amazingly beautiful specimen.
The story is set in the 1930s. Andrew Bankson is lonely and somewhat stagnant in his study of one of the Kiona river tribes, when fellow anthropologists, Fen and Nell arrive on the run from a hostile tribe. Andrew is desperate to keep them nearby for their company, and also for his attraction to Nell. There is a delightful scene where Andrew takes Fen and Nell, via canoe, tribe shopping along the river. They are to select their new tribe to study and its much like selecting a piece of real-estate; Nell is completely like a woman shopping for a house, looking for the perfect setting and amenities. She is bothered by the slightest detail of a place (a pair of picky anthropologists) until they meet the tribe on beautiful Lake Tam, where they settle. Thats all of the plot Ill give away!
Not only is the novel beautifully written and in a fascinating setting, the characters are wonderfully rendered; so much so that my only complaint about the novel is that it was over too soon. This is a case where Id have loved 100 more pages of these characters and this setting!",4,"[-2.8070070287161792, -1.5794853132612545, -1.0301883929978888, -0.9913288018086265, -1.1153484096719788]",-0.9913288018086265
9931,I am using a grow light in this. I love that I can move it around where ever I need the best light. Long cord and heavy duty clip are a good feature. The on/off switch makes it easy to use too.  Nice quality for the price. I will be getting more as I plant my seedlings and get ready for spring.,4,"[-4.3801674856897135, -1.6736380725668547, -1.1599247095069498, -0.9913871383509311, -1.3631484727902161]",-0.9913871383509311
4038,"Enjoyable reading and with the familiar characters from previous Paradise Lake installments. I don't usually figure out who did it, but it was a little obvious . A nice Christmas short story with a nice message.",3,"[-4.568969654607873, -2.154225396321553, -1.2738047409972335, -1.0146188694195861, -0.9914276192730931]",-0.9914276192730931
1679,"This is book 2 in the Torn Series. Drake and Chloe are given a new start with their relationship. But will outside forces still continue to plague their love? This is much darker then Torn, Drake and Chloe both struggle with inner demons and threats from people they thought they could trust. Excellent follow up K.a. Robinson",4,"[-3.915034989336471, -1.9118000462262186, -1.1839471962630246, -0.9914762357717078, -1.0594435113994323]",-0.9914762357717078
2364,This is a sweet and fun contemporary romance. There is debut nothing graphic which was a nice change of pace. Janie is awkward and endearing. Quinn is just alpha enough. Good read.,3,"[-3.3913859978617884, -1.9578739817051412, -1.4531049139025778, -0.9916086182646062, -1.1543809237122362]",-0.9916086182646062
3889,Trails and tribulations of an orphaned teacher. Read the book in one sitting. Very highly recommend.,4,"[-2.0711185112561763, -0.991611362901146, -1.0403446407628474, -1.0608273731702613, -1.1414008727039089]",-0.991611362901146
4400,Action packed but you don't really connect to the characters because you learn so little about them. Different that the females are affected uniquely by the nerve agent and they aren't the undead. Not sure what they are but there are similarities! Does immunity exist? A bite doesn't doom you apparently.,3,"[-1.4494392637332987, -1.0090816518063792, -1.088923604520952, -0.9916758143079738, -1.3228611151155998]",-0.9916758143079738
8604,"Grady and Melaine story was quick, with some funny moments.

Received an ARC for an honest and fair review.",3,"[-3.156938215249706, -1.2900750366440412, -1.1244132087049763, -0.9918126857645522, -1.2066435272809315]",-0.9918126857645522
3641,This was a good friends to lovers story. The posse is a group of friends from way back. They watch out for each other and are great friends. After spreading Jude's husband's ashes the guys come up with a plan to keep Jude in Crystal Cove. Three of the posse decide that they will date Jude. Jude shoots down two of them right away and Cooper decides to let Jude know how he feels before it is too late. Cooper is there for Jude when her son gives her some news and offers her a future.,3,"[-4.850050786965006, -2.016284265449977, -1.13308979926433, -0.9918409580933456, -1.1498400657435204]",-0.9918409580933456
9751,"This was given to two dogs to try.  One of the dogs is a large dog and the other is a medium size dog.
A can was shared by the two dogs over dry dog food.  Both dogs gobbled it up the first day and thought it was wonderful.
When the same thing was done the next day, the larger dog wasn't interested in it, but she's a picky eater and often rejects things that are repeated.  The medium size dog gobbled his up again.

I'm sure the large dog will enjoy this again as long as some time passes before she's given it.",4,"[-2.3276804685813652, -1.7268369411071607, -1.2886883587682672, -1.021202492290143, -0.9918511167834381]",-0.9918511167834381
4679,"I enjoyed the storyline. Went a bit fast for me, but all and all a good book. Looking forward to reading book 2.",3,"[-4.1464758996807625, -1.618778699210301, -0.9921588919433333, -0.9986959848414467, -1.1801572350966503]",-0.9921588919433333
1364,"Yes, I loved it. It was an investment time I do not begrudge one whit. He was a hero of truly epic proportions. Do not think his life and times speak only to those days and consign them to some dry existence. This man lived and left his mark on the times. The trappings of the times may be foreign, but the man is not. His ilk, his soul can be found down through the ages. Even now, there are those who yearn for a hero to lead them. But all hero's are only men and women, the good the bad and the ugly of humanity who seize a dream and run with it until their hearts can no longer carry them. To read this story is to read of one such man.",4,"[-3.229875482932229, -1.595461809953445, -1.0339176481029893, -0.9922803725779363, -1.0024117557037946]",-0.9922803725779363
9073,"This one was
A little sad at first but got really interesting and made you start to realize that there was something bad was going to happen hard to wait to see what it is and hope they can overcome it.",4,"[-2.4192420377615838, -1.0081126325419119, -0.9923494192623019, -1.0484296278988479, -1.5678979288131893]",-0.9923494192623019
1412,"An enjoyable and interesting mystery, found the plot and the characters engaging.",3,"[-3.526868915476212, -1.789682327299069, -1.0826354148384685, -0.9923801284629715, -2.023798973695346]",-0.9923801284629715
