,X_sentences,Y,Y_decision,Y_confidence
5069,"""Keep the beauty alive in the ugly.""

Drifter is book one in the Nomad series by Author Janine Infante Bosco.  It is an MC novel and the first book in the Nomad Series.

""He's the guy who enticed the bad girl buried beneath the class, the guy that makes that girl want to come out and play.""

Stryker has seen and experienced more in his young life than one hundred men combined.  Gina is a spitfire.  Her surety and spunk aren't present without reason. She is a strong contender in business and can hold her own in and out of the office.

""We're looking for lightning. We're going to get burned. That's a fact.""

I was in shock and disbelief in the opening pages of Drifter. I know these things happen, I am a bit naive to it. But, reading it is always a jolt to my system.  I knew immediately that Stryker was going to have baggage that he could never comfortably carry. But was caught off guard by the extra burden those around him would be forced to shoulder. I love how Stryker was a sexy, alpha-male, but also had a gentle side that he showed to those he loved.  When Gina was added to the picture, their compatibility and heat was unstoppable, they were such a great couple. The only drawback to this story was the inconsistent editing errors that occasionally caught my eye. However, the storyline kept me invested and the characters felt like long-lost family.

Drifter was a fast-paced, edge of your seat, wipe the sweat from your brows and lust from you eyes read.

""When you feel like there is nothing beautiful in this world, look around you. Find your beautiful.""",3,"[-1.5950418608452601, -0.9587423885087415, -0.9734976764597907, -0.9985164282045422, -1.2706963495147439]",-0.9587423885087415
9130,"A few typos but other than that pretty good.  Full of the action of a regular military unit, Alpha Division can kick ass.",3,"[-2.3182834763360747, -0.9587768311675195, -1.0338685316945415, -1.001730350120334, -1.4238788310313728]",-0.9587768311675195
3989,"Twist of Fate is my first read by Jamie. I have to say like others I couldn't and didn't want to put it down.
She had me the minute Silas sat down at the airport. Silas in the ARMY on his way home for R&R runs into Lilly while she is waiting for her flight. Come to find out they are on the same flight sitting next to each other. Silas helps Lilly and her nerves while flying. When they reach their next destination they find out flights have been canceled. Silas being the man he is get a hotel room and shares with Lilly. Wait for it, wait for it.....He wants to kiss her, he wants more than a kiss. They agree on a one night stand no strings attached. OMG!! I mean who hasn't had a one night stand? This one night stand though will forever change their lives.
They go their separate ways. Years later they bump into each other. It is like sparks fly all over again. However Silas has a girlfriend Kristen. Yeah not an ideal situation. The one you let walk away and your girlfriend.
Silas tries to talk to Lilly on more than one occasion. Lilly manages to give him the slip right when something very important needs to be said.
One thing about having your one night stand that you couldn't forget and your girlfriend in the same area secrets fly. Things are said that hurt Kristen. Things that eventually end their relationship.
There was a part where I was screaming ""no, no, no tell it isn't so, tel me it can't be?"" I had to finish this book. I had to see what happened. I wanted to know does Lilly and Silas make it? Jamie sure does know how to keep you on your toes I tell you that much. You want answers to my questions too? Go get your copy today.",4,"[-3.5971255036589316, -1.8932415931489308, -1.143508914551921, -0.9761170099701968, -0.9602589980658202]",-0.9602589980658202
8838,"Filled with the assurance only a 16 year old has, Merry uses more than her feminine wiles to have her way with Thomas, the young knight whose eye she's caught. He is leaving for London the next day, to return in two weeks time. Unfortunately for them both, King Edward and his liege lord, Marcus, decide they must send him and the rest of the King's men away to protect the land.  Five years later, Thomas returns to find a very different young woman, who is no longer the happy, teasing girl that caught his heart, but an angry, spiteful winch, who seems determined to do him physical harm.
Stella Alden weaves a tale filled w gallantry, love, intrigue, distrust, and deceit. The plot is fast paced, reminiscent of ""The Princess Bride,"" and the main characters rich with all too human behavior and emotional frailty.
A fun read for someone whose nose is always in a book--it's fresh and , and very hard to put down.  Enjoy.",4,"[-3.378219098900468, -1.7290458154351076, -0.9603784262297539, -0.9887381842236138, -1.0392939190498618]",-0.9603784262297539
1843,In most romance books you know the couple will end up together you just read to find out how they get there. In this one the authors surprises you. You aren't sure how things will come out for any if the characters until the very end. Reading about the struggle with jealousy that Faith faced was inspiring. Her older friend's wise advice is good for all of us.,3,"[-2.7410647262281174, -1.788421583464566, -1.287925127728868, -0.9610957640805027, -0.9606890843355803]",-0.9606890843355803
3719,"I read this book and was amused from time to time.  I enjoyed it enough that I commented to my wife, who was reading another book at the time.  After several comments, she asked what the name of the book was that I was reading, because she was  getting a kick out of the comments I was making.  Then she realized that she had read the same book months earlier.  She agreed that it was good and that both of us will likely read more in the series.",3,"[-3.0374687267596334, -1.560270986308864, -0.9607619321975619, -0.9964664778048999, -1.1701362652913556]",-0.9607619321975619
786,"I thoroughly enjoyed this book. I received it as a gift and didn't have any advance expectations, so I didn't mind that it isn't really an Alex Cross book. I liked the main characters of Ben, Moody, and Abraham and admired their integrity and courage during horrible situations in post-Civil War Mississippi. While I was aware lynchings did occur, I didn't realize how widespread they were and that people were killed for the most trivial of offenses. ""Trial"" was very moving and informative and because of the subject matter, sometimes hard to read. However, the violence had to be a part of the book to show the horrors people in the town were facing.

The book was suspenseful and the short chapters keep the story moving. I was shocked right along with Ben when he learned who could be trusted and who couldn't in his old hometown. There was a strange scene at the end of the book when he and Abraham's granddaughter Moody are provoking a reaction out of the town's people that didn't seem to fit and that took away from the book somewhat. We also never really get to know Ben's wife and her point of view of some of the events going on in Ben's personal life. However, I enjoyed the rest of the book and am glad I read this excellent historical mystery.",3,"[-2.9176030842758616, -1.5717637757386584, -0.9607757273714918, -0.9967654680966775, -1.0219693420124294]",-0.9607757273714918
8204,"Quick little reads that have a lot of action and suspense.  Gives you a quick set-up, pulls you in, then resolves the mystery",3,"[-4.520587049678674, -1.7791862692205567, -0.9608248220088651, -0.9942334252011382, -1.695616514598949]",-0.9608248220088651
5718,"Very good action, suspense story with a MM love story in the mix. Definitely keep my interest while the bad guy was revealed.",3,"[-5.210248626890911, -2.51535826297975, -1.1498567263325652, -0.9609914622629123, -1.501088492062805]",-0.9609914622629123
8701,"It's about time Jay got it together. Every woman he dealt with was crazy, I think Dee Dee is to he just doesn't know it and won't unless he cheats. Very good ending to a very good sequel.",4,"[-4.006696427628903, -1.0848025546743538, -0.9609926692623394, -1.0006709836550154, -1.061097674427127]",-0.9609926692623394
2036,"Joanna, along with two other women, spent fourteen days in hell, literally, and the serial killer holding them captive was the devil. Joanna knew without a doubt that's what he was, and eighteen years after escaping, she's still trying to forget that tragic part of her life. Plus, she knows talking about it could very well return her to that hell. He's watching, and waiting, for her to slip. There's only one reason she'll break her silence, and as more women begin disappearing as she did, she knows the time has come to share her story, to relive what she endured and barely survived.

Tony, a former FBI profiler, is struggling since the loss of his family and quitting the Bureau. Tony gets a frantic call from his sister and learns his niece is missing. He may not be an agent any longer, but he doesn't hesitate to use his previous standing to look for her. When he and Joanna meet, the chemistry is intense and the connection immediate and they share a passionate experience. However, as Joanna slowly starts letting him into her past, Tony doubts her story and believes she may be the one responsible instead of a victim.

But as Tony and Joanna begin spending more time together, he quickly realizes she's telling the truth and not only can she possibly help him save his niece, but she may be putting herself in danger again to do so.

Who's responsible for what happened to Joanna all those years ago? Is it the same man doing it now? If so, why? Will Tony and Joanna be able to save his niece? Will these two be able to move forward from their pasts and find a future together?

One-click now and follow along as a man and woman cross paths due to tragic circumstances, yet find hope in the love they discover.

**I voluntarily read and reviewed an Advanced Reader Copy of this book.**",3,"[-3.547270406746554, -1.6440738075906005, -0.961521283934226, -0.9720874794737489, -1.1379269946694996]",-0.961521283934226
8227,A good introduction to leaving time...plan to read leaving time in the near future.  I have majority of Jodi picoult's books.,4,"[-4.178519676805393, -3.2313569511123417, -1.988339168918213, -0.961532429753417, -0.9864909157516124]",-0.961532429753417
2416,"I enjoyed this first story of Montana Promises. A sleepy little town that has more than a few menage' relationships. This one was filled with sorrow, and quite a bit of suspense. The men and women of the town feel real, and the relationships grow throughout the story. You only meet this first threesome but I'm sure in this series you'll get to meet more. Amber, the female lead, is a bit dizzy to me, but it resolves itself when she starts trusting in the men that want to love her.",3,"[-5.333770959320225, -2.763355945647588, -1.0917650440779885, -0.9616768689119394, -1.1794840870374497]",-0.9616768689119394
3185,"Dare I say it,  it was fun watching Austin fall in lust,  fall into obsession,  fall in love and basically fall apart.  He's a great character, larger than life,  funny,  complex,  angry,  loving...  He felt very alive to me.  And Peter Cotton,  the object of his obsession,  20 years old but with an enormous history behind him,  he was easy to love too.

This is an amazing book,  definitely a roller coaster of a ride,  with mystery, suspense,  police drama and love story all equally intertwined.  The sexual tension was really alive and hot,  but there was also humor and a sense of confident writing.  The men's banter felt effortless and real, and I liked all of Austen's interactions.

Highly recommended with the added appeal of being great value for money,  it's 9802 locations,  a proper, full length book, for $2.99,  I'll definitely be looking for more by Dani Alexander",4,"[-3.6375646482746298, -1.4379026482278554, -0.9877828362595961, -0.9619929068289073, -1.2560061339594206]",-0.9619929068289073
3776,"When single mom Chelsey Alton hears there is a job opening for a Municipal Clerk in Coral Beach, she quickly applies for the job. The council board members just as quickly vote to hire her, except for one, but the job is hers. Chelsey does have a few doubts about the job starting with the fact that the job is vacant because the previous Municipal Clerk is murdered. However, she puts that aside and delves into the job.

Chelsey learns there is an Administrative Assistant job opened as well after the previous assistant unceremoniously walked out. She recommends her friend Bonnie for the job and she gets hired too.

It doesnt take long before Chelsey realizes something strange is going on in the town of Coral Beach from mysterious fires, murders, angry residents, mobsters and nasty board members. Determined to stay out of it, she finds just the opposite happens and shes right in the middle of it.

What a great read this is! Each character was vividly portrayed. Chelsey is a strong heroine surrounded by a zany cast of characters. Her sidekick Bonnie keeps readers laughing. There are also stalkers, romantic interests and evil mobsters tossed into the mix. The story takes a million twists and turns and keeps you guessing to the end. I really enjoyed this well written mystery. Who knew being a Municipal Clerk could be so dangerous?

I haven't read the first book, Red Tape, but its on my Kindle and I will definitely be reading it. Although Tax Cut is the second book, I felt it stood on its own. I didn't feel lost as I read it, I jumped right in and Im glad I did.

FTC Disclosure: The author provided me with a copy of this book to review for this blog tour. This did not influence my thoughts and opinions in any way. All opinions expressed are my own.",4,"[-4.40808867728934, -2.0735399073794527, -0.9621249069316605, -0.9981516402585598, -0.973474231075927]",-0.9621249069316605
4716,"I didn't think I'd like going into the past as much as I have been.  We know how the world is/was with the last Rylee novel (*wipes a tear*); we don't know everything that happened in the past to help shape it. We definitely had glimpses that there was a lot of shaping/manipulating that went on.
With Lark's world we get to see what happened before. We get to learn so much about the supernatural world of the elementals. I can't wait to read more. Especially as I now have so many questions!

You need to read the first three books to thoroughly enjoy this.",3,"[-2.072163675203188, -0.9622164214416264, -1.1142879722037486, -1.0173366873636425, -0.9631619612845015]",-0.9622164214416264
8421,"This is a well written story about two broken people coming together to help each other.

Lily Harkness has a past that haunts her.  She proves she can still be tough by working in a men's profession as CEO of Harkness Oil and Petroleum.  She arrives in Dahar seeking exclusive rights of the country's oil reserves.  What she doesn't expect is to have to deal with one very stubborn Sheikh.

Sheikh Isma'il al Zahara has a past that he wishes to keep to himself.  He is just trying to rebuild his country right now and doesn't need any distraction, least of all one stubborn beautiful blond named Lily Harkness.  But, he is intrigued by her.  How will he be able to keep this strictly business?

I enjoyed this book and look forward to reading more by the author.  One warning is the sex scenes tend to be a bit on the dark side.  So, if you're squeamish about that sort of thing, maybe this isn't for you.  If you enjoy it or want to experiment with something spicy like this, then this is a excellent book for you.",3,"[-2.6205847219727327, -1.3493319637604206, -1.1663035531956996, -0.9624143356769495, -1.0650781033015093]",-0.9624143356769495
7803,"This is a larger than average cutting board, so keep that in mind. It fits (just barely) in my cabinets lengthwise, but is a tougher fit when other items are in the cabinet.

It's thinner than a normal cutting board, but still produces excellent results. These types of boards don't dull knives and can be sterilized, which is great when dealing with potential pathogens (meats, etc).

It has four non-slip corners which helps keep it in place. Surprisingly, this is the best feature. I can't tell you how many times a board has slipped on me and I've nearly sliced off my finger. These non-slip pads are an excellent idea.

Overall, recommended. Just keep the large size in mind.",3,"[-3.587356360990547, -1.6307900960261268, -1.1242318105810556, -1.0396897183881781, -0.9624741010460526]",-0.9624741010460526
102,"Lucy Sullivan is young, single, neurotic and getting married.  At least that's what a fortune teller predicts when she and 3 office mates visit her.  Suddenly everyone is congratulating Lucy on her upcoming marriage which is a little strange to her as there is no boyfriend in sight.
When she meets Gus, he seems a definite possibility.  He is good looking and funny but also unreliable.  There's also Jed, the new guy at work.  Or maybe Chuck?
There are so many wonderful characters in this book.  Lucy's office mates, Meredia, Megan and Hetty, each of whom has problems of their own.  Lucy's roommates, Karen and Charlotte, who also have very definite personalities and are very much involved in the ""dating business"".  Lucy's interactions with her roommates, co-workers and dates are funny, heartwarming and unique.  The pace never lets up and you just don't want the book to end.
We know that eventually Lucy will find her mate but the process of her getting there is great fun for us (not necessarily for Lucy).",4,"[-4.616935450925691, -1.823900270419575, -1.0283674442828066, -0.9626651999326177, -1.2253916306416173]",-0.9626651999326177
7115,"Very good mystery. Of course, the potential love interest is still ANOTHER cop, which has gotten very old. The best friend is fun and funny. There are lots of red herrings, good because the heroine lives on a boat. The series, that I imagine follows this, should be worth reading also. There were only a very few typos or misused words.",4,"[-5.2959882341882984, -1.9571245636667478, -0.9626777760768696, -0.9910656226307358, -1.5933556950171428]",-0.9626777760768696
9815,"Works Great
I use it for shorter barrel rifles like AR 15",4,"[-1.6428845360615711, -1.770067415779532, -1.419961965161145, -1.0372756090307935, -0.9628011201571348]",-0.9628011201571348
3561,I continue to be pleased by the characters development and intertwining.  At times the story is a little immature but always humorous.,4,"[-3.0679675883273445, -1.0894247461436946, -0.9632038649298325, -1.0019315370596338, -1.2376555795801791]",-0.9632038649298325
267,"This novel is part of a series, but it works as a standalone as well. You will not feel lost of this is the first book by this author you are reading.
In fact, I find it a great introduction to the characters and the series as a whole.
The author is a good writer. The plot is engaging.  Pacing is great, dialogue is great, really, this novel is worth reading.",3,"[-2.6634683294706636, -1.04387427309132, -0.9632483754590988, -1.0036603070629424, -1.1252052214783017]",-0.9632483754590988
3849,A regular full length feature. The story of one man and how his journey home effected several other families. Good western adventure. Lots of action. And the heroes win in the end.,4,"[-4.674982482359718, -1.424342385309324, -0.9634822922786221, -1.001088072984642, -1.2869385082656368]",-0.9634822922786221
8600,"This book is told in two parts.  Part One tells the story of how Luca and Allison meet in an institution where they are both trying to work on their issues.  Luca is a pyromaniac and I don't feel it was fully explained how or why that came to be.  I found their relationship to be very intense and although he was always brooding, you could tell that he wanted to help her.  When he finally finds out what happened to her and why shes there, the desire to right the wrong done to her causes him to make a deal that will turn on him.
Allison is very reserved and doesnt trust easily.  After she gives her heart to Luca, a betrayal causes her insecurities and self-doubt to root deeply in her soul.
Part Two brings us to years later when they meet again and the hurt comes back to the surface.  I wanted Luca and Allison to find themselves face to face again.  I was rooting for them to get together, and although they finally do, I wasn't satisfied with the way it happened.  We are made to understand that Luca explains the reason for his departure from the institution all those years ago, but it is never explained to the reader.  I wanted to know what happened and was disappointed that it wasn't shown.
There are misunderstanding adding to drama and characters that want to see them separated.  The secondary characters, like Ollie and Archer added so much interest to the story and I found myself wanting to know much more about them.
The story is very well written and the characters definitely pulled me in.  I hated that it ended in a cliffhanger, but the setup for the next book was done very well.",3,"[-3.1880399115040507, -1.6864090255663875, -1.09881313113981, -0.9639572150871256, -1.313378545114067]",-0.9639572150871256
775,"Dante (Danny) Valentine makes a pretty good living as a necromancer. Raise the dead, ask a few questions, and terms of the will or suspicions of murder can all be answered. When a demon shows up at her door, points a gun in her face, and summons her to a meeting with Lucifer himself, though, that's way beyond the job description--even though Danny does the occasional bounty hunting job.

What Lucifer wants is for him to track down a rogue demon--a demon who, according to Lucifer, stole a mysterious 'egg' from Hell. If that egg hatches, Lucifer assures Danny that the Earth just might not survive the experience. To help her, Lucifer sends his personal hatchet-demon, Japhrimel to ensure she survives long enough to confront the rogue. Because, unfortunately, he's given his personal word that neither demon nor man shall harm the rogue.

Danny wants to go alone, but her friends insist on coming along. When their journey takes her to the city where her ex-boyfriend lives, he joins in as well. She needs all the help she can get. The rogue has taken over a Mafia family and has plenty of human resources, as well as his own demonic powers, to call on. Danny doesn't seem to stand a chance, especially given Lucifer's promise. Being a woman just doesn't seem enough.

Author Lilith Saintcrow creates an interesting take on the legend of demons. Far from being unmitigated evil, demons like people--and have manipulated their DNA to raise them from apes to something that a demon could socialize with. Of course not all of the ancient legends are false, either--and the hideous power demons hold is dangerous indeed. Dante Valentine is a damaged but sympathetic character, attempting to survive, dealing with her losses (begining with being abandoned as an infant), and torn between a demon lover and the man who once held her heart and then broke it.

I'm happy to recommend WORKING FOR THE DEVIL.",4,"[-2.794965678114349, -1.441163750543689, -1.1533329933432148, -0.9808112298574014, -0.9639675777698011]",-0.9639675777698011
1529,"I have read many of Deepak Chopra's books through the years with great enjoyment. I particularly read his books during the time that he was a spokesman for Transcendental Meditation. He is a great story teller and having heard him speak a couple of times, also a great inspirational speaker. Brotherhood by Deepak and his younger brother Sanjiv added another dimension to the Chopra story for me. This book was set up with each brother writing a chapter without the help or consultation of the other. The brothers write alternating chapters. At times they tell about the same people or experiences, but from a different perspective. At other times the chapters aren't related in subject at all.
Deepak has been publicly involved in more spiritual matters in his previous writing. Sanjiv appears to have a more scientific attitude. Both are medical doctors, though I do not believe Deepak is involved in medicine to a great degree, except perhaps Ayurveda. Sanjiv practiced a more traditional western medicine and is a professor and a dean at Harvard Medical school.
Being somewhat familiar with their backgrounds in India, I found Brotherhood a great addition to my knowledge of India, their families and what it was like to grow up in India. The stories in Brotherhood are extremely well written and very entertaining. They are humorous, moving, and at the same time historical. I found Sanjiv's writing to be particularly good, especially since it is Deepak who has been the one writing books for many years. In Brotherhood Deepak's writing gives the impression of being overwhelmed by the information that he is relaying and becomes somewhat scattered. On the other hand Sanjiv's writing is clear and more linear.
Perhaps, I have been a bit too analytical in this review. Overall the book is very enjoyable, and is a quick and easy read. When Sanjiv was asked how he might live his life differently if he had the chance, he described exactly what he had done and said he would do it again. These are two extremely intelligent and caring individuals who have added greatly to this country and to the world.
I would like to add, upon reflection, for those who wondered why and how the split occurred between Deepak and Maharishi, it is explained in this book.",4,"[-3.814971164059386, -1.4637459693101436, -1.5088839723091934, -1.0219367341260197, -0.9641833574846465]",-0.9641833574846465
1818,It's a  little too sappy to give it 4 stars but i liked this book. Read it in one afternoon. Would recommend for the romantics or those who want an easy vacation book.,2,"[-3.686073091821167, -1.4829809402315555, -0.9643912951838042, -0.9958679978263069, -1.0849720215902288]",-0.9643912951838042
