,X_sentences,Y,Y_decision,Y_confidence
6877,"Stand & Deliver (Men of Haven #5) by Rhenna Morgan
4.5 stars
M/F romance
I was given this book for an honest review by Wicked Reads.

This is another great story about the Haven brothers. I really would suggest reading the previous books in this series, as there are several characters and relationships that will make more sense if you have a background.

Beckett is a guy who takes what he wants without really question...however, he has found his match in his co-worker, Gia. She is a tough, independent woman who can hold her own in their business of protecting people. He has lusted after her since she first saw her, but because Gia was firm in her no dating co-workers, he's lusted from afar. He also has a revolving door of women than he brings to their get togethers after work, so he has never truly left that open for Gia to consider, since she didn't want to be part of his harem.

Gia is a woman who is amazing at her job. She has lusted after Beckett for the whole time she's worked with him...three years. But, she is a firm believer that you don't date co-workers. On a night when she has had a little too much to drink, she reveals a more vulnerable part of herself to Beckett and despite not really remembering that, Beckett shows her that he's not willing to wait any longer.

When trouble starts brewing for Gia's career, Beckett and his brothers band together to show her what a family truly is. Gia's family life definitely leaves something to be desired, but when she sees Beckett's family, how much love they have for each other, she knows that being a part of that isn't bad.

The mystery behind this story was much more satisfying for Gia and Beckett. The catharsis in this story is amazing and I felt vindicated for Gia. I wish that we would have known more about the fall out of that, but maybe if there are going to be more books, we will see a little more in to that aspect. Let's just say that I do hope that there are more books to come as they are entertaining, hot and have a lot of action.",4,"[-3.8193205031483686, -0.9118082499785933, -1.2849185115983903, -0.9637137048090028, -1.1244294392390786]",-0.9118082499785933
8372,"I really enjoyed this book. I always wonder if these kind of contracts are binding?
I love the way the back and forth of the fighting goes. He doesn't try to use sex as a direct punishment. He keeps their relationship at  work quiet. I am beginning to think he is using her.",4,"[-3.850963239868596, -0.9118150192302473, -1.1783217209235108, -0.960902856201888, -1.2103121062265665]",-0.9118150192302473
8906,"This is a very steamy suspense with great characters.

When Jordan left the Marines he got a job with Pierce Securities. But since he's a newbie, he's given the worst assignments. Because he had been on so many missions in the military, he thought these menial jobs were a waste of his experience. When he finally got a missing persons case, he hoped to show his boss how good he was. But he knew it wouldn't be easy since the police hadn't gotten anywhere with finding the woman who had been kidnapped from her apartment.

Mia and Jordan lived across the hall from each other and while Mia thought he was hot, she didn't do relationships. So a night or two with him is all she wanted. It looked like a couple of nights wasn't enough for either of them though. When he saw Mia being taken, he'd do anything to find her.

Jordan was not happy being out of the military and working at the security company. He really thought he was too good for the jobs he was given there. That made him hard to like and I wanted to slap him upside the head to knock some sense into him. But he was hot and that was all Mia was looking for. Mia was working hard to save enough money to bring her sister to live with her, leaving no time for a relationship. Both Jordan and Mia were surprised that their agreed upon casual sex turned into more. It didn't take long before I liked both of these people.

I enjoyed this exciting romantic suspense.",3,"[-2.566167143248497, -1.333770905052294, -0.911987242175367, -1.0078860110279113, -1.408212962066857]",-0.911987242175367
727,"Those who get a little too wrapped up in ""The Sopranos"" should read books like ""The Westies"" every now and then just to remind them of what havoc real life organized crime can inflict.  The book chronicles the rise and fall of the Irish gang of the same name that was every bit as bloodthirsty as John Gotti's more famous crew.  The gang occupied New York City's since regentrified Hell's Kitchen neighborhood.  Mystery author Lawrence Block effectively used the Westies lore in creating the character Mickey Ballou in the Matthew Scudder private detective series.  The fictional Ballou could be Jimmy Coonan or Mickey Featherstone, the real life chieftans of the gang, who were known for dismembering victims and dumping their bodies in the East River.
""The Westies"" is a brutally violent story and one that makes good reading for anyone who likes real life organized crime stories.  The prose and the reporting are a cut above average for this type of book.",3,"[-3.2256729580412395, -0.9121311641747757, -1.22709761632413, -0.9751960309579425, -1.1610526474617675]",-0.9121311641747757
8082,"The caught my interest quickly. The heroine, Lana, strong, sacy and hard headed. The hero, Adam, ladies man, sexy and bull headed. The characters whereas for each. Love the way they argued and then came back together. The bad guy, Sebastian, there a story this author has to write. Easy read, kept me wanting to what was going to happen next. Highly recommend this book.",4,"[-0.9122724540947993, -1.027193822734962, -1.0337406004138734, -0.9829228832517766, -1.2909915297391843]",-0.9122724540947993
2007,"I really loved this story. Which is not unusual when it comes to this series. I loved the way both Ginger and Matt decided to be ""friends"" and would talk to each other on the phone for hours, like teenagers. It was very sweet. I loved how that phone connection enabled them to tell each other things they haven't (couldn't) tell anyone else.

I know a lot of readers of this series have issues when the author gives too many details of other characters, but I love that aspect of her books. It really makes me feel like I know the whole town and shows that the main characters in each book aren't living in a bubble. In this story in particular, I enjoyed the side story of Charlie and his mom. Of course, it's a great set up for the next book, too. I have a soft spot for nerdy kids and I'm hoping the next book is just as much about Charlie as it is about Lin Su.",3,"[-3.515046749022679, -1.7570429713580724, -0.9123635102167462, -1.0074070524823533, -0.9453703875528019]",-0.9123635102167462
5998,"I like Susan Stoker's stories, but the dialogue and writing are sometimes very juvenile and not well-written.  I enjoyed the book, very suspenseful at times.  I thought Dax & Mack were a good couple, but I can't imagine a man constantly saying how much he thought she was cute and adorable -- really??  Definitely going to try the 2nd in this series.  Loved the whole SEAL of Protection series -- even though I thought some of the writing could have been better.",3,"[-4.111510775276753, -1.9215344174191609, -0.9148375649276684, -0.9985996215487163, -0.9126250740304314]",-0.9126250740304314
8732,"Thunderstruck is about a woman who is kidnapped and held prisoner for nine months by a psychopath. She is able to escape, only to realize she no longer knows who she is. The man who held he prisoner is after her, so she is protected by Ramsey Security. We saw Rafael Ramsey, or Saint, in Damaged and the Saint. We saw a glimpse of Troy in that book. Troy is a retired hired contractor, whose job is to protect the woman, Darla. As soon as they meet, there is a connection between the two. From her captivity, Darla many issues. Troy pushes her just enough and patiently deals with her issues. She wants to be better for him, so he helps her find the new Darla. Their attraction grows into a love story. This couple does find their HEA.

This book was just an okay read for me. With all the teasers and the blurb of the book, I have been waiting to read this story for a while. The story did have a nice flow and good chemistry between the two main characters, as well as the secondary characters. The other books written have dark issues, but there are those moments that are funny, which lighten the mood up and break up the darkness. I do not feel like this story had those moments. This story felt heavy to me and because of that, it wasn't as good a read for me as past ones.
The story was still a good one, it just was not one of my favorites

I received an ARC of this book for an honest review.",3,"[-3.8557721542715067, -1.7605859586316965, -1.1016682237427633, -1.0055680543940888, -0.9126656652936871]",-0.9126656652936871
3751,"Once you get by the knickers and other cutesy britishisms, this is a good mystery. The characters are solid as well as the story. Amber is kind of a clumsy good-hearted sleuth that just wants the man of her dreams.",4,"[-4.236951587290468, -1.7414018026429248, -0.9127871612290085, -1.0128513107581267, -1.3642191057062032]",-0.9127871612290085
4855,I had a rough time getting into the first few pages for some reason but then the story grabbed me and I loved it. I liked Seraph as a main character. She was abused but she wasn't a victim. I liked the way the author portrayed her as trying to be invisible. It was an intriguing read.,4,"[-2.2669130162496427, -1.1992072057653145, -0.9128537043021556, -1.0128228949847884, -1.0140233138673915]",-0.9128537043021556
3193,"One minute Kylie is a normal high school girl, the next she's thrown into the world of paranormal and can suddenly read minds - would you want to know what people were really thinking.  Kylie realises her dad has been lying to her, her best friend has betrayed her and she doesn't know who she can trust anymore.

As a full length book, the characters and storyline really get to develop and draw you in.  Its full of humour, suspense, romance and emotion, incredibly easy to read, flows nicely and will leave you gripped.  You'll fall in love with at least one of the characters, and be looking forward to reading more about them.

This is the 4th book I've read by Susan Hatler, and have loved the others but they just seem to be getting better.  I was having a bad week, and this book was just the pick me up I needed so forced myself to read it slowly over a week.

I received this book from the author on a read to review basis.",4,"[-3.229459501015154, -1.1002591031275153, -1.1739724584388915, -1.0177408730324387, -0.91330225246822]",-0.91330225246822
3156,Joseph is at it again....Mark is his last son he is trying to marry off.  Mark thinks is dad is up to no good.  Joseph chose Emily and her son Trevor to be Mark's new cook at the ranch and decided that they would be a great fit for Mark and set out to watch his matchmaking plans become fruitful.,2,"[-4.228153333119841, -1.741648406733225, -0.9136267188019891, -0.9857965416185901, -1.2025459697209226]",-0.9136267188019891
3575,"This book was serious and silly all in one. There are hazards to skinny dipping and falling for the wrong guy, and this book will teach you all about that!",3,"[-2.586869681507795, -0.9855718204379696, -0.9138241928987797, -1.0116142964699202, -1.0039796173246782]",-0.9138241928987797
3271,"Chloe Patterson is about to marry her longtime boyfriend. He's handsome, he's a successful lawyer, and he's crap in the bedroom, there's also the little detail of Chloe not being sure that she really loves him. So the morning of her wedding she decides that she doesn't want to marry the lawyer and runs to her dad's. Her mother, who lives guided by appearances, is outraged but her father is supportive of her decision and offers her a ranch his family has owned for generations in Monterrey for her to go stay and think things through.

Before her move there she connects with an old friend who runs rescues for pit bulls, they rescue the dogs and try to get them adopted or train them to be rehab dogs. Her friend is looking to open a new franchise of the rescue operation in northern California and wants Chloe to help.

Once she gets to Monterrey and has some time to relax and think, Chloe starts viewing the ranch as the new center for the rescue dogs. Her friend hooks her up with the vet in town and once Chloe and Lucas meet is instant attraction, even though neither one of them are incline to act on that attraction.

Lucas Campbell is a great guy, sweet, smart, very sexy, and nursing a broken heart. His fianc left him standing at the altar on the day of their wedding, so to help himself heal he takes missions with vets without borders. His relationship with Chloe blooms into a great friendship and he spends most nights and weekends helping her with the rescues. Alice took her time building their relationship and the sexy times don't come right away, they actually take quite a while to happen but when they do they're schmokin', the chemistry between these two is hot, hot, hot.

There's some angst mixed with great humor in true Clayton's style. This lady knows how to tell a story and how to write a hunk of a guy. I loved the fact that Chloe was strong enough to stand up for what she wanted without having her dominating mother interfere with her goals. This is a great story with fantastic leading characters and a great team of secondary characters. That's also something I love about Alice's books, no character is too small to make an impression on the reader. The addition of the old school ambiance of the ranch and the music just makes this a book you can't miss reading.",4,"[-4.294898769436102, -1.900652692247978, -1.155365282586935, -1.004388343143023, -0.9141683245434165]",-0.9141683245434165
8934,"This book grabbed me from the start and kept me on the edge of my seat and turning the pages. Now that is not to say the story is kind of unbelievable and taboo. There was plenty of suspense and action, with a twist I did not see coming. When all said and done I enjoyed the story and was entertained. Bodyguard was included with an ARC copy of Hard Bounty.",4,"[-3.218225753741846, -1.346933058152084, -0.968192317103617, -1.024091570536984, -0.9142303628716848]",-0.9142303628716848
6116,"I really enjoyed this story, the characters Griffin and Nina had chemistry from the off and the twists and turns were great

I received an advanced copy and I voluntarily leave my opinion",4,"[-3.567384243577602, -1.168981336801492, -0.9142602424684856, -1.0007543094766258, -1.0902526826843753]",-0.9142602424684856
7582,"The Linksys SE1500 5-Port Fast Ethernet Switch offers great value for the money and can be used for a variety of purposes.

Pros:
Works exactly as advertised
Simple plug and play set-up
Can be used on multiple devices and for a variety of purposes
Speeds up to 100 Mbps
Power saving feature
Automatic speed optimization
Automatic power down on unused ports
Compact, low profile design
Excellent value for the money

Cons:
None

When I went to visit my mother-in-law in Florida, I discovered that she had purchased a medical alert bracelet that required an Internet connection. The main unit for the medical device, required that the single Ethernet cable she had, be plugged into the back of the unit. Since I wanted to use my laptop computer, and there was no wireless connection available, I wasn't sure what to do. My brother-in-law, who lives in the same condo complex, let me use his computer to search for something on Amazon that would solve the problem. After searching for a while; I came across this Ethernet switch made by Lynksys and made the purchase.

Setting it up couldn't have been easier. First I plugged the Ethernet switch into a wall outlet. Than, I removed the main Ethernet cable from the medical device and plugged it into port number one on the switch. Next, I plugged the medical device into port number two. Finally, I plugged my laptop into port number three. The only extra items that I had to purchase were two 6' Ethernet cables which I used for the medical device and my laptop computer. The entire set-up took less than 5 minutes and the results were exactly what I had hoped for. I'm able to use my laptop computer at the same time that my mother-in-law's medical device is in use. Linksys, which is known for making great products, has another winner here.",4,"[-2.0949461553150512, -1.9164768638244556, -0.9620026774328639, -1.0487524669003832, -0.9147227955719136]",-0.9147227955719136
3300,This riveting story of hidden American history and the problems that the characters go through to find it is well worth your time to read.,4,"[-2.2773706711976884, -1.5014434556481118, -1.081866578171891, -1.0208961571608643, -0.9151177171994067]",-0.9151177171994067
5068,Four and a half stars for sure. I just downloaded a sample because I wasn't sure. I was drawn in from the beginning and bought it. This book is awesome. The story is not the norm. It's different from any book I've read before and it is amazing. It made me laugh so hard and want to jump on there and slap someone. Don't miss out,3,"[-1.6323811578109222, -0.9855625035974944, -1.0037883416435691, -1.0175903338436074, -0.9152506338667918]",-0.9152506338667918
9513,Breakfast At Tiffanys involves a woman who has impeccable social skills and manages to become known in high society circles. She meets a writer who becomes a major part of her life and contributes to her personal evolution.  Audrey Hepburn plays this highly sociable woman while George Peppard plays the writer.,4,"[-2.6673344444603173, -0.9261605383754606, -0.9182431069962268, -1.00601270252138, -0.9153493658557033]",-0.9153493658557033
3238,The book lashed for half the book -- but then I enjoyed the last part of it- -- I had some crying which I like that -- Nik is good but very mysterious -- you don't really know his past.  Overall I enjoyed it .  I checked it then from my local library.,2,"[-3.304336576616839, -1.260031301560492, -0.9154391456840758, -1.0066824170877426, -1.1333625325466454]",-0.9154391456840758
6327,"Cold picks up where Stone left off with Ivy and Levi coming to entirely different conclusions than they expected. Ivy realizes that a relationship with Levi is impossible, she decides that she needs to protect her heart, focus on her career, and get out of town. She has become emotionally overwrought in trying to be the best ""Grace"" for the movie and after the yelling match with Levi she has become distrustful. Ivy's defense are up, but what she doesn't expect is for the one who broke her heart to try and win back the pieces.
Levi realizes just a little too late that he loves Ivy. Unfortunately, Levi has been pushing Ivy away because of his tortured past, but he mistreatment of her has landed him in the doghouse and out of her good graces. Now, Levi is getting his just desserts from not only Ivy but her twin sister, Camilla, is upset with Levi, too. Even though he knows he has to work for Ivy's forgiveness, he doesn't anticipate how much he has hurt her and how hard he will have to work.
I appreciated that the dynamic writing duo, Max Monroe, has a suspense element to this story because it adds to the roller coaster of emotions and angst. I cannot wait to see what else they have in store for their reading audience in the conclusion of this trilogy, Fox, coming out May 22nd.
*I received an ARC of this book, and I voluntarily chose to write an honest review.*",3,"[-3.4490126100696052, -0.9793383044864097, -0.9159069262747915, -1.0110410031495005, -0.9739741403121515]",-0.9159069262747915
9793,"If you have a smaller backyard or can't throw a ball over and over and over, this might be the tennis ball thrower for you. It's easy to use and I appreciate the fact that you don't have to throw the ball manually. My younger nieces liked it because they can't throw the ball far yet and the dog liked it because she got to play fetch longer. You can also use regular tennis balls, so that's nice. Our only complaints are that it can be a bit loud and sometimes it jams.",3,"[-2.310158891959514, -1.2860943799170672, -1.042123398765884, -1.056690990731384, -0.9160810454774969]",-0.9160810454774969
3708,"The Ones Who Got Away is the first book in a series by the same name about several survivors of a school shooting (at the prom, nonetheless! OMG, the descriptions/nightmares here were vivid--just a heads-up), twelve years later. This one deals with two of the survivors, Liv and Finn; the only other survivors we meet are all women (Rebecca, Kincaid, and Taryn) so presumably their SOs will not be fellow survivors...? Though I could be wrong--time will tell.

Anyway...

The four women, who hadn't been particularly close before the shooting, came together afterwards and at one point before graduating and going their separate ways, wrote letters to be opened in ten years in which they each pledged--to themselves and to honor their classmates who didn't ""get away""--to do certain things with their lives. They all missed the decade mark, but when they are brought back to town for a documentary about their experience, the woman who had custody of the letters brings them with her. Over drinks, the four of them read their letters out loud and decide what they have or haven't accomplished (with not a little bit of justification and hedging on some of their parts--and a teensy bit of cringing, too ;))

Liv's pretty sure she doesn't actually need to go through with her younger self's plans--and absolutely sure that she doesn't need to pick things up with Finn where they left off (she was from the wrong side of the tracks, and his father was very controlling and not terribly nice, to put it mildly, so theirs was a secret relationship) but of course fate--and Ms. Loren--have other ideas. I loved watching Liv and Finn as they reconnected, came to terms with their pasts, and figured out a way that they could move together into a future--second chance romance at its best :)

I'm not sure how this managed to be my first book from Ms. Loren, but it absolutely won't be my last! Rebecca's story is next--can't wait!

Rating: 4 1/2 stars / A

I voluntarily reviewed an Advance Reader Copy of this book.",4,"[-2.4818810786787227, -0.9161181156585858, -1.221028216876428, -1.0008461136521973, -1.023016232113952]",-0.9161181156585858
706,This was a good read. Sometimes things got a bit repetitive but all in all a good story line. I will read the next book.  The beginning of the book moved fast.,3,"[-4.877797071068613, -2.724599209009263, -0.916433926106536, -0.9815611294415628, -1.2547990008285637]",-0.916433926106536
30,"For years, I have heard reviews and raves about this book, referred to as the Yoga Bible. I finally set out to read it. The first chapter, the overture to the book, is very deep - B.K.S. Iyengar's view into enlightenment and freedom of all earthly possessions and desires. It certainly is not something I plan to pursue or practice any time soon, but it is good knowledge to have. He then proceeds to break down every yoga pose - or as many as can fit in this book - describing the technique, the benefits, and a rating of easy-difficult (1 to 60). Most semi-difficult poses are about an 8 so he is very ambitious. I do disagree with him on no inversions during menstruation, esp. when he provides absolutely no proof or reason. For a long time, I observed this as most yoga teachers preach it too but without any reason. My current teacher told me simply that it was a chauvinistic idea and to disregard it altogether. Inversions during menstruation are just fine, and unless proven or advised otherwise for a reason, I plan to do them. I am still plowing through rest of this book, and for now, it is at best a 3-star rating.",2,"[-2.54783351935124, -1.1063229599928401, -0.9434833462030321, -1.021124228910476, -0.916569223325558]",-0.916569223325558
8724,"This was an absolutely enthralling and intriguing book to read;  there was so much to it  family issues, secrets, death, revenge, tragedy and enduring love.  A pure pleasure to read;  even though I found some parts emotional at times, this in no way distracted from the overall story.  Tyler and Katie have to battle a lot in their relationship.  Both have gotten over a recent drug problem, but they have more heartache to bear;  this throws them both into relapses for totally different reasons.  Rob, Tyler and Sarah become separated as children and are put into foster care;  their lives up until that time being unimaginable.  The three eventually reunite, and Rob and Tyler become famous as part of the same band, Trouble  but they have to keep it a secret that they are siblings.  They have an image to maintain, which would be destroyed if knowledge of their past, or their family, is revealed  their secrets are too horrific.  Catherine, Robs ex-wife, is out for revenge and eventually their past secrets are revealed to the world;  as well as some even they know nothing about.  This was a totally captivating story with a good mixture of love, tragedy and undying friendship, which I would have no hesitation in recommending.  I received a copy of this book in exchange for an honest review.",4,"[-1.8323468992870464, -1.2936095040819042, -0.9166145224940887, -1.002106655833637, -0.978858889526786]",-0.9166145224940887
