,X_sentences,Y,Y_decision,Y_confidence
336,Wow I could not put this book down from the beginning!! Jay is an amazing author can't wait to see what she comes up with next.,4,"[-4.989467458987818, -3.1108849677406347, -2.6932412649068653, -1.0376460121472086, 1.2197827683021039]",1.2197827683021039
3217,What a fantastic story that is filled with heart-wrenching emotions. Even if you are not into bad biker stories you will love this!,4,"[-6.208876184262993, -3.8998901120656755, -2.742273161555127, -1.046123076197884, 1.2172916652611272]",1.2172916652611272
5699,"Laurel & Jack are back! This story is thrilling, & definitely complex, with nonstop action!! It crackles with suspense at every turn of the page. I literally could not put it down & finished in one sitting! Can't wait to see where Laurel & Jack go from here especially with all the surprises revealed this time around!!! ",4,"[-4.3064130431095995, -3.350702098022504, -2.7670111189608493, -1.065814575528606, 1.2142975089573007]",1.2142975089573007
7015,"This was just OK for me. Actually, I didn't read the whole thing; I got bored with the history of it and skipped ahead to the last 3 chapters. I'm glad I did because I would have been irritated trying to get thru it all. It seems Callum and Mari had many obstacles to overcome. This didn't hold my interest as other ""highland"" books have.",1,"[-1.546772877174199, 1.2138143726033164, -1.0102366514269971, -1.0246048770190623, -1.6601463207692522]",1.2138143726033164
1001,"I read about 45 percent of this book and deleted it. After reading that much there was still no likable characters, the story plot was about vicious family dynamics and crooked cops.",1,"[0.8182431425879646, 1.2136488562637546, -1.0264664691946277, -0.9943108253515881, -2.2228136774752656]",1.2136488562637546
4820,"Okay here is my issue with this one...waaaayyy toooooo draaawwn ouuuut!  I loved the premise of this book and the writing was really great.  The chemistry between Jace and Avery was fabulous.  The problem for me on this one is a couple things though...1) the downshift from Jace wanting to be this no strings attached, all fun, not commitment player to this totally consumed, totally dedicated boyfriend happened way too fast for me.  That could have been drawn out a bit more to show the transformation that Avery had on him.  Other than that I think that everything else was waaaaaay too drawn out.  This could have been 200 pages shorter and still been really great and gotten the same message across.  I felt like the book could have ended like 2-3 times and then I look down and am only at like 65-70%.  The last 15% of the book was totally not needed and could have all been wrapped up in a short epilogue.  I used to be a HUGE Toni Aleo fan and Taking Shots is still one of my all time favorite books.  The thing that has steered me away from her over the years are these almost 600 page books that just go on and on with no real need.  Last, **TINY SPOILER ALERT**, I actually felt like this book was too similar to her previous book Taking Shots.  In fact the scene where we find out who her dad is could have been practically plucked right out of Taking Shots.  The insecure heroine, the heroine having the horrible verbally abusive family, her hiding secrets about her past from the hero, and I could go on and on are all way too similar.  I feel like Toni's books try to drag in too much plot line instead of digging into the main storyline.  Overall, not a fan.  There were some good moments in there but sadly they were overshadowed way too quickly with too much filler and not enough focus on the real issues.  Great cover though!",1,"[-1.5980557586408404, 1.2117882076484143, -1.4389361420933906, -1.0484089051982473, -1.1092550724423518]",1.2117882076484143
3951,I loved this book. I loved the real ness of it. This story brings together two people who need each other more than they can understand. To me this is epic love because despite their flaws they still love unconditionally .,4,"[-6.390435916574799, -3.921856058644591, -2.765473128354593, -1.0089014766637898, 1.2085323995473993]",1.2085323995473993
6258,"So So good! Really enjoyed this story! So much fun, a little angst,  and some danger and lots of love!",4,"[-7.643036148607254, -5.11956871859275, -2.963703726757855, -1.0120168129255394, 1.2081990958532016]",1.2081990958532016
9397,"the film and the extra scenes fail to make mention of what became of the son?  Did he finish college? Is he happily living with a family of his own?  Does he work for his dad, or what?

He was a central figure afterall.  I didn't read the book, and maybe this has been addressed by someone in the other review postings, but I find it odd that the real son was left out of the ending.  This movie would not have been made if it did not have the son figure.  Did he not want to participate and why?  I fear that maybe he and his dad had a falling out.  That would be incredibly tragic and put a damper on the story.

As for the movie, my lower than average rating is because I found the movie to be sooo depressing.  A good drama builds to a climax where the action requires a ""drop-dead"" event, decision or encounter, then a resolution.  Here, 90 percent of the movie was at a climax stage.  It was one horror after another.  Okay, maybe that was the real life, but I needed a break-a few actually.  My wife and I agreed that we were glad to have not seen this at the theater as it would have been too draining.  Also, the resolution was nice-although expected-but, the movie almost immediately ends.  It could have been done better.",1,"[-2.0603575479298493, 1.2081322166208035, -0.8711977391738767, -0.9876988714781839, -2.3042303606602346]",1.2081322166208035
4759,"This deserve more than 5 stars.

What an amazing way to end the story of Landon and Rachel; is the third book of the Swanson Court series and let me tell you will love it.  The story was amazing equal parts of true love and hot sex scenes (blushing).  Landon is one of my favorites book boyfriends (so many) because he is so romantic and so emotional but with fierce and alpha characteristic. The way he declare to her his love was one of my favorite parts; he is sooooooo sweet and kind (and hot as hell).

As always Serena do not disappoint me at all. The story held my attention from start to finish. Very well written and filled with plenty of emotions that captivate my heart.  Everyone should read this series because you will love it like I do.  Again the story is amazing and beyond perfect for me.  I recommend 100% so ladies go grab yours",4,"[-5.617993708044245, -3.3176047862750067, -2.49290998204538, -1.0191722301731017, 1.2053841427786247]",1.2053841427786247
9122,"This book is a GREAT read!!!  Piper Kay has a definite PASSION for this genre!!!  Payce's never-ending love for Braxton is beautiful!!!  Heck, I am not even sure my husband's love for me is that strong-lol!!!!!!  This is a great sequel to Perfect Passion!!!  It has a good plot, action, and not to mention some SEXY scenes!!!  Good job Piper Kay!!",4,"[-4.5537028271290305, -2.332857260401828, -2.4343299488687222, -1.034096289486264, 1.204371047341611]",1.204371047341611
3689,The plot of this book wasn't very believable nor was it very enticing. No one really wants to read about a pastor-girl turned sex kitten in so few pages. It could have been done a lot better I guess. All of the paint was a turn-off because I was too busy trying to figure out what they were actually painting. Not her best work.,1,"[-0.10711774209487124, 1.2030117833566187, -0.8316738898842555, -1.0357279611260006, -1.999729488837663]",1.2030117833566187
4486,"a little too much of a read for me and too dramatic for my tastes.... it was really hard to read in parts and i couldn't relate to any of the characters
it had weird relationships and a lot of parts were kind of hurtful.. i just wish parts of it were written differently
not sure if i'd recommend but
while i finished the book, i will not read it again",1,"[-1.6715238221413982, 1.1984939063117825, -0.7091483208504032, -0.9960141111928013, -2.521479448846769]",1.1984939063117825
3571,The first sentence gets you in this one! I was hooked and couldn't put it down. I'm excited for this series and hope it keeps coming.,4,"[-3.448567470062234, -3.2522707261676636, -2.6995747827257626, -1.0896194848224658, 1.1937690412631683]",1.1937690412631683
5709,"I really liked how this story was written. So full of emotion and Skyler, I fell in love. So good!",4,"[-5.879991942618231, -4.458301581187069, -2.648680579783993, -1.0298332386629159, 1.1935816885416053]",1.1935816885416053
5292,"Loved this even more then the first and cannot wait to read the next! I'm so happy that things are going well for the main characters romantically.  This plot keeps thickening and is ripe with  multiple possibilities! I'm loving this writing duo who, completely compliment each other ",4,"[-7.313748796808977, -3.9437121444803735, -2.840897983752429, -1.0160996926744519, 1.1918102796032606]",1.1918102796032606
4703,Wow what a way to start my day and I was happy to finally read this book. I was so happy that they got a great family on there side and I was so happy that it was AMAZING book. Can't wait to see what Alexa has next,4,"[-5.151916096215746, -3.5126547134511004, -2.8113087957339333, -1.0445473615086862, 1.1903796481362254]",1.1903796481362254
9376,"This movie is an absolute disaster. I haven't seen the original but let me tell you no director could possibly put together any worse set of actors for a film. In a land where they're doomed to be roasted to death, they show optimism. They build a plane ,dance aroud to radios that appear from nowhere. There are many loopholes to this plot. It didn't seem that the moderate sized plane that crashed in the desert could carry as much as load as they somehow bought out of it.

If you're an intense movie watcher like most are or if you're looking for a good lost nowhere movie please don't buy this. It's good that I borrowed  a friend's copy of the dvd. Somehow my friend hasn't seen it. I suggest he put it up for auction somewhere. In any case,this movie's a complete disappointment with very incompetent acting and action.",1,"[-0.7185611671180345, 1.1881537883716926, -1.298393149590774, -1.0504998489775148, -1.3833419707162005]",1.1881537883716926
4649,"Graham and Soraya's story is awesome!!!!  I love Vi Keelands books and this one is great too!!! The story was very interesting from the beginning!  I love when an author just grabs you and you feel like it's you in the story. This was very Hot,Sexy, and so romantic! Loved it!!!!",4,"[-6.121512387728354, -3.45128443835457, -2.6448140688696045, -1.0244069016083235, 1.18337495775697]",1.18337495775697
6338,"Another fun and sexy installment from the Bridgewater County Series!

Avery is sexy and sweet. Jackson and Dash are strong and bossy, just like Bridgewater men should be. Together they are explosive!

I loved every intensely sexy word! I was sucked in from the start. There is nothing sexier than a Bridgewater men...well except for two Bridgewater men! Beautifully written as always! A MUST READ!! 5 stars!!",4,"[-5.392910197518503, -3.2139527237720147, -2.5241062614816143, -1.0479439318524597, 1.183002376479019]",1.183002376479019
4940,I'm stunned speechless. This book was amazing. Every book in this series just got better than the last. Great storyline well told and beautifully handled. Characters with depth. Your emotions are engaged from the first page. Bring tissues you need them. Definitely recommending,4,"[-4.460971047501528, -2.2459142602916025, -2.678858554714858, -1.0730875142879397, 1.1822095704665723]",1.1822095704665723
8476,This was a warm hearted funny book. This is the first book I've read by this author. What a great sense of humor!  I love laugh out loud funny!,4,"[-5.7216605409778145, -4.305201075832325, -2.7609799136063486, -1.0106834451313915, 1.1782306513119798]",1.1782306513119798
2311,This book was just okay to me.  I probably won't continue with the rest of the series.,1,"[-0.518220546954721, 1.1769276673022113, -0.896949216320546, -1.0482610837357642, -1.9459418751786905]",1.1769276673022113
8698,"This was a typical (new style) regency romance with sex and terminology that might not have existed in that era and the old terminology, arse was combined with newer terminology, cock. The non-virtuous heroine was lucky not to be pregnant from any of her (two?) encounters. While the claim was that there was only one in the past, the language and the descriptions strongly suggested that there were more....The grammatical and spelling errors were relatively few but quite notable, as neckless instead of necklace. It was not made clear how the poor heroine got money, except vaguely from her uncle--it would have taken only a few words to clarify it. It was very predictable. I knew what was going to happen. Overall, not a horrible read, but unless and until there is a thorough edit, I won't read another in this series....and I was really in the mood for a well done regency romance. While I read the whole thing--I'm not sure why--I wouldn't jump to read another. I gave it three stars because it was not terrible, but it could have been so much better.",1,"[-0.9721102741897896, 1.17609655549554, -0.4943431013530315, -0.992007262438334, -2.5667868461117678]",1.17609655549554
3791,"I will forever love the Hells Horsemen. Deuce will always be in my heart and make my panties wet. Now I can add a hot Ripper to the list. He's so loving in his own way. Danny went through so much in this book. I was surprised by some of the
Events. Bring on the next book",4,"[-4.088591036418399, -2.8436647597667806, -2.42641714155575, -1.0388215237868674, 1.1711595787114695]",1.1711595787114695
8487,loved it! I love the Mandrake stories! it's like watching an awesome movie in my mind! so much action laced with just enough romance to make it interesting ;) with real emotions! so exciting and fun!,4,"[-7.270094677072098, -3.9453863681710684, -2.7822450794884066, -1.0461035704587711, 1.1695895340258036]",1.1695895340258036
810,"I tried, I really, really did. There was just so much STUFF going on that most of the time I had no idea what was happening or where Steptember even was. There was so much detail that the story itself started to get lost (as least for me).

The book is really well written, and the author has an amazing imagination, but this is a tough book to get through. Not only do you have to pay super close attention to all the minute details, but her vocabulary is way beyond that of the recommended age group (ages 10-14). I can't remember the last time I used the dictionary feature on my Kindle so much. While a hearty vocabulary is always good, it just seemed unnecessary and a bit pretentious here.

I wish I could have loved this book as much as most people seem to, but it just wasn't for me. Maybe my heart wasn't in it as I read, or I was distracted, but either way, I never looked forward to picking this up. By about 30% into it, it started feeling like a chore to read it.",1,"[-1.4881094107121102, 1.1669187138123118, -1.3091926522797734, -1.0312902339917531, -1.39235496875713]",1.1669187138123118
1770,"The story started well enough,  but when new relationships developed the reader was not given anything of true substance.  I was truly disappointed.",1,"[-1.5761454447967862, 1.1669083976021226, -0.9592617598423736, -1.0175434491357893, -2.5167842064017165]",1.1669083976021226
8307,Love this book. Very different from all her other books and series.  It was a real heart warming Christmas story.  Bring tears and joy to my eyes.,4,"[-5.473198100305858, -3.711021494799978, -2.5883160791046693, -1.0483971142183075, 1.1657190594700995]",1.1657190594700995
3872,I loved this book! Great story that keeps you turning the pages! A must read for anyone who loves a HEA! I can't wait for Grant's story!,4,"[-7.40837205539794, -4.788515493222832, -2.6641745831446224, -1.0074616422946385, 1.1655592380059476]",1.1655592380059476
3452,Loved loved this book. I wish it didn't end I hope there is more to there story  I won't tell what happened but I did cry my eyes out in one part of the book. I can't wait for the next!!,4,"[-5.262414925594874, -2.661923038414314, -2.7146068712009717, -1.0576878881223344, 1.1650967550633682]",1.1650967550633682
8480,I did not like Make You Burn very much. I really did not like the lead male in this story. The lead lady wasn't much better. This book just wasn't a good read for me.  I received an ARC of this book from the publisher and NetGalley.,1,"[-2.242983280269389, 1.1649257796397037, -1.4164551517461894, -1.0239303462909837, -1.3135450530865156]",1.1649257796397037
10,Arrvd on time & well pkd.  Used the for the first time today. Love them!,4,"[-3.7479665796426795, -4.241222807569182, -3.167577088383223, -1.0563301901593578, 1.164907323057794]",1.164907323057794
1358,Nora Roberts is my very favorite author.  This in another of her wonderful stories.,4,"[-6.189265737861927, -3.7785460264902655, -2.7349410373744565, -1.0321536794767612, 1.1644091926394509]",1.1644091926394509
3838,I have never read a book that has made me cry in the first few chapters. This book was so touching and me feel so bad for what Kayley went through. Get a box of tissues before you start reading this book. A great book!!!!! Must read. Great Job 'LL!!! I can't wait to read more of your wonderful writing.,4,"[-2.2924963883892744, -1.6055331496010248, -2.5799995269640177, -1.0643824230284837, 1.1618217157009687]",1.1618217157009687
4172,"When you read a series that just captivates you, it is simply amazing. I recently found J.M. Walker and I am so glad that I have because this series was amazing. This book just rocked me to my very core because it was and epic love story for Brett and Evvie. Their love just shined and even though it was a bumpy road they fought hard and came out victorious. This book is more than 5 stars, its simply perfect",4,"[-5.620675241483557, -3.3478442710158007, -2.524577921811661, -1.0274333732439358, 1.160245144086623]",1.160245144086623
5551,This is one of those stories you don't want to put down because you need to get to the end.,1,"[-0.7797927856424933, 1.1596113807832436, -1.6166796741273162, -1.0512228742457848, -1.398256709432781]",1.1596113807832436
3104,"It's a good very superficial view of early American History.  I was disappointed in how many good stories were not fully fleshed out or ignored entirely.  However, considering the pathetic state of teaching American history in our public schools, this book, superficial as it is, will probably educate many people.",1,"[-0.439507857746406, 1.1589491408069792, -0.8612813203352505, -1.0274869982850128, -2.328985377299154]",1.1589491408069792
2517,"This is a truly poignant story of life, love, acceptance, and forgiveness. This is a well written and edited book. It's as if you are there alongside the characters as they laugh out loud, as the tears flow down both of yours cheeks, as they realize they and their lives aren't perfect yet it's all okay! I will look forward to continuing this journey with this group of friends that are family.",4,"[-5.1939297861323475, -2.8129870727969064, -2.8249550067533873, -1.040547626312702, 1.158897485647439]",1.158897485647439
7947,Love it.  Saves so much time wih vacuum and mop feature,4,"[-3.931393110468453, -3.919421394307595, -3.0274495905620555, -1.0552667322114757, 1.1585666594406179]",1.1585666594406179
9526,"Truly bad. One of the more boring films of recent memory. Cage is wooden, grim, uninteresting and uninvolving, brings nothing to the role. The film is essentially depraved and unpleasant and there is nothing to learn and nothing to enjoy. Move on.",1,"[-0.12562675643218535, 1.1583605679588236, -0.9708827155703617, -1.0501955109003758, -2.2291703499719633]",1.1583605679588236
4493,Thank you Books you can't put down because you were exactly right about this book!  I was laughing so hard in the first chapter of the book when Zach and Zoe were talking about her love life.  Then I was caught off guard by what happen to Zach and I cried like a baby. I couldn't put this book down I had to finish it the same day. I can't wait to read more books by Rebecca Rohman.,4,"[-3.75219348967381, -1.7439021956793184, -2.3105888219180044, -1.0502728499443899, 1.153536073293666]",1.153536073293666
3730,"I have read one other book by JS Cooper and I came away .... Well grossed out actually.  But the price tag (Free) of scarred, lured me in.  I was so disgusted with Bryce and Lexi that I stopped reading at 50% and skipped to the end and read the last bit there.  Why the heck do people write books where you can't even root for the main character!?!?  Shame on me... Never again.",1,"[0.8454208719902774, 1.1516562880759236, -1.4985125579598595, -1.0818071724673834, -0.5216481601369295]",1.1516562880759236
8629,"Thank you RB I really enjoyed reading Max, Kurt and Joss pov. I highly recommend this series to everyone.",4,"[-5.088388662392413, -4.332467687912766, -2.8204343969081576, -1.013130839202812, 1.1506850554311276]",1.1506850554311276
7396,"I bought this CD for 3 bucks at a used CD shop.  I wanted to get into Dream Theater because I'm a tremendous prog rock fan.  I ended up being deeply disappointed in this CD/album.

More often than not, Dream Theater sounds like they simply borrow bits from all the other prog rock bands out there, and try to mesh into their own style, but it doesn't work at all, at least not on this CD/album.  I recognise the influences here.  When I'm listening to the album, I can hear Metallica, Rush, ELP, Yes, Pink Floyd, and even Ravi Shankar/Indian influences.  But, unfortunately, the influences don't really mess.  They're all over the place without becoming cohesive, and the album doesn't work at all.  The musicianship is generally very good, but it feels cold and mechanical.  The lyrics are tremendously pedestrian and borderline stupid.  The lead vocalist is desperately trying to bring emotion to the awful lyrics, and he ends up making them worse.  There is one tremendous song that I have played over and over again, and that's Beyond this Life.  Even though the lyrics and singing aren't very good, the music on that one track is fantastic.  But the other tracks don't stay with me.  Hopefully, there's better Dream Theater stuff out there.",1,"[0.17745602000887817, 1.1504422700958679, -1.4461073823942747, -1.0165419946227612, -1.2992386161511513]",1.1504422700958679
5940,"I loved this book! I have become quite a fan of this author. She has such a smart, easy and unique style of writing that captures both your attention and your heart. Well Crafted! Beautifully Written! Romantic! Sweet! Sexy! Endearing!  And totally engaging with a dash of suspense and a sprinkle of mystery! A wonderful recipe for a great book! Would I recommend this book? Absolutely! Will I read this author again? You bet, just as soon as she releases her next book! Fabulous entertainment and an awesome read!",4,"[-4.642108614628738, -3.4617607725498076, -2.9097668376525245, -1.0315102077364058, 1.149245776641761]",1.149245776641761
3721,"This book got me hooked on the series!
I love the way the characters work so well together.
Sean is a tough one!",4,"[-4.959039429108361, -3.8813091974592346, -2.8461686360193355, -1.0166806856417119, 1.1486378933985202]",1.1486378933985202
4930,The concept of this book caught my attention and reviews said hot steamy sex.  Hmmm.. Not sure what others consider steamy but it was more like a slow burn. He was crude and showed no feelings. It was a wham bam every Wednesday. He hit it and quit it. Yes their secret rendezvous were taboo especially the day of the funeral but after a year - kinda made no sense to keep it hid. Felt author tried to make it an issue after that long.  This book could have really been a hit if the story had developed the characters a little more. I rated a 4 but more like 3.5 stars.,1,"[-0.7537819161721704, 1.1482675768242396, -1.2666946276851072, -1.0219490882031514, -1.9125396362337836]",1.1482675768242396
6096,Loved it! Eagle Elite is one of my absolute favorite series...Sergio has slowly won my heart. I can't wait to see more in the next.,4,"[-4.941238916051114, -3.432571889453443, -2.5623529658438473, -1.050529268359079, 1.1465332056252329]",1.1465332056252329
6909,"Love this book, awesome!!  Read the first 3 and can't wait for Max story next. These books are well written and even though they are standalone, reading the first book will help to understand what is going on. Enjoy this great read and series",4,"[-5.714608735450946, -3.8151826595245732, -2.7257489138598263, -1.026140768598659, 1.1457904238866499]",1.1457904238866499
2924,"Holy crap! Hold on while I pick my jaw up off the ground! This book was pretty intense, as with the first two books, it's very well written, keeps you on edge from the first page to the very last word, plenty of hot, steamy angry sex, and also some very tender moments. I love this couple together, a lot. Derek definitely has some surprises that unfold in this book as well as their mother. Overall a great installment to this series. I really need that last book to come out now!!!!!

I voluntarily reviewed an ARC copy of this book.",4,"[-3.4034546917046047, -2.2429922252839485, -2.6743921167256772, -1.037541025887084, 1.1456519248889039]",1.1456519248889039
