,X_sentences,Y,Y_decision,Y_confidence
2309,It's been a while since I read this book plus the other 2 in the series but I read them back to back and the author did a great job of bringing history forward.,4,"[-4.2102573693763965, -1.3862836043138551, -1.8020507256328555, -1.00275990489373, -1.0234587081255309]",-1.00275990489373
4375,"Andie Marks gave up her party days and now has a lifeplan to succeed, in order to escape a bad childhood.  As a sharp lawyer, she works long hours day-after-day to meet her goal, at each age milestone.  Her best friends con her into joining them on a wild weekend to Las Vegas for her friends bachelorette weekend.  She decides to let her hair down after her boyfriend breaks up with her via a text message.
  After drinking and spilling a drink on a sexy irresistible cowboy at the blackjack table, she and Gavin (Mack) MacKenzie get lucky in the casino and in her hotel room.  The next morning Mack is gone and all Andie has is a hangover with a memory of wild steamy monkey sex but not of getting married.  Two years have elapsed where each of them are living their own life.  When Andie applies for a marriage license, they have to reunite.  What will happen this time?  Andie still struggles on what to do:  follow her lifeplan or go with her heart?
  This book was a great romance making me laugh while having some hot sex scenes.  I did feel upon reuniting the story should have explored more of them building a relationship since two years had passed and Andie had some memory lapses.  Based on what was driving Andie and why, it was hard to believe she would have a boyfriend like that.  I still enjoyed the book because it was a romance that made me laugh.",4,"[-3.8875453964323707, -1.49891400795111, -1.4405782318191362, -1.002776437232246, -1.0250059840555201]",-1.002776437232246
1346,"I do have to say this one was better than the last. Maya Banks put the sex in first because there would be no sex later in the book,but it is still worth the read. I think P.J. and Cole are good together.",3,"[-3.5452052790260975, -1.3821996384448247, -1.4066828954949224, -1.0028293270587345, -1.2042849219151632]",-1.0028293270587345
9581,This works very good on a silver flute.  It's soft and will go along time before you feel like you have to launder it.  Would purchase again.,3,"[-1.3783812402917184, -1.2335456367394146, -1.4360398020201544, -1.0167695915382966, -1.0028338856345007]",-1.0028338856345007
1534,"THE VEIL brings a fresh and interesting world as it's an interesting blend of dystopian and urban fantasy. So, pretty much the perfect combination in my book. There's a whole lot going on between the paras, human magic users, the Veil itself, and the Containment control and oppression over everything. What really interested me was that so many chose to stay in the zoned French Quarter. It's made clear that the ""outside"" world wasn't affected much and yet so many chose to stay behind with limited resources and constant struggle.

Claire made for a really interesting character. At the start of THE VEIL, she knows about her own ability but is living in hiding. Despite having these unwanted abilities with magic, she's still rather prejudiced about other magical users and the paranormal world. Granted considering what magic and paranormals cost her, I don't blame her one bit. That being said, her eyes are slowly opened in this book and I really enjoyed her progression from almost naive with a huge lack of confidence, to someone decidedly stronger by the end of the book. It was interesting to watch, and I can't wait to see how she grows even more over the next few books. Speaking of interesting characters, the supporting cast was very well fleshed out. From Claire's best friends, to their enemies, the paras, and an interesting newcomer, Liam, every single character really stood out, only further serving to hook me into this new series.

I enjoyed this start of a new series from Chloe Neill. While she's most known for her Chicagoland books, I can see these books becoming every bit as popular.  If you're looking for a fast paced read that you won't want to put down once you pick it up, look no further than THE VEIL.",3,"[-3.7886293759452787, -1.1565452574272537, -1.318240900855264, -1.003051568996628, -1.1811029518296725]",-1.003051568996628
4317,An easy straight forward romance set at the time our oceans have just about died. A good story line without a lot of meandering.,3,"[-5.023614418257996, -1.8592595963499765, -1.4729985495919875, -1.003108119460692, -1.3240920098277815]",-1.003108119460692
3367,"Sherlock Holmes would have been stumped on this mystery until it was
disclosed in the final pages.

This is the second book I have read in this series and both were equally good.

Billy",4,"[-2.9519892365166447, -1.115046371148184, -1.245186201639527, -1.003207675524585, -1.5083238476034209]",-1.003207675524585
6967,Tho  was full of short fun stories an  introduces you to a few  author s and there talent as writers. Very enjoyable.,4,"[-4.796567975330036, -2.1309070612073193, -1.7264590888162876, -1.0032783065680853, -1.371009302690677]",-1.0032783065680853
1455,"In the previous Phryne Fisher book there were several references to Phryne being a pilot, but aviation played no role. The pilot references seemed like an add-on, so I'm pleased that in this volume we get to see Phryne in action: flying and wing-walking. Phryne is commissioned to find the murderer of a Melbourne tycoon. At the same time, she is also called to investigate a kidnapping.

As background to these two mysteries we get to see Phryne furnish her house and attend society functions, as she lives the glamorous life in 1920s Melbourne. Phryne is very much the ""New Woman"" of the 1920s- short hair, fashionable clothes, sexually liberated.

I like the approach of having two mysteries in the book, and as in the previous volume, 1920s Australia provides a fascinating setting. This was a quick and entertaining read, and I'll be reading more in the series.",3,"[-3.5377771480473905, -1.6433711948988174, -1.4095867590803195, -1.00342738546874, -1.0284805527641803]",-1.00342738546874
9564,"I liked this movie and well worth renting but not worthy of five stars. Do recommend however and I'm sure most will find it quite entertaining and enjoyable, especially Mad Max loyalists.",3,"[-3.6078056131914957, -1.5795112265254678, -1.6894747314167775, -1.0035197679112804, -1.0099888625710118]",-1.0035197679112804
7662,"If you have weak wireless areas in your home, you need this.  TP Link's products are getting better for making connections easier and working with almost any router or wireless system.

Easy to set up and easy to use.  We have our main wireless at one end of the house due to the router location.  This helped us to extend a strong wireless system through to the other end of the house.

Highly recommended!",4,"[-2.9260107930718284, -2.2325400783956484, -1.764706512030628, -1.036776582717017, -1.0036088208606009]",-1.0036088208606009
341,I learned a lot reading this book. Lots of historical information. It's long but there is so much to cover and as the authors say at the end-they had to leave a lot out! Fascinating insight into part of Jefferson's life from a pov that we haven't heard from before.,4,"[-3.0605915718209724, -1.5229732506897902, -1.6943074402338247, -1.003644890482341, -1.110139114673499]",-1.003644890482341
3174,"The book carry the one is a good read if you have nothing else to do. There are a few jumps in the story because of memories, and there can be parts when it feels as if the story is dragging.",2,"[-4.079995928272291, -1.3022318660968564, -1.2988040443555309, -1.0037240532465783, -1.5638147583146829]",-1.0037240532465783
1680,"I didn't know what to expect from this book, but I like survivalist books, even fiction.  This book did not disappoint.  I really liked the main character's attitude.  What a can do personality.  A real MacGyver.  You are always rooting for him.  A little too technical at first, but I enjoyed his mind as I read on.  There was not a dull moment.",4,"[-3.7709168253435816, -1.5471616604549623, -1.6002346154388838, -1.003776857388899, -1.007984384517166]",-1.003776857388899
614,David's writing has a lyrical nature. I like reading his books -- like Moth Smoke -- just because of the way he writes and the language. I thought Exit West was one kind of story but then the doors appeared. Not what I expected. And probably not everyone's cup of tea. But it's different and I liked it.,3,"[-3.4191282311170896, -1.2702833106153144, -1.6680977522330975, -1.003799997846589, -1.0635326181306854]",-1.003799997846589
2293,JUST LIKE THE TITLE!  OTHER BOOKS BY THE AUTHOR WERE MUCH BETTER.  I WOULD PASS ON THIS ONE ONLY SO YOU MAY STILL ENJOY HIS OTHER BOOKS,1,"[-4.058234476754019, -1.0042958469277246, -1.0796046508364832, -1.0409408603419985, -1.3650537472556996]",-1.0042958469277246
4408,"When Goldsborough began writing these pastiche Wolfe novels,we fans rejoiced

Not only did he capture Stout's voice superbly, but he created mysteries that were very bit as good as the master's

Then they stopped and for (far too) many years there was no word from the Brownstone on 34th St

About 2/3 years ago Huzzah!) not only did the older novels come back, but Goldsborough started writing new ones that were every bit as good as they ever were
, what, not Wol
Alas, as is true of ANY writer, not every work is a gem (even Stout had his off days/books)

This latest, while still eminently readable... and surely a must for ""the Wolfe pack""... seems, for want of a better word, a bit ""tired"";

The pacing is just a wee bit slow and, frankly, the milieu of Broadway during a period of time that isn't today seems ""off"" (not to mention vaguely
not ""Wolfe-ish"")

Put simply, the book is a victim of Goldsborough's own talent; he's been so good for so long that, when he's merely perfectly adequate, we want more

I await the next one",2,"[-2.668905050925084, -1.4358306378303525, -1.6132250862852064, -1.004460986130296, -1.0604963683490904]",-1.004460986130296
880,"Listen: ""On the rare nights that she sleeps, she is back in the skin of the woman from before.""
That is the opening sentence of this literary tour de force, and if it doesn't draw you in, you are undrawable.

Moreover, to those of us who treasure the ""mystery"" genre, the unmistakable essence of another haunting opening to a wonderful literary T.D.F. from another century: ""Last night I dreamed I returned to Manderly"" from Daphne Du Maurier's classic ""Rebecca""

But, whether you welcome a writer that could be this generation's DuMaurier, or whether she ""only"" is seen as this generation's Flint
she is, with this one book, a voice that demands to be heard",4,"[-2.7927310144112494, -1.1555323203798367, -1.640482344915095, -1.0044862720418248, -1.150432313808673]",-1.0044862720418248
4538,"The first of a series can get boring as the author sets up future works, but this series is basically individual novels which share a beginning. Good job, fun idea for a series and well written.",3,"[-2.531379992549441, -1.6416535322817207, -1.927938446692479, -1.004639656244601, -1.3433154912602059]",-1.004639656244601
9060,Good mystery. Some things not discovered until the end. Well worth reading.,4,"[-3.6574552755761385, -1.468760328701444, -1.7091905133779477, -1.0047994479239997, -1.3553751106627407]",-1.0047994479239997
9819,"I like the smaller version a little bit more, but the larger Pro edition is also a blast!",4,"[-4.1108216579630135, -1.5993184755536702, -1.767192219699567, -1.0048186451535865, -1.1397323893733977]",-1.0048186451535865
6220,"After his wife divorced him and then his mother died, James Henry gave up his job at the university and moved back home to care of his father, while taking over the position of head librarian for the county's main library branch. So here he finds himself, living back home, divorced and now that he admits it, more than fifty pounds overweight. Addicted to cheese puffs and food in general, he decides he needs to make some changes. When Lindy, the art teacher at Blue Ridge High, approaches him to leave a poster on the library's bulletin board about a supper club for overweight individuals, he decides this may be the way to start. Soon, the five members meet and decide to call themselves the Flab Five. In addition to Lindy and James, they are Gillian, part vegetarian and manager of the Yuppy Puppy; Bennett, US Postal Service carrier; and Lucy, assistant at the sheriff's department. When they hear about the death of the town's high school football hero and all around bad boy, Lucy wants to investigate...her goal with her weight loss is to become a deputy not just an office worker. In support of her, they find themselves in the midst of an investigation that seems to be pointing to an innocent girl, Whitney. Are they able to figure out who really killed Brinkley or will this be their own downfall. The story goes back and forth between the mystery and the townspeople involved in it and their own weight loss angst situations. There are some wonderful diet recipes throughtout the book. For anyone who has ever struggled with weight loss and food addictions, this book hits the spot with the Flab Five's daily battles to lose the pounds. And the mystery is complicated enough that you don't see the murderer coming until the end. Disclosure: I was provided with a copy of this book in exchange for an honest review.",3,"[-1.704659597018369, -1.201790861029759, -1.3547161837743258, -1.0048619761134179, -1.4244538164424498]",-1.0048619761134179
7575,"This works great. I had been using my index finger to navigate around my Panasonic Multimedia System tablet. As a result I sometimes pressed the wrong link because my fingers are big.  This allows me to press the links I want to press without making a mistake and I can navigate around my tablet much quicker than using my index finger.

This has a soft tip at one end that seems hollow when I press on it. It is firm though. It works without me having to press hard when I press a link, move up and down the screen or hit a letter on the screen keyboard of my tablet. All it takes is a light tap.

It looks nice. It is about the size of a small pen and is smooth so it is easy to hold. I has a clip.

If you are interested in something to replace your finger when using a tablet this is a nice choice.",4,"[-1.2698524748526054, -1.2264406074750003, -1.5351722575950475, -1.0502796293594296, -1.004876045322504]",-1.004876045322504
8900,Uncommon ground is easy to read and holds your attention. The characters are believable and well developed.,4,"[-2.318150502302127, -2.378657395712036, -1.2793686244981877, -1.0048771220216821, -1.5387652317975373]",-1.0048771220216821
2307,"The Great Kahn is dead and there is political maneuvering and in-fighting to see who will succeed him and lead. A view into Tatar life, the top of the world and the Chinese under Tatar rule. A page-turning insight into the lives, homeland, tactics and thinking of a people who once threatened to conquer the world. All seen through the eyes of a Dominican priest and a Templar knight, sent as emissaries to negotiate an alliance.  Filled with fascinating information about these once-upon-a-time events which shaped civilizations and changed lives. Well worth the time.",4,"[-2.4352976263452373, -1.5577127263858872, -1.7045228100332734, -1.0048806856617307, -1.038139660773988]",-1.0048806856617307
7465,"This is a very nice wallet.  The touch is, well, not exactly soft.  But you can tell it's well done.  It is a little on the small size.  But does well for a trifold wallet.",4,"[-3.0436758178606764, -2.042334110282522, -1.2611801619838265, -1.0053101203741186, -1.2471145272340747]",-1.0053101203741186
738,"This book was highly enjoyable; far more than I initially expected!

For the most part, I really enjoyed the heroine, Seraphina. The whole thing with the garden in her brain was a little strange, but not so much so that it made the whole thing unenjoyable. Her musical abilities were interesting and quite well done, honestly. Her role in the dragon world was also very interesting.

The hero, Kiggs, was a really great character. He was very enjoyable and I definitely rooted for them to get together. There was quite a bit of tension, but not too much that I didn't believe it or felt like it was overdone. In fact, I do wish there had been more - all I wanted was for it to happen!

The secondary characters were where the book really excelled, though. I really enjoyed the other half-bloods in the story, especially as they became more and more relevant and befriended Seraphina.

The political intrigue, surprisingly enough, kept me very entertained. I'm usually the first person to scorn politics, but it remained very interesting during the entirety of the book. It was well-done and had enough twists and turns that I kept wanting to read.

The dragon mythology was very interesting. It was very different from other dragon books that I've read previously and for this, I remained very entertained. I very much enjoyed the family dynamic. The way half-bloods play into society was also interesting. I love that the world and the culture was so well done.
I highly look forward to future books from this author, especially those dealing with Seraphina and her world.",4,"[-4.273795652385215, -1.9488282340543723, -1.4085815870481302, -1.0054419227019649, -1.0055760724920475]",-1.0054419227019649
9441,"Shane Acker's new film, coincidentally scheduled to release on 9/9/09, is in interesting bit of political fantasy.  Probably ever since the Machine was invented, man feared they would take over. In this case, the film's situation is the direct result of a philanthropic Scientist who created a Machine for the good of the State.  Unfortunately, it all went wrong.

9 awakens--not quite Machine and not quite Man, either, to find others of his kind.  He wants to learn as much as he can about the machines, but Wise Old 1 does everything he can to prevent the newest member of their troup from doing so. The eventual conflict and end is both heartwarming and disturbing.

Well worth the time if you like science fiction oddities.  May be too disturbing for your younger kids--under 7 or so.

Rebecca Kyle, September 2009",3,"[-2.464784533694522, -1.5920949588198452, -1.4720076203741905, -1.0055463437916783, -1.1704035093756742]",-1.0055463437916783
2410,"Parallax View: ""The apparent displacement of an object caused by a change in the position from which it is viewed"".

Who can you trust?? To me this is part of what this book is about, as in the story the protagonist, Tracie Tanner finds herself in this tenuous situation. She is only supposed to deliver a letter from Soviet General Secretary Mikhail Gorbachev to the U.S President Ronald Reagan, but what occurs along the way is very frightening. Why would Gorbachev be sending a letter that no one knows the content besides him. Tracie is ordered not to open the letter under any circumstance and as a CIA agent she does what she is assigned to do and protects that letter with her life.

The other part of the book to me is loyalty.
Loyalty
""Faithfulness or devotion to some person, cause or nation.""

Tracie is rescued by a young, air traffic controller, Shane Rowley. He pulls her out of the plane that crashed suspiciously as she was on her way to deliver the letter. Unbeknownst to Shane, he will be on the ride of his life. These two people are both very loyal to their country so they will do whatever it takes to see that the letter reaches President Reagan.

Parallax View takes the reader on the ride of your life. I was around of course in 1987 so I remember the Cold War mostly from movies and books. This finely researched and written fictional account of the CIA, KGB and higher up government officials in the year 1987 make for a fast paced page thriller that I could not put down. I love Mr. Leverone's style of writing as the story does not lag but keeps the reader wanting more. I can almost see a sequel to this story...

I received a copy of this book for review from Pump Up Your Book Tours and was not monetarily compensated for my review.",4,"[-2.635248476503652, -1.4041675023854334, -1.598835373453236, -1.00557903907103, -1.1562903781912661]",-1.00557903907103
9729,"My dog is on medication that causes her to drink a lot of extra water.  While I do my best to take her out frequently, she occasionally has accidents anyway.  Her old crate had a crack in the bottom tray so it was useless for keeping urine off the carpet.  Plus, I recently moved to a new house and needed to move the dog over separately from her pen.  So I needed a functional crate for her.  I went with the 48 inch crate (single door) since she is a full grown Rottweiler (about 85-90 pounds).  There was a bit of additional room for a water dish and toys, and my dog was able to stand up fully, turn around, etc., but not to go wild in this crate.

This crate was the perfect size.  It was easy to put together and it was sturdy once assembled.  (It comes with a divider in case you are training a large-breed puppy.  So you only have to buy one crate instead of a series of larger and larger ones as your puppy grows.  Instead, you can just move the divider.  I am not using the divider since I bought this for an adult dog.)  The door is easy to open and close and the coating on the bars is smooth and unbroken.

In the end, I was really happy with this.  It was exactly what I was looking for.  It replaces a much older crate used for something like 12 years and I definitely believe I will be getting at least that length of use out of this one, if not more.  Well worth what I paid for it.",4,"[-1.8096650484171235, -1.4750417907195115, -1.3496638915137384, -1.0056292147229287, -1.3114814985103107]",-1.0056292147229287
71,"I came to Pride and Prejudice having seen the 1940 movie adaptation. Long heralded as one of the best-told love stories in literature, I expected a book filled with passion and details of the encounters of Elizabeth Bennett and Fitzwilliam Darcy.

What I got was something much slower, a cautious dance between two people who at first dislike each other but slowly begin to admire each other in their infrequent meetings, and later begin to love. However, I enjoyed the dance very much. The slowness of the relationship made me want it to happen more intensely, and when it finally did, about 4/5 of the way through the story, I was elated. Admittedly, I found some parts before that moment to be a bit dull and mundane, but Jane Austin was a wonderful writer whose wit and flourish kept me going.

This book is not for everyone; modern readers who crave a quick pace and constant action will not be satisfied. But if you can relax and let yourself go back in time when love took time and life moved more slowly, you will not be disappointed with this story.",3,"[-3.81373615940962, -1.4154140958324233, -1.625547619988321, -1.0056532892886694, -1.2301394982761547]",-1.0056532892886694
564,"We travel quite a bit. Everywhere we go in Europe Napoleon has been there. I always told myself I needed to read his biography. This book fit the bill for me. I did not need the 8 volume story, just a good sketch of his life. I enjoyed the book but got bogged down in some of the battle details. I would have appreciated more information about the man.",4,"[-4.443394332146667, -1.632515467034628, -1.4200701763524055, -1.0056610129668724, -1.199442241941091]",-1.0056610129668724
80,"I received a free copy of this book from Netgalley in exchange for an honest review. This does not affect my opinion of the book or the content of my review.

jennifers review

The Lie weaves a suspenseful tale about Emmanow going by the name Janewhose horrific experience while on vacation in Nepal has come back to haunt her five years later.

The story goes back and forth between current-day Jane and past Emma. Although it took me a few chapters to figure out that Jane and Emma were the same person, I came to an appreciation of the way the story was told. If I hadnt seen what Emma went through first-hand, it might not have been so moving.

My only complaint is that both the past and the present were written in present tense. That didn't make much sense to me. If its the past, why not use past tense? It would have been less confusing to get into the story.

Once I got into the rhythm of the story and past my confusion, I was completely immersed in Jane/Emmas tale. The suspense and action were a big part of what grabbed me, but I think the best aspect of The Lie is the rich characterization. Every character had their own secrets, motives, and psychological issues. This is a book where you either love or hate the characters, but you don't know who can be trusted.

The story is fast-paced, but the author doesnt neglect setting or character descriptions. I felt like I could see everything that Emma saw.

At times I felt that Janes story was a disruption. I wanted to get back to what was happening in Nepal. That might just be me, though, because Jane was certainly in danger in the present day. Its not like her peril was less interesting or less concerning. I did like that the reader is kept guessing about who might be after Jane. Still, I was worried about Emma and needed to get back to see what was happening to her and her friends.

Overall, I really enjoyed reading The Lie. I think it would appeal to many readers, especially those who like stories of betrayal and deceit. I give The Lie four and a half stars. It would have been five stars if it weren't for the rough start.",3,"[-1.824085635718124, -1.0725276861435136, -1.2614419403486177, -1.0058044334634295, -1.5635057601502031]",-1.0058044334634295
