,X_sentences,Y,Y_decision,Y_confidence
0,"Thank you for the clarification regarding what the Mass actually is.  It is often confused with the Last Supper for many reasons, especially what was taught to us in Catholic schools, and the fact that the words of Consecration come directly from the Gospel accounts of the Passover meal of Jesus and His disciples.  Understandable mistake, don't you agree? To further understand the Mass we also, importantly, need the Easter Sunday miracle.  But I must add a note of disagreement with your statement (traditionalist as it is) of:""...the priest is not ""representing"" Jesus but instead stands in His person, presenting His sacrifice to the Father for the people.""  Vatican II was exceptionally clear that there is a second and equally vital part to that equation, and that is that the Presence of Christ occurs through the union of priest and congregation.  I am always surprised when anyone leaves that out of any discussion of the Eucharistic liturgy or its theology.  The laity need not be ""led.""",0,-17.210645349840778,17.210645349840778
3,"Next time I hear about the SWAT team responding to a man barricaded in his home, I'll be thinking Roy finally lost it..probably sandbagging the inside walls of his home now..so little time...",0,-15.678292078678185,15.678292078678185
21,"Behold, the Biblical fat years are past, and the years of hunger are upon us, and the harvest is not home.

For openers, get rid of one house of the legislature.  It is a total duplication.  Then again, if two houses are better than one, why not have three or four houses, so that almost everyone can have an uncle in the legislature?",0,-15.616672651127919,15.616672651127919
36,"Oh, but I have indeed dealt with IBM employees.  My use of IBM in my comparison analogy was intended to be of limited application in a comparison not of the rate of bureaucratic movement, but of how so much of our best Church operations make use of periods of prayer and reflection in doing important Christian work. One only needs to think of the highly effective and spiritually productive work of the LCWR in dealing with the awful CDF. I accept full responsibility for not making the basis of my comparison clearer!",0,-15.322778885696795,15.322778885696795
20,"Pt. 3
The ideas in the THEOLOGY OF THE BODY come primarily from a long series of addresses given by Pope John Paul II.  As authoritative as papal pronouncements are, they do not rise to the level of conciliar teaching.  These talks presuppose an understanding of gender that cannot engage many of the experiences of ACTUAL women and men as they come to understand their own bodies.  Women theologians [and a number of men theologians] are talking back to theologies that use biology to determine human identity.  Describing women with an overemphasis on biological and physical features leads to definitions [as we had in the past] of women with weak even negative sacramental valences.  The contingent realities of our bodies are involved in our identity, but to locate the mystery--the essence---of the human person in such structures mistakes MYSTERY for MAGIC.  The divine does saturate the human but as sacrament and not as an impersonal power.",0,-14.27826915610317,14.27826915610317
39,"You seem to ignore the fact it took thousands of years for those climate changes. Now it's taking decades. And for the 97th billionth time, 97 % of climate scientists KNOW it's manmade. We put tons of CO2 into our atmosphere EVERY day. Not to mention mercury and methane. But it's just a pimple on the butt for our earth, right? Do have you have any clue on the size of our atmosphere?",0,-13.533038187646657,13.533038187646657
19,Maybe their protests would have more impact if they were held somewhere that Islamic law was practiced?,0,-13.497734563082515,13.497734563082515
34,It's getting to the point where the only people who can afford to buy Toronto houses will be real estate agents and Ontario Hydro employees.,0,-13.121988020655786,13.121988020655786
43,"I support the separation of church and state. If a church wants to endorse candidates, it should lose its tax exemption. And true Christians would not support taking from the vulnerable to give more to the wealthy IMO.",0,-12.502295078454571,12.502295078454571
15,Football 101 - a good offensive line makes any QB and RB look a lot better.  A good offense keeps the defense off the field making them look better.  It also give the defense incentive to play hard.  If you can't score you can't win regardless how well the defense plays.,0,-12.195290118623873,12.195290118623873
7,"Counting health insurance, average cost to a district for a teacher is around $100K, all salary and benefits included.
The health plan is not Cadillac, as defined by law, and the law ONLY looks at price.  In any other state, it would be no where NEAR Cadillac.
The cost of housing and the cost of health care are two things killing budgets in Alaska and not just school budgets.  It makes it hard to recruit engineers and top managers because they live a much nicer lifestyle elsewhere.",0,-11.951241187397203,11.951241187397203
2,"The pope is politely telling Trump that people matter more than walls, and poor people matter most of all!",0,-11.919756825315115,11.919756825315115
8,"No. No more ""cow bells"".  

Instead, we need harder deeds done quietly by the lay, ones requiring real sacrifice, attention, anticipation of real needs.   Real deeds of quiet, effortful charity, cheerfully done for the love of God, and done with God, in chattering interior conversation with Him. 

The idea of a bully pulpit is actually a defective one, the noisy savior.

The world would have far more ""bonus odor"" (see St Paul's writing) were we to use fewer cow bells in the public square, and instead smiled more to our spouses, neighbors, and perhaps stopping over to their home in the evening to ask about their chemo therapy treatment, and whether they needed anything, after we mowed their grass without mention. 

Yes, the little things quietly done for others out of love of God.  In one sense - perhaps not fully intended by CS Lewis - mere Christianity is what we need.   No more cow bells.

https://www.youtube.com/watch?v=Q_MWeOs8Ffg",0,-11.798621633477971,11.798621633477971
40,"John is an aboriginal Canadian that does not like white Canadians. He has posted his thoughts about this many times in the past and it is evident in the post above.

As we all now know in Canada it's not hate speech if you are a minority member.",0,-11.725124434829995,11.725124434829995
17,What's to fear if one's believes in the afterlife and live according to God's commandments? End of the world is the beginning to an eternal of happiness!,0,-11.301007704833959,11.301007704833959
22,"In other news. from the same fake news media, no,not  the Globe, the other one, read it:
""From the leaders of Muslim nations not affected by Trump’s travel ban conspicuous silence.
Even the Organization of Islamic Cooperation, a group of 57 nations that considers itself the collective voice of the Muslim world, kept quiet""
It's a relevant comment, since many are here outraged with Trumps ban travel.
Real News:
57 nations Are Not Affected by the travel ban.
7 nations were chosen for their threat they represent to american citizens.
There you are, now go tell your friends.",0,-10.711212523667314,10.711212523667314
11,"One fact that we do know for certain is that the wife's testimony was bought with immunity.  When testimony is bought, justice is not in the equation.  This has nothing to do with gender.

Finally, to suggest that females lack the stamina expected of a male in behaving responsibly is misogynistic.  These observations are not predicated on facts not in evidence.",0,-10.646969263747188,10.646969263747188
10,Jesus reduced them to two focused on Love.,0,-10.476979785696031,10.476979785696031
26,"Or, more recently, 'Ford Nation' ... up until the video actually did come out.",0,-10.180337694555863,10.180337694555863
27,"This guarantees a huge property tax increase to pay off the bonds.  Probably double which is Caldwell's usual formula for increasing taxes, fees, etc.  Meanwhile he keeps adding more nonessential projects on which to spend our money.",0,-9.743504161452433,9.743504161452433
41,"....""Jesus kept telling her ....to shut up"". can also be interpreted as good natured chiding and she always seemed to have the final say (""He went home and was subject to them"") (""Do whatever He tells you"").  And I recall one particular time when she and ""the family"", due to some concern and probable  embarrassment about His doings were ""asking about Him"". He used it as a great teaching moment about his own family bond with us and, we assume, conflabed with the fam afterward setting their minds at rest about His mission.
I agree with you about the need for young voices. As a former religious ed teacher I was continually inspired by the soulful contributions of my students.",0,-9.388070615799815,9.388070615799815
4,if there any balance yes but there isn't,0,-9.37251608899153,9.37251608899153
