,X_sentences,Y,Y_decision,Y_confidence
3842,"Ain't gonna happen.  Until the hypocrisy is gone with having swishy bishops and priests condemn us from the altar, then going to their gay parties and meeting their boyfriends, is gone nothing will change.  And we gay people know them too.  They try to pick us up in gay bars or bathhouses.   It is horrible what they can justify for themselves, while condemning in others.  Gay people often hate the church for the hatred they have received from the hierarchy, from religious family members and the hatred expressed by supposedly devout people, usually with the blessings of Father SoNSo or Bishop suchNSuch.  They are gone and never coming back.",1,2.392450027332681,2.392450027332681
2576,"Muslims accuse us of Islamophobia, but we should bear in mind Islam's entrenched xenophobia, homophobia, misogyny, anti-Semitism, Christophbia, Europhobia, Americanophobia, and destructive iconoclasm.  Muslims even have Islamophobia against each other. as Kurds, Shiite, Sunni, Wahhabi, Druze and other Islamic sects try to exterminate each other.    Islamic purists like ISIS, Al Quada, and Taliban are waging civil wars and bloody genocide going on across the Muslin world. It is worse than anything expressed in the west, but we are not supposed to think about it.",1,2.3920907333633465,2.3920907333633465
1678,"Usually, masses in the very early Church were offered in houses.

Dogma has changed over the centuries. As the noted historian of religion Jaroslav Pelikan wrote, ""There is not a single antenicene Church Father who would qualify as impeccably orthodox.""",0,-2.387080769148924,2.387080769148924
2395,"Lehi, I'm so incredibly sorry for your loss. Unfirtunately, it's likely appropriate for your family to perform some research. Your concerns are valid. Peace be with you.",0,-2.385756837157753,2.385756837157753
3408,For Trump to call those who spoke out against the tyranny of white supremacists and putting them in the same category and blaming them is not only condoning racism but is fueling the fire for such. This president needs to be removed immediately. There is no room for such behavior for a great country that is about equality.,1,2.3831828850670878,2.3831828850670878
1404,Why is fear of eternal dam*nation playing in role in these discussions? Fear and lording over others. The obvious question these former princes of the church need to ask themselves is why they need to play this role in other people's lives. Can they cite an example from  the gospels where Christ played that role? I think not. How many times must it  be said that only the Father plays this role and the church is only here to serve.,0,-2.3828364941466322,2.3828364941466322
2004,It is not a fight worth getting into.  Can't argue with a mentally ill man who says 'We aren't a man in a dress. We are women.' and look anything but transphobic by the liberal media.,1,2.382134562003997,2.382134562003997
3153,"The trouble is, the Church blessing is basically a contract, a promise, a vow. Before the vow in front of a valid witness (usually a priest) the couple are not married legally in the eyes of Canon Law; after the vow/promise/contract they are. Life is not so simple. Falling in love and deciding to get married is a process, often fairly long and complicated. At first the narrative is between the couple themselves, then it involves their families, and finally at the end of the process, their union is blessed and acknowledged by the entire Church community and by civic society. Pastoral guide? Accompany the process.",0,-2.380578276384438,2.380578276384438
1423,"Archbishops Chaput and Cupich are diametrically opposed to each other in their interpretation of AL. ++Chaput's interpretation is likely to prevail amongst most American Catholic bishops and those in Canada. Argentinian bishops are at odds with their counterparts in North America. Elsewhere I expect the same conflicts to arise.
The Pope has supported the Argentinian bishops in a private letter to them which was leaked, by whom one might speculate?
It is perfectly reasonable for a group of Cardinals and I'm sure they represent many more Cardinals and bishops throughout the world to ask the Pope to publicly resolve the dichotomy. 
Let's face it if cardinals and bishops worldwide are confused, how much more confused must the presbyterate and the laity be?
The Pope's up-to-now resolute determination to remain silent will come a cropper when he next gives a mid-air press conference. His answer to the question will be really interesting.",0,-2.3802571188171613,2.3802571188171613
2533,"Jesus in his divinity requested power through the Father. You are actually proposing magic, which is an exercise of power, rather than miracles, which are an exercise in faith. He came as an example to us and chastised us for not having his faith (trust in God rather than loyalty to doctrine). He told those he healed that their faith had healed them. I suspect that those who go to Lourdes with humble faith are cured and those seekind divine power are sent away with nothing.",0,-2.3774256548877464,2.3774256548877464
4211,More nonsense from the Big Oil Party. Time to vote these knuckleheads out of office.,1,2.3773708715868875,2.3773708715868875
2921,"This was part of the wisdom of having a common language uniting the Latin rite of the Catholic Church...avoiding squabbles over translations and priests ab libbing the Mass. 

Also, I wonder how is it that all the Missal companies managed to translate the Mass without controversy before the Novus Ordo, and now liturgical translation is a huge point of contention.",0,-2.3754345630007982,2.3754345630007982
1814,"Every once in a while I read one of Ms. McLaren's articles only to ask myself after why I bothered. They are always so trite and filled with detail about her, her kids, her spouse, or the challenges she faces as a white, privileged, working mother. (sorry, my words, not hers). I'm a little puzzled why a national paper would publish articles that seem better suited for a personal journal.",0,-2.3740604943173027,2.3740604943173027
83,"There are racists in every race and culture. I don't care what anyone says, but I have seen it firsthand. It is ugly and stupid and sometimes, dangerous. The root causes come down to fear and jealousy and sometimes outright greed.

Most all people in this country today have no concept of what slavery was. When they speak about it, they can only speak about it in distant terms. They never experienced it. Jim Crow laws? There are still people out there who know what that was like, myself included. I was never subjected to Jim Crow, but I did witness it in action. I watch a young black male child that was my friend get cracked in the head by a cop for using the ""Whites Only"" water fountain. I was angry about it then and now. That has no place in this society.

Tearing down statues and burning flags is not the solution. Understanding history is. When we do not understand our history, we doom ourselves to repeating it. The Dems like a dumbed down voter, remember that....",1,2.3737231075074465,2.3737231075074465
3108,"The power 5 conferences with their big money tv contracts have made it impossible for the schools outside the power 5 from ever being competitive.  UH says football makes money, but they are not including the costs of all the women's sports that have to be funded because of the football scholarships.  

Best solution is to drop football, drop equivalent number of women's sports and focus on the other sports that UH can still be competitive in.",0,-2.373276689319168,2.373276689319168
3502,"Actually I paid off my student loans and to borrow your spelling I didn't have any ""debit"" until I married my wife for which I am happy to pay off her undergrad Stafford loan from a midwestern university. Both of us paid our way through grad school and only needed loans for undergrad. So yes, borrowing money for ""collage"" directly helped us land steady higher paying jobs that allow us to pay those loans back. How old is your son now? How long has he been in undergrad? How many years does he have till he finishes?",0,-2.368267843134032,2.368267843134032
1904,"1, what do you mean ""a little help""? To a large extent ACA subsidized 90% of their plans.
2, You got to keep your plan? Probably the only people in the country that did.
3, Insurance only covered 26 year old children (kids) if they lived in their parents house. If they moved out they lost it.
4, there was never any need to hamstring the entire nation to cover preexisting conditions. 
5, for all the millions who got benefit from the ACA, there were 10's of millions who were damaged by it.",0,-2.3674896610939786,2.3674896610939786
263,Trump is a psychopath.,1,2.363538536175407,2.363538536175407
342,"Gotta love the potential and probables......

After all, said things are the new fact, no?",0,-2.359629755350155,2.359629755350155
1312,"it's a private institution, they have the ability to pick and choose and have their model child preferences to enter the school or for some with political family ties.",0,-2.358734122558533,2.358734122558533
394,Stored next to Obama college transcripts,0,-2.3570499108201846,2.3570499108201846
3426,"Nary a rabble rouse in the entire clear and polite request:

http://www.ncregister.com/blog/edward-pentin/full-text-and-explanatory-notes-of-cardinals-questions-on-amoris-laetitia",0,-2.3563902281241615,2.3563902281241615
3687,"I'm curious to know, did the pope actually say that those who disagree with Amoris Laetitia are and do what you have quoted? 

It seems to me that although they may not apply necessarily to all who disagree with Amoris Laetitia, it may be that those predicates apply to some who disagree, and perhaps this is what the pope is communicating.",0,-2.354742220261961,2.354742220261961
916,"That's a good reminder on language. Thank you.
As for taking a source's word for everything, those entities -- and especially the UO -- would be surprised by that idea. So many of the first-blush, single-day stories are just laying out what the entity says is going on, and we count on readers to bring their own intelligence and skepticism. That said, we dig in where every we can.",0,-2.3515711023174486,2.3515711023174486
4428,"???? What, ""house slave"" is a racial slur??? When a lover says to a man or woman,""I'm your slave!"" that's a racial slur? In South Asia in many cultures ""slave sister"" is an affectionate appellant for sisters who are close! C'mon!  What should he have said,""I'm a slave to my house?""",1,2.349045624074675,2.349045624074675
3400,"""What's the big deal here other than the so-called religious wrong-wingers cranking out transgender phobia""

Wow, seriously? I'll tell you what ""the big deal here"" is......it's the Left's ridiculously over-the-top, all-consuming obsession with identity politics. I mean, come on.....transgender freeking bathrooms in public schools? Really?  This is the big defining issue of our day that has to go all the way to the Supreme Court? I don't even understand the culture I live in anymore, especially people like you who blame any part of this insanity on right wing phobias.",1,2.347358615458557,2.347358615458557
3330,"Denis LeBlanc----trust you or four mayors ?  I'll trust what the mayors have to say before you any day of the week. We don't need 14 additional firefighters . You cite how busy things may get and use the same scare tactics you and the police use every time you want something .  Before you boast what a great job your guys do , I know of two heart attack cases where your guys arrived on the scene and got it wrong . Taking one person on a slow ride to the hospital when they were having a heart attack because your people got the assessment wrong . That was two case in two weeks. What are the odds ?  Who knows how many more may have not made it because your people got their cases wrong as well.    And then there's the overtime money taxpayers were saddled with because fire officials allowed too many fire fighters off on vacation at one time , many times.  Taxpayers were correct to tell you NO .",0,-2.345338211749124,2.345338211749124
20,"Trump has been the only one to threaten to wipe N Korea off the face of the earth. N Korea doesn't have the capability to do that. And you're not old enough to know the last dictator who threatened genocide, in fact he didn't threaten it he just did it. Yes you are a moron, we or nobody else on earth wipe out a nation because they threaten. You defend Trump when he says he will wipe out N Korea, so are you advocating genocide of the N Korean people and probably 3 million or so S Korean and 30,000 US soldiers. Yea think it over. I'm tired of all the chicken haws advocating war when they have never seen it or volunteered for it themselves.",1,2.344410717468625,2.344410717468625
4344,"The nature of the vows at a Catholic marriage cannot be undone by mutual consent:

""I, ______, take you, ______, for my lawful wife/husband, to have and to hold from this day forward, for better, for worse, for richer, for poorer, in sickness and health, until death do us part.""

Now if they read this way you would have a point:

""I, ______, take you, ______, for my lawful wife/husband, to have and to hold from this day forward, for better, for worse, for richer, for poorer, in sickness and health, unless or until one or both of us decide differently.""",0,-2.3405615787547864,2.3405615787547864
3563,I've been up Kit Carson six times and I have absolutely NO IDEA what the writer of this article is saying with regards to the location of the new trail on the mountain. Pitiful reporting and grade school writing.,0,-2.3403387440989327,2.3403387440989327
2444,do  you live in a detached house?,0,-2.339886144435844,2.339886144435844
4327,Putin needs to buy better trolls...this was pretty weak sauce.,1,2.3391755482008465,2.3391755482008465
923,"""...introduced non-partisan, merit-based Senate appointments ...""
.
.
You have simply got to be kidding.

The last tally from what I can recall, was that out of 15 or so appointments, not a single one came from the private sector. And even in these days of a bloated public sector, the private part of the economy is still 60% of employment...",0,-2.3390436506890855,2.3390436506890855
1102,"It isn't just ""sex talk"" as Francie Dugan says, trying to trivialize the genuinely swinish insults Trump aims at women, as well as at veterans, dark-skinned citizens, and all Muslims; Trump has acted on his words for years with actual assaults and discrimination in his businesses.  Worse than that, Trump is corrupt to the core, cheating partners and employees, and using bankruptcy to enrich himself at the expense of the general public when his businesses have failed.

We don't need a person with Trump's history of amoral predation sitting in the most powerful chair in the world.",1,2.3363098309539927,2.3363098309539927
181,You should stop. Your ignorance is painful to read.,1,2.331457095227366,2.331457095227366
3897,"In 2011, only 27% of households were families with children (ie, dependent minors) ... when the 2016 numbers come out it will doubtless be lower. Single individual households outnumber families with children now... couples without children outnumber those with. Mobility limited individuals are around but not a huge demographic (and encouraging cycling ... might keep them mobile for longer, active lifestyles significantly improve that outcome).  

Kids are more than capable of handling themselves on bikes. I grew up in the 90s in suburban Vancouver, which is busy and suburban. We biked everywhere, and I was free too do so from the age of 8. 

Most Canadians very much could live a low car or car free lifestyle... but they choose not to, rationalizing it with ""safety concerns"" etc (and if it is a concern, the best solution is providing safer infrastructure)  Many Canadians rarely leave a 10km circle of where they live, which is very bikeable.",0,-2.330347320051052,2.330347320051052
2540,"That's a massive stretch to say this is about ""pope francis vs catholic women"". In this case this is about pushing back against those who either say the pope has no idea what he's saying on economics or that his statement is against catholic social teaching. Francis's views on economic justice is well within the social tradition of the preferential option for the poor, especially as it is practiced in Latin  America with liberation theology.  So on this count I'm 100% with this article.",0,-2.328940085119651,2.328940085119651
561,"Here is exactly what you wrote, Jerry: ""Maybe this difference of opinion is why no one trust the press, or wants them around."" ... No one trusts the press, or wants them around? Then you just wrote ""I never said. nor do I think anyone else said we don't want journalists around."" ... Oy!",0,-2.327990743657584,2.327990743657584
2415,Thank you!,0,-2.3276253985344897,2.3276253985344897
103,"You speak of morals and hypocrisy. 
.
Fact you admit he is a liar. His record of lies speak for themselves.
Fact: for a President he has one of the most foul mouths ever and he cozies up to friends who language is even worse. It is but a query away.
Fact: videos, recordings, quotes of him demeaning women are easily found on the internet.
Fact he has committed adultery. 
Fact, he has been accused of rape, in a legal deposition. 
Fact, he was accused of raping a 13 year old girl in association with a pedophile.
Fact he has described his own daughter as a ""piece of a.."" 
Fact “You know, it doesn’t really matter what [the media] write as long as you’ve got a young and beautiful piece of ass.”
Fact, He currently has lawsuits against him for his actions threatening violence on others. 
Fact: His daughter asked him to promise not to date anyone younger than she, she was 17. 
.
You claim Liberals are deviant!",1,2.3254239305435798,2.3254239305435798
3551,"The fact that maybe one of the executives decided to sell off would maybe not be so obvious, but what are the chances that 3 of them do it all within a couple days of each other?  That is just too close to be coincidence.  

Also, when one of those 143 million people has their identity stolen now, Equifax should be liable for all associated fees and legwork to restore that person's identity.",0,-2.3216131336725336,2.3216131336725336
3755,"""In the past three years I have never had the opportunity to sit and talk to the pope""

Francis does not have time for Marie Collins,  but he does have time for Kim Davis.",0,-2.318855000756432,2.318855000756432
139,"I don't know if I should feel bad for these people, or make fun of them: white, angry old men, sitting in basements, cleaning guns, making ammo, storing up canned goods and Pilot Bread, waiting for some sort of Civil War Part II. 

I wish they'd accept that the world is changing (as it always has), and would embrace it and become useful members of society, instead of clinging to some version of America which, honestly, never really existed. 

Their problem is they live in an intellectual echo chamber. The only media they consume feeds and confirms their distorted views: that we live in some sort of dystopia teetering on utter and total socialism, all the while invaded by Muslims and Mexicans and gays.

The bottom line is, the world has changed, as it will continue to. As a white male myself, I don't fear it; I embrace it. We still live in one of the safest, strongest rule of law country on the planet. To be born in the US in the 20th century is to win the existentialist lottery.",1,2.3176097894250676,2.3176097894250676
3446,"Solution:  all whites should self-identify as black and all blacks should self-identify as white.

You're welcome.",1,2.3140637756149474,2.3140637756149474
1263,"The home page of the NYT site (nytimes.com) no longer includes your vitally important story but does have the rock stars feature, in case you'd like to debate editorial judgment. (However, there is a story on a former UO track athlete that should make your Duck socks roll up and down.) Instead, you'd rather push an agenda, like every other one-note Mary who populates these comments sections. With all that newsroom experience you claim to have, ask yourself how long those three reporters must have worked on that special report for the magazine. Now, how would you know if the R-G is devoting any resources to the very subjects you say are begging to be investigated and just hasn't finished yet? You wouldn't, because you have no idea how this newsroom functions. The vet story was about people living and functioning in the community. Being hyper-critical of a local paper for its placement of a local story written by a staff reporter is indicative of only one thing: you need a hobby.",0,-2.3139174572449974,2.3139174572449974
566,"Springtuckian:  The U of Nike certainly does NOT place EMPHASIS on teaching, Integrity, Honesty, Morals, Character.......",0,-2.3119047688142955,2.3119047688142955
2094,"Thank you for this article, Beth. The decision has caught a lot of people off guard and I know quite a few who have already been impacted by it even outside of the UAA system. People are now having to finish their degrees elsewhere to be able to continue with their skiing (and taking their tuition money with them), being forced to look for new employment and feel that they have been kicked out of their own home. We deserve a much more involved breakdown of the logic behind the decision. It seems like an extraordinary waste given the many ways that the skiing community continues to give back to us as Alaskans, and the ways in which it draws attention to our state from prospective students and competitors from the lower 48 and around the world.",0,-2.3117395067533364,2.3117395067533364
2501,"The daughter lamented the relative lack of Latinos on the roster and separately their lack of preparation.

Are honest discussions, inadvertently shared, cause for resignations? There was no sense of racism in what I read, no blanket dismissal of Latinos or their abilities, just analysis of the preparedness of three individual students.",0,-2.3114161762371372,2.3114161762371372
4306,"How can one choose not to further do something one was not doing in the first instance?

The conflict appears to be with the clear simple command of Christ Himself, which of course makes a demonstration of ""several teachings and practices on the subject not all in palpable harmony"" difficult in the extreme.",0,-2.30993169986991,2.30993169986991
4440,"Let's face it people, there's a lot we as individuals can do to ensure that we have self-inflicted healthcare by taking care of ourselves.  Wow. Isn't that a totally new concept.  Last week while eating at a local buffet eatery, I saw a couple helping themselves to at least ten plates of food.  Their plates were smothered with pancakes, french toast, waffles smothered with strawberries and whip cream, bacon, sausage links and patties, biscuits and gravy and that was just their appetizers.  Then they went  back to the buffet and each loaded four more plates with steak, potatoes, eggs, and biscuits.  These are people that'll surely live a short life.  
Refublicans don't care about the nation's healthcare system, only that they want to do away with access to healthcare.  The Refublicans so-called values don't include passion or compassion for their fellowmen and women.  But one thing that is clear, every elected official receives Cadillac healthcare and retirements off the taxpayers back.",0,-2.3076166100455047,2.3076166100455047
2447,Great story of a local company expanding slowly and responsibly. Unlike the sad story of Haggen's attempt to enter our market at a fever pitch. Kudos to Market of Choice.,0,-2.306036787946133,2.306036787946133
90,"Dear Globe: you lost me at the first line - ""American President Donald Trump is not an idiot. "" 

Of course he is and there is nothing ""intemperate"" about speaking the truth about this idiot.",1,2.3039816354099503,2.3039816354099503
124,Shame on your ignorance.,1,2.303492244787806,2.303492244787806
2833,So you think the Mayor is more qualified to run the day to day of the City?,0,-2.303084160379113,2.303084160379113
45,"You know who else was obsessed with perfect genes, right? 

Hitler, who had Josef Mengele at his side experimenting on humans to find the perfect one, while killing millions of Jews. 

The obsession with genes on the part of this president and his administration is really disgusting.",1,2.3028032951534128,2.3028032951534128
2140,""" It would broaden the conflict-of-interest rules for state legislators, who would be required to declare more conflicts related to their jobs and family.""  Yes, get rid of the legislative rule (39b?) that allows a legislator to call a conflict, but it only takes one person to negate that claim.",0,-2.301774282043952,2.301774282043952
2782,"CCW holders are part of the public. If I protect myself and my family, I am protecting the public.",0,-2.299976693209853,2.299976693209853
1943,"https://muslimscondemn.com/

It looks like many Muslims have been protesting and speaking out against these atrocities, no matter who committed them.

It looks like many non-Muslims are unaware of these protests. Deliberate ignorance?",1,2.297898630239557,2.297898630239557
524,You hope.,0,-2.297860189846464,2.297860189846464
166,Best thing just let the WH idiot alone. His mental health problem will doom him to a locked chambers. Stop pestering the orangutan. Next he'll be scooping his behind and throwing sheet at the spectators.,1,2.2967693696369555,2.2967693696369555
858,"Actually, it  doesn't.

Many significant differences between them.

If you need help discerning them, I'm glad to assist you.",0,-2.2966917841212586,2.2966917841212586
