,X_sentences,Y,Y_decision,Y_confidence
2033,"Government tweaking/manipulation of policy related to housing is not new. It's just that the last year or so has seen the introduction of measures that might not completely favor increased participation in the market and increased prices, which was the status quo for a very long time (with those past efforts being the real reason many young people are already buried in debt).",0,-2.498031604663003,2.498031604663003
459,"'
…except, of course, that's just simply not the case.
.",0,-2.4936608634159976,2.4936608634159976
118,"""She finds Trump crass, vulgar and a misogynist."" LOL! It's ironic many people said the same of Jesus!",1,2.4901371896748925,2.4901371896748925
1453,"I'm supposed to submit civilized comments.  I have one question.  What kind of ""civilized"" being would torture, main and kill any animal like this?  I am sickened from reading the article.  Trapping has to be outlawed!",1,2.4895555061343018,2.4895555061343018
25,"The president is obviously mentally ill.  This is not how a 71 year old man acts - ever.  Even his worshipers are finally - at long last - beginning to understand the depths of his multiple personality defects and his cartoon-like incompetence.

Trump must be removed from office.",1,2.4871568538021434,2.4871568538021434
1796,"My understanding has been that the Hebrew, todah, refers to both praise & thanksgiving. Foremost, it refers to Jesus' giving thanks to the Father, when He instituted the Sacrifice. And the concept, Eucharist, followed from that origin.

I get what you're saying regarding various under/over-emphases or even omissions.",0,-2.485987527589028,2.485987527589028
2544,"This is nice for older people and handicapped, and parents of young kids who need a car and parking spaces for everyday errands and activities. But with every ""advancement"", I see people getting less active and more overweight. People no longer have to leave their couch for anything.",0,-2.4850117658559756,2.4850117658559756
170,"Takes one pussy to know another pussy, Ger, I agree.  Hee, hee",1,2.483154505079828,2.483154505079828
3566,the US citizens stands by their country more than Canadians,0,-2.4820715386188397,2.4820715386188397
1965,"Ten years ago, my husband developed an autoimmune form of arthritis. We knew what it was because his mother has it, but since we were not insured - I was in a waiting period before qualifying through my work - and preexisting conditions would place a yearlong hold on coverage under my employer's insurance plan, we did not dare go to a doctor until we were covered. Because of this, he spent a year suffering from an untreated degenerative disease that left him barely able to walk. He spent most days sitting in a chair. Once he was diagnosed, and after the insurance company had (literally - we heard about it from friends) called every relevant doctor in town to confirm that he had not been diagnosed before, he received treatment that changed him from chair-bound to walking overnight. 

My husband has a chronic disease. Treatment is prohibitively expensive without coverage. A return to lifetime limits and preexisting condition clauses could make him uninsurable. We need the ACA.",0,-2.4808314726990854,2.4808314726990854
4070,"TO:  another_reader

If you've the experience I have with materials, engineering, surveying in AK, etc...
you'd realize that ""Flexpipe made in AK"" pencils out very very good for all of Alaska, not jut in the O&G-sector but in many types of civil-engineering projects.

""Flexpipe made in AK"" is a TOTAL GAME CHANGER, not only in Alaska, but worldwide when you see the pattern of design and implementation, including methods of pipe-production and methods of product applications.

For Example;  AK-Flexpipe can be used to retard glacier recession while producing an amazing amount of hydropower from ""a frozen reservoir behind an engineered ice-dam""

""Everything that can be invented has been invented""... Charles H. Duell 1899  Commissioner of the U.S. Patent Office",0,-2.4800587202735414,2.4800587202735414
4195,I can't imagine what it's like to feel so strongly about gender identification that anyone would be willing to bring the wrath of so many down upon themselves. The haters come out in droves over the transgender issue.,1,2.4776821096240282,2.4776821096240282
1570,"You get out of the LWV forums what you seek.  As I've said before, going to some with a predetermined favorite candidate but with an open mind has resulted in my eventually voting for someone else.  How one handles the spotlight and supports their positions verbally is at least as important as reading their printed material.  This is public service.  Address the public.",0,-2.4764427455011835,2.4764427455011835
3251,"Well sure, because you are using your invented definition of ""state's rights"" versus actual enumerated Constitutional separation of powers.",0,-2.476101049808139,2.476101049808139
3277,"Christmas may have become a secular tradition at Hogwarts, but J.K. Rowling's genius was in recognizing and responding to readers' need for the mysterious, magical, and mystical.  Church hasn't convinced them such a world exists, so they desperately wish the world of Hogwarts were real. Alas. We are stuck in Muggledom.",0,-2.4694587135636206,2.4694587135636206
301,"Once again Mr. Cole I am so happy you came down from the News Miner to work for ADN. This kind of journalism is what the state so badly needs at this time. The reporting that you, Mr. Wohlforth and Mr. Hertz are doing is critical. Where else would we see an expose like this excellent piece?",0,-2.468642919875151,2.468642919875151
4204,"This does not reflect evidence-based standards in maternity care that have been ""standard"" for many years. Women have been encouraged to eat and drink in labour for decades. What a terrible title. ""May"" be safe? "" 'We really don’t know how much if anything people can eat or drink in labor,' said senior author Dr. Vincenzo Berghella..."" Seriously? Evidence supporting eating in labour has been out since the 1980's. I expect more from the Globe and Mail than this. “ 'If we’re well hydrated and have adequate carbohydrate in our body, our muscles work better,' said Berghella. A woman’s uterus is largely made of muscle."" You don't say. A marathon runner wouldn't dream of not eating or drinking while exerting herself... so why not a woman in labour? The phrase ""women were allowed"" was used repeatedly throughout this piece. Women are the prime decision makers for their births... who is doing the ""allowing""? Human rights in childbirth and respectful maternity care matter. Eat & drink ladies!",0,-2.4673342615714935,2.4673342615714935
4279,"Be interesting to see ""where Luther"" led so many Protestants, as Christianity hasn't flourished since his time, but largely dissipated, at an increasing rate as we are seeing today.

No unity, no serenity.

We've gone through a proliferation of ""denominations""..and now we are are seeing their logical conclusion...out the exit door into ""occasional home church"".

That ain't the way of the early Church.",0,-2.4671632563864248,2.4671632563864248
1631,Good for her!,0,-2.465574485336056,2.465574485336056
3300,"Of course it's used as an insult, though the phrase itself is merely descriptive - just like SJW""s use ""white male"", ""Cis gender"", etc.  while sneering.  It's a mirror - put out hate and you'll get hate back.",1,2.4654958960943825,2.4654958960943825
3911,I would be tempted to consider them the Junior Varsity.,0,-2.4650618223803447,2.4650618223803447
168,"Thank you for the clarification regarding what the Mass actually is.  It is often confused with the Last Supper for many reasons, especially what was taught to us in Catholic schools, and the fact that the words of Consecration come directly from the Gospel accounts of the Passover meal of Jesus and His disciples.  Understandable mistake, don't you agree? To further understand the Mass we also, importantly, need the Easter Sunday miracle.  But I must add a note of disagreement with your statement (traditionalist as it is) of:""...the priest is not ""representing"" Jesus but instead stands in His person, presenting His sacrifice to the Father for the people.""  Vatican II was exceptionally clear that there is a second and equally vital part to that equation, and that is that the Presence of Christ occurs through the union of priest and congregation.  I am always surprised when anyone leaves that out of any discussion of the Eucharistic liturgy or its theology.  The laity need not be ""led.""",0,-2.4623012538379063,2.4623012538379063
472,The climate-change-related changes in weather have no scientific consensus.  The consensus relates to increased average temperatures.  Predictions related to weather are much more complex as is reflected by the fact that it is currently impossible to predict weather more than a few days into the future.  Some of us look at the science and understand it.  Others recite what they are told by the media.,0,-2.462145439643285,2.462145439643285
3035,"If it is so bad, then why aren't these people running back to their Islamic paradises?",1,2.461415966577115,2.461415966577115
3141,"IRT RiRapoza, it is not the Christian purpose to allow illegal immigrants into the Church and say, ""It is what our faith calls us to do.""   What the members of the United Methodist Church has done is to challenge the Word.   The members of the United Methodist Church have been guided in the wrong path, of not complying to the laws of their Government.  The mission is to show compassion to citizens and legal immigrants that reside in Hawaii and the United States, and not those who are here illegally.  It is clearly written in his Word.",0,-2.461036487922863,2.461036487922863
2503,"A fairly good list Ms Wente.  Let me add a couple or so.. The British are soon to free themselves from Europe's grand experiment in Soviet-style technocratic, bureaucratic, centralized governance. The European populace have begun to wake up to the mess their overlords are making to their once great societies, due in large part to Frau Merkel's social engineering scheme . The American globalist elites are still disbelieving of the shake up they're in for. The global warming elites labored mightily, between champagne suppers, and produced a non-binding collection of best efforts wish lists. Meanwhile the Chinese and Indians will not deny their people the cost effective, reliable energy the west has enjoyed for over a century. All in all Ms Wente things are looking up. Allow me to wish you a Merry Christmas if The Globe leftist commentariat permit.",0,-2.4583348074248454,2.4583348074248454
1725,"Have you checked to see which of the players are doing nothing constructive to help Black youth, donating money, running youth programs and such?   And again, why is it okay with you that Pres. Trump takes the time to attack these players with profanity, but utters not a peep about the disrespect the KKK shows to the flag?",1,2.4579901724157707,2.4579901724157707
2006,"You can't really understand U.S. politics without acknowledging that a significant part of the American electorate consists of people who are profoundly bigoted and ignorant.  Whether we call them deplorables or hicks or evangelicals, these people should be shamed and marginalized.  They are a threat to decent people and to themselves.",1,2.45797253654449,2.45797253654449
1605,"Interesting.   My main concern is that Canada and the provinces make the decision to adopt certain practices based on the province (or the Feds, in some cases such as for diagnostic tests) picking up the tab.   If responsibility for partial payment is passed on to patients, who do not necessarily have the expertise to determine what is most appropriate, then you have a situation where the government has less incentive to play a role in setting guidelines in a way that is optimal for the greater good.  (ie., maintain or even improve effectiveness of treatments) 

From a more theoretical perspective, I'm reading ""The Wealth of Nations"" at the moment and Adam Smith makes the point that one of the three roles for government is to provide public institutions and services which are too expensive for individuals to undertake, but would greatly benefit society as a whole.   Both education and health care fit in that category.",0,-2.4571640102575634,2.4571640102575634
2044,"I almost always like your comments, Evan, but . . . . even though many of Trump's female fans attending his televised rallies holler their incredible approval of his aggressive disdain for women, I still object to your repeating his deplorable vulgarity in a forum for 'civil' comments.",1,2.4542944208167565,2.4542944208167565
229,"Then why did he donate $25000 to an organization named after a cop-killer?  http://www.gopusa.com/?p=31004?omhide=true
Oh, that is right, he hates cops.  He blames them for killing unarmed blacks.",1,2.454248918872521,2.454248918872521
595,"10 months and one hearing completed.  At the rate this MMIW inquiry won't be completed, with report in hand, until the world temperatures have risen 5 degrees and it will the great-great grandchildren of the women who were murdered that hear the final conclusion.",0,-2.4538770728818298,2.4538770728818298
3846,"Well, let's see here. I lived through the 1973 Arab Israeli war, the Falklands and various other conflicts and the economy appeared to come through unscathed. Am I wrong? I would have been interested to get more detailed information from the writer. I would also have been interested to see how the economy reacted to the beginning of WWII and Korea, the Berlin blockade and Cuba.",0,-2.453045057188925,2.453045057188925
386,It's at times like this that I take great comfort in knowing that my portfolio is overweighted in US equities.,0,-2.4509154736351366,2.4509154736351366
126,"Hey, look at the comment section!  
A bunch of white folk arguing about how black folk don't have it bad!
.....'cause, ya know, white folk know all about being black.",1,2.449845678619327,2.449845678619327
71,"Dan,

I appreciate your breakdown of the three groups and their motivations for wanting to control or purify the church. The common thread I have observed among all three is an incomplete surrender of their sinful self to the redeeming power of God. Often a person who is trying to control others is really trying to find a way to soothe the innate discomfort they are feeling in their own relationship with God. 

I praise God that He is able to give us victory over sin, fill us with His peace and then utterly amaze us with what He is able to do through us. So I say with confidence that, if God can do the things I've seen Him do through me, then there is a whole lot of opportunity for others to allow God to do at least as much in whomever He picks, even calling women to serve in church leadership positions where so many men have failed.",0,-2.4497987579802953,2.4497987579802953
439,"In order to change doctrine we have to be able to admit that what has been developed as doctrine depended on knowledge and culture at the times the doctrinal decisions were made.  I don't know if Catholicism, maybe a great deal of Christianity can admit that, because it says that the Bible is not inerrant.  

Yes, it is time for a new vision of God, creator of the cosmos that is in continuing evolution to ...what?  And, a new understanding of  the meaning of the incarnation of God as man in Jesus Christ.  What did Hir (his/her) coming demonstrate about God and humanity, about God in humanity?  Does God evolve, too?

But, lets start on a smaller scale, say with the role of women in the Church and in the world.   Educated and socially/politically empowered women of today don't fit into the Biblical ideas of powerless women who cannot be leaders, make decisions affecting men, or be priests.  Is how the Church views women a matter of old customs or God?",0,-2.4497194337016768,2.4497194337016768
4014,"Is there any public figure, political or private, that you would trust to be President?",0,-2.443959887775023,2.443959887775023
1000,"Did you mean crime against the gun holder, or crime comitted by the gun holder?   


Low rates compared to who?",0,-2.4435194001218212,2.4435194001218212
1538,"So you'll do a poll on this ,but you won't do
one on those overpaid legislatures and senate members and their staff members on their so called job performance?",0,-2.4413908255418555,2.4413908255418555
2667,"Journalists are LIARS by omission.  ""claimed""?  Yes, it was SO at the time.  If Carrier made a business decision to reverse their previously stated intention, they have the right to do that.  It was NOT a contract between Carrier and the President, it was an informal agreement.  No law has been broken, no PROMISE violated by President Trump.",0,-2.436286021689822,2.436286021689822
272,"Stop making bombs then you idiots.
Oh wait they work for Soros and Clinton
Oh it's trumps fault that you made the bombs
I get it.
Silly me",1,2.4356888419947937,2.4356888419947937
2937,"Joanna777, YOU have offered nothing here that will help further the discussion. Instead you try to hijack the discussion and turn it to you favorite topic, the PFD. 

This column is about health insurance, keep it that way.",0,-2.434544647474988,2.434544647474988
3546,"Fact: Housing costs significantly more. 
Fact: Avg. Real wages $4500 less per year
Fact:  University Costs significantly higher: Student Debt loads significantly higher.  

Argue all you want about whether you approve of how Millenials spend disposable income. Facts are they have less disposable income to spend.",0,-2.4340479739585823,2.4340479739585823
2858,"What we have here is a situation just like the old Anchorage Northern Knights and Alaska Aces , with one exception ---these proposed new owners , by they're own admission , don't have nearly the resources those business's had .   IF this group is able to buy the Dispatch , I see it it folding within two years , if not the first year  .  This new group are good people and their hearts are in the right place , but that  won't change the reality of the situation.  Simply put---it costs too much money to put out a printed edition and our local TV stations already offer online news for free . The numbers just don't pencil out . We've  had a good long run of having a newspaper in Anchorage . That is about to end.  All the news a person can absorb is on one's cell phone . People aren't going to pony up the money needed to save the Dispatch . It's done like dinner .  If you think it's going to survive---I've got a gas line project to sell you.",0,-2.429010882975949,2.429010882975949
387,The media has to concentrate on the real news like the Russian connections and business deals instead of getting all distracted by Drump's twitts. David Cay Johnston is the kind of investigative journalists that we need now more than ever.,0,-2.4264126889206117,2.4264126889206117
237,"Really? President Trump tweeted ""I hate Black people""?  He never said that. 
 Fake News.",1,2.42340762460401,2.42340762460401
3675,"Apparently you may have misread the story.  If you read it carefully, it was after Jesus called him down from the tree-
""But Zacchaeus stood there and said to the Lord, “Behold, half of my possessions, Lord, I shall give to the poor, and if I have extorted anything from anyone I shall repay it four times over.”
And Jesus said to him, “Today salvationc has come to this house because this man too is a descendant of Abraham. For the Son of Man has come to seek and to save what was lost.”  (Luke 19:8-10)

Note that Zacchaeus uses the words ""I shall"" - indicating that going forward, this would be his action.  He most certainly did NOT say that he was already doing so......

He was amending his life going forward .....",0,-2.421430137610021,2.421430137610021
2279,Seriously! I'm glad someone is finally taking this rape issue seriously! I can tell you are a true white knight Highway. People need to know that on these prestigious liberal college campuses 1 in 1 women will be raped. It's basically worse for women on liberal college campuses than it is  for women in the war torn Congo.,1,2.4212361174503627,2.4212361174503627
2901,"RE : ""National Security""

The cartoonist forgot the red ""L"" under the maple leaf on the beavers' chest..this is especially relevant, as the beaver is clutching cash, in $1,500 increments, I presume..",0,-2.4198103403476328,2.4198103403476328
3284,"16 miles of roads intown and depending on snow, hundreds of miles of ice roads during most winters.",0,-2.4191302570843547,2.4191302570843547
2724,"I would suggest the word is more often used by women to describe other women in arguments, than it is used by men. But either way there's nothing wrong with sex-specific insults. I don't want to start rattling off the list because I'd like this comment to meet ""civility standards"", but suffice to say there are plenty of insult words reserved for men, as there are insult words reserved for women. 

I've met some shrill men over the years though now that I think of it.",1,2.418237945440602,2.418237945440602
2953,"Europeans of most nations have enslaved men and women since before written history. Give it a rest, you sound like you look down on African people. Are you aware that 63% of Africans are more intelligent than you?",1,2.4159061954577465,2.4159061954577465
1927,Agreed. Any analysis of the success of QC's system has to take into account the generally lower overall labour force engagement in that province. The entire province works measurably less than the rest of the country. Any gains by child rearing women is more than offset by the general decline of employment numbers across the board.,0,-2.412929843919859,2.412929843919859
1955,"My only addition to this wonderful analysis is the role of Church itself. While we belong to a Church that holds a mountain of spiritual wisdom and beautiful tradition we also belong to a Church that has, as an institution, fallen into the precise obedient, uncritical behaviour Joan identifies and a result women, the environment and those who have a separate spiritual tradition have suffered enormously. Let us lead by example and thank goodness the greatest part of our Church now does that.",0,-2.4117281851025774,2.4117281851025774
4384,Traps need to be outlawed. Traps are inhumane. Traps cause animals to suffer. Traps are used be lazy uncaring evil people.,1,2.411423943835538,2.411423943835538
3893,"""with the intent to influence, solely on the basis of partisan political affiliation""

So standing for our national anthem is now a partisan issue? If you stand your a republican if you kneel your a democrat.",0,-2.404651194280326,2.404651194280326
4388,"Not trying to distinguish between NY Times and ProPublica (and credibility depends on the content of the story, not the ""brand"" publishing it); just trying to make a quick and efficient point about the intent of Russia's misinformation campaign, Wikileaks' anarchist politics, and the electronic vulnerabilities of both parties ...",0,-2.3999259653456457,2.3999259653456457
2902,You do have an option. It's called private school.,0,-2.39963388497567,2.39963388497567
328,"Just in case anyone's wondering why Trump can't stop dividing the country with racist rants like the gross comments in Alabama stoking his white supremacist base:

Donald Trump: Eugenics
https://www.youtube.com/watch?v=3Yh0jAxOxGE
Why anyone would think he's soo a white supremacist is beyond me.",1,2.3993397361559023,2.3993397361559023
426,"James Reeves

.....and when all else fails, trot out the good old conspiracy nonsense.

Does the following look like ""70 year old science"" to you, James?

1) 2015
Conclusion

The children living in the well-established fluoridated area had less dental caries and a higher proportion free from disease when compared with the other two areas which were not fluoridated. Fluoridation demonstrated a clear benefit in terms of better oral health for young children.
    
--The Dental Health of primary school children living in fluoridated, pre-fluoridated and non-fluoridated communities in New South Wales, Australia
Anthony S Blinkhorn, et al.
BMC Oral Health 2015, 15-9  

Steven D. Slott, DDS
Information Director
American Fluoridation Society",0,-2.3976764528367234,2.3976764528367234
3924,"Not to quibble or be too picky, but presumably you meant that 3 carrier task force's are currently in the Sea of Japan, the most since 2007.

They are:

USS Nimitz
USS Theodore Roosevelt
USS Ronald Reagan.

Thanks.",0,-2.3968149032720443,2.3968149032720443
594,"If that's true, then let the lawsuit go forward so those ways of ascertaining who's ""better"" can become part of the public record. Let's all learn what distinctions beyond the petty determine the university's faculty salary structure. It's an excellent teachable opportunity to take the ""probably"" out of your supposition based on being ""personally aware"" and replace that innuendo with, say, some actual discovery and facts.",0,-2.3960687920400456,2.3960687920400456
481,"John Adams Christianity Quote Poster
 
The general principles on which the fathers achieved independence were the general principles of Christianity. I will avow that I then believed, and now believe, that those general principles of Christianity are as eternal and immutable as the existence and attributes of God.

Benjamin Franklin's Creed
http://www.questioningchristian.com/2004/11/benjamin_frankl.html",0,-2.3925039290390018,2.3925039290390018
