,X_sentences,Y,Y_decision,Y_confidence
947,"What about hostility to topless women? I hear there are many church going towns in the USA where topless women are not allowed. 

Whereas in Europe nudity is a lot more acceptable. Families go to nude beaches together in Germany. And that happens to be in the west!",0,0.19941858856056327,0.19941858856056327
586,"Bingo!

Now you see why Clinton referring to the electorate as ""deplorable"" cost her the election.

See, you're catching on!",0,0.19935809839844798,0.19935809839844798
672,"Sunday, January 22, 3:44 a.m. tweet:

Nobody loves women more than I. Nice of them all to show up yesterday and celebrate how we're going to make America great again.",0,-0.19854233732952475,0.19854233732952475
4142,"Americans who sympathize with the Alt Right are not true Americans. Imagine your relatives , dad, grandpa's, uncles fight in WW2 , some losing their lives, some like my dad never getting over the horrors of WW2, and the job they did to destroy Hitler the Nazi's and Fascists have to listen to the next spoiled generation of Americans who were raised in a civilized nation and had all the things they never had growing up, that the Nazi's and other white supremacist groups, have ""rights"" too. My dad was like John Wayne, say that ""Nazi's"" have ""rights"" now in America would get you a good sock in the jaw.",1,0.19835093839158824,0.19835093839158824
4241,Sir Richard is fooled by the climate hoax.  Glad the President said goodbye to it.  Been hearing the doom and gloomers for almost 50 years and fraudulent science is what underpins this charade.,0,0.19736796636207,0.19736796636207
3892,"I know of a Christian muslim who accompanied two Clergy to their favorite muslim owned restaurant. They bragged they were great friends with the muslim owner....The Christian spoke the same language as the owner, and asked him what he really thought of the two 'christian men' -Not knowing this man was also a Christian, the owner laughed and told him when the Mahdi comes they will chop off their heads. Their book says it is forbidden to be a 'real' friend to the people of the BOOK (Bible)They will pretend to facilitate the outcome they desire. This is why a person can work for a year at a company and then murder everyone there at a party with no conscience as happened in California.",0,-0.19700420592688617,0.19700420592688617
22,"Glad I didn't fight in Nam. Hate to find out late that I was going to shoot people who look like me. Bet you the white soldiers would have discriminated against me like the blacks. Really disappointed to watch a 2-hour PBS show about Lyndon Johnson and learn that there was NO attack on an American ship in the Tonkin Gulf. It was raining hard and the radar was just showing a lot of static. So they decided to shoot everything they had at everything and anything. The next morning there was no evidence of debris or oil slinks. They make a mistake. Johnson was running for re-election and was tired of Goldwater calling him a coward. So he bull-lied and said we were attacked and took the opportunity to declare was and win re-election. What a bastardo. So many young men, women, and children lost their lives just because a President lied. There are still hundreds of thousands of live bombs is Laos waiting for future chid victims to maim and kill. BTW, I was 4-F. My handicap was a blessing.",1,0.1965237129059323,0.1965237129059323
4140,you know the paper you're reading has a liberal bias and is catering to their liberal comrades when....?  you read 2 articles and the one about the loose dog in the largest city in the state getting trapped by some jerk before the dog got hit by a car anyway gets twice as many people commenting their outrage than the article about a black kid murdering a native kid in cold blood.,1,0.19607581130507024,0.19607581130507024
1445,"The day Uber comes to Alaska officially, I'll be down at the office of Yellow Cab, pouring one out for the Taxi monopoly in this state and it's timely death.",0,0.1956684518187659,0.1956684518187659
4497,"There is statistical normal, which would make homosexuality abnormal, but statistics is not the measure of right or wrong.  I should have been precise.  Natural.  Meaning gay sex is natural for gays and an aberration for  heteros.  Hetero sex is not natural for gay people.",0,0.1954032061929738,0.1954032061929738
4348,"Joe-you should have read more;  for I agree with that and had posted it.
* Focusing on percentage of USA residents by race, Blacks are higher statistically ...* in the shooting deaths,  for there is 5 times as many whites-but all lives matter. 

I will continue to say all lives matter and we need to stop this.",0,0.1939170050406538,0.1939170050406538
3807,"In the 2015 federal election, outgoing NDP Leader Tom Mulcair said that what matters is what's in your head, not what's on it.

That statement only takes one so far. For example, would the GM invoke this principle if a candidate for the leadership of a political party took to wearing a KKK hood? Would Mulcair? 

Clearly not, and I take the reason to be that some garb is so freighted with associations that the wearing of it cannot be tolerated, even in a state that protects freedom of conscience and religion and freedom of thought, belief, opinion and expression, to quote from s. 2 of the Charter.

So it was disappointing for many that Mr. Mulcair would come up with this principle to defend the wearing of a garment (the full face covering) that is the heritage of a patriarchal school of thought that woman are not to be allowed to enter the public sphere on a pari passu basis with men.",0,-0.19379235777999093,0.19379235777999093
387,You have got to be kidding .  Your worried about what people say in private ?  Where was your outrage over what Bill Clinton actually did ?  He used women from when he was governor on.  Read the book The Clinton's War on Women.  Not only did his actions speak louder than words---Hillary Clinton enabled him and she worked to destroy all the women who dared to complain about what he did.   If your worried about who you can trust---women do more to attack other women in bathroom / break room situations than all the men in all the locker rooms across America.  For years it's been a known fact women dress to impress and show up other women---not men.  What a man says in private should be of no concern to you.   Let the first person who have never said something in private that they regret today---stand up .,0,0.19378151446676206,0.19378151446676206
3501,"I am deeply disappointed in the HeraldNet for shoving aside the very real concerns of women regarding the large loophole in the new rule that allows any male, including any sex offender, to be in women's showers, locker rooms and bathrooms.  Any male can loiter in these places and walk in on any girl or woman in the shower, including stripping down and showering next to them.  
The initiative does not use the word transgender because the current rule does not either.  The current rule applies to ""gender expression or gender identity"" which is ambiguous enough to allow any male to claim one of 58 gender identities as listed on Facebook.  No proof is possible, which is why the current rule strips women of their ability to question any naked male walking into the shower with them or with little girls.
Please go to justwantprivacy dot org to request petitions and to donate.  There is only 2 weeks left!  Let's put it on the ballot, debate it openly and let the voters decide!",0,0.19311355600689484,0.19311355600689484
1354,"You don't understand. Glenn was a great man (and if you hadn't mentioned Gagarin, I would have done it myself, just to put Glenn's achievement in perspective). WE DON'T NEED HEROES.  Nowadays, even thugs with badges call themselves heroes! Be the best you can be, give the best you can give!",0,-0.19294308658683668,0.19294308658683668
2734,"I think that it is more than a little wrongheaded to blame New Ways Ministry for the refusal of the Catholic Church to recognize as a saint someone because they are thought to have been gay or to have supported equal rights for the LGBT community.  
Even though I think that what Fr. Martin suggested re the conversation between the Church and LGBT people is very timid, I am very glad that he has chosen not to allow himself to be silenced because of the opposition of those who believe that they ought to be the ""Catholic police"".",0,0.19254980827841783,0.19254980827841783
604,"""Tancredo began to explore a run after being outraged that Republicans didn’t speak out against the cancellation of a conference hosted by a white nationalist organization, the VDARE Foundation, where he was scheduled to speak.""

Uh yeah, Tom, good luck with that whole ""I'm not a racist"" thing.",0,0.1922898226747436,0.1922898226747436
1552,Are you sure you want to start a conversation about the powerful men who travel and party with this guy Epstein?,0,0.19189673935960005,0.19189673935960005
686,Makes sense that a closet socialist would think so.,0,0.19138894982705135,0.19138894982705135
4171,"Oh silly Peter, I am not angry. It is curious that you would expend effort ""just to make me mad"". I would have hoped for a rebuttal if you disagree. Still, it was not actually expected. 
  
Like me say my argument again is easy to understand term. China is pushing the reduction of CO2 in every nation except theirs. Every nation but theirs is spending $billions (100s of $billions even $trillions) to reduce CO2 with no notable effect other than skyrocketing energy costs. China is buying our coal, mining their own coal, and bringing on a new coal fired power plant every week and have stated that they intend to continue doing that for the next couple decades at least. 

Does that clarify my point? Do you disagree? If so why?",1,0.19083626053685476,0.19083626053685476
2808,"In general, I agree with your assessment there are nut jobs in both Islam and Christianity, however, I take issue with your estimate that since 1950, fewer of them are doing it in the name of Christianity. And why a cut off date of 1950? Why not 1900?",0,-0.19021821796018723,0.19021821796018723
4418,So Our Lord abolished the Ten Commandments.,0,-0.18965498664951097,0.18965498664951097
1033,"That is what you think, in other words your opinion. You would not argue against Christ's command for us to love one and other. You take that literally, why can't you take His instruction upon marriage literally too? What other way is there of taking it but literally?",0,0.18948705124126497,0.18948705124126497
865,"There is no ""gun epidemic.""",0,0.18892437530583983,0.18892437530583983
4163,"She doesn't and wouldn't discount philosophy. She's decrying magical thinking generally and should. 

Science, not theology, is our best chance for understanding the physical universe. Ethics that do not appeal to deities or scripture for foundations (in other words, secular thought) is our best chance for creating equitable political structures.  Religion is irrelevant to those projects. Its comforting qualities in the face of mortality are a boon, I suppose. Mr. Mulroney needs to focus on explaining religion's shocking record of oppression of gays, women, and non-believers (e.g. natives). ""But atheists and scientists have been evil at times too"" is no justification at all for, say, Catholic dogma that sees women as lesser, won't allow women leaders in the church, hangs on to the anti-gay stuff and thus green-lights oppression on that front, and insists there be no birth control or protections used in impoverished countries in Africa. In the name of...? Stop deflecting.",0,0.18856495649336424,0.18856495649336424
125,Oh boy the psychopath is free.,0,-0.18842944565610953,0.18842944565610953
4115,"What a clever boy!  I'm a big boy now, right mommy?",0,0.18710545458965133,0.18710545458965133
1650,"The drug problem in prisons would end if guards stopped smuggling in the drugs. Guards, often female,develop relationships with male and sometimes female inmates and bring in contraband for their ""partners"". Another gateway is lawyers and mental health workers who have private meetings in the prison with clients. Sounds unbelievable, but with closed circuit cameras and cell phones these people are now getting caught doing what inmates said they were doing. Google London guard at EMDC. She was acquitted but she obviously brought the drugs in.",0,-0.18705409086393465,0.18705409086393465
3904,Yawn...... only a party living in the past thinks gay rights and abortion are topics in 2017.,0,0.1869711750105314,0.1869711750105314
2916,"Both Taxpayers and Managers are eager to wildly grow the Leviathan's spending as long it is for things they want.  They have no problem spending other people's money if it is going for this year's $700 billion military budget (more than $2,000 for every American), or deportation, or private prisons, or corporate welfare. 
Many Republicans of both stripes want to expand the Leviathan's regulations over a woman's reproductive choices and the bathroom use by transgender Americans.  Sessions is calling for much greater regulations and prohibitions on the use of cannabis.
True, they want to cut spending for healthcare. They want less spending on food for the 22% of American children living in poverty.  And they want to end regulations that stop coal companies from dumping their toxic waste into other people's drinking water.  
But neither wing have principled objections to government spending or regulation.",0,-0.18632305559810658,0.18632305559810658
721,That's what all the burping and belching is about huh Dana?,0,-0.18586171966181153,0.18586171966181153
4431,"diverdave, You believe everything Trump said when he was campaigning -- except for the Muslim ban.  Peculiar.",0,-0.18571713285947755,0.18571713285947755
4361,"What an extraordinarily odd comment. Polynesians and Hawaiians have existed in the Pacific hemisphere for many thousands of years. Far longer than America saw its first western European. long before Europe descended into the Dark Ages, before Jesus gave his sermon on the mount.

Yet it is your contention that we are haters and racists because we want to continue to live in our own nation free of foreign influence.

We haven't asked for a single penny from anyone. We only want to enjoy the sovereign independence that is our inherent right as a people and a nation. A right that we have had for far longer than there was an America.

You're clearly confused if you think that our wanting to be left in peace to live in our own country is somehow a threat to you. Can you explain to us why you feel threatened by people who only want to live in peace in the country that has belonged to us for longer than the US stole lands from the indigenous peoples of North America ? Mahalo.

ponokeali'i",0,-0.1856148928796224,0.1856148928796224
4116,"I have yet to hear to hear a coherent definition of a ""Islamophobia"" nor a compelling reason for specifying it seperately from other religions in this motion.",0,-0.1852446568249475,0.1852446568249475
1850,"Is this man (John Butts) a practicing homosexual? If he is, why don't the sisters help him to remain chaste? It seems they are actively encouraging it by their acceptance of his situation. If he is struggling to remain chaste and is looking for support and getting it  from the Sisters, then I congratulate them and encourage their endeavours  by helping those afflicted with this unfortunate disposition.",0,0.18501350037706543,0.18501350037706543
886,"I am saying freedom of speech and protest as long as you aren't spreading racist hatred, misogyny or antisemitism, to name a few.  I hope that doesn't seem like a big stretch for you.",0,-0.1849203365684855,0.1849203365684855
2014,"Kick the ""P""s over to the liberals and unite with the WR under a conservative banner.  It is the only way to get rid of Notley-Arab and her socialists. It is what Albertans want/need.",0,0.18485048469655618,0.18485048469655618
3863,Nonsense. I said no such thing. If you poke a bear with a stick you will get a response. The left wing protesters decided to protest against what started to be a march against the removal of statues.,0,-0.18412595536073195,0.18412595536073195
3198,Says who?,0,-0.18338301881718255,0.18338301881718255
3891,Who in their right mind would pay to hear white bread speak?  Let alone nearly $300?,0,-0.1833282901014741,0.1833282901014741
3043,"It's absolutely ridiculous. I'm sure that the tickets didn't say ""Whites only"" on them and I'm also sure that if she went along to the Notting Hill Carnival she would have been revelling in it being full of ""her people"" and not complaining about a lack of white people there.",1,0.18112548420580743,0.18112548420580743
4312,September 11 was orchestrated by Saudis. Zip-ding to do with Afghanistan.,0,0.18030178265394503,0.18030178265394503
2944,"""He is a sensation now.""
.
The internet needs to show better judgement. Is this guy a ""sensation"" in the same way that Asian dude was on American Idol? You know, the guy that sang completely off-key.",0,-0.18016940957052707,0.18016940957052707
3700,We can't get our Butt on the field fast enough.,1,-0.17972008072601398,0.17972008072601398
1428,"Muslims don't require women to cover their faces or wear any kind of head scarves

Those are cultural things - not religious",0,-0.1790082706984799,0.1790082706984799
1120,"The purpose of knives is a tool for preparing food. The purpose of guns is killing. I use knives in cooking on a daily basis: I have also used guns, to kill people. I have only ever used a gun when I was in the army, and it was only to kill people or to sharpen my skills in killing. 

Kitchen knives can be used for killing, but that is a misuse of the tool. I used to know a woman who killed using a screwdriver. I'm sure you would agree that killing with a screwdriver is a misuse. But the proper use of firearms is killing.

 I am told, and I believe, that ""Don't point a gun at someone unless you intend to kill them"" is said in every gun safety course. Certainly, I heard it repeatedly from my instructors.

If you think that guns in the hands of civilians are going to be used for their proper purpose of killing, then I don't believe you have thought it through.",0,-0.17824775175368157,0.17824775175368157
3413,"Really Wes? You can't think of why the Khan family spoke at the DNC? Could it be because the way trump has slandered all Muslims? How he talk about marking Muslims in this country, like the Nazis did to the Jews?  Or closing mosques around the country (which is unconstitutional, btw).  Yeah Wes, it's a mystery.",0,-0.17818187551060372,0.17818187551060372
1374,"100% Correct.  These leaked emails prove Clinton wanted to use Powell for her scapegoat on her ILLEGAL activity, and he refused; but as long as the Leftist Washington Post can keep steering the narrative away from that fact, and back on to his opinion of Trump, then Hillary is once against shielded.  It is as sickening as it is obvious.",1,-0.17807651904198019,0.17807651904198019
2405,"Islamic ideology as contained within the Quran is the direct source of the problem. The Quran is viewed by all practicing Muslims as the immutable, irrefutable, eternal and direct word of God and thus it's commands and dictates cannot be challenged. The Quran serves as the basis for Sharia jurisprudence and is incompatible with the values of liberal western democracies. This fact seems to be lost on most western politicians. Please sign petition e-909 to help Canada ensure that a parallel Sharia court system never exists in Canada (unlike the secret Sharia courts of the UK) https://petitions.parl.gc.ca/en/Petition/Sign/e-909",0,-0.17797603296091835,0.17797603296091835
3149,What's the Bible view on executing the mentally ill?,0,0.17786390578577604,0.17786390578577604
4236,"He was accused of throwing a grenade that killed U.S. army medic Christopher Speer in the firefight and was sent to the U.S. detention facility in Guantanamo Bay.

I can't believe the Mass Media still refers to soldier Speer as a medic.  He was dressed in full battle gear and acting as a soldier when he was killed. Plus in the chaos of a bombed out compound in full out battle there is no proof he threw that grenade. 
   Plus they omit that he was forced at 15 years of age into his role and was therefore a child soldier.
This 10 million taxpayer's dollar is on Harper's tab. Playing politics instead of following his Child Soldier treaty obligations.",0,0.17696620756376413,0.17696620756376413
1063,"Obama decreed Daca via Executive Order. Trump rescinded it, with a six month moratorium via the same Executive Order. There's  nothing wrong legally with What Trump did. If the virulent protesters and Latino community Have a problem with this, perhaps they should allow the legal process to continue to a legal Congressional resolution! And... why don't they blame the ILLEGAL alien parents who VIOLATED THE LAWS OF THE COUNTRY! NO... they play the victim card!  It's all about the laws of the country folks.  If you don't like it, change it... legally!",0,-0.17650333999795031,0.17650333999795031
2137,"... or instead, read: ""How Men’s Rights Leader Paul Elam Turned Being A Deadbeat Dad Into A Moneymaking Movement""

https://www.buzzfeed.com/adamserwer/how-mens-rights-leader-paul-elam-turned-being-a-deadbeat-dad?utm_term=.xvDpp7gkg1#.gqL3368E8n",0,-0.17636597850357183,0.17636597850357183
1388,"Thing are getting better in LoD0....now when you get shot, you might well be expected to live!",0,0.17627262937718613,0.17627262937718613
1179,They are showing very clearly what they really are..,0,-0.17569256948631207,0.17569256948631207
4371,"ALL fossil fuels are subsidized, so why are Republicans sooooo hell bent on picking and choosing the winners and losers ... if you ask me, it has to do with your small case 'c' 'christianity'.  You feel threatened that y'all aren't calling all the shots any more, can't sooooo easily pick the winners and losers.

Face it, renewables are here to stay, and are helping drive a stake into the heart of pollution causing fossil fuel industries which is one of the basis of this article.

If you REALLY think fossil fuels aren't subsidized, I guess I can't fix stupid ...",1,0.17560750551624005,0.17560750551624005
2292,"What on earth has happened to England? I knew the GREAT fell of years ago, but this has taken the country to pond life.  Read the bloody papers educate yourself with current affairs.  Northern Ireland has given its life's blood to the United Kingdom.  You are the ones who have betrayed us.  My family have a pedigree that is second to none, for services to the armed forces.
The DUP are a step higher than any party in England.  We have morals scruples and above all loyalty. 
I remember that son of a circus tight rope walker Mr John Major spouting off he would never talk to the IRA, while all the time he was.  He should have paid more attention and less dalliances with Edwina Curry.
One other thing we beat you hands down every year on our high standards of education.  We also defend the faith.",0,-0.1750115415900224,0.1750115415900224
2887,So did Islam!,0,0.17442168223892396,0.17442168223892396
1130,"Trump's first bluff with China was his blunder over the One China policy, and he folded like a house of cards, causing the Chinese to laughingly proclaim him a paper tiger. The armada bluff was similarly disastrous. You have to be as naive as Trump to think that the Chinese don't know where US aircraft carriers are at all times — and that they don't share that information with North Korea. Calling the armada story a bluff is giving Trump too much credit; more likely it was a spontaneous lie that left the White House staff scrambling to provide cover for him. When the inevitable happened — Trump's lie was exposed — Trump just looked like a fool, again.",1,0.17418702422493282,0.17418702422493282
3417,"The Republicant's promise ""to repeal/replace the ACA in a meaningful way"" was to dump millions and millions of Americans from the health care rolls.  Now they are mucking with the insurance exchanges out of resentment in a way that is costing Americans more money.  

But that's the Grabbing Our Pu$$ies party way -- party and vindictiveness over what is truly best for Americans.  And in this case, hiding behind closed doors to create a ""policy"" that no one even saw or understood. Anything for a ""win."" Their spineless enabling of Trumpism is mind boggling. Ultimate hypocrites. 

I have not always supported Murkowski but she chose the right path with her health care vote and I applaud her.",0,-0.1738449680583971,0.1738449680583971
3818,They just wanted to strip search her!,0,-0.17381764766015873,0.17381764766015873
1340,"The Governor of Louisiana and the Governor of South Carolina had to convert to Christianity to win office. Nikki Haley, the Governor of South Carolina, refused to let her turban wearing father campaign with her (it is South Carolina, after all, not California). Bobby Jindal, the Governor of Louisiana, explicitly told his Indian supporters not to wear saris or other Indian outfits at his inaugural dance (again, Louisiana is not New York).",0,0.17354835371714117,0.17354835371714117
