,X_sentences,Y,Y_decision,Y_confidence
2552,"It is not clear what the EXAMINER considers an appropriate form of protest. 

Eastern Europeans like Emily seem to feel entitled to make a lot of rules for black people about what they can and cannot do in Amerikkka. Emily, we were here long before you and we do not accept your rules. We'll decide what is appropriate. Not you.",0,0.08436982617205913,0.08436982617205913
1280,"If he would add a booster it would be only half as loud compared to Hillary,s screaching. Do you really want to hear her voice everyday for next 4 years?",0,0.08412199056706604,0.08412199056706604
2556,"There is no such thing as alt-left.

There is alt-right, properly called white supremacist.",0,0.0836364553119806,0.0836364553119806
3827,People can only see the ANC because people `like Ramaphosa and Gordhan have the White media is on their side.,0,-0.08315532432647599,0.08315532432647599
1936,"""The Cons have decided to go extreme right."" - Pathetic. Be grateful that you don't actually know what ""extreme-right"" really is.",1,-0.08307862072337735,0.08307862072337735
1957,"Please . . . the Roman Catholic Church has NO moral standing regarding healthcare policy.  Hear the crickets?

From Humanae Vitae to continued attacks on providing contraception to the reality of gender identity, the Church remains in the Middle Ages.  BUT, it will get very exercised about its right to ""freedom of speech,"" statutory limits for clerical sex abusers, and its ability to proselytize from the pulpit.

Donald Trump is the Roman Catholic Church's dream come true.",0,-0.08277050091096538,0.08277050091096538
2294,"And what type of F150 do you drive??  Nenshi has been rated the BEST mayor in Canada and one of the best in the G30 nations.  Dont like bicycles, then continue building outwards like Houston and soon enough you will have their same distinction as being the fattest city in the respective countries.
Calgary had finally left the Klein era, and obviously with your limited ability and intelligence to comprehend such obvious improvements, you have shown your inferiority here in society.   But then again people like you have to balance out the cream of the crop to bring the average down....read the Bell Curve buddy.",0,-0.0826138691988405,0.0826138691988405
3996,The road to ruins is paved with good intentions...,0,0.08257584038073729,0.08257584038073729
3541,A musher wouldn't be disqualified for his team and sled being out on their own for an hour? Isn't he supposed to be taking care of them?,0,0.08211120381532289,0.08211120381532289
1839,"The thrill of flirting with death is not what I would call an interesting life.  It created distress amongst those closest to him.  The need to achieve the highest high to ward off the lowest low.  Even his fellow extreme risk colleagues were worried about him.  To me, this crosses the line of what this man wanted to achieve in life, or death.  I think more mourn his death than celebrate his life, and this leads me to believe this was a wasted life.",0,0.08190732355781005,0.08190732355781005
1347,"I agree with your suggestions for training.  Good training conditions lead to good sautomatic response.  

But I have to ask my friend just what kind of ramifications will a Trump Law and Order campaign be?  He wants law and order and wants it now. Does that fit what you hope for?    He's put the objective first and no comment on process(one of your strengths).    
I think liberal political policy condemns poor black neighborhoods to fear by not facing the violence.   That does not mean I want a suspension of civil rights- which I fear from the emotions of vengeance and personal power exhibited with Mr, Trump.  Should that worry me?",0,0.08054834231774533,0.08054834231774533
829,"While I do agree we'll be getting ""more of the same"" if Hillary gets elected, Charles is just an antiquated Republican mouthpiece. Both parties have failed America. We need young people to get involved and vote because the clowns we have in Washington are completely out of touch. Stamping their feet and throwing a tantrum or lobbing personal attacks when things don't go their way. Let's shed ourselves of the two party system and get back to basics.",0,0.08037440190989709,0.08037440190989709
4047,"François Jourdan, French islamologue;
“...Islam is very frozen for many centuries and basically lack of freedom - today, it must be said clearly that we cannot build a society of one religion, Christian, Jewish, Islamic, Buddhist... or atheist. 
This phase of human history is now overtaken by religious freedom and human rights. Secularism requires not the ban but the discretion of all religions in the public space as other citizens have the right to have another way of life. 
This isn't the Koranic trend where Islam does not consider itself as other religions and must...DOMINATE !...”
So, He said;
“...Secularism requires not the BAN but the DISCREATION OF ALL RELIGION in the public space...as others Citizens have the right to have ANOTHER WAY OF LIFE”, oui ?
Islam does not consider itself as OTHER religions and MUST... DOMINATE !...
 get it Canadians ???...",0,0.08031931401362336,0.08031931401362336
4215,"Doug Saunders is the kind of guy that ruins things for other people, possibly a symptom of ongoing autism.",0,-0.07974147226145445,0.07974147226145445
2284,"Science won't matter to the people against abortion.

This is their quest for the religion. Notice is all men explaining to women what the should and should not do with their bodies? This is typical, like the women's health panel in congress with no women on it.

In the end they will use whatever excuse they can to get between a woman and her doctor even though it is something they previously were against.

Lars is simply trolling attempting to move the goalposts all over so no one can actually answer his points. It is the same tactic Trump uses, lie so much that there is too much to refute.",0,0.07968056203631213,0.07968056203631213
3810,"In fairness, they had a lot of stuff stolen and it's not like their culture is being stolen, it's not even being appropriated.  It should be called cultural adoption or cultural imitation.  And we all know that imitation is the finest form of flattery.

This nonsense of ""I don't want white people doing aboriginal things"" would be hilarious if it wasn't so bloody crazy.  If we have something to learn from you, why don't you teach us and let us learn it?",0,0.07959731570398576,0.07959731570398576
3342,"Trump got elected, because he ran against an awful candidate and democratic party, the other GOP candidates were emaciated around him, he stoked the fears in this country, Russia releasing damaging information every few days about the Clinton/Dems and Comey writing a letter at the perfect time. He also fed us ideas that are popular to people like jobs, building walls, banning all Muslims, bringing back waterboarding, remove all illegal immigrants, having a $400 billion deficit, never touching medicare/SSN, getting rid of Obamacare and still keep the popular stuff, etc. Which none will probably happen.

America was tired of the politicians at the time and were willing to accept all of his many many flaws to get somebody different in office. He got elected, because we lost our moral compass and elected a man that is really just not a good dude.",0,0.07833093781460776,0.07833093781460776
4210,"I've always found this writer's imagery in writing a difficult slog to get through. It really could only come from a particular type of woman's mind. 
I would have commented on the headline itself but with only 23 comments, why bother-it's comparable to a CNN much ado about nothing. And I mean nothing.",0,0.07760809629442189,0.07760809629442189
3523,"And the evidence of this is ...? Yeah, I thought so.",0,-0.07754697494421925,0.07754697494421925
2640,"Yup.  Stunts, empty rhetoric and selfies...the main diet for Libs.

The grossly naive Trudeau failed to recognize that, when you choose to dance with a gorilla, you're not done until the gorilla says you're done.",0,-0.07752604005157981,0.07752604005157981
1676,"Uh, I'm a guy.  She's a good looking woman.  You think that matters?  

On the flip side, we could have Hillary <shivers> in there...she could vote in another war like the Iraq Invasion.  That was some special work...had to eliminate a few hundred thousand Iraqis.  Awesome!",0,-0.07723100706183739,0.07723100706183739
2714,Alaska is circling the toilet bowl and Cabelas is going to save us.,0,0.07671705651952498,0.07671705651952498
2291,"6.9 MILLION OF 35.2 MILLION CANADIANS VOTED FOR THE LIBERALS. I WAS ONE OF THEIR VOTERS.
OKAY NOT ALL CANADIANS ARE ENTITLED TO VOTE SO 6.9 MILLION OF THE 25.8 MILLION ELECTORATE GAVE THE LIBERAL PARTY THE RIGHT TO RULE OVER THE REMAINING 73% OF THE ELECTORATE.
OUR DEMOCRATIC SYSTEM ALLOWS THE LIBERALS TO RULE WITH SAME AUTOCRATIC RUTHLESSNESS OF THE HARPER GOVERNMENT.
DON'T YOU JUST LOVE CANADIAN DEMOCRACY.",0,0.0763084997750989,0.0763084997750989
822,"""Look like penitentiaries"" being the operative term.  I once went to school in an ATCO trailer, so I'm not that concerned about aesthetics.  I'm more concerned about whether they're like penitentiaries on the inside.",0,0.07530540573403521,0.07530540573403521
4082,"At least it won't 12 years to figure out this man child simply isn't ready as was the case with the Ontario Liberals.
Remove public unions from the Liberal vote base and they don't even have enough votes for party status. 
A vote for Liberlas is simply a vote for privledged and the status quo period.
I'm good thanks !!!!!
Boooooooo",0,0.07420070117150401,0.07420070117150401
2001,"Could it be he was schizophrenic for a long time and as others, ""slipped through the cracks"" of the mental health system?  Also, if he was using drugs (Dual Diagnosis in Psych) because of self-medication or vulnerability to do so in association with the ""wrong people"", it only ends up worse.  The picture is not absolute, but it seems indicative of some sort of mental disorder.",0,-0.07405671252492385,0.07405671252492385
3772,"Please, please, please, could this despicable shrew just get lost in the woods and stay there.",0,-0.07400181745289514,0.07400181745289514
4256,A better question to ask is why the shooter was not on the no fly list especially since this mentally ill guy had a gun and had claimed he been watching ISIS videos.,0,-0.07377004303587609,0.07377004303587609
3377,"I am Inupiat, from Nome. I was always told about the ""ishigoks"". They were a creature like the first one you dicsribed. They were little green men that were very strong. We only heard stories of people seeing them and driving through them.",0,-0.07340236294737301,0.07340236294737301
3147,"No.  I am basing destroying the Lincoln Memorial, Mt. Rushmore and all other Lincoln statues on his racist words two years before the Civil War:

September 18, 1858

""I will say then that I am not, nor ever have been, in favor of bringing about in any way the social and political equality of the white and black races, [applause]-that I am not nor ever have been in favor of making voters or jurors of negroes, nor of qualifying them to hold office, nor to intermarry with white people; and I will say in addition to this that there is a physical difference between the white and black races which I believe will forever forbid the two races living together on terms of social and political equality. And inasmuch as they cannot so live, while they do remain together there must be the position of superior and inferior, and I as much as any other man am in favor of having the superior position assigned to the white race.""",0,0.07240974759536178,0.07240974759536178
1935,"It came to this because we have a poorly informed and gullible electorate who believed the lies of a proven fraud and con man.

Just think Trump University.  That explains everything.",1,0.07049471737754476,0.07049471737754476
2067,"It's not just any water or run of mill eco-system, pay attention!  Even though your sweet beret makes you look smart, I have a feeling you didn't comprehend the article.",0,0.07019081062837262,0.07019081062837262
3576,Doing their bit to keep alive the idea that this is a misogynist culture where women are perpetual victims?,0,-0.06848248242209887,0.06848248242209887
855,"It's madness.  Those in the LBGT community keep asserting rights that do not exist in Fed law (except for gay marriage).  The US Constitution bars any "" law ...prohibiting the free exercise"" of one's religion.  So how can a baker, for example. be forced to do so?  He cannot",0,0.06774038284888184,0.06774038284888184
1868,"gouges fellow Canadians? I find that the relatively small fees I pay for the convenience and service are more than reasonable compared to other services in the economy I pay for. On a monthly basis, its easily one of the cheapest services I subscribe to.  No one forces Canadians to deal with the banks yet they seem to have a pretty good customer base.",0,0.06739669201215182,0.06739669201215182
3683,"Play with fire, you get burned!

6,000 British Colombians die from smoking cigarettes each year! Second hand smoke kills another 1,000. 

Spend money fixing this HUGE issue!",0,-0.06735550779073862,0.06735550779073862
2764,"The article is a failed attempt to whitewash Iranian regime's international terrorism. No one can deny  the Iranian regime's proved involvement of killing its opposition figures abroad as late as early this month in Turkey, killing Americans in Beirut, planting EDM killing US soldiers in Iraq, bombing Jewish center in Argentina, attempt to kill Saudi ambassador  in Washington DC and so on",0,-0.06698676358214328,0.06698676358214328
3121,"OS:  Jail and prison statistics speak for themselves.  I have NEVER paid for pusey, never have and NEVER  will, NEVER read or watched Porn.  NEVER smoked WEED, or Cigarettes,  NEVER  tried or  used  Meth, Heroin,  Cocaine.  

I get my HIGH  every day in  life by LIVING CLEAN, My Wonderful Wife of 30 years, and believing in our creator, the Almighty GOD, and his glorious son Jesus Christ.",0,0.06612408587601881,0.06612408587601881
3141,"It is one thing to disagree with a teaching {and another thing to mischaracterize another's position on the teaching}, but to deny EENS is the DE FIDE teaching is intellectually dishonest or outright delusional. Simply put, you are a heretic.",0,0.06606248044056806,0.06606248044056806
1350,"The MLB playoffs are in full swing, and I have yet to see any baseball players kneel or give the Black Power raised-fist salute during the playing of the National Anthem.  The owners who make up the NFL should have laid the law down from the beginning last year.  It is disgraceful that the owners and the NFL collectively tolerate this kind of disrespect towards our flag, our National Anthem and our country.",0,0.06595549627959096,0.06595549627959096
4131,"The Chinese care about one thing and one thing only - The Chinese. They aren't going to waste their money trying to fix problems in the Middle East, or providing humanitarian aid to the third world, or providing lucrative welfare to ""refugees"". They're selfish to the fullest degree and it's paying huge dividends.",0,0.0654868551773089,0.0654868551773089
485,The nations which suffered from the effects of fascism now must stand firm against the neo-fascism now ruling the U.S. left over from the failed eradication of the ideology of WWII.  Just transferred to North America and nutured to full bloom by the German-heritage Trump.  Time for a Revolution.,0,0.06519374907530318,0.06519374907530318
2741,"So apparently, the UO law school staff was monitoring the dude's facebook page?  Come on.  This is the same law school in which 23 faculty demanded the firing of a fellow professor who chose to put black make-up on her face!  I hope this dude wins a bonanza in settlement.  (The UO will never allow this to go to a jury.)",0,0.06412613500754394,0.06412613500754394
3778,"""latinos for trump"" is not latino....or has no self worth.",0,-0.06374229455550529,0.06374229455550529
321,"I hope so, because Hillary will beat Trump from prison.
 Trump is more unpopular with women than leaving the seat up.
 A vote for Trump, is a vote for Hillary !",0,-0.06354854659234466,0.06354854659234466
2936,"If everything his accuser says is true or not, the charge is all that is required here to destroy the man.  The Duke Lacrosse Case comes to mind.",0,0.06346442811456598,0.06346442811456598
4396,"If the people who live around you are as like minded as you then that is the place the criminals would love to come visit. They can go door to door reaping havoc and you and your neighbors can cower behind the window curtains and watch as they rape, pillage and plunder in a drug induced frenzy. God forbid you try to apprehend or stop them, you may end up hurt or in jail or even worse, your feeling may be hurt. Please post the area you live, Talkeetna right? Maybe the criminals you do not want to see apprehended will head your way where the pickings are much easier and leave us hillbilly's alone. As proven, us hillbilly's  will try to stop the criminals in our community.",0,-0.06313849404196814,0.06313849404196814
3805,"If they're weewiliki's ""needy"" children, then I'm okay with it.",0,-0.0621592737117207,0.0621592737117207
2737,"In other words, the Indian clergy are simply ignoring AL's heterodoxy on marriage and worthy reception of Holy Communion.",0,-0.06205337861460514,0.06205337861460514
540,"When are we all going to start speaking the real truth.  

""Women from all walks of life are often told, 'We have separate but equal roles.' That usually means totally the opposite,"" said Kate Kelly, a human rights lawyer""

That does not usually mean opposite roles it means lesser or no real role.  

The sooner everyone states the truth that sexism, just like racism, is always an attack against human dignity, we will never be able to cure the problem or its symptoms of Global poverty, violence, rape, slavery, illiteracy, etc. 

Time to stop the hate and that means calling the hate of women HATE and owning the fact that religion including Catholicism has practiced that hate for centuries and continues to do so as long as we do not ordain women the same as men or allow them to be bishops, cardinals or Popes.",0,-0.06185036910926556,0.06185036910926556
2258,Letter reprimanding him with not bowing down? What a bunch of weenies!,0,0.061637496904010325,0.061637496904010325
2422,And they should. That is a lot of money....,0,0.06084040171578242,0.06084040171578242
262,"A payout and ransom are two different things. Payouts are strictly voluntary and, therefore, legally enforceable under contract law, whereas ransoms are involuntarily paid while under duress (and therefore, not enforceable under contract law). Don't be stupid yourself.",1,-0.06081762146739744,0.06081762146739744
2176,"Bill, you don't seem so hostile!  The best bet is to decrease the bear population like the Natives do and more than one Yukon River smoke house raider bear has been killed by a Native women with an ax. Weak medicine for a bear, but still better than  sniffer spray and almost better than an .44 libs are always telling us about natives wisdom until it comes to bears!",0,0.0606824379492954,0.0606824379492954
2053,Like foxbots are interested in facts? Never. Share any fact checking site with these people and they'll tell you they're are all liberal sites.,0,-0.06061611057215632,0.06061611057215632
4491,"His ""immenseness""  Spews this "" We’re all in it for Jesus, His Church,  our good  people, not for ourselves!""

Thank you Dolan for changing my life!  

The fraudulent bankruptcy that you orchestrated has left Milwaukee AD with over 200 million dollars in cash tucked away in scam trusts, and hundreds of millions of dollars in real estate.  

( bankrupt with 200+ million in cash, 3times that in real estate?)

I planned on taking the secret of my abuse to the grave with me.  Your scheme had your Lackey Listecki bait victims like me to come forward with the false promises of healing resolution and fair compensation.  He then spent 5 years and most of the estate on a dirty legal campaign designed to toss out every single victims claim.

The horrid side effects of clergy abuse that I spent years trying to contain have relentlessly been released during the torturous 5 year betrayal that promised me healing.  This final betrayal has severely damaged me and left me without hope.",0,0.058906923425222635,0.058906923425222635
3181,"I'm with you there brother. I've wanted Pelosi out of leadership since about 2003.

That said I am thoroughly disgusted with both sides! It's pretty sad that our Democracy has turned into a question of which side you most want to vote AGAINST...",0,0.05838939457182968,0.05838939457182968
1982,"Johann, I'm sorry you feel so self-important.  You stated you will no longer do business with ""anyone who is a Republican or supports Donald Trump"". From your statements, you are doing so because you disagree with their political and social beliefs. How does that differ from a baker (also the CEO of his own little bakery) who elects not to participate in a gay wedding, Jewish bar mitza or a quinceanera celebration because he disagrees with their political or social beliefs? And please don't regale me with more trite indignation.

Woohoo!!  CEO of a 2-bit internet company!! I'm a CEO of my own little business. That and a dollar doesn't buy me a cup of coffee. Nor does it give me the right to discriminate against anyone (or be a jerk doing so). 

I'm sorry that your candidate lost. Maybe you should take your crayons and playdough to your safe place for a while. Meanwhile, you can continue to be part of the problem dividing us ... or grow up and become part of the solution.",1,-0.057898604066784154,0.057898604066784154
786,What?,0,0.0573713666253719,0.0573713666253719
2681,"All these economic migrants will just disappear after their hearing and be a no show. They will appear in all the new sanctuary cities and demand their Charter Rights, their free shelter, free money , free health care, free food. The enabling of this lawlessness and criminality by the mayors of these sanctuary cities should result in their removal or recall by the voters during the next election.
I know Gregor of Vancouver is up for reelection in 2017 and we'll do everything to defeat him.",0,0.05736160992906636,0.05736160992906636
3408,"No, the most discriminated people are rich, white Christian males.

They get no breaks.",0,-0.05654611274916199,0.05654611274916199
1975,"is this news??? put it in the ads section. and who cares about who got promoted.  really, who give a rats ass about these peoples new jobs.  what about naming the person that got promoted to supervisor on the construction site, or at the trash dump, or at mcdonalds.  i had a nephew that got promoted from drive thru at burger king and now is training supervisor ahahahahahhahha serious though, i could care less about these people, why do you keep putting this crap in your newspaper.  is it because you have to kiss someones ass.  its just like in the sports section on where the kids are playing in college, majority are punahou alums. does the SA sports writers keep checking all on these kids in college playing sports or are all these reported by their publicity seeking parents.  I vote these parents are emailing or calling in about to report how wonderful their child is doing in their college sport.  bingo",1,-0.05644773127497271,0.05644773127497271
2906,"I have just reviewed every post I made in this discussion to anyone, and the word ""Hell"" does not even appear.

Kari informed me that she was following the Spirit without regard to the Church and its teaching, I wished her well, a good trip.

We are done with ""the Church is actually opposed to people getting on with their lives. It wants them to spend the rest of their lives alone. How is that fair? They are essentially being punished"" because they are simply a subjective impression that Christianity involves a call to put up your feet and light a smoke, while real Christianity involves a call to difficulty, to hardship, to sacrifice - at times heroic sacrifice.

If you cannot and will not accept that, I can't really go forward in a discussion with you.",0,-0.05639917949983286,0.05639917949983286
2607,"A Native in Wainwright once told me ""We lived here without the white man for thousands of years, when the white man's money is gone we will still be living here"" It is the Natives that are complaining that government does not do enough, not me. BTW people in the Mat-Su pay taxes for services.",0,-0.056310314042360865,0.056310314042360865
3089,"Charles it is ""You can't handle the truth""! Sorry to inform you but you should have believed what Mot already pointed out and I echo now.

""Your people, on the other hand, were selling each other to Arabs long before those Europeans even managed to find West Africa!""",0,-0.055143561446655776,0.055143561446655776
3327,More russian fake news. Say when will somebody come up with some proof.,0,0.05501283276801883,0.05501283276801883
2767,I am more concerned with Carl Anderson's presence in the Academy. That is one scary evil dude.,0,0.054509921783277626,0.054509921783277626
3190,"Yeah...Trump's cabinet of billionaires, lobbyists and corporate insiders really care about you and your family.",0,0.05354033114202039,0.05354033114202039
