,X_sentences,Y,Y_decision,Y_confidence
3020,"Housing  needs to be treated as an public health issue it is. As the article states there is not a shortage of housing but a reluctance of those  who own and reluctant to do so. Studies also show providing housing first helps provide a stable foundation in which additional issues can there be solved.These are LOCAL issues, to provide man with a fish when is hungry is VITAL to TEACH him to fish is everything. We have the talent and the awareness to do so.",0,-2.5644423560954097,2.5644423560954097
355,He is the voice of the Miramichi.,0,-2.5614388394260224,2.5614388394260224
2924,Reimer  had injury problems. Seems Anderson has been able to avoid this injury bug that consistently hampered Mr. Reimer whenever he took a prolonged starter role.,0,-2.560734588996108,2.560734588996108
511,"(Fewer employers offer pensions now compared with our parents’ generation, )
In one sense people without pensions are lucky. A pension is part of the pay package. Those with no pension have control of all their total income - and they get more salary. With a pension your former employer is, in most cases, in your back pocket for life - your life.  There are a number of employers, including the federal government, which have taken from their pensioners. 

It is a little unnerving for example , as a military retiree to know that government, politicians, have control of our pensions. In the 80s the actuarial cost was 25.02% of salary. That is money we did not see. 

So look at it positively - every generation has their problems.",0,-2.5599860032138,2.5599860032138
4465,"I repeat, I'm not joining the GOP until you lose the white racists at a minimum. I'm sorry that you are not interested in what you are agreeing with that the white racists find so appealing. If you sleep with dogs, expect to get fleas. BTW, I'll let younger black folks that didn't have to survive Jim Crow to consider joining the GOP. If you want their votes, I suggest you tell the police to stop killing them. BTW, many police unions have endorsed Trump. That is one reason why the GOP is losing the youth vote. Many of them have friends that look like to people the police kill.",1,2.5578552167503394,2.5578552167503394
473,"What an incredible man. An example for all of us today. A truly brave man who served his country and earned the respect he was given. Not because of his family name, inherited wealth or artificially contrived ""fame"" but by true quality of character and the actions associated with that character.

Godspeed John Glenn, you and men like you were the heros of my youth. Thank you sir.",0,-2.5578256038687828,2.5578256038687828
1553,"The daughter no doubt knows she's overweight and doesn't need Mom to point this out. Also, she's an ADULT. What she does with her body is up to her. What I'd do if I were Mom is share what I'm doing and how it makes me feel, as in, ""You know, I started walking every morning for 30 minutes and I feel so much better.""  If Daughter doesn't pick up on a few of these, then I'd quit bringing it up. It sounds like a great way to start a big argument.

PS. This subject is absolutely off limits between me and my parents, as in, I will leave the room, hang up the phone, turn around and go home, etc. if they bring it up.",0,-2.557365560889351,2.557365560889351
2200,"<<To say He was a product of His time is is to effectively deny that He was the Son of God, which I'm sure you don't wish to do.>>

No, it does not effectively mean that. The Church proclaims Christ was fully man, no? A man of his time.",0,-2.5566871767853647,2.5566871767853647
959,"Where do you derive the idea that the spiritual and the physical will co-exist from? Again, genuinely curious and not doing my typical rhetorical challenge question.

Towards the end of several the gospels I suppose it paints a picture like this. Christ walking through walls, ascending to heaven etc. But those are pretty cut and dry examples. Nothing described there (or anywhere else during the life of Christ) is so far out there that it could be debated as symbolic over literal. Christ literally walked through a wall, it wasn't something like a ""wheel within a wheel"" or ""all walls ceased to exist"" type of symbolism.",0,-2.549247438618522,2.549247438618522
3298,"Bill C-44 that the Liberals just introduced includes changes to the Immigration Act:
http://www.parl.gc.ca/HousePublications/Publication.aspx?Language=E&Mode=1&Pub=bill&Doc=C-44_1&Parl=42&Ses=1#enH9060

the Railway Safety Act:
http://www.parl.gc.ca/HousePublications/Publication.aspx?Language=E&Mode=1&Pub=bill&Doc=C-44_1&Parl=42&Ses=1#enH9374

the Radiocommunications Act
http://www.parl.gc.ca/HousePublications/Publication.aspx?Language=E&Mode=1&Pub=bill&Doc=C-44_1&Parl=42&Ses=1#enH5510

the Aeronautics Act:
http://www.parl.gc.ca/HousePublications/Publication.aspx?Language=E&Mode=1&Pub=bill&Doc=C-44_1&Parl=42&Ses=1#enH9284

and yes, it makes amendments to the Criminal Code:
http://www.parl.gc.ca/HousePublications/Publication.aspx?Language=E&Mode=1&Pub=bill&Doc=C-44_1&Parl=42&Ses=1#enH13232",0,-2.5481335204723927,2.5481335204723927
2461,"I realize the benefit extends to fathers but your situation is likely a very rare one. I don't know of a single dad that took parental leave other than a few days.
I bet you regret hiring the guy as it sounds like he's not appreciated by his co-workers and slowed down the progress of a project and cost the company money.",0,-2.5476407426482295,2.5476407426482295
944,"Aloha Lee, I googled, ""NCAA volleyball head coach"", then selected ""Images"", and I tried to keep a count--I think 492 photos--of on-court attire.  None of the men or women wore a T-shirt or dri-fit shirt.  Men were in a colored shirt--polo or long sleeve oxford/dress shirt, or an athletic jacket that was team attire, and some wore a tie or a tie and a jacket/suit.  Women were in a colored polo, some athletic suit team jacket, a blouse, or a pantsuit. <p><p>Now having just written that, the most casual coach in all of the photos may have been...Dave Shoji, LOL.  I believe to your point about Hawaii being the land of elegant informality it might pass for attire on our home court, but she may surprise us and dress up for her road matches.  I believe your point is valid because, as you know, we dress down here in Hawaii, but when we go to the mainland we dress up to the appropriate level there.  But beyond all else, she is only, what,  a dozen matches into her career?  Everyone--let it go!",0,-2.5475386927395527,2.5475386927395527
504,"All of you people who defend this baker have no idea what it's like to be hated through no fault of your own, or to be discriminated against.  Have you ever stopped to think how demeaning this is, to be made to feel like a second-class citizen in your own country?  Have you ever wondered what it feels like to be called an abomination?  Gay people don't bother you in the least.  Try to reciprocate.",0,2.544004070581254,2.544004070581254
4127,"Key point - you're 45 years in practice.  So you're very much a part of an older generation of doctors.    My Dad was even older and worked similar hours (delivered babies too).   

One of the hidden and non-discussed issues is the choice of medicine as a life-style choice.   In the past (even older than your practice) - medicine was a calling.   It still is for many (hopefully the majority) but the reality is, a growing portion of our medical graduates chose medicine for the wrong reasons.    EG:  In a major urban center - try to find a young, female GP.    I was shocked at the number who required membership fees at a clinic where 6 partners worked the equivalent of 3 full time doctors.    These are the type of doctors complaining the loudest.      One of the hidden problems is the number of NEW graduates who end up working a part-time career as a choice because our system allows and rewards that.     That is a very poor use of a resource (and medical graduates are a resource.",0,-2.5438987385744993,2.5438987385744993
934,"Seeing as to how most of the other women skaters are wearing micro-skirts, yes.",0,-2.5401367106998816,2.5401367106998816
2866,I'll take my chances with the bears thanks.,0,-2.5387612402008726,2.5387612402008726
961,"I suspect a lot of Christians have heard or read what you wrote Jade.   I doubt it makes much difference, for Christians, Christmas  symbolizes the birth of the person they put their faith in.    

I have a pastor friend who does missions in Peru and he said many of the Christian churches have a mix of protestant, catholic, and native gods.   A spiritual life doesn't demand or expect empirical evidence and a myth can being meaningful, if not factual.     

Me, I'm content with mystery.  Living creatures have some very different ways of perceiving 'the world'.   Different, not necessarily good/bad, right/wrong.

http://www.pbs.org/wgbh/nova/nature/dogs-sense-of-smell.html

https://en.wikipedia.org/wiki/Time_perception

Appreciate the potential of the yet unknown!

In no way do I denigrate science.   I don't question the physical universe that science continues to define.",0,-2.5377299271062004,2.5377299271062004
3031,"But that's the point. We do know that the earliest Christians thought Jesus was God.  The few who came along from time to time claiming otherwise were refuted and er, corrected (anathematized?) until it got so bad that they had to hold a council to definitively define the divinity of Christ once and for all, to put it in official documentation so to speak. 

My experience with those who emphasize Jesus the man will then claim that He was limited by the place and time in which He lived, that he may have been uneducated, illiterate, that He just didn't understand things the way we do now-----so how can we be sure what He would have thought about our ""modern day"" issues? They do not want to allow that He was Fully Divine as well and, though He didn't go around flaunting it, would have known Everything, and I mean Everything-all languages, the hearts and minds of people, the past-present and future of humanity and what would come, ALL science since God/Jesus is behind the science, etc.",0,-2.535267331291418,2.535267331291418
456,"I suppose there are books written and to be written of how we fear being different from the people of the U.S., and how we fear being the same.",0,-2.5332461979926952,2.5332461979926952
1910,"I'm curious how Trump will keep premiums down. If insurance companies can't exclude those with preexisting conditions, but customers aren't required to purchase insurance, they won't until they are sick. The system falls apart. If he keeps prohibition against excluding those with preexisting conditions, he may have to keep the entire program with only a few tweaks but with Republican sponsorship. Maybe he could give everyone who purchases insurance the full tax credit regardless of income. This might work out very well.",0,-2.532799230214108,2.532799230214108
3439,"FFS, hakuna your tatas you fear-mongering doom-prophesying bible-thumpers. 

How do you think anyone NOT Christian feels about having to listen to religious pap when they are trying to conduct government business? This country was founded on the idea of religious freedom, which means ALL religions. The whole Christianity thing in our money, in our pledge, etc. - recent additions. Separate the church and the state, otherwise - start taxing the churches. Period. 
I eagerly await the invocation of the following deities:
Flying Spaghetti Monster (blessed by thy noodly appendage, R'Amen)
Dionysus
Cod (of Troutianity)
Odin (the ALL FATHER)
Athena
Zeus
Castiel
Lemmy Kilmister
Douglas Adams

Or, gee... maybe we could NOT have a government-sanctioned prayer at government meetings. Y'know, follow the letter of the law?",1,-2.532490729461446,2.532490729461446
1237,THERE is NO RUSH --PUSH the project FORWARD with reason and reasonable/sensible planning-----FOR the WHOLE STATE,0,-2.5324544611059987,2.5324544611059987
1243,"But, are they?  Based on pythagorean equation, both the Cubs and Giants have the records they should have, or nearly so.  Same for Your Js.

In 2015, Your Js, after 'bout 100 games had a run diff of +100, but were only a .500 team.  You could effectively argue that team was severely under performing by miles.

Last season, Tex had a very good record, but their RD was barely even.  Classic overachievers, everything fell their way.

Maybe on paper the Cubs, Giants, Your Js are better than their record, but statistically, no.",0,-2.5294281430312258,2.5294281430312258
3540,"The problem Alceste is that given his position and the scrutiny that he would come under, as is evident today, it would have prudent to err on the side of caution. As a lawyer I would have thought you would have been familiar with that advice. What did he have to lose if he had gone the extra step ?",0,-2.5283804697375065,2.5283804697375065
1209,"Re.: Ms. Bederman's letter.

It started with the Jews, but if those Jewish principles spread, first to Europe as a whole, and then to a great part of the world, it is through Christianity, which grew out of Judaism. Those shared Judeo-Christian principles formed the basis for  the development of our modern notions of respect for individual human rights. 

it is doubtful that they would have spread further than their own homeland had they not been carried out to the world through those who believed they should apply universally, not just to Jews, and went out to spread the ""good news"" to the world.",0,-2.5257534185523207,2.5257534185523207
3934,according to an officer in Mesquite they did not know the man and he hadn't even had a driving infraction.,0,-2.524785100880459,2.524785100880459
494,"That's not true.  They may be diminishing, but there are few on here every once in a while.  Just mention ""National Anthem,"" ""wedding cake,"" or ""Christianity,"" and watch them come out of the woodwork.",0,-2.5243113582135326,2.5243113582135326
44,"Boots>  The fools then must be the FJ Watson and SOHAG Chin?  They both failed to understand the simply put english on what the POTUS can do in this case.  Again, who are the fools?  I do not detect any sense of ""REP"" arrogance in this matter.  This isn't to make a certain class of peoples' life difficult, but, again who are these people in question?  They are not American citizens and therefore are not afforded any protections under US law.  Now, again, tell me and the rest of the posters who the real fools are?  Maybe the Muslims are coming after your (men/women)???",1,2.5238452543096166,2.5238452543096166
211,"What version of the Bible are you quoting?  For in the NAB, Zacchaeus uses the words ""I shall give..."", in the NRSV, he uses the words ""I will give.....""  and other versions follow suit.   These versions indicate a future action - not one already accomplished.  These versions seem to support your arguments a bit better than the quote you are using which indicates a present and perhaps past action.....",0,-2.5234502236165506,2.5234502236165506
3345,"I am merely joining my fellow posters trying to reach out to those who don't realize Jesus preached the values of seeking money.  That lesson, found throughout the gospels, is so often obscured by all the less important talk of love, charity, and so forth.  If only there were more rotgut drinking hard driving profit seekers in our church.",0,-2.5232507831563873,2.5232507831563873
793,"Organizations do have rights under the Charter. The right of association is one of the cornerstone freedoms in Canada. However, private organizations operating in the public sphere may not deny a lawful service to any citizen.",0,-2.52255355062322,2.52255355062322
3548,"There was not a stalemate.

There were two Synods on the Family, both of which rejected what is known as the “Kasper Proposal”.

The Holy Father then wrote “Amoris Laetitia” and then inserted the infamous “footnote 351"" which endorsed/not endorsed the Kasper Proposal.

Next a group of bishops in Argentina issued their interpretation, which effectively endorsed the Kasper Proposal.

The Holy Father wrote them and appeared to endorse their interpretation.

The letter was “leaked” - signs point to a German source.

There was confusion.

The Vatican confirmed the authenticity of the letter, but the Holy Father did not endorse what he appeared to have endorsed.

This is truly bizarre since the role of the Pontiff is supposed to be confirming the brethren, not adding to the confusion.

Walter Cardinal Kasper had been going to press with his proposal for two decades.",0,-2.5216642720410682,2.5216642720410682
3304,"Is it just me or is the undertone of this article that the author is really against private ownership of any and all animals.

Truth is that few animals in mother nature's world have it as good as a well-loved family dog or cat.",0,-2.514214928399122,2.514214928399122
954,"You are not paying attention. The Constitution makes for no provisions for: 1.  Sovereign Indian nations 2. No treaties with its own constituency 3.  Congress has no Constitutional authority to 'enlarge or abridge' one's U.S./State citizenship be that citizenship with ""Indian ancestry/race!"" 4. The 14th Amendment's 'equal protection' should be sufficient for you but I doubt you accept anything from the Constitution...certainly nothing you have cited so far.  Just in case you opt to cite the Commerce and Treaty Clauses of the Constitution...all were made moot by U.S./State citizenship.",0,-2.510134536781412,2.510134536781412
4114,"There are no signals from Pope Francis that moral doctrines regarding ""irregular couples"" (contracepting, divorced-remarried or LGBTQ) will be reformed during this papacy. And most definitely not regarding abortion.

In Amoris, for example, he not only changed no moral doctrines but changed no canons or disciplines either!  

Fr Martin, like the Pope, reemphasizes the primacy of the pastoral over the legal & repudiates remnants (not saving!) of legalism, rigorism, judgmentalism & exclusivism, while commending mercy & hospitality!

When those who, like Pope Francis or Fr. Martin, ask ""Who am I to judge?"" --- they are not even talking about objective states & the question doesn't presuppose any given stance regarding this or that moral reality. Instead, consistent with the Gospel injunction not to judge, the question charitably presupposes another's subjective exculpability.

That said, I believe the Church does need to revisit -not only canons & disciplines, but- moral doctrines.",0,-2.5089203324664706,2.5089203324664706
3257,"We were lucky as ours came straight from the chemical lab of a large oil company and was as pure as it gets. 

but that was long, long ago, in another time and place.

just don't look into the mirror...",0,-2.508859951357545,2.508859951357545
3316,"'...borough officials have said they hope the final payment will be lower.'

(!)",0,-2.5082537943005456,2.5082537943005456
4022,"I don't doubt that one bit, I just want to hear more about it.  I am not knocking it, as I don't understand it, I just want to know more.",0,-2.5063956411345547,2.5063956411345547
2862,"Part 1: In a sea of orange and blue, the excitement pierced the atmosphere at Sports Authority Field. This was a defining game for the Denver Broncos. The Dallas Cowboys were expected to destroy the newly rebuilt Denver Broncos team. I had three expectations for this game: Denver needed to stop the run, score on offense, and have few turnovers. My first expectation was that the Denver Broncos defense needed to hold the Cowboys’ run game to minimal yardage. The Denver Broncos defensive players haven’t defended the run game well in previous years, which made this one of the most important goals for the team in this game. My second expectation was that the Denver Broncos needed to score using offensive players in order to provide their defensive players with a well-deserved rest.",0,-2.5055326250840806,2.5055326250840806
777,My deepest sympathies to all of Gertrude's family and friends in Mountain Village and the surrounding communities.,0,-2.5031907821800288,2.5031907821800288
4123,"Three things come to mind here.  The second:

2) Some here have observed that in modern Western society many marriages fail.  (To be more precise, perhaps we should say that 1 or both parties fail to keep the marriage going—marriages don’t fail, but people do.)  But given this situation, it’s all the more reason—not less—for the church to challenge this decadent modern society and to uphold moral truths.",0,-2.5008407245086612,2.5008407245086612
2417,Owning a newspaper would be a god send to any political candidate. I think mr. Researcher has hit the nail on the head. Is it too late for Walker to buy the paper?,0,-2.4998334894418144,2.4998334894418144
1629,"""Alberta Williams’ sister hopes for justice from missing and murdered Indigenous women inquiry""

I'm not sure that is the purpose for this inquiry. Are people's expectations being unrealistic?",0,-2.497580885999851,2.497580885999851
2479,Jim Jenkins wonderful to see you again and right on top of it!,0,-2.4968777240331823,2.4968777240331823
3470,"Oh Peggy, How I've missed you these last couple of weeks....",0,-2.4945949694030656,2.4945949694030656
1927,"In spite of what this Catholic group states, the Bible also says in several places, those who do not work should not eat, this command is below:

2Th 3:9-11  It was not because we do not have that right, but to give you in ourselves an example to imitate.  (10)  For even when we were with you, we would give you this command: If anyone is not willing to work, let him not eat.  

Psa 37:25  I have been young, and now am old, yet I have not seen the righteous forsaken or his children begging for bread.

And the verse they use is a poor motivation for helping the poor - So we are supposed to give in order to get ? I do realize there is a balance as some cannot provide for themselves and therefore must be provided for. Most homeless people I see are clearly taking advantage of others generosity, and it must stop. Catholic groups also emphasize giving and works as a way of entering into Heaven, Christ is the only a person can gain access to Heaven.",0,-2.493783626813081,2.493783626813081
1252,Heartbreaking. Literally gave up her life so that her daughter may live.,0,-2.4897310513331843,2.4897310513331843
1250,I agree- I consider BBC World the best of the best when it comes to reporting international stories and dissecting what is really going on. However- it is not cheap. However- perhaps there could be more collaborative cost-saving opportunities the two organizations could explore.,0,-2.4889292470532993,2.4889292470532993
339,but most likely otherwise was quite truthful,0,-2.4870205574649775,2.4870205574649775
332,specifics?,0,-2.4859167002618574,2.4859167002618574
4033,Dear Mr. Palatable - thank you for staving off Biden.  We had a great 8 years.  Wouldn’t change a thing.,0,-2.483615388315285,2.483615388315285
1891,Congratulations...you are an amazing young woman!,0,-2.47975719255461,2.47975719255461
0,And the woman exposing herself saying grab this pussy is an offer I take? She definitely is the sane and high class American that you gloat about trying to represent,1,2.479153794469493,2.479153794469493
859,We also need more beer gardens to produce more local brews.,0,-2.478909139855544,2.478909139855544
36,"I dunno. I think it's about time people starting throwing rocks and punches at greasy white supremacists. You kick a dog long enough, he's going to bite you.",1,2.4784364233300664,2.4784364233300664
2625,"""political turmoil over “Obamacare” undermine coverage gains that drove the nation’s uninsured rate to a historic low""

Pretty sad when you can't even get through the first sentence of the article.",0,-2.4731097441745282,2.4731097441745282
438,"Things like these are needed in order to keep a city vibrant and competitive.  Nothing is free, and projects only become increasingly expensive.",0,-2.4723080458956304,2.4723080458956304
3013,"Great advice on wearing helmets and I hope Dr. Carlson's daughter makes a full recovery.

However, it wouldn't be a full teaching moment if we didn't remind ourselves as drivers to be on the lookout for bicyclists and pedestrians, given the vulnerability of those groups.  Thank you in advance for not driving distracted.",0,-2.470649207258642,2.470649207258642
2823,Yay!  More Walmart outfits!,0,-2.469992326241332,2.469992326241332
1199,""". . . on the recommendation of then Minister in the Presidency, Essop Pahad . . .""

Now why does that not surprise me.",0,-2.469970182125514,2.469970182125514
1867,"If a citizen acted the same way an investigation would perhaps conclude that the homeowner actually acted carelessly. 

In the case of a Trooper it becomes a ""learning"" experience for students?

Lets hope the ""investigation"" leads to some questions as to whether the homeowner acted correctly. Where was the dog food stored?  Was garbage stored outside improperly? Something attracted the bear to the property and it wasn't a tiny dog. Did he try anything else to dissuade the bear before deciding to kill it with 4 shots.",0,-2.466210941995683,2.466210941995683
2161,"Two articles on RC things in NCR currently.  The other about Museum of Divine Statues in Cleveland. Both have common thread of valuing things. To me, in contradistinction to the uniqueness of the gospel assertion of the priority of the person, and especially the least. Museums are about things.  It is disconcerting that Christians would give any priority, relevance to things.  Human life remains cheap, of little value as we continue to cavalierly discard persons, everywhere crushing them like ants.  But we will house in hermetically controlled museums - things!",0,-2.465898346610219,2.465898346610219
