,X_sentences,Y,Y_decision,Y_confidence
2519,How very insightful to have mass in the streets!  The community of God visibly at work bringing healing as Jesus did.  Thank you for sharing this.,0,-2.9325238504212248,2.9325238504212248
1345,"After over three decades of reading and researching every reference to women deacons in the West and most of the references in the East as well as all the secondary literature on the subject from the 17th century to the present, I am certain as an historian that women were ordained.  The rituals for ordination exist and many references to ordained women also remain.  The question of whether the ordination of women was ""real ordination"" is a theological, not an historical question.  The ordinations of women were considered as having the same value as the ordination of men at the time.  Whether any or some of these ordinations met criteria developed much later can be decided, then, only by the theologians who now apply the criteria of their own time.  The definition of and criteria for ""true ordination"" has changed drastically over time, particularly in the Western Church.",0,-2.927937458543382,2.927937458543382
3386,"""But fear not--it is the same God and the same Jesus wherever we gather.""

Why don't you ask each of the 40,000 plus denominations of Protestants how well that same God/same Jesus thing worked out for them.",0,-2.925170309520288,2.925170309520288
3283,"So, why was May in power in the first place.

Could gender have played a part in her getting that job in the first place.

If she did get to be PM because of her gender, was she ever competent to do that job, as well as a person who would have earned by merit..?",0,-2.9224942235981963,2.9224942235981963
1018,"We're a wounded family living in a broken home.   amen...

Advent is feeling more like an extended Ash Wednesday this year. More like Kaddish or sitting Shiva...a very Old Testament Advent that seems more connected to sorrow than to the Coming of Christ. Maybe its the inseparable nature of Christmas and Easter, of Advent and Lent... vivified. I am grateful to have Advent brought to the fore... here. More please.",0,-2.9197754333824024,2.9197754333824024
1658,"If she was still alive, Mother Theresa should have hosted the Juno Awards.",0,-2.916769007431174,2.916769007431174
3649,"I raised one child in may lifetime and I never enrolled that him into a public institution until the he became of age to start kindergarten.  I paid for all of his daycare and preschool activities from my labor.  I taught him all of his basic alphabet, numbers, and colors while starting preschool.  My son never had to eat breakfast or lunch through a school program because I made sure I got up early enough in the morning to cook him a hot breakfast, make his lunch, and send him off to school on a bus.  I made sure he had hot dinners seven days per week at the dinner table where we talked every day about his day.  I never handed my parental responsibilities over to the local school system.  And for all those efforts or child rearing, my son developed into a strong, loving, kind young man who is successful in his own right.  I can truly declare that I now enjoy the fruits of parenting.",0,-2.914182456790817,2.914182456790817
2109,"Yeah. It's audience is also larger than most of the largest Western MSM (CNN, MSNBC, Fox News, etc), combined - showing that more people trust is than they do Western propaganda. G&M certainly doesn't hold a candle to the journalistic integrity of RT, and you'd find that for yourself, if you actually spent some time reading it, rather than dismissing it because your preconceptions were manipulated from the start.",0,-2.912967624113003,2.912967624113003
975,"Bummer, Man!",0,-2.912012880164599,2.912012880164599
2891,"In Indonesia the Catholic Bishops' Conference and the National Council of Churches will be holding joint commemorations next year. Where either Protestants or Catholics are in a large majority they tend to ignore each other. Where they are both minorities in this Muslim nation an ecumenical ""merging"" has been taking place between Calvinist, Lutheran and Catholic traditions and insights. We've had a common Bible since the early 1970s. Quietly, but yes all too slowly, we are becoming one at the local and regional levels.",0,-2.9118916134424886,2.9118916134424886
1257,"Just did a nice stroll on the winter ski joring trail because I figured it would be good for bird viewing and was not disappointed, even treated to a fox siting, who was also ""enjoying"" the birds.  Here is a link to all the UAF trails: http://www.uaf.edu/fs/northcampus/trailmaps/",0,-2.9117308364939687,2.9117308364939687
2424,"""Medicare is partially administered by outside agencies

First, other government agencies help administer the Medicare program. The Internal Revenue Service collects the taxes that fund the program; the Social Security Administration helps collect some of the premiums paid by beneficiaries (which are deducted from Social Security checks); the Department of Health and Human Services helps to manage accounting, auditing, and fraud issues and pays for marketing costs, building costs, and more. Private insurers obviously don't have this kind of outside or off-budget help. Medicare's administration is also tax-exempt, whereas insurers must pay state excise taxes on the premiums they charge; the tax is counted as an administrative cost"". 
https://www.forbes.com/sites/theapothecary/2011/06/30/the-myth-of-medicares-low-administrative-costs/#4521302c140d",0,-2.9101201522140823,2.9101201522140823
1649,"In Latin, third person singular verbs do not specify a gender. ""Amat"" (a verb known to all beginning Latin student) can be translated as ""he loves, she loves or it loves"".",0,-2.9049234157592707,2.9049234157592707
2341,"** ""First, there is a provision called the Pease Limitation... Second, there is the AMT....""**Tom Yamachika
--
* "" The Alternative Minimum Tax ....... would be axed."" * ** Tom Yamachika
--",0,-2.9029648333738747,2.9029648333738747
2126,"Hauna Jon, Studying broad risks was not the purpose of the Joint Fact Finding Study Group.  The purpose of the JFF was to ""bring together available information on pesticide usage by Syngenta, Dow AgroSciences, DuPont Pioneer, BASF Plant Science, and Kauai Coffee and any possible impacts to environmental and human health from such usage.  You might be discrediting yourself by arguing that an economist like Brewbaker is more knowledgeable about human health than a pediatric physician like Evslin.",0,-2.8972732998026984,2.8972732998026984
2185,"Cell phones are not allowed in class at Bohemia Elementary because (obviously) they are a major distraction.  It is also doubtful that the teacher being 'observed' by the District Superintendent is going to pull out her cell phone and snap a photo of her observer.  Don't be so naive,...'y'all'...this is an elementary classroom setting, not a high school football game...but I'd doubt you'd know the difference.
I drop my kids off at Bohemia every morning.  Up until very recently I have never seen Krista at the school in any capacity.  Lately she has been there nearly EVERY morning, 'Observing' in the room of a teacher who's Educational Assistant (E.A.) happens to be the same married woman she's now dating.  Coincidence? No way.  
Now, how would you like to be the teacher who is being observed...daily...by the District Superintendent?  Is this issue having an effect on her ability to teach? Absolutely. Does this ultimately impact the learning environment? Clearly it does.",0,-2.8969265880711044,2.8969265880711044
2097,"Last Christmas indeed it was for Michael, very sad news",0,-2.8968948974580675,2.8968948974580675
1351,"The Church has always taught that all people are called to repentance and to forgiveness. When a conflict arises, as wih remarried persons being committed to their lives and to their desire to be holy, an effort has to be made so that forgiveness can be offered to them. The traditional theology of marriage has short circuited that process of discernment, so Francis joins the traditional discernment process to the handling of the remarried.
One result of this could be that everyone who discerns the action of God in their lives will realize their remarriage was sinful. More likely, some will discover that, while others will be opened to see God's involvement in their family. The Church will benefit from time pastors spend with people, so that perhaps one day more definitive answers might be given to these questions.",0,-2.8938442888396203,2.8938442888396203
2092,There was a strong Catholic ethos in his presidency. The Peace Core was a notable example of a very Catholic notion of service. The appreciation of beauty and the arts which Jacqueline embodied also was very Catholic. One might easily explore the Catholic imagination of JFK in an article or book.,0,-2.892861993416896,2.892861993416896
2972,"Finally, a writer and one whom the Herald actually published,  who states the truth!",0,-2.8881878086714092,2.8881878086714092
475,"Thanks! We have about 25 students declared as majors in our incoming first year class. That is huge for an astronomy program. We also have a summer program for  about 20 high school students called HI-STAR. These kids get a crash course in astronomy and observing, then do year long projects with our astronomers. Over the years we've had a large fraction of NH students, and many have gone on to national science fairs. This year we have NH senior undergrads mentoring NH high school students, so we are creating not just a pipeline for those kids, but role models as well.",0,-2.8843087849078426,2.8843087849078426
2214,"Yjin,
I'm not one to understand prophesies, but if memory serves, sometimes they come out in ways that we don't expect.  I would suggest that an institutional church could continue on after Francis, with a pope, and yet for all practical purposes, the church will have come down so far as to cross over into the general noise of society: essentially no more relevant than any other religion, secular organization, etc.   Under such a scenario, there would not need to be complete destruction/disappearance of the institution or it's popes: simply the realization that it no longer matters, that it affects few people, and has little influence on society.

Given the numbers who have left, or who stayed but effectively ""checked out,"" and the impact this will have on long term church demographics,  and the effective loss of trust in the institution triggered by the bishops, it may well be that Malachy could be correct, even if there are future popes.  Perhaps the question is ""popes over what?""",0,-2.8833335270338702,2.8833335270338702
1508,"Nope, it's all the same stuff.  If you're a writer (or artist or whatever) you should be free to use the material you want to use to tell your story. People have always done so in the past.  

Then it's a matter of whether you tell the story well or not, meaningfully or not, for all and sundry. This is art, not political one-up-manship. 

And if you want to encourage diversity and the understanding that comes with diversity, I see no reason to obstruct cross-cultural storytelling, regardless of whether one group is advantaged or disadvantaged.  Cultural appropriation polemics merely create silos, it sure doesn't heal them.",0,-2.8822598632837284,2.8822598632837284
3985,"Okay - going to try this one paragraph at a time to see what the DP is censoring ...1st paragraph: 
""Yes, the investigation is ongoing. I hope that part of it will be to determine if the cop who fired off the round had a clear target in sight, or was just firing in a general direction in a panic ...""",0,-2.8816053962503223,2.8816053962503223
2569,How incredibly naive of you.,1,2.876729767356297,2.876729767356297
3948,"THANKFULLY fdr didn't get the deal he wanted....we'd be a communist nation by now! LOL...and Yeah, I refuse to use those little things to try to read anything...I figure phones are for phone calls and that's what I use mine for...I don't even text on it...LOL (Anyone who texts me, gets a return phone call...)  There were more quotes, but the space here is limited.",0,-2.8767020764940074,2.8767020764940074
3508,"Stephen
My experience with insurance of all types is certainly different then yours. Could you supply a reference?",0,-2.8749136022801047,2.8749136022801047
614,"Truer words were never spoken!
I go to Waianae , on Oahu, for vacation to avoid crowds. I heard that there are so many homeless kids out there in Nanakuli that the school installed washing machines so they can get their clothes washed now and then.
A charity group out there organized a Christmas give away so each kid could come and choose a toy. One little boy came up with a can of tuna he'd found in a corner. He said he wanted it instead of a toy because his whole family could eat if he got it .",0,-2.873121356148074,2.873121356148074
816,The adults in the room are talking. Don't interrupt.,0,-2.872241400010404,2.872241400010404
1879,"We don't know the full story.  But consider that it may be related to postpartum depression, a real condition that some mothers get in the days/weeks/months after giving birth.",0,-2.8710961680764253,2.8710961680764253
3319,Sears demonstrably did NOT know how to attract customers. Your claims are withour backing evidence and therefore are also without merit.,0,-2.870562548879528,2.870562548879528
2543,"I have been suffering from amyotrophic laterals sclerosis (ALS) disease for the last three years and had constant pain, especially in my knees. my first sign that something was wrong, was my slurred speech. And then the inability to eat without getting choked, strangled, and coughing.Throughout my three years ordeal, i was able to walk with assistance nothing was really working to help my condition.I went off the riluzole (with the doctor’s knowledge) and started  on amyotrophic lateral sclerosis herbal formula i ordered from Health Herbal Clinic, Just 7 weeks into the Herbal formula treatment I had great improvements with my slurred speech, there is no case of constant pain and chest tightness since treatment, visit Health Herbal Clinic official website www. healthherbalclinic.  net or email info@ healthherbalclinic. net. This treatment is incredible!",0,-2.8690958061145517,2.8690958061145517
916,"Once again, you claim to be the official spokesperson for Canada.

How do you know ""most Canadians haven't even heard about the issue and wouldn't be interested if they did""?

What proof, evidence or links can you provide?",0,-2.8636280372302387,2.8636280372302387
4474,"LOTL, that petition you mention in your last sentence can be read in John's Gospel  (17:21). Since you made the sentence an exclamation, I presume that you, like me, recognize just how pivotal is the petition to (and how definitional of) any genuine claim to be Jesus' disciple. What exactly was Jesus asking of his Father? If you read to the end of the chapter, the answer is clearly stated: ""...that the love with which thou hast loved me may be in them, and I in them."" (The New Oxford Annotated Bible, v 26)

The unity Jesus seeks of his followers is primarily a unity in love, not doctrine. I don't deny the importance of doctrine, but I do deny that it has supreme importance. Belief in (intellectual assent to) the dogma of the Eucharist cannot redeem a person: only Eucharistic love, manifested in and through word and deed, can do this. Note, however, that intellectual assent to Eucharistic dogma is not a condition for exercising the love referenced by the dogma.",0,-2.862857327996479,2.862857327996479
335,This team is on it's way up. Really look forward to next year!,0,-2.8619564983476558,2.8619564983476558
3620,"I am quite capable of long meditation.  I don't need icons to do so.  There is no scripture about worshiping the flesh of Jesus, only consuming it.",0,-2.858161262547667,2.858161262547667
2280,"Apparently you've not read The Constitution; you should start with the 1st Amendment. 

Are you unaware that The Pledge of Allegiance, a statist mantra penned by a socialist, did not originally contain the silly phrase ""under God""? 

As far as ""the writings of the founding fathers"" goes...

""Christianity neither is nor ever was a part of the common law.""

""In every country and in every age, the priest has been hostile to liberty.""
- both from Thomas Jefferson 

""The government of the United States is not in any sense founded on the Christian religion.""
- John Adams 

""Religion and government will both exist in greater purity the less they are mixed together.""
- James Madison 

""All national institutions of churches, whether Jewish, Christian, or Turkish, appear to me no other than human inventions set up to terrify and enslave mankind, and monopolize power and profit.""
- Thomas Paine

There are many, many  more, but I'm out of space and I think I've made my point.",0,-2.855806767447371,2.855806767447371
454,"From the PR Delegate to Congress: 
""I won't say that I am comfortable or that I praise all the ways that he managed the issue, but I will tell you that everything that the president said that he was going to send to the island, it's getting there. The resources are there. The help is there.""

""He instructed all his cabinet members to treat Puerto Rico as a state, in terms of this hurricane. I mean, that kind of instruction is important to have access to all those programs.""",0,-2.8534036983902196,2.8534036983902196
834,"This does not only apply to docs but also small businesses...sure it's a tax deferral/saving but we also do not get any benefits, pensions etc...It is a small benefit for the risks we take....obviously you have never owned a business...",0,-2.850255641405033,2.850255641405033
4147,"Dude. You are so disrespectful. What is up with people like you trying to force being black on Coloured people? We are not black and calling us anythong other than Coloured means that you have no respect for my heritage. I am not black and I am proud of it. I am Coloured. 

You wrote this nonsense because you or the person you work for have an agenda but it wont work.",1,2.8494268803340113,2.8494268803340113
60,What a bunch of bloated self important idiots!!,1,2.8484992360215093,2.8484992360215093
1110,"Greetings....thanks Father Reese for the historical background!  Still the laity is not being included in needed reforms.  As a child attending Presentation of the Blessed Virgin Mary grade school  in 1965,  we were totally in the dark when the reforms started!  Now the Church has a teaching moment available only if they include the laity!  Come +Holy Spirit+ bestow your wisdom  and charism on your Church.",0,-2.8439823806249134,2.8439823806249134
474,"Are you implying that women experience equality in the world? They have the same economic, health, social and educational opportunities as men? Also, this article is about maternal and reproductive health, so yes, it will benefit women in the majority.",0,-2.842923720854352,2.842923720854352
1045,"Actually, it is very Trumpian.  That's why they take the term ""Nasty Woman"" with pride.",1,2.8424947847235043,2.8424947847235043
3485,"There was no direct confrontation between US forces and Russian military in either Korea or South Vietnam.

Relevance counts.",0,-2.8387190910391924,2.8387190910391924
536,My guess: Must be someone wanting to boost Fracophone population. Anyone speaking (whatever) French helps.,0,-2.8257979366181907,2.8257979366181907
2498,"A fairly good list Ms Wente.  Let me add a couple or so.. The British are soon to free themselves from Europe's grand experiment in Soviet-style technocratic, bureaucratic, centralized governance. The European populace have begun to wake up to the mess their overlords are making to their once great societies, due in large part to Frau Merkel's social engineering scheme . The American globalist elites are still disbelieving of the shake up they're in for. The global warming elites labored mightily, between champagne suppers, and produced a non-binding collection of best efforts wish lists. Meanwhile the Chinese and Indians will not deny their people the cost effective, reliable energy the west has enjoyed for over a century. All in all Ms Wente things are looking up. Allow me to wish you a Merry Christmas if The Globe leftist commentariat permit.",0,-2.8254667160430715,2.8254667160430715
249,"Also black-on-black ... no racial component to exploit. Liberals are sad, pathetic and utterly predictable.",1,2.8238264092873075,2.8238264092873075
2212,"""The adjective 'consubstantial', for its part, could also lead a praying individual to a heterodox conclusion about the relationship between the Father and Jesus.""

Actually, it cannot, because it has a specific meaning, codified long ago as a translation from the Greek homoousios.  No further qualification is required, beyond the pre-first communion understanding.  One could look it up in a dictionary, as well.  I believe that Aquinas explained the rest, for anyone interested in exploring whether the Father or Holy Spirit is inclined to ""passion"".",0,-2.822644595891304,2.822644595891304
3111,"""To prove insider trading, federal prosecutors would have to show the executives knew about the nonpublic information when they decided to sell their stock, often a tough task, experts said.""

That level of proof regarding insider trading is no accident; therefore, Americans are left to believe that within a few days following this breach (of which they had zero knowledge) an amazing epiphany came independently to each of them thus allowing these corporate executives to avoid a fall in the value of their investments.  You betcha!",0,-2.822168293115472,2.822168293115472
4227,"This does not reflect evidence-based standards in maternity care that have been ""standard"" for many years. Women have been encouraged to eat and drink in labour for decades. What a terrible title. ""May"" be safe? "" 'We really don’t know how much if anything people can eat or drink in labor,' said senior author Dr. Vincenzo Berghella..."" Seriously? Evidence supporting eating in labour has been out since the 1980's. I expect more from the Globe and Mail than this. “ 'If we’re well hydrated and have adequate carbohydrate in our body, our muscles work better,' said Berghella. A woman’s uterus is largely made of muscle."" You don't say. A marathon runner wouldn't dream of not eating or drinking while exerting herself... so why not a woman in labour? The phrase ""women were allowed"" was used repeatedly throughout this piece. Women are the prime decision makers for their births... who is doing the ""allowing""? Human rights in childbirth and respectful maternity care matter. Eat & drink ladies!",0,-2.8216207070926895,2.8216207070926895
1202,^^ Cannot be serious ^^,0,-2.8191409730093904,2.8191409730093904
2347,"Duke Charles Martel:
1. Winston Churchill was the PM of Great Britain, as is Theresa May.  I don't think May was partying Saturday night.

2. Whereas Churchill didn't hold any concerts or singalongs (as far as I know) the British were encouraged to celebrate with song, dance and laughter during the  horrors of WW2.

A celebration of community spirit is a time honoured way of dealing with loss, grief and even fear.  Manchester did the right thing - as we all trusted it would.",0,-2.8180410956599466,2.8180410956599466
574,Way to go Honda. My son has an old one and it keeps going and going.,0,-2.8168930945954744,2.8168930945954744
307,"That question has not been answered.

General population studies cannot be applied to a specifically filtered group - which is what Eg: Soh does.     So to answer the question, you would need to conduct a study on the population in question (eg:   Software Engineers).     Even that would only give you an ""average"".    Individual variance would mean that there will always be individuals (male or female) who deviate from the norm.

It is ALWAYS the goal of any company (particularly a tech company) to hire exceptional employees (those who deviate from the norm).     Thus, studies which talk about ""average"" are not relevant to a company looking for NOT average.     i.e.    Google is NOT hiring to conform to a general population average.    They are looking for people who deviate above the norm.

So the question is kind of irrelevant.",0,-2.8148954057808036,2.8148954057808036
2389,"Asking questions of candidates should serve to distinguish them from each other.  I understand that when Clinton was debating Sanders, it made sense to question her about ties to Wall St, etc.  I honestly don't see what purpose that sort of questioning now serves.  Yes, Clinton has ties to Wall St.,  But so does Trump.  
I wish that Wallace would ask questions on the issues that show real differences and then hold the candidates to the truth.",0,-2.814797174910116,2.814797174910116
1479,"Our food from the ocean is disappearing...DLNR has done a terrible job protecting our natural resources. On Molokai we are creating our own Community Based Subsistence Fishing Management Plans, so is Haena on Kauai. Each ""Area"" has their own way of Management. Hawaiians were ""very"" strict in using the KAPU system to protect their food source. TRY WAIT is community based and driven with good people with good mana'o, outsiders like Makani Christensen who protect ""commercial"" interest need to walk softly as we all try to feed our families and care for future generations!",0,-2.8146800088809045,2.8146800088809045
