,X_sentences,Y,Y_decision,Y_confidence
3370,"What I found out when I started to attend a protestant bible study in college was that I knew a lot more of the ""integrative message"" of Scripture than most of my bible memorizing protestant friends.

I may not have been able to impress myself or others with verse/verbatim.

But I was less prone to confusion when one protestant friend tried to one up another protestant friend with a proof text.

Instead I fell back on my faith and on my constant exposure to Scripture through the Holy Mass, and was able to offer a more integrative scriptural answer to one of the points of the Bible study, even though I couldn't quote chapter/verse.

Instead I would say, as an example...""doesn't it also say somewhere in the NT that we should love God with all our heart, soul, mind, and strength""?

It was only later on that I took up regular personal Scripture reading, and that too has been a huge help.  5 minutes a day.    

5 minutes a day, one can go through slowly the whole of the NT each year.",0,-4.518021070548287,4.518021070548287
3635,"Volunteering with groups that help people, such as food banks, soup kitchens, youth outreach, but mostly in how we live our daily lives. The biggest impact will be by people who actually live in the community and personally interact with their neighbors. Not sure how this can be done on a ""church"" level, but perhaps the church can promote the interaction. It has to be on a basic level, becoming friends with people and getting to know them.",0,-4.310060798798952,4.310060798798952
1606,"""Improving work-force participation rates among women with young children has been highlighted as a focus of the government in recent months.""

Once again the emphasis is on business to the detriment of workers and taxpayers. An increase in the work force means more unemployment and thus more welfare costs, lower salaries  through competition for jobs.

What is even more unfortunate is the work of Wilkinson and Pickett is ignored. They showed in the excellent researched The Spirit Level, that an increase in GDP/person in developed countries did not affect living conditions.  For example Japan is a bucket case economically but tied for top place as the best place to live. Further the US, tops in wealth and bottom as a place to live. 

The significant factor was income inequality(top 20% income divided by bottom 20%). The lower the inequality, the better the living conditions. That correlation held over 23 countries. No explanation why. But the data is solid. 
That should be checked out.",0,-4.1719114112790825,4.1719114112790825
3622,Wonder what her Christmas message sounds like. Did she record it before the cold?,0,-4.161704497579326,4.161704497579326
3486,Thanks for confirming my thesis!,0,-4.122776913583168,4.122776913583168
1614,"Jesus prayed for unity (""that all may be one as you Father and I are one, that they be one as we are one"") is the last hours of His life. One should ask oneself in what ways might this unity be manifested, in the early days and now?  

-How has Our Father answered this prayer from His pleading Son?
-What have I done today to draw out unity among believers?
-What ways have I instead added to division, doubt, disunity?
-One should ask:  Did the Father deny His only Son this ardent prayer of His Son's?

Perhaps the ""Catechism"" is but one sign of unity.  Our Creed, Sacraments. Our dead formal language of Latin (which owing to its fixed state has a built in root of constancy  vs. classic language drift.

I don't expect you to understand these points of unity, but perhaps it will help others to pause a bit and to think about unity.

Unity in belief, unity in morality, unity in prayer, unity in forms of worhship, unity in the Sacraments, unity even in death (the commUNION of saints).",0,-4.07192874654549,4.07192874654549
1798,Thank you so much for this. I'll spread the word and share.,0,-4.054671146654134,4.054671146654134
3600,"What are the odds that,whatever happens in court, the delays will find ways of continuing?",0,-4.030576298428914,4.030576298428914
20,Shut the fuck up you stupid bitch,1,3.939308456366633,3.939308456366633
3824,"Yes!  I, too, wondered why they don't seem to be aware that the parents and grandparents were/are ignored.  The article pointed cited PEW(?) finding that 50% leave/left before or at age 18.  Ok.  If correct, that means an equal number leave/left after age 18.

Any reasonable, seasoned teacher knows that you should not call on, choose as teacher helper, or engage with the same 10% of kids all the time -- the kids of the parent volunteers.  How were priests raised?  Did none of them have parents who complained about people who only listened to ""yes"" men/women whether in families, at work, at school, or in the Church?",0,-3.9385343877063566,3.9385343877063566
837,Hi Eric :),0,-3.9272947116483197,3.9272947116483197
4470,Nice! Interesting to see the changes. Thanks.,0,-3.9250519868080422,3.9250519868080422
233,"“Crying racism has become a knee jerk reaction, with blacks and libs.”
You are a dumb and rude person. 

There is no way you can prove your idiotic statement. You base your stupid argument on that very stupid statement.

Grow up.",1,3.8935625892812373,3.8935625892812373
2452,"I don't remember having vog ""back in the day"".  Unless my ""back in the day"" was waaaay before yours.",0,-3.887763660586402,3.887763660586402
142,Trump is one stupid man,1,3.8611918060017,3.8611918060017
573,"This article is so short, we're only getting a snapshot of his life.  Not sure if we can fairly judge how much social interaction he had to trade off?  I didn't go downtown very much during school either and just hung around my department's study hall which was party central when it wasn't exam time and I made some pretty good friends during my summer jobs.",0,-3.8533403546694522,3.8533403546694522
874,The IRLY Building Centre in my tiny town in the BC Interior just became a Home Hardware. I'm hoping they start stocking some of those 'Only at Home Hardware' products I see in the TV adverts.,0,-3.812874968187721,3.812874968187721
2516,"We are practiced in a 'religious' faith that is received from top-down -- not so much a faith that is conscience-based, compelled by truth-sense, authentically people-owned and welling from the ground-up.
What should happen is for conscience to well-up from the people who are practiced in faith/hope/ love: faith that is grounded in understanding the authentic connectedness of all life; hope that is justified in authentically informed consciousness of life's universal relatedness; and love that is solidly grounded in the sense of mutual and personal obligation to one another and all other;
except for these, people-based faith, hope and love, chaos prevails. It's for institutions, churches included, to recognize and authenticate people in faith/hope/love, communication/consciousness/conscience - the trinitarian dynamic of godlikeness. In this endeavor, churches must be of one mind - as to the oneness-thinking of churches, there's a long way to go! what hurts to say, but is true.",0,-3.7704744831081527,3.7704744831081527
1858,"Unfortunately, I was not at this meeting, so I do not know what was truly discussed.",0,-3.7654042366371945,3.7654042366371945
3651,"I like the words of Jesus more.

""My Father is always at his work to this very day, and I too am working.""",0,-3.763746567244321,3.763746567244321
4229,"Ken_Conklin, Social justice is justice applied to the societal level.  You have your own idea of what a church should be.  Different churches are, of course, different.  Consistent with your idea, some churches are focused on praying to God.  Other churches, however, also apply their religious principles to the larger world.  They want to make the world a better place for everyone.  By the way, you either haven't been to the Church of the Crossroads or your powers of observation are weak.",0,-3.7503603050328227,3.7503603050328227
768,"I am speaking of Divine Revelation  as the Church teaches, as it reads in my post above that you quote. What you call inspiration for the Scriptures is Divine Revelation given to the scripture writers by the Holy Spirit.  That is what the Church has taught from the beginning .",0,-3.749628394865205,3.749628394865205
1499,"The Daily Stormer wasn't forced offline but to access it you need a tor browser. 

Just sayin' is all.",0,-3.698339645145359,3.698339645145359
3660,"I don't usually roll through all the posts, but I wanted to see if anyone recognized that much of what is mentioned is what 'compelled' Vatican II to acknowledge the presence of the laity who had for decades - or more - simply looked at the back of the priest, who whispered in Latin , in a building that was designed for visual impact not --- acoustics. There was a massive pipe organ that drowned out everything from the back pew to the high altar. It was more important to see the priest during the homily than to hear him. The rosary people pressed on regardless through to the final amen.

Enter...Vatican II, Liturgical reform, Mass in vernacular, facing the assembly... but no one can really remedy the church structures/buildings that were never designed for -- full active conscious participation in the liturgy and have merely been 'adapted' to that purpose. New constructions take that in a bit more.  
I waited to see if someone would recognize Vatican II factor.",0,-3.6916333222046793,3.6916333222046793
1463,"To Branko and Co, this is wonderful news and I wish you all the best in your endeavours - this country is crying out for more top-notch investigative journalism, so I for one will be holding supporting your work as best I can on my own limited means.

Best of luck for the future, Scorpios!!",0,-3.674354769236663,3.674354769236663
1306,No worries. They're not needed anyway.,0,-3.673036965108788,3.673036965108788
152,Trump would call Dumbowski an ugly pig and a nasty woman.,1,3.672359786119647,3.672359786119647
4138,"The place of Eucharist in the process of Initiation is not realized by most Catholics. The progressive role of the Spirit in Baptism, Confirmation, Eucharist should be more apparent.  Eucharist is the repeatable part of Baptism; every Eucharist starts with Baptism
Few Catholics see the inner dynamic of the Eucharist (Gathering / Story Telling / Meal Sharing / Commissioning.  For many it is still Offertory-Consecration-Communion.

3. The Story Telling (Liturgy of the Word) and the homily remain ""poor country cousins"" to receiving Communion, which is the ""main reason why we came to church.""

4. Real Presence is still exclusively associated with the bread to the detriment of the assembly and the Scripture. The Psalter remains a ""foreign book"" to most Catholics.

5. The language of the prayers is much more the language of sacrifice (Good Friday) than meal language (Holy Thursday).

6. In practice the epiclesis still occupies a place of second rank to the institution narrative",0,-3.634847301926574,3.634847301926574
3312,"After over 200 years of the poems, then songs, existence, someone who only had an agenda and nothing more, decided to tell the left that they had found an obscure verse that everyone should know about?   Is that about right?",0,-3.6290546119783995,3.6290546119783995
923,The parents want to use their own money they raised online.,0,-3.6278903130939977,3.6278903130939977
4063,"What does Clarence Thomas have to do with joe Biden's actions? Thomas went to a non profit conference in 2008? How many other justices have gone to conferences or have given speeches at non profits? Almost all of them have at Ideological non profits, both left and right, so what? And based on your amounts and the timeline you provide, 18 years, the Koch Foundation has given The Federalist Society a whopping $105,555 a year. So how much have George Soros and Warren Buffett have given to left wing non profits in the same time frame?",0,-3.6078038256419065,3.6078038256419065
217,"Why are rednecks such ignorant morons?  Any idiot who goes and decides to take it in their own hands, violently, will end up shot violently like the fool that they are and then really cause their family financial problems. 

I'm sorry but just because Clinton supporters don't walk around chanting her name & acting ignorant doesn't mean they don't exist, they just aren't going all loud & idiotic like trump supporters. ""Literally looking like something out of ferguson, so much for the bs ideal that white people don't riot"" 

I hope they aren't this dumb come nov 8th because I'm sorry but he's going to lose.  The truth is that the majority of trump supporters can't vote because they're felons, haven't registered and/or don't believe they should have too, or are too small a # to win an election.  Too many influential people are voting for Clinton and their followers are voting along with them. That's reality.  I'm not a fan of either of these clowns but at this rate even I'd let her win.",1,3.599987001213531,3.599987001213531
3025,Fr. Curran writes an excellent article that touches on the basic questions dividing many Catholics today. Can 'Doctrine' change? And MUST doctrine change if greater knowledge and understanding develop?,0,-3.5869793845618796,3.5869793845618796
2970,"Troop 480 has a webpage with info on the area they service.

https://sites.google.com/a/troop480.com/troop-480-home/home/treerecycle

Cub Scouts, Boy Scouts & Venture Crews throughout the area are involved and will be collecting tree's.",0,-3.5132593905171925,3.5132593905171925
3572,So what is the contact information for this academy?,0,-3.488419052217588,3.488419052217588
1715,Worst hate crime against whites.,1,3.4737361863801777,3.4737361863801777
3695,"Jim, I remember a while back NCR did an article on the Catacombe Pact. A secret gathering of Bishops and Cardinals in the Catacombes where they promised to do all they could to promote the Jesus of the Gospels and build a Church which was more loving, compassionate, forgiving etc.. to restore to the Church the face of Christ. Helder Camera was apparently present, as were many Latin/South American Bishops. Pope Francis knew men who were present at that Mass and reportedly signed up to that pact. The way he led his life as Cardinal and Bishop would indicate that this is true. 

We all know that he lives amongst wolves and we also know that he is having to tread carefully on certain matters, but for the first time in my adulthood, I feel a tremendous sense of hope. 

Long live Pope Francis!",0,-3.4551562182179145,3.4551562182179145
1639,"I've read through the bible more than once and spent hundreds of hours in meetings with others who also read the bible.   It is not a simple answer unless you take every word at face value.  Jesus himself seldom lectured but often posed parables and conundrums to both the unchurched and the scriptural experts.   He taught that we all had access to agape' love, not just the few who could recite the rules.     

Faith is not passive, it's an active search by each of us.  Jesus turned the hierarchy and expectation of the Jewish faith upside down.     You might find it fun to take your faith with serious intention and share with others who believe in the guidance of the Spirit and living revelation.   

The  God of Jesus teaching was not found in the walls of a church with a preacher teaching 'the law'.  Jesus taught an inclusive faith driven by love, not an exclusionary faith driven by judgement.

 You're welcome to choose your own course to happiness,  We are each uniquely made.",0,-3.4538998160791596,3.4538998160791596
2765,Did your parents have any children that lived?,0,-3.4495599718429695,3.4495599718429695
2976,"Jesus spoke of the following Him and the coming Kingdom of God. The Kingdom includes a consciousness of social justice, peace, and inclusion. God's Love is not something we earn or deserve by being good. It is a free gift. Jesus taught us a way of life of loving God and others as God loves us. It is showing mercy, compassion, forgiveness, and helping and healing others. It is both a personal and community mission. The early followers sold everything  they owned in order to help the more needy in their community. Recently, every parish in our area have developed their mission statement which describes their community based goals. It is part of belonging to the Kingdom of God.",0,-3.444418397784749,3.444418397784749
2210,"The Holy Spirit speaks to, among many others, any Council, but the essential ingredient is who listens?  That is why Councils do indeed get it wrong at times, just as every part of the Church has from time to time throughout our history been very wrong as well.",0,-3.423064627397034,3.423064627397034
1997,"""Karina Gould, who was parliamentary secretary to the international development minister, will take over Democratic Institutions from Maryam Monsef, who was demoted to Status of Women.""

Well there's an upgrade. Until the day she was elected Karina Gould never held a full time job, nor had she ever lived outside her parents' home. Does Junior go out of his way to find unqualified ministers or what?",0,-3.4223513128939453,3.4223513128939453
3641,"In fact such letters were written all the time, going back into the last century, and the answers published and indexed annually.

What is unusual in the current situation is that (a) neither a response nor a non reply was forthcoming, and (b) that there were multiple ""leaked"" documents from authorities, including the Holy Father himself, that seemed to say multiple things.

While I understand that ""leaking"" supposedly confidential documents has been part of the intramural games played in the Church since the early 1960s, they have not heretofore included papal responses.",0,-3.4212222126264606,3.4212222126264606
3659,"When healing people, Jesus called forth the Faith of those being healed.  Jesus 'needed' the faith of people to bring about healing.  The whole concept of John's Gospel is about showing to the READERS, the importance of faith-- -just a few examples the faith of the royal official, the faith of the Syro-Phoenician woman [who wouldn't take a ""NO' from Jesus].  Jesus needed human cooperation from us.  Jesus did not impose anything on us from above.

In the Gospel of Matthew, Jesus healed two blind men---but first he asked them ""Do you believe that I am able to do this?"" They said to him, ""Yes, Lord,"" Then he touched their eyes and said, ""According to your faith let it be done to you"". [Matthew 9:28-30].

God does not treat humanity like we are puppets.  God works in cooperation with us",0,-3.4152089005533233,3.4152089005533233
1213,"I've noticed many of my friends on the left and right display  nearly identical behavioral characteristics when it comes strongly held beliefs.  It becomes more acute as they move further in either direction.  Reason/facts/empirical evidence/science...all ""out the window"".  

A couple examples come to mind:

=>Creationism 

=>Government can correct every ""cosmic injustice""...every lunch is free.  

It's called DENIALISM!  

“It ain’t what you don’t know that gets you into trouble. It’s what you know for sure that just ain’t so.” Mark Twain",0,-3.4101948746458586,3.4101948746458586
533,I did a reboot and was able to view the video perfectly well.  Thanks to all who replied.,0,-3.404981754657043,3.404981754657043
1626,"But I think that it goes even beyond the generational issue.  Why would anyone ask someone about another group of people, with whom the first has no contact?  
I think that questionnaires ought to be directed at the group about which one wants to find out.  
The bishops may have suppositions about why others do things, but they don't know, without asking them.  Asking the bishops to devise a method to question young people who are not in church to begin with seems to be a rather odd proposition.  Wouldn't it be better to devise a way to question those young people directly?
But, of course, I am presupposing that the Vatican, or anyone else in the institutional Church actually wants to know.  It seems to me that they are happier in their own universe, with their current suppositions.",0,-3.377560904229429,3.377560904229429
1242,DANG!,0,-3.3639345157999507,3.3639345157999507
126,"Trump is definitely a worthless stain on America.
He's definitely a sick, fascist, white supremacist traitor.",1,3.3596147990735936,3.3596147990735936
4051,"Watch the Bronco game last Sunday.  Stadium looked just as full as it ever does.

You stand for the Anthem today?",0,-3.332177012666488,3.332177012666488
3688,"WRONG!
That refers to LEGISLATIVE powers, meaning only the House and Senate can legislate. The other two branches can't. The government as a whole derives its power from the people.

""How could both the national government and the states exercise sovereignty?  For Madison the answer was quite simple: all the power ultimately derived from a third entity: the people. Neither the national or state governments were truly self-governing. Both derived their authority from the consent of the governed.  The opening phrase of the preamble of the Constitution--""We the people of the United States""--reflected the conviction that the new government derived its power from the citizens.""

Source: The Everything Founding Fathers Book: All you need to know about the men who shaped America, by Meg Greene, Paula Stathakis, page 43",0,-3.3151543254424487,3.3151543254424487
1902,"Although he was a deist, Thomas Jefferson who first used the term ""separation between church and state,"" believed that this was to protect religion from the state rather than to protect the state from religion.  Although he was a deist, he felt that religion was an important actor in society, which has much to offer America.",0,-3.3117763646832357,3.3117763646832357
1205,"Is it possible, even remotely, the he and or the Spirit, are opening up the rhetoric to truth and appropriate actioning?",0,-3.2941914346644494,3.2941914346644494
1080,"Some people have gotten too good at both sensing AH, and even more urgently wanting others to know that they know some easy latin jargon. 

Please provide your evidence of a single place where I have made a direct AH, leave aside any comment that uses collective nouns.   ""Repeatedly""..should be rather easy for you.   Now search. 

Until then you have no credibility or basis to dialog with me.",0,-3.292304000862738,3.292304000862738
3320,"Bison are bison.  The 1928 re-introduction of Bison was to provide for saving the species wiped out by hunters for profit and government  in the 19th Century.  Plains Bison were the only species available for transplant to re-establish Bison in the same area they had thrived in for millenniums.  None of your comments have any factual content and are just false.  The only harvest of these bison should be for subsistence.  The lottery removes any aspect of subsistence in favor of the ""sport"" hunter.  Airplanes can spot the herds which will not move from an area until the feed runs out, so same day ban has no relevance.  Off road vehicles can be used without restriction to travel throughout the hunting area.  No need for roads.  Oil revenues used by the state created the implantation of barley farming into the area with no historical existence.  Your last sentence have no relevance and are just false in structure and content.  Give it up.",0,-3.288410859735984,3.288410859735984
3767,"Looking at some of the earliest writings of the Church, such as the Didache (~70 AD) and the 1st Epistle of Clement to the Corinthians (~92AD), as well as the New Testament writings, it would appear the church by that time had a fairly uniform organizational & liturgical structure. This included bishops (episkopoi, “overseers”), priests (presbuteroi, “elders”) & deacons (diakonoi, “servants) By the mid 2nd century, the basic NT Canon had been established, as noted in the Muratorian Canon (~160 AD).

So within about 70 years after the Resurrection, there was an organization communicating across the Mediterranean. Not the type of an organization waiting for the end of the world.

While the persecution by Nero was bloody, it was thankfully brief. So from about 70 to 90 AD, no persecutions are noted, until for some reason Domitian initiated a series of persecutions.",0,-3.2806559432218076,3.2806559432218076
1391,"Doing a search of my fathers name I came across this article. I am Herb Warrick's only daughter. Amazingly, what Don Ostrand said, that he down played his importance, is an under statement. I didn't even know this museum existed until 10 years before he died. He was definitely a humble man. My father, and his second wife, Ramona, who also worked for the phone company with my dad, were the rocks of this family. They were married over 35 years. She was the love of his life. Together they made this museum happen. I miss him dearly.",0,-3.271758965421042,3.271758965421042
866,We are talking about the difference between individuals and institutions,0,-3.255887809793874,3.255887809793874
